Title,Year,Duration,MPA,Rating,Votes,méta_score,description,Movie Link,writers,directors,stars,budget,opening_weekend_Gross,grossWorldWWide,gross_US_Canada,release_date,countries_origin,filming_locations,production_company,awards_content,genres,Languages
281. Looney Tunes Golden Collection Volume 2,1958,7h 1m,,8.0,33,,,https://www.imdb.com/title/tt28335350/?ref_=sr_i_281,[],"['Tex Avery', 'Robert Clampett', 'Friz Freleng']",,,,,,1958,['United States'],,,,['Animation'],['English']
282. The Wind Cannot Read,1958,1h 55m,,6.1,401,,"During World War II, a British officer stationed in India is recruited by Army Intelligence and tasked with learning Japanese to interrogate Japanese P.O.W.s, and he falls in love with his pretty Japanese teacher, Sabby.",https://www.imdb.com/title/tt0052396/?ref_=sr_i_282,['Richard Mason'],['Ralph Thomas'],"['Dirk Bogarde', 'Yôko Tani', 'Ronald Lewis', 'John Fraser', 'Anthony Bushell', 'Marne Maitland', 'Michael Medwin', 'Richard Leech', 'Tony Wager', 'Tadashi Ikeda']",,,,,"July 14, 1958",['United Kingdom'],"['Pinewood Studios, Iver Heath, Buckinghamshire, England, UK (studio: made at Pinewood Studios, London, England)']",['The Rank Organisation'],,"['Drama', 'Romance', 'War']",['English']
283. The Party Crashers,1958,1h 18m,Unrated,5.6,150,,"An unruly teenage gang led by Mark Damon gets their kicks by crashing square teen parties around town. At an innocent teen gathering, Damon charms rich spoiled brat Connie Stevens into accompanying him to a motel party and she drags along her decent young date (ex-child star Bobby Driscoll). While there, Damon discovers his alcoholic mother (Doris Dowling), who falls down a flight of stairs while struggling to get away from her son. Along the way, the kids' parents provide the viewer with insight about their children's troubled lives. The final film of both Farmer and Driscoll before they moved to television work.",https://www.imdb.com/title/tt0052049/?ref_=sr_i_283,"['William Alland', 'Bernard Girard', 'Dan Lundberg']",['Bernard Girard'],"['Connie Stevens', 'Bobby Driscoll', 'Mark Damon', 'Frances Farmer', 'Doris Dowling', 'Walter Brooke', 'Cathy Lewis', 'Denver Pyle', 'Theodora Davitt', 'Robert Paget']",,,,,September 1958,['United States'],"['Paramount Studios - 5555 Melrose Avenue, Hollywood, Los Angeles, California, USA (Studio)']",['Paramount Pictures'],,['Drama'],['English']
284. The Strange World of Planet X,1958,1h 15m,Approved,4.8,1.4K,,"A friendly visitor from outer space warns against conducting experiments with the Earth's magnetic field, that could mutate insects into giant monsters.",https://www.imdb.com/title/tt0051020/?ref_=sr_i_284,"['Paul Ryder', 'Rene Ray']",['Gilbert Gunn'],"['Forrest Tucker', 'Gaby André', 'Martin Benson', 'Alec Mango', 'Wyndham Goldie', 'Hugh Latimer', 'Dandy Nichols', 'Richard Warner', 'Patricia Sinclair', 'Geoffrey Chater']",,,,,"December 31, 1958",['United Kingdom'],"['High Canons, Buckettsland Lane, Well End, Hertfordshire, England, UK']","['George Maynard Productions', 'Artistes Alliance Ltd.']",,"['Kaiju', 'Drama', 'Horror', 'Sci-Fi']",['English']
285. She Gods of Shark Reef,1958,1h 3m,Approved,2.8,1.2K,,"Two brothers, one wanted for murder, are shipwrecked on an island inhabited by nubile young women who have amassed a valuable cache of pearls.",https://www.imdb.com/title/tt0052188/?ref_=sr_i_285,"['Robert Hill', 'Victor Stoloff']",['Roger Corman'],"['Bill Cord', 'Don Durant', 'Lisa Montell', 'Jeanne Gerson', 'Carol Lindsay', 'Ed Nelson', 'Beverly Rivera']","$50,000 (estimated)",,,,August 1958,['United States'],"[""Kaua'i, Hawaii, USA""]",['Ludwig H. Gerber Productions'],,['Adventure'],['English']
286. The Restless Years,1958,1h 26m,Approved,6.3,253,,High-school life and the prejudices and moral values of small-town USA during the 1950s.,https://www.imdb.com/title/tt0052129/?ref_=sr_i_286,"['Edward Anhalt', 'Patricia Joudry']",['Helmut Käutner'],"['John Saxon', 'Sandra Dee', 'Teresa Wright', 'James Whitmore', 'Luana Patten', 'Margaret Lindsay', 'Virginia Grey', 'Jody McCrea', 'Alan Baxter', 'Hayden Rorke']",,,,,December 1958,['United States'],"['Universal Studios - 100 Universal City Plaza, Universal City, California, USA (Studio)']",['Universal International Pictures (UI)'],,"['Film Noir', 'Crime', 'Drama', 'Romance', 'Thriller']",['English']
287. Andy Hardy Comes Home,1958,1h 20m,Approved,5.9,550,,"Andy Hardy, now a grown man with a wife and children, returns to his hometown on a business trip and finds himself getting mixed up in local politics.",https://www.imdb.com/title/tt0051360/?ref_=sr_i_287,"['Aurania Rouverol', 'Edward Everett Hutshing', 'Robert Morris Donley']",['Howard W. Koch'],"['Mickey Rooney', 'Patricia Breslin', 'Fay Holden', 'Cecilia Parker', 'Sara Haden', 'Joey Forman', 'Jerry Colonna', 'Vaughn Taylor', 'Frank Ferguson', 'William Leslie']","$313,000 (estimated)",,,,"June 1, 1959",['United States'],"['Metro-Goldwyn-Mayer Studios - 10202 W. Washington Blvd., Culver City, California, USA']",['Fryman Enterprises'],,['Comedy'],['English']
288. Windjammer: The Voyage of the Christian Radich,1958,2h 22m,Approved,7.5,307,,"Windjammer, the first presentation in CINEMIRACLE, is the record of a training cruise of the full-rigged S/S Christian Radich from Oslo across the Atlantic, through the Caribbean, to New York and back home again.",https://www.imdb.com/title/tt0052397/?ref_=sr_i_288,"['A.J. Villiers', 'James L. Shute']","['Bill Colleran', 'Louis De Rochemont III']","['Bjørn Amvik', 'Arne Andersen', 'Per Antonsen', 'Niels Arntsen', 'Svein Aske', 'Trygve Bendiksen', 'Tore Bilet', 'Sigurd Borgen', 'Boston Pops Orchestra', 'Erik Bye']",,,"$6,757",,"April 25, 1958",['United States'],"['Charlotte Amalie, St. Thomas, U.S. Virgin Islands']",['Cinemiracle Productions'],"Awards, 1 win & 1 nomination total","['Documentary', 'Romance']",['English']
"289. Aphrodite, Goddess of Love",1958,1h 31m,,5.7,138,,"The construction of great temple dedicated to the goddess Aphrodite, followed by new and high taxes and the arrival of a plague, create discontent in the population, and threatens the love between a sculptor and a slave.",https://www.imdb.com/title/tt0051342/?ref_=sr_i_289,"['Mario Bonnard', 'Sergio Leone', 'Alberto Manca']",['Mario Bonnard'],"['Isabelle Corey', 'Anthony Steffen', 'Irène Tunc', 'Ivo Garrani', 'Giulio Donnini', 'Carlo Tamberlani', 'Gian Paolo Rosmino', 'Andrea Aureli', 'Matteo Spinola', 'Adriano Micantoni']",,,,,"August 29, 1958",['Italy'],"['Incir De Paolis Studios, Rome, Lazio, Italy (Palace grounds and interior)']",['Schermi Produzione'],,"['Drama', 'History']",['Italian']
290. Eva Wants to Sleep,1958,1h 35m,,7.2,562,,"A young female student arrives in a new city, and finds herself in a confusing situation: there is no place for her for sleeping. An incredible odyssey through the endless maze of night streets is ahead.",https://www.imdb.com/title/tt0051598/?ref_=sr_i_290,"['Tadeusz Chmielewski', 'Andrzej Czekalski', 'Jeremi Przybora']",['Tadeusz Chmielewski'],"['Barbara Lass', 'Stanislaw Mikulski', 'Stefan Bartik', 'Ludwik Benoit', 'Maria Kaniewska', 'Roman Klosowski', 'Waclaw Kowalski', 'Gustaw Lutkiewicz', 'Stanislaw Milski', 'Wladyslaw Osto-Suski']",,,,,"March 17, 1958",['Poland'],"['Grodzka, Piotrków Trybunalski, Lódzkie, Poland']",['Syrena'],"Awards, 2 wins & 1 nomination total","['Satire', 'Adventure', 'Comedy', 'Crime']",['Polish']
291. Tank Battalion,1958,1h 20m,Approved,4.0,203,,"Four men in their tank, during the Korean War in 1951, find themselves behind enemy lines.",https://www.imdb.com/title/tt0051052/?ref_=sr_i_291,"['Richard Bernstein', 'George Waters']",['Sherman A. Rose'],"['Don Kelly', 'Leslie Parrish', 'Edward G. Robinson Jr.', 'Frank Gorshin', 'Regina Gleason', 'BarBara Luna', 'Robert Paget', 'Mark Sheeler', 'Baynes Barron', 'Tetsu Komai']",,,,,July 1958,['United States'],,"['Iron Foxhole Inc.', 'Viscount Films - Terry Moore Production']",,"['Drama', 'War']",['English']
292. Letter from Siberia,1958,1h 2m,,7.4,967,,A witty examination of life and culture in Siberia.,https://www.imdb.com/title/tt0050633/?ref_=sr_i_292,['Chris Marker'],['Chris Marker'],['Georges Rouquier'],,,,,"October 29, 1958",['France'],"['Angarsk, Russia (planned city, founded in 1948)']","['Argos Films', 'Procinex']",,['Documentary'],['French']
293. I Accuse!,1958,1h 39m,Approved,7.2,783,,"In 1894 France, a Jewish officer in the French Army is falsely accused of spying for Germany.",https://www.imdb.com/title/tt0051754/?ref_=sr_i_293,"['Gore Vidal', 'Nicholas Halasz']",['José Ferrer'],"['José Ferrer', 'Anton Walbrook', 'Viveca Lindfors', 'Leo Genn', 'Emlyn Williams', 'David Farrar', 'Donald Wolfit', 'Herbert Lom', 'Harry Andrews', 'Felix Aylmer']","$1,800,000 (estimated)",,,,"March 6, 1958","['United Kingdom', 'United States']","['London, England, UK']",['Metro-Goldwyn-Mayer British Studios'],,"['Biography', 'Drama', 'History']",['English']
294. Tread Softly Stranger,1958,1h 30m,Not Rated,6.7,592,,"An irresistible temptress causes trouble between two brothers after the more handsome, charismatic one turns up, leading to robbery and death.",https://www.imdb.com/title/tt0052315/?ref_=sr_i_294,"['Jack Popplewell', 'George Minter', ""Denis O'Dell""]",['Gordon Parry'],"['Diana Dors', 'George Baker', 'Terence Morgan', 'Patrick Allen', 'Jane Griffiths', 'Joseph Tomelty', 'Thomas Heathcote', 'Russell Napier', 'Norman MacOwan', 'Maureen Delaney']",,,,,"September 1, 1959",['United Kingdom'],"['Rotherham, South Yorkshire, England, UK']",['George Minter Productions'],,"['Crime', 'Drama']",['English']
295. Voice in the Mirror,1958,1h 43m,Approved,6.7,189,,"Jim Burton has become a chronic alcoholic since the death of his young daughter, and is cared for by his hard-working wife. A doctor's warning that Jim could become mentally ill strikes enough fear into him that he really wants to cure himself, but he can't. One night, he meets William Tobin, a fellow drunk, and finds that he helps himself by trying to help Tobin. Thus is born, amid setbacks, a group resembling Alcoholics Anonymous.",https://www.imdb.com/title/tt0052373/?ref_=sr_i_295,['Lawrence B. Marcus'],['Harry Keller'],"['Richard Egan', 'Julie London', 'Walter Matthau', 'Troy Donahue', 'Harry Bartell', 'Peggy Converse', 'Ann Doran', 'Mae Clarke', 'Max Showalter', 'Hugh Sanders']",,,,,"December 23, 1958",['United States'],"['Universal Studios - 100 Universal City Plaza, Universal City, California, USA (Studio)']",['Universal International Pictures (UI)'],,"['Drama', 'Romance', 'Thriller']",['English']
296. Orders to Kill,1958,1h 33m,,7.1,810,,American agent faces an engrossing moral dilemma when he is parachuted into France to eliminate a suspected traitor in the French Resistance.,https://www.imdb.com/title/tt0052033/?ref_=sr_i_296,"['Paul Dehn', 'George St. George', 'Donald Downes']",['Anthony Asquith'],"['Eddie Albert', 'Paul Massie', 'Lillian Gish', 'James Robertson Justice', 'Leslie French', 'Irene Worth', 'John Crawford', 'Lionel Jeffries', 'Nicholas Phipps', 'Sandra Dorne']",,,,,"April 13, 1958",['United Kingdom'],"['Shepperton Studios, Shepperton, Surrey, England, UK (studio: made at Shepperton Studios England)']","['Lynx Films Ltd.', 'British Lion Films']","Won 3 BAFTA Awards, 3 wins & 4 nominations total","['Drama', 'Thriller', 'War']","['English', 'French', 'German']"
297. Blitzmädels an die Front,1958,1h 27m,,6.8,33,,"During WWII The German 'Wehrmacht' is heavily under fire after the invasion of Normandy. There are also a lot of women participating in the war, working at the front line as couriers for the air force. In this war, everyday, they put their lives on the line.",https://www.imdb.com/title/tt0051417/?ref_=sr_i_297,['Hans Hellmut Kirst'],['Werner Klingler'],"['Eva Ingeborg Scholz', 'Antje Geerk', 'Edith Elmay', 'Bert Fortell', 'Horst Frank', 'Klausjürgen Wussow', 'Werner Peters', 'Nana Osten', 'Uta Hallant', 'Claudia Gerstäcker']",,,,,1959,['West Germany'],,['Hübler-Kahla Film'],,['War'],['German']
298. Our Virgin Island,1958,1h 24m,,5.8,169,,Two newlyweds buy a small private island in the British Virgin Islands and live a happy life without the comforts of modern society.,https://www.imdb.com/title/tt0052370/?ref_=sr_i_298,"['Pat Jackson', 'Ring Lardner Jr.', 'Robb White']",['Pat Jackson'],"['John Cassavetes', 'Virginia Maskell', 'Sidney Poitier', 'Isabel Dean', 'Colin Gordon', 'Howard Marion-Crawford', 'Edric Connor', 'Ruby Dee', 'Gladys Boot', 'Julian Mayfield']",,,,,October 1958,['United Kingdom'],['Virgin Islands'],"['British Lion Film Corporation', 'Countryman Films']",,"['Adventure', 'Drama', 'Romance']",['English']
299. Mardi Gras,1958,1h 47m,Approved,5.4,257,,"Military school cadet Boone wins a date with a French movie goddess (Carère) who happens to be the queen of the Mardi Gras parade. They fall in love, but Carère's movie studio wants to capitalize on this newly found love for publicity.",https://www.imdb.com/title/tt0051908/?ref_=sr_i_299,"['Winston Miller', 'Hal Kanter', 'Curtis Harrington']",['Edmund Goulding'],"['Pat Boone', 'Christine Carère', 'Tommy Sands', 'Sheree North', 'Gary Crosby', 'Fred Clark', 'Dick Sargent', 'Barrie Chase', 'Jennifer West', 'Geraldine Wall']",,,,,"November 18, 1958",['United States'],"['New Orleans, Louisiana, USA']",['Twentieth Century Fox'],"Nominated for 1 Oscar, 1 win & 2 nominations total",['Musical'],['English']
"300. Moi, un noir",1958,1h 10m,Not Rated,7.3,1.2K,,"A life of Nigerien immigrants in Abidjan, Ivory Coast within a week.",https://www.imdb.com/title/tt0051942/?ref_=sr_i_300,['Jean Rouch'],['Jean Rouch'],"['Oumarou Ganda', 'Gambi', 'Petit Touré', 'Alassane Maiga', 'Amadou Demba', 'Seydou Guede', 'Karidyo Faoudou', 'Jean Rouch']",,,,,1958,['France'],"['Abidjan, Ivory Coast (main location)']",['Les Films de la Pléiade'],"Awards, 2 wins total",['Drama'],"['Italian', 'French']"
301. Soldaterkammerater,1958,1h 30m,,6.3,468,,"Every year, thousands of young men are summoned to undergo an education where completely different demands are made than in civilian life. The soldiers must be in perfect physical form and they must learn to deal with modern weapons.",https://www.imdb.com/title/tt0052214/?ref_=sr_i_301,"['Bob Ramsing', 'Henrik Sandberg']",['Sven Methling'],"['Paul Hagen', 'Louis Miehe-Renard', 'Ebbe Langberg', 'Preben Kaas', 'Klaus Pagh', 'Ole Dixon', 'Svend Johansen', 'Carl Ottosen', 'Henrik Rosing Wiehe', 'Emil Hass Christensen']",,,,,"October 17, 1958",['Denmark'],"['Sandholmlejren, Birkerød, Sjælland, Denmark (barracks)']",['Merry Film'],,['Comedy'],['Danish']
302. Cop Hater,1958,1h 15m,Not Rated,6.3,605,,The hardworking detectives of the 87th Precinct in an unnamed city during a massive heat wave investigate the seemingly random murders of policemen.,https://www.imdb.com/title/tt0051489/?ref_=sr_i_302,"['Evan Hunter', 'Henry Kane']",['William Berke'],"['Robert Loggia', ""Gerald S. O'Loughlin"", 'Ellen Parker', 'Shirley Ballard', 'Russell Hardie', 'Hal Riddle', 'Bill Neff', 'Gene Miller', 'Vincent Gardenia', 'John Gerstad']",,,,,"October 1, 1958",['United States'],"['New York City, New York, USA']",['Barbizon Productions Inc.'],,"['Film Noir', 'Crime', 'Drama', 'Mystery']","['English', 'American Sign Language']"
303. Blind Spot,1958,1h 12m,,5.2,253,,A blind American Army officer becomes involved in a murder mystery and solves it after regaining his sight.,https://www.imdb.com/title/tt0051416/?ref_=sr_i_303,"['Kenneth R. Hayles', 'Robert S. Baker']",['Peter Maxwell'],"['Robert MacKenzie', 'Delphi Lawrence', 'Gordon Jackson', 'Anne Sharp', 'John Le Mesurier', 'George Pastell', 'Ernest Clark', ""Ronan O'Casey"", 'Andrew Faulds', 'Robert Gallico']",,,,,July 1958,['United Kingdom'],"['Walton Studios, Walton-on-Thames, Surrey, England, UK (studio: made at)']","[""Butcher's Film Service""]",,"['Crime', 'Drama', 'Mystery']",['English']
304. The Case Against Brooklyn,1958,1h 22m,Approved,6.5,589,,"Fact-based story of a rookie cop who takes on a crime syndicate involved in corrupting government officials in Brooklyn, New York.",https://www.imdb.com/title/tt0051456/?ref_=sr_i_304,"['Ed Reid', 'Daniel B. Ullman', 'Bernard Gordon']",['Paul Wendkos'],"['Darren McGavin', 'Margaret Hayes', 'Warren Stevens', 'Peggy McCay', 'Tol Avery', 'Emile Meyer', 'Nestor Paiva', 'Brian G. Hutton', 'Robert Osterloh', 'Joe Turkel']",,,,,June 1958,['United States'],"['Brooklyn Borough Hall - Downtown Brooklyn, Brooklyn, New York City, New York, USA (Establishing shot used as the office building for District Attorney Michael W. Norris)']",['Morningside Productions'],,"['Film Noir', 'True Crime', 'Crime', 'Drama']",['English']
305. 12 O'Clock,1958,2h 12m,Not Rated,7.3,109,,"Bani Chowdhury and solicitor Ajoy Kumar are deeply in love with each other. But their world comes crashing down when Bani's cousin, Maya is found dead in the first class compartment at a railway terminus in Bombay. Bani who had gone to the station to receive Maya, is charged with the murder. A distraught Ajoy with the help of his assistant Motilal Sharma begins to comb the country for every available clue. And just when everything seems lost he gets a breakthrough.",https://www.imdb.com/title/tt0051335/?ref_=sr_i_305,['Tanveer Farooqi'],['Pramod Chakravorty'],"['Guru Dutt', 'Waheeda Rehman', 'Shashikala Jawalkar', 'Rehman Khan', 'Johnny Walker', 'Sabita Chatterjee', 'Hari Shivdasani', 'Rajan Kapoor', 'Tun Tun', 'Amrit Rana']",,,,,"January 1, 1958",['India'],['India'],['NH Studioz'],,"['Crime', 'Drama', 'Mystery', 'Thriller']",['Hindi']
306. This Angry Age,1958,1h 40m,,5.8,255,,"During the 1950s, in French Indochina, the Dufresne family struggles to survive amid harsh economic times and natural disasters.",https://www.imdb.com/title/tt0051400/?ref_=sr_i_306,"['René Clément', 'Marguerite Duras', 'Diego Fabbri']",['René Clément'],"['Silvana Mangano', 'Anthony Perkins', 'Richard Conte', 'Jo Van Fleet', 'Nehemiah Persoff', 'Yvonne Sanson', 'Shao-Chuan Chu', 'Guido Celano', 'Alida Valli', 'Larry Williams']",,,,,"February 14, 1958","['Italy', 'France', 'United States']","['Cinecittà Studios, Cinecittà, Rome, Lazio, Italy (Studio)']",['Dino de Laurentiis Cinematografica'],"Awards, 4 nominations total",['Drama'],"['English', 'Italian']"
307. The Electronic Monster,1958,1h 16m,Approved,4.6,226,,An insurance investigator finds there's more to electronic dream therapy than meets the eye.,https://www.imdb.com/title/tt0051576/?ref_=sr_i_307,"['Charles Eric Maine', 'J. McLaren Ross']","['Montgomery Tully', 'David Paltenghi']","['Rod Cameron', 'Mary Murphy', 'Meredith Edwards', 'Peter Illing', 'Carl Jaffe', 'Kay Callard', 'Carl Duering', 'Roberta Huby', 'Felix Felton', 'Larry Cross']","$125,000 (estimated)",,,,May 1960,['United Kingdom'],"['Merton Park Studios, Merton, London, England, UK (interiors)']",['Anglo-Guild Productions'],,"['Crime', 'Horror', 'Mystery', 'Sci-Fi']","['English', 'French']"
308. Onionhead,1958,1h 51m,Approved,5.9,680,,"In 1941, an Oklahoma college graduate joins the US Coast Guard and serves as a cook on a ship based in Boston.",https://www.imdb.com/title/tt0052030/?ref_=sr_i_308,"['Nelson Gidding', 'Weldon Hill']",['Norman Taurog'],"['Andy Griffith', 'Felicia Farr', 'Walter Matthau', ""Erin O'Brien"", 'Joe Mantell', 'Ray Danton', 'James Gregory', 'Joey Bishop', 'Roscoe Karns', 'Claude Akins']","$960,000 (estimated)",,,,"October 25, 1958",['United States'],"['Government Island, Alameda, California, USA (boot camp scenes)']",['Warner Bros.'],,"['Comedy', 'Drama', 'Romance', 'War']",['English']
309. Quantrill's Raiders,1958,1h 8m,Approved,5.5,321,,A Civil War guerilla gang plans an attack on a Kansas arsenal.,https://www.imdb.com/title/tt0052103/?ref_=sr_i_309,['Polly James'],['Edward Bernds'],"['Steve Cochran', 'Diana Brewster', 'Leo Gordon', 'Gale Robbins', 'Will Wright', 'Kim Charney', 'Myron Healey', 'Robert Foulk', 'Glenn Strange', 'Lane Chandler']",,,,,"April 27, 1958",['United States'],"['Hollywood, California, USA']",['Allied Artists Pictures'],,['Western'],['English']
310. The Deep Six,1958,1h 45m,Approved,6.0,570,,"Called to active duty during World War II, U.S. Navy Reserve lieutenant Alec Austin struggles to do his military duties while observing his Quaker beliefs, to the dismay of his comrades.",https://www.imdb.com/title/tt0050298/?ref_=sr_i_310,"['John Twist', 'Harry Brown', 'Martin Rackin']",['Rudolph Maté'],"['Alan Ladd', 'Dianne Foster', 'William Bendix', 'Keenan Wynn', 'James Whitmore', 'Efrem Zimbalist Jr.', 'Joey Bishop', 'Barbara Eiler', 'Ross Bagdasarian', 'Jeanette Nolan']",,,,,"March 9, 1958",['United States'],"['The Lodge at Pebble Beach, California, USA (where the couple goes to get married)']",['Jaguar Productions'],,"['Drama', 'War']","['English', 'Armenian']"
311. Sea Fury,1958,1h 24m,,6.0,241,,"Off the Spanish coast, two tug-boat captains are caught in a violent feud over a woman but their rivalry is set aside when a sinking freighter carrying explosives must be salvaged and towed to port.",https://www.imdb.com/title/tt0052170/?ref_=sr_i_311,"['John Kruse', 'Cy Endfield']",['Cy Endfield'],"['Stanley Baker', 'Victor McLaglen', 'Luciana Paluzzi', 'Grégoire Aslan', 'Francis De Wolff', 'David Oxley', 'George Murcell', 'Percy Herbert', 'Rupert Davies', 'Robert Shaw']",,,,,"January 26, 1959",['United Kingdom'],"['Estartit, Girona, Catalonia, Spain']","['The Rank Organisation', 'Aqua Film Productions', 'S. Benjamin Fisz Productions']",,"['Action', 'Adventure', 'Drama', 'Romance']",['English']
312. Black Cat Mansion,1958,1h 9m,,6.5,539,,"The descendant of the servant of a cruel and vicious samurai returns to the town where she was born, only to find that a cat who is possessed by the spirits of those murdered by the samurai is trying to kill her.",https://www.imdb.com/title/tt0202268/?ref_=sr_i_312,"['Jiro Fujishima', 'Yoshihiro Ishikawa', 'Sotoo Tachibana']",['Nobuo Nakagawa'],"['Toshio Hosokawa', 'Midori Chikuma', 'Yuriko Ejima', 'Fujie Satsuki', 'Shinzô Shibata', 'Takashi Wada', 'Haruhiko Nakagawa', 'Fumiko Miyata', 'Noriko Kitazawa', 'Hiroaki Kurahashi']",,,,,"July 13, 1958",['Japan'],"['Kyushu, Japan']",['Shintôhô Pictures'],,"['Drama', 'Horror']",['Japanese']
313. The Bonnie Parker Story,1958,1h 19m,Approved,5.8,500,,"In the 1930s, amoral blonde tommy-gun girl Bonnie Parker cut a swath of bodies across the South-West. Starting out on gas stations and bars with side-kick Guy Darrow she graduated to bank hold-ups with Darrow's brother and, after bloodily springing him, her jailed husband. But there was never any doubt who was in charge.",https://www.imdb.com/title/tt0051430/?ref_=sr_i_313,['Stanley Shpetner'],['William Witney'],"['Dorothy Provine', 'Jack Hogan', 'Richard Bakalyan', 'Joe Turkel', 'William Stevens', 'Ken Lynch', 'Douglas Kennedy', 'Patricia Huston', 'Joël Colin', 'Jeff Morris']",,,,,"May 28, 1958",['United States'],,['Albany Productions'],,"['Film Noir', 'Biography', 'Crime']",['English']
314. The Cool and the Crazy,1958,1h 18m,,5.1,264,,High school thug is front man for a local marijuana ring.,https://www.imdb.com/title/tt0051488/?ref_=sr_i_314,['Richard C. Sarafian'],['William Witney'],"['Scott Marlowe', 'Richard Bakalyan', 'Gigi Perreau', 'Dickie Jones', 'Shelby Storck', 'Marvyn J. Rosen', 'Caroline von Mayrhauser', 'Ken Plumb', 'Robert Hadden', 'Joe Adelman']",,,,,March 1958,['United States'],"['Kansas City, Missouri, USA']",['Imperial Productions Inc. (III)'],,['Drama'],['English']
315. Kommunist,1958,1h 51m,,7.1,377,,A devoted struggle for better life.,https://www.imdb.com/title/tt0051827/?ref_=sr_i_315,['Yevgeny Gabrilovich'],['Yuli Raizman'],"['Evgeniy Urbanskiy', 'Sofya Pavlova', 'Evgeniy Shutov', 'Boris Smirnov', 'Sergey Yakovlev', 'Valentin Zubkov', 'V. Adlerov', 'Nina Belyayeva', 'Stepan Borisov', 'Ivan Kashirin']",,,,,"February 9, 1958",['Soviet Union'],"['Rostov, Yaroslavskaya oblast, Russia']",['Mosfilm'],,"['Drama', 'History', 'Romance']",['Russian']
316. Conflagration,1958,1h 39m,,7.0,1K,,"Follows Mizoguchi, an aspiring Buddhist monk who became involved in the temple that was owned by his father. Through a series of flashbacks, framed as a police interrogation, Mizoguchi unravels the story of his obsession with the temple beginning with his childhood.",https://www.imdb.com/title/tt0051584/?ref_=sr_i_316,"['Keiji Hasebe', 'Kon Ichikawa', 'Yukio Mishima']",['Kon Ichikawa'],"['Raizô Ichikawa', 'Ganjirô Nakamura', 'Tatsuya Nakadai', 'Yôichi Funaki', 'Tamao Nakamura', 'Jun Hamamura', 'Tanie Kitabayashi', 'Michiyo Aratama', 'Kinzô Shin', 'Yôko Uraji']",,,,,"August 19, 1958",['Japan'],,"['Daiei Kyoto', 'Daiei']","Awards, 6 wins & 1 nomination total",['Drama'],"['Japanese', 'English']"
317. The Doctor's Dilemma,1958,1h 39m,Approved,5.8,524,,"A single doctor about to be awarded a knighthood for his claim of curing tuberculosis is infatuated by a woman's beauty and charm, promising to save her husband's life, only to change his mind after discovering the man's immoral character.",https://www.imdb.com/title/tt0052744/?ref_=sr_i_317,"['George Bernard Shaw', 'Anatole de Grunwald']",['Anthony Asquith'],"['Leslie Caron', 'Dirk Bogarde', 'Alastair Sim', 'Robert Morley', 'John Robinson', 'Felix Aylmer', 'Michael Gwynn', 'Maureen Delaney', 'Alec McCowen', 'Colin Gordon']","$576,000 (estimated)",,,,January 1959,['United Kingdom'],"['MGM British Studios, Borehamwood, Hertfordshire, England, UK (Studio)']","['De Grunwald Productions', 'Metro-Goldwyn-Mayer British Studios']",,"['Comedy', 'Drama']",['English']
