Title,Year,Duration,MPA,Rating,Votes,méta_score,description,Movie Link,writers,directors,stars,budget,opening_weekend_Gross,grossWorldWWide,gross_US_Canada,release_date,countries_origin,filming_locations,production_company,awards_content,genres,Languages
138. The Loves of Edgar Allan Poe,1942,1h 7m,Approved,5.6,233,,"Edgar Allan Poe led an unhappy childhood, broken only by the unceasing devotion of his foster mother, Mrs. Frances Allan, whose loving ministrations gave him courage to carry out his desire to write. His first love was Elmira Royster, and though she married another while he was at the University of Virginia, he could never purge his thoughts of her and, under the influence of her spell, he poured out the deepest passions of his heart. After a discouraging period during which he was disowned by his foster father and lost his appointment to West Point, he found the love that tamed his restless heart with Virginia Clemm. After he and Virginia married, Poe did his greatest creative work, writing for the Southern Literary Messenger and Graham's Magazine.",https://www.imdb.com/title/tt0034997/?ref_=sr_i_138,"['Arthur Caesar', 'Bryan Foy', 'Samuel Hoffenstein']",['Harry Lachman'],"['Linda Darnell', 'Shepperd Strudwick', 'Virginia Gilmore', 'Jane Darwell', 'Mary Howard', 'Frank Conroy', 'Harry Morgan', 'Walter Kingsford', 'Morris Ankrum', 'Skippy Wanders']",,,,,"August 28, 1942",['United States'],"['20th Century Fox Studios - 10201 Pico Blvd., Century City, Los Angeles, California, USA (Studio)']",['Twentieth Century Fox'],,"['Biography', 'Drama']",['English']
139. We the Living,1942,2h 50m,Not Rated,7.2,434,,"The time is the Russian Revolution. The place is a country burdened with fear - the midnight knock at the door, the bread hidden against famine, the haunted eyes of the fleeing, the grublike fat of the appeasers and oppressors. In a bitter struggle of the individual against the collective, three people stand forth with the mark of the unconquered in their bearing: Kira, who wants to be a builder, and the two men who love her - Leo, an aristocrat, and Andrei, a Communist. In their tensely dramatic story, Ayn Rand shows what the theories of Communism mean in practice. We the Living is not a story of politics but of the men and women who have to struggle for existence behind the Red banners and slogans. It is a picture of what dictatorship - of any kind - does to human beings, what kind of men are able to survive, and which of them remain as the ultimate winners. What happens to the defiant ones? What happens to those who succumb? Who are the winners in this conflict? Against a vivid panorama of political revolution and personal revolt, Ayn Rand offers an answer that challenges the modern conscience.",https://www.imdb.com/title/tt0035130/?ref_=sr_i_139,"['Ayn Rand', 'Corrado Alvaro', 'Orio Vergani']",['Goffredo Alessandrini'],"['Fosco Giachetti', 'Alida Valli', 'Rossano Brazzi', 'Giovanni Grasso', 'Emilio Cigoli', 'Annibale Betrone', 'Elvira Betrone', 'Sennuccio Benelli', 'Gioia Collei', 'Bianca Doria']",,,,,"October 20, 1942",['Italy'],"['Scalera Studios, Rome, Lazio, Italy (Studio)']","['Era Film', 'Scalera Film']","Awards, 1 win & 1 nomination total","['Adventure', 'Drama', 'Romance', 'War']",['Italian']
140. Pardon My Sarong,1942,1h 24m,Approved,6.8,2.5K,,"A pair of bus drivers accidentally steal their own bus. With the company issuing a warrant for their arrest, they tag along with a playboy on a boat trip that finds them on a tropical island, where a jewel thief has sinister plans for them.",https://www.imdb.com/title/tt0035173/?ref_=sr_i_140,"['True Boardman', 'Nat Perrin', 'John Grant']",['Erle C. Kenton'],"['Bud Abbott', 'Lou Costello', 'Virginia Bruce', 'Robert Paige', 'Lionel Atwill', 'Leif Erickson', 'Nan Wynn', 'William Demarest', 'Samuel S. Hinds', 'Marie McDonald']","$400,000 (estimated)",,,,"August 7, 1942",['United States'],"['Salton Sea, California, USA']","['Mayfair Productions Inc.', 'Universal Pictures']","Awards, 1 nomination total","['Farce', 'Slapstick', 'Comedy']",['English']
"141. Take a Letter, Darling",1942,1h 32m,Approved,6.8,619,,"A struggling painter takes a job as a secretary to a female advertising executive. While working to obtain an account from a tobacco company, they end up falling in love.",https://www.imdb.com/title/tt0035413/?ref_=sr_i_141,"['Claude Binyon', 'George Beck']",['Mitchell Leisen'],"['Rosalind Russell', 'Fred MacMurray', 'Macdonald Carey', 'Constance Moore', 'Robert Benchley', 'Charles Arnt', 'Cecil Kellaway', 'Kathleen Howard', 'Margaret Seddon', 'Dooley Wilson']",,,,,"May 6, 1942",['United States'],"['Big Bear Lake, Big Bear Valley, San Bernardino National Forest, California, USA']",['Paramount Pictures'],"Nominated for 3 Oscars, 3 wins & 3 nominations total","['Comedy', 'Romance']",['English']
142. Fingers at the Window,1942,1h 20m,Approved,6.3,1.2K,,"An unemployed actor in Chicago aims to solve the mystery concerning a string of axe murders, apparently committed by a ""lunatic"".",https://www.imdb.com/title/tt0034732/?ref_=sr_i_142,"['Rose Caylor', 'Lawrence P. Bachmann']",['Charles Lederer'],"['Lew Ayres', 'Laraine Day', 'Basil Rathbone', 'Walter Kingsford', 'Miles Mander', 'Charles D. Brown', 'Cliff Clark', 'James Flavin', 'Russell Gleason', 'William Tannen']","$320,000 (estimated)",,,,"September 15, 1942",['United States'],"['Metro-Goldwyn-Mayer Studios - 10202 W. Washington Blvd., Culver City, California, USA (Studio)']",['Metro-Goldwyn-Mayer (MGM)'],,"['Film Noir', 'Crime', 'Drama', 'Mystery', 'Thriller']",['English']
143. Meet the Stewarts,1942,1h 13m,Approved,6.1,398,,"A young newlywed couple learns to make their new marriage work; trying to impress family, stay on budget, and remain as diplomatic towards each other as possible.",https://www.imdb.com/title/tt0035052/?ref_=sr_i_143,"['Karen DeWolf', 'Elizabeth Dunn']",['Alfred E. Green'],"['William Holden', 'Frances Dee', 'Grant Mitchell', 'Marjorie Gateson', 'Anne Revere', 'Roger Clark', 'Danny Mummert', 'Ann Gillis', 'Margaret Hamilton', 'Don Beddoe']",,,,,"October 30, 1942",['United States'],,['Columbia Pictures'],,['Comedy'],"['English', 'Cantonese']"
144. The Lone Prairie,1942,58m,Approved,6.0,42,,"Lucky Dawson and his pal Bob Wills and the Texas Playboys (Leon McAuliffe, Millard Kelso, Joe Holley, Harley Huggins and Luke Wills) ride into the town of Rimrock, which is under the ruthless control of Lafe Kinney and his chief lieutenant Ed Slade.",https://www.imdb.com/title/tt0034990/?ref_=sr_i_144,"['J. Benton Cheney', 'Ed Earl Repp', 'Fred Myton']",['William Berke'],"['Russell Hayden', 'Dub Taylor', 'Bob Wills', 'Bob Wills and His Texas Playboys', 'Ernie Adams', 'Victor Adamson', 'Fred Burns', 'Steve Clark', 'Edmund Cobb', 'Victor Cox']",,,,,"October 15, 1942",['United States'],"['Corriganville, Ray Corrigan Ranch, Simi Valley, California, USA']",['Columbia Pictures'],,['Western'],['English']
145. Alias Boston Blackie,1942,1h 7m,Approved,6.4,714,,Blackie tracks down a wrongly convicted prisoner who escapes during a Christmas magic show.,https://www.imdb.com/title/tt0034445/?ref_=sr_i_145,"['Paul Yawitz', 'Jack Boyle']",['Lew Landers'],"['Chester Morris', 'Adele Mara', 'Richard Lane', 'George E. Stone', 'Lloyd Corrigan', 'Walter Sande', 'Larry Parks', 'George McKay', 'Cy Kendall', 'Paul Fix']",,,,,"April 2, 1942",['United States'],,['Columbia Pictures'],,"['Comedy', 'Crime', 'Drama', 'Mystery']",['English']
146. Andy Hardy's Double Life,1942,1h 32m,Approved,6.5,653,,College-bound Andy blurts marriage proposals to his sweetheart Polly and her pert swimmer friend Sheila.,https://www.imdb.com/title/tt0034458/?ref_=sr_i_146,"['Agnes Christine Johnston', 'Aurania Rouverol', 'Carey Wilson']",['George B. Seitz'],"['Lewis Stone', 'Mickey Rooney', 'Cecilia Parker', 'Fay Holden', 'Ann Rutherford', 'Sara Haden', 'Esther Williams', 'William Lundigan', 'Robert Pittard', 'Robert Blake']",,,,,December 1942,['United States'],"['Metro-Goldwyn-Mayer Studios - 10202 W. Washington Blvd., Culver City, California, USA']","[""Loew's""]",,"['Comedy', 'Family', 'Romance']",['English']
147. They Raid by Night,1942,1h 13m,Approved,4.4,303,,"The British Commandos send Bob Owen (Lyle Talbot) to Norway to prepare for a raid. His mission also includes freeing General Heden (Paul Baratoff) who is being held by the Nazis. His aides include Eric Falken (George Nesie) and Harry (Charles Rogers). Inga (June Duprez), a Norwegian girl to whom Falken was once engaged but who has become the sweetheart of Oberst Von Ritter (Victor Varconi), betrays their hiding place. The three overpower the Gestapo men sent after them, take their uniforms and enter the prison camp and free Heden. The four men then start for the coast to meet the Commando expedition. Inga, who the men still trust, again informs von Ritter and Falken is captured but Bob and Harry escape with the aid of Dalberg, who they thought was a Quisling stooge.",https://www.imdb.com/title/tt0035430/?ref_=sr_i_147,['Jack Natteford'],['Spencer Gordon Bennet'],"['Lyle Talbot', 'June Duprez', 'Victor Varconi', 'George N. Neise', 'Charley Rogers', 'Paul Baratoff', 'Leslie Denison', 'Crane Whitley', 'Sven Hugo Borg', 'Eric Wilton']",,,,,"June 19, 1942",['United States'],,['Producers Releasing Corporation (PRC)'],,"['Drama', 'War']",['English']
148. Cairo,1942,1h 41m,Approved,6.1,545,,Reporter Homer Smith accidentally draws Marcia Warren into his mission to stop Nazis from bombing Allied Convoys with robot-planes.,https://www.imdb.com/title/tt0034565/?ref_=sr_i_148,"['John McClain', 'Ladislas Fodor']",['W.S. Van Dyke'],"['Jeanette MacDonald', 'Robert Young', 'Ethel Waters', 'Reginald Owen', 'Grant Mitchell', 'Lionel Atwill', 'Eduardo Ciannelli', 'Mitchell Lewis', 'Dooley Wilson', 'Larry Nunn']",,,,,"August 17, 1942",['United States'],"['Metro-Goldwyn-Mayer Studios - 10202 W. Washington Blvd., Culver City, California, USA (Studio)']",['Metro-Goldwyn-Mayer (MGM)'],,"['Comedy', 'Drama', 'Musical', 'Romance']",['English']
149. Die goldene Stadt,1942,1h 50m,,6.1,290,,"Anna Jobst is the daughter of a rich, conservative farmer. Living on the bank of the Moldau, she wishes nothing more than follow the river to Prague, the ""Golden City"".",https://www.imdb.com/title/tt0034800/?ref_=sr_i_149,"['Richard Billinger', 'Alfred Braun', 'Werner Eplinius']",['Veit Harlan'],"['Kristina Söderbaum', 'Eugen Klöpfer', 'Annie Rosar', 'Dagny Servaes', 'Paul Klinger', 'Emmerich Hanus', 'Kurt Meisel', 'Rudolf Prack', 'Liselotte Schreiner', 'Hans Hermann Schaufuß']",,,,,"December 17, 1942",['Germany'],"['Banks of the River Moldau, Czech Republic']",['Universum Film (UFA)'],"Awards, 2 wins & 1 nomination total",['Drama'],['German']
150. Spy Smasher,1942,3h 35m,Approved,6.9,437,,"Alan Armstrong, aka Spy Smasher, battles a Nazi villain known as The Mask, who heads a gang of saboteurs determined to spread destruction across America.",https://www.imdb.com/title/tt0035372/?ref_=sr_i_150,"['Ronald Davidson', 'Norman S. Hall', 'William Lively']",['William Witney'],"['Kane Richmond', 'Marguerite Chapman', 'Sam Flint', 'Hans Schumm', 'Tristram Coffin', 'Franco Corsaro', 'Hans von Morhart', 'Georges Renavent', 'Rudolph Anders', 'Henry Zynda']","$153,682 (estimated)",,,,"April 4, 1942",['United States'],"['Iverson Ranch - 1 Iverson Lane, Chatsworth, Los Angeles, California, USA']",['Republic Pictures (I)'],,"['Superhero', 'Action', 'Adventure', 'Family']",['English']
151. Mr. and Mrs. North,1942,1h 7m,Approved,6.0,428,,"Jerry and Pam return home to find a dead body. It's Stanley Brent, husband of Pam's friend Carol. Clues suggest someone in their social circle committed the murder in their apartment. Pam's investigation inadvertently exposes the killer.",https://www.imdb.com/title/tt0033926/?ref_=sr_i_151,"['S.K. Lauren', 'Owen Davis', 'Richard Lockridge']",['Robert B. Sinclair'],"['Gracie Allen', 'William Post Jr.', 'Paul Kelly', 'Rose Hobart', 'Virginia Grey', 'Tom Conway', 'Felix Bressart', 'Stuart Crawford', 'Porter Hall', 'Millard Mitchell']",,,,,"April 28, 1943",['United States'],"['Grand Central Terminal, Manhattan, New York City, New York, USA (establishing shot)']",['Metro-Goldwyn-Mayer (MGM)'],,"['Comedy', 'Crime', 'Mystery', 'Romance']",['English']
152. Texas to Bataan,1942,56m,Approved,5.3,115,,"In the 17th of the 24 films in Monogram's ""Range Buster"" series, Texas ranch owner Conroy returns from Washington with an order for horses to be shipped to the Philippines. The Range Busters, Dusty, Davy and Alibi, are selected to take the horses there but, before leaving, they capture three spies who are trying to steal the horses and also learn that the ranch cook, Cookie, is a Japanese spy, but he manages to escape. In the Philippines, they go to a café for dinner and see Cookie and Miller, a German spy. Eavesdropping, they learn that Ken Richards, a neighboring Texas rancher, is the Axis contact back in the states. They capture Cookie and break up the spy ring in the Phillipines, and then return to Texas intent on settling matters with Richards. They do so and are honored by the U.S. Government just as the radio blares forth the December 7, 1941 announcement of the Pearl Harbor bombing. They head for the nearest enlistment station.",https://www.imdb.com/title/tt0035425/?ref_=sr_i_152,['Arthur Hoerl'],['Robert Emmett Tansey'],"[""John 'Dusty' King"", 'David Sharpe', 'Max Terhune', 'Elmer', 'Marjorie Manners', 'Steve Clark', 'Budd Buster', 'Escolastico Baucin', 'Frank Ellis', 'Kenne Duncan']",,,,,"October 16, 1942",['United States'],"['Corriganville, Ray Corrigan Ranch, Simi Valley, California, USA']",['Range Busters'],,"['Drama', 'War', 'Western']",['English']
153. The Wife Takes a Flyer,1942,1h 26m,Approved,6.2,167,,"Christopher Reynolds, an American flying with the R.A.F, is shot down over German-occupied Holland and is given shelter by a Dutch family. Posing as the insane husband of the daughter of the house, Anita Wolverman, Reynolds convinces the German officer quartered there, Major Zellfritz, with the necessity for her divorce decree to be granted. After the court hearing, Anita, goes to manage a home for retired ladies and, persuaded by Reynolds, tries to gain military information from the German officer. After her former husband escapes from the mental asylum, his exploits are blamed on Reynolds. With the help of the old ladies and Anita, who ""remarries"" him, Reynolds escapes to England in a stolen German airplane.",https://www.imdb.com/title/tt0035560/?ref_=sr_i_153,"['Gina Kaus', 'Jay Dratler', 'Harry Segall']",['Richard Wallace'],"['Joan Bennett', 'Franchot Tone', 'Allyn Joslyn', 'Cecil Cunningham', 'Roger Clark', 'Lloyd Corrigan', 'Lyle Latell', 'Georgia Caine', 'Barbara Brown', 'Erskine Sanford']",,,,,"April 28, 1942",['United States'],,['Columbia Pictures'],,"['Comedy', 'Romance', 'War']",['English']
154. Manila Calling,1942,1h 21m,Approved,6.8,188,,"During the Japanese invasion of the Philippines, a few Americans and a Filipino guerrilla unit seize a Japanese jungle base and use the radio transmitter to broadcast anti-Japanese propaganda, prompting retaliatory Japanese attacks.",https://www.imdb.com/title/tt0035033/?ref_=sr_i_154,['John Francis Larkin'],['Herbert I. Leeds'],"['Lloyd Nolan', 'Carole Landis', 'Cornel Wilde', 'James Gleason', 'Martin Kosleck', 'Ralph Byrd', 'Charles Tannen', 'Ted North', 'Elisha Cook Jr.', 'Harold Huber']",,,,,"October 16, 1942",['United States'],"['20th Century Fox Studios - 10201 Pico Blvd., Century City, Los Angeles, California, USA (Studio)']",['Twentieth Century Fox'],,"['Drama', 'War']",['English']
155. One Dangerous Night,1942,1h 17m,Approved,6.5,216,,The Lone Wolf tries to clear himself of a charge of murdering a blackmailer.,https://www.imdb.com/title/tt0036237/?ref_=sr_i_155,"['Arnold Lipp', 'Max Nosseck', 'Donald Davis']",['Michael Gordon'],"['Warren William', 'Eric Blore', 'Marguerite Chapman', 'Mona Barrie', 'Tala Birell', 'Margaret Hayes', 'Ann Savage', 'Thurston Hall', 'Warren Ashe', 'Fred Kelsey']",,,,,"January 22, 1943",['United States'],,['Columbia Pictures'],,"['Adventure', 'Crime', 'Drama', 'Romance']",['English']
156. Commandos Strike at Dawn,1942,1h 38m,Approved,6.5,1K,,"A gentle widower, enraged at German atrocities against his peaceful Norwegian fishing village, escapes to Britain and returns leading a commando force against the oppressors.",https://www.imdb.com/title/tt0035746/?ref_=sr_i_156,"['Irwin Shaw', 'C.S. Forester']",['John Farrow'],"['Paul Muni', 'Anna Lee', 'Lillian Gish', 'Cedric Hardwicke', 'Ray Collins', 'Robert Coote', 'Rosemary DeCamp', 'Alexander Knox', 'Elisabeth Fraser', 'Richard Derr']",,,,"$1,300,000","December 30, 1942",['United States'],"['Heals Rifle Range, Saanich, British Columbia, Canada (German Base)']",['Columbia Pictures'],"Nominated for 1 Oscar, 2 wins & 1 nomination total","['Drama', 'History', 'War']",['English']
157. Kid Glove Killer,1942,1h 14m,Approved,6.8,1.2K,,Crime lab expert Gordon McKay uses the latest forensic techniques to solve murders in a city plagued by political corruption and mob rackets.,https://www.imdb.com/title/tt0034941/?ref_=sr_i_157,"['Allen Rivkin', 'John C. Higgins']",['Fred Zinnemann'],"['Van Heflin', 'Marsha Hunt', 'Lee Bowman', 'Samuel S. Hinds', 'Cliff Clark', 'Eddie Quillan', 'John Litel', 'Cathy Lewis', 'Nella Walker', 'Ernie Alexander']","$199,000 (estimated)",,,,"September 10, 1942",['United States'],"['Metro-Goldwyn-Mayer Studios - 10202 W. Washington Blvd., Culver City, California, USA (Studio)']",['Metro-Goldwyn-Mayer (MGM)'],,"['Film Noir', 'Crime', 'Drama', 'Thriller']",['English']
158. Shut My Big Mouth,1942,1h 11m,Approved,6.1,135,,"Wellington Holmes, a timid and very shy horticulturist, heads for Big Bluff. When the stagecoach is held up by Buckskin Bill and his men, he coincidentally knocks out three of them earning himself the unwanted job, as Marshal of Big Bluff. After escaping Big Bluff, disguised as a woman, the stagecoach is again held up by Buckskin and he, Elena Montoya and her father are made prisoners. He escapes again and when Buckskin arrives in town he again coincidentally overpowers the criminals. Having been previously masked, Buckskin now claims to be Buckskin's enemy and the residents of Big Bluff believe him. They release him and offer him the reward for leading Wellington to Buckskin's hideout. So Wellington and Elena with the ransom money for her father, but no posse, head out to bring in Buckskin. The law is kept and all of the criminals are successfully captured, brought to the county's prison and are put behind bars.",https://www.imdb.com/title/tt0035324/?ref_=sr_i_158,"['Oliver Drake', 'Karen DeWolf', 'Francis Martin']",['Charles Barton'],"['Joe E. Brown', 'Adele Mara', 'Victor Jory', 'Fritz Feld', 'Don Beddoe', 'Will Wright', 'Russell Simpson', 'Joan Woodbury', 'Lloyd Bridges', 'Ralph Peters']",,,,,"February 19, 1942",['United States'],"[""Beale's Cut, Newhall, California, USA""]",['Columbia Pictures'],,"['Comedy', 'Western']",['English']
159. Counter-Espionage,1942,1h 13m,Approved,6.5,400,,The Lone Wolf tracks down German spies in London during the German bombing.,https://www.imdb.com/title/tt0034617/?ref_=sr_i_159,"['Aubrey Wisberg', 'Louis Joseph Vance']",['Edward Dmytryk'],"['Warren William', 'Eric Blore', 'Hillary Brooke', 'Thurston Hall', 'Fred Kelsey', 'Forrest Tucker', 'Matthew Boulton', 'Kurt Katch', 'Morton Lowry', 'Leslie Denison']",,,,,"September 3, 1942",['United States'],,['Columbia Pictures'],,"['Comedy', 'Crime', 'Mystery', 'Romance', 'War']","['English', 'German']"
160. Gang Busters,1942,4h 11m,Approved,6.9,141,,Detective lieutenant Bill Bannister is assigned to run down an unknown gang of terrorists who have spread a net of crime over the city.,https://www.imdb.com/title/tt0034767/?ref_=sr_i_160,"['Morgan Cox', 'Al Martin', 'Victor McLeod']","['Noel M. Smith', 'Ray Taylor']","['Kent Taylor', 'Irene Hervey', 'Ralph Morgan', 'Robert Armstrong', 'Richard Davies', 'Joseph Crehan', 'George Watts', 'Ralf Harolde', 'John Gallaudet', 'William Haade']",,,,,"March 31, 1942",['United States'],"['Universal Studios - 100 Universal City Plaza, Universal City, California, USA (Studio)']",['Universal Pictures'],,['Drama'],['English']
161. Black Dragons,1942,1h 4m,Approved,4.3,1.3K,,"A cabal of American industrialists, all fifth-columnists intent on sabotaging the war effort, are methodically murdered by the malevolent Monsieur Colomb. It is only until detective Dick Martin is assigned to the case that everyone's true motives and identities are revealed.",https://www.imdb.com/title/tt0034521/?ref_=sr_i_161,"['Harvey Gates', 'Robert Kehoe']",['William Nigh'],"['Bela Lugosi', 'Joan Barclay', 'George Pembroke', 'Clayton Moore', 'Robert Frazer', 'Edward Peil Sr.', 'Robert Fiske', 'Irving Mitchell', 'Kenneth Harlan', 'Max Hoffman Jr.']",,,,,"March 6, 1942",['United States'],"['Monogram Studios - 4376 Sunset Boulevard, Hollywood, California, USA (Studio)']",['Sam Katzman Productions'],,"['Horror', 'Thriller', 'War']",['English']
162. Die große Liebe,1942,1h 42m,,6.2,260,,"During a leave in Berlin, Lieutenant Paul Wendlandt, a young Luftwaffe pilot, falls for Anna Holberg, a famous singer, who returns his love. But in time of war it is hard to live on love only. The lovers keep being separated on account of Paul's missions and their intended marriage ceremony is constantly postponed. To cap it all, misunderstanding sets in between Paul and Anna. Will they ever become the happy couple they deserve to be?",https://www.imdb.com/title/tt0034815/?ref_=sr_i_162,"['Hans Flemming', 'Peter Groll', 'Rolf Hansen']",['Rolf Hansen'],"['Zarah Leander', 'Grethe Weiser', 'Viktor Staal', 'Paul Hörbiger', 'Wolfgang Preiss', 'Hans Schwarz Jr.', 'Victor Janson', 'Leopold von Ledebur', 'Julia Serda', 'Paul Bildt']","DEM3,000,000 (estimated)",,,,"September 11, 1942",['Germany'],"['Berlin, Germany']",['Universum Film (UFA)'],"Awards, 1 nomination total","['Drama', 'Romance', 'War']",['German']
163. Lady from Chungking,1942,1h 6m,Approved,5.7,363,,"After the Japanese invade China in WW 2, a young woman leads a band of partisans against the occupying troops.",https://www.imdb.com/title/tt0036093/?ref_=sr_i_163,"['Sam Robins', 'Milton Raison']",['William Nigh'],"['Anna May Wong', 'Harold Huber', 'Mae Clarke', 'Rick Vallin', 'Paul Bryar', 'Ted Hecht', 'Ludwig Donath', 'James B. Leong', 'Archie Got', 'Walter Soo Hoo']",,,,,"November 1, 1943",['United States'],"['Talisman Studios - 4516 Sunset Blvd., Hollywood, Los Angeles, California, USA (Studio)']",['Alexander-Stern Productions'],,"['Drama', 'War']",['English']
164. Strangers in the House,1942,1h 35m,,7.0,504,,"Loursat, a lawyer, lives with his daughter Nicole. Abandoned by his wife about 20 years ago, he has sunk into alcoholism. One day, the corpse of a stranger is discovered in the attic of his residence.",https://www.imdb.com/title/tt0034893/?ref_=sr_i_164,"['Georges Simenon', 'Henri-Georges Clouzot']",['Henri Decoin'],"['Raimu', 'Juliette Faber', 'Gabrielle Fontan', 'Héléna Manson', 'Tania Fédor', 'Marguerite Ducouret', 'Jean Tissier', 'Jacques Baumer', 'Noël Roquevert', 'André Reybaz']",,,,,"May 16, 1942",['France'],"['Studios de Billancourt - 50 Quai du Point du Jour, Boulogne-Billancourt, Hauts-de-Seine, France (Studio)']",['Continental Films'],,"['Crime', 'Drama']",['French']
165. Uncensored,1942,1h 23m,,6.8,20,,"During the Nazi occupation of Belgium during World War II, a Belgian resistance group revives the newspaper ""La Libre Belgique"" to expose and counter Nazi propaganda efforts to deceive the people. They are so effective that the Nazis offer a reward for the capture of the paper's staff, although they don't know their identities. One of them is a well-known entertainer, and when his jealous partner hears of the reward, he turns him in. The paper's publishers escape capture, but their staff doesn't. The paper's founders must find not only a way to keep from getting captured by the Nazis but keep their newspaper going and get their staff released.",https://www.imdb.com/title/tt0035486/?ref_=sr_i_165,"['Oscar Millard', 'Rodney Ackland', 'Terence Rattigan']",['Anthony Asquith'],"['Eric Portman', 'Phyllis Calvert', 'Griffith Jones', 'Raymond Lovell', 'Peter Glenville', 'Frederick Culley', 'Irene Handl', 'Carl Jaffe', 'Felix Aylmer', 'Eliot Makeham']",,,,,"August 24, 1942",['United Kingdom'],,['Gainsborough Pictures'],,"['Drama', 'War']",['English']
166. China Girl,1942,1h 35m,Approved,6.2,724,,"With America still neutral, an American news photographer on assignment in Burma is courted by both the Japanese and The Flying Tiger volunteers fighting for China to film the strategic Burma Road.",https://www.imdb.com/title/tt0034593/?ref_=sr_i_166,"['Ben Hecht', 'Darryl F. Zanuck']",['Henry Hathaway'],"['Gene Tierney', 'George Montgomery', 'Lynn Bari', 'Victor McLaglen', 'Alan Baxter', 'Sig Ruman', 'Myron McCormick', 'Robert Blake', 'Ann Pennington', 'Philip Ahn']",,,,"$1,400,000","December 9, 1942",['United States'],"['Bradbury Building - 304 S. Broadway, Downtown, Los Angeles, California, USA (Hotel Royale, Mandalay, Burma)']",['Twentieth Century Fox'],,"['Drama', 'War']","['English', 'Mandarin', 'Japanese']"
