Title,Year,Duration,MPA,Rating,Votes,méta_score,description,Movie Link,writers,directors,stars,budget,opening_weekend_Gross,grossWorldWWide,gross_US_Canada,release_date,countries_origin,filming_locations,production_company,awards_content,genres,Languages
432. El secreto de la monja,1940,1h 26m,,,,,,https://www.imdb.com/title/tt0220030/?ref_=sr_i_432,"['Jorge M. Dada', 'Íñigo de Martino', 'Eduardo Ugarte']",['Raphael J. Sevilla'],"['Lupita Gallardo', 'José Crespo', 'René Cardona', ""Elena D'Orgaz"", 'Carlos Orellana', 'Julio Villarreal', 'Mimí Derba', 'Manuel Arvide', 'María Calvo', 'Arturo Soto Rangel']",,,,,"October 31, 1940",['Mexico'],['Mexico'],,,"['Drama', 'Fantasy']",['Spanish']
433. Moya lyubov,1940,1h 20m,,6.1,74,,A girl named Shura is looked after by two young people at once. Suddenly Shura's sister dies and she adopts her sister's child. Now it becomes clear which of the boyfriends is worthy of her reciprocity.,https://www.imdb.com/title/tt0032812/?ref_=sr_i_433,['Iosif Prut'],['Vladimir Korsh-Sablin'],"['Lidiya Smirnova', 'Vladimir Chobur', 'Ivan Pereverzev', 'Feliks Chernousko', 'Naum Sokolov', 'Aleksei Matov', 'Mariya Shlenskaya', 'Maria Klyuchareva', 'Nikolay Trofimov', 'Vladimir Shishkin']",,,,,"July 8, 1940",['Soviet Union'],,['Belarusfilm'],,"['Comedy', 'Musical', 'Romance']",['Russian']
434. Private Affairs,1940,1h 14m,Approved,5.8,65,,"Amos Bullerton, son of an old Boston family, has chosen for twenty years to remain a black sheep rather than submit to the dictation of his staid family. Jane Bullerton, his daughter, finds herself in the same quandary, ordered by her crotchety grandfather Noble Bullerton, to marry a man she doesn't love.",https://www.imdb.com/title/tt0032947/?ref_=sr_i_434,"['Walter Greene', 'Charles Grayson', 'Leonard Spigelgass']",['Albert S. Rogell'],"['Nancy Kelly', 'Robert Cummings', 'Hugh Herbert', 'Roland Young', 'Montagu Love', 'Jonathan Hale', 'Florence Shirley', 'G.P. Huntley', 'Dick Purcell', 'Leonard Carey']",,,,,"July 5, 1940",['United States'],"['Universal Studios - 100 Universal City Plaza, Universal City, California, USA (Studio)']",['Universal Pictures'],,"['Comedy', 'Romance']",['English']
435. The Courageous Dr. Christian,1940,1h 7m,Not Rated,6.0,113,,A doctor fights an epidemic that breaks out in the poor section of town and tries to get the rest of the town to help out.,https://www.imdb.com/title/tt0032361/?ref_=sr_i_435,"['Ring Lardner Jr.', 'Ian McLellan Hunter']",['Bernard Vorhaus'],"['Jean Hersholt', 'Dorothy Lovett', 'Robert Baldwin', 'Tom Neal', 'Maude Eburne', 'Vera Lewis', 'George Meader', 'Bobby Larson', 'Bobette Bentley', 'Reginald Barlow']",,,,,"April 5, 1940",['United States'],"['RKO Studios - 780 N. Gower Street, Hollywood, Los Angeles, California, USA (Studio)']",['Stephens-Lang Productions'],,['Drama'],['English']
436. He Married His Wife,1940,1h 23m,Approved,6.1,283,,Race horse owner pays so much attention to business he winds up divorced from his wife. His alimony payments are so steep he plots with his lawyer to get her married off.,https://www.imdb.com/title/tt0032575/?ref_=sr_i_436,"['Sam Hellman', 'Darrell Ware', 'Lynn Starling']",['Roy Del Ruth'],"['Joel McCrea', 'Nancy Kelly', 'Roland Young', 'Mary Boland', 'Cesar Romero', 'Mary Healy', 'Lyle Talbot', 'Elisha Cook Jr.', 'Barnett Parker', 'Harry Hayden']",,,,"$50,600","January 19, 1940",['United States'],"['20th Century Fox Studios - 10201 Pico Blvd., Century City, Los Angeles, California, USA (Studio)']",['Twentieth Century Fox'],,['Comedy'],"['English', 'French']"
437. They Came by Night,1940,1h 13m,Approved,6.1,42,,Jeweler James Fothergill helps Scotland Yard recover a valuable ruby by worming his way into the gang which stole it and setting them up for the police.,https://www.imdb.com/title/tt0033148/?ref_=sr_i_437,"['Sidney Gilliat', 'Michael Hogan', 'Frank Launder']",['Harry Lachman'],"['Will Fyffe', 'Phyllis Calvert', 'Anthony Hulme', 'George Merritt', 'Kathleen Harrison', 'John Glyn-Jones', 'Athole Stewart', 'Cees Laseur', 'Hal Walters', 'Kuda Bux']",,,,,"March 7, 1940",['United Kingdom'],"['Gainsborough Studios, Islington, London, England, UK']",['Twentieth Century-Fox Productions'],,"['Crime', 'Drama']",['English']
438. Pier 13,1940,1h 4m,Approved,6.2,81,,Policeman (Nolan) flirts with waitress (Bari) and finds out her sister (Valerie) is involved with the robber (Fowley) he is trailing.,https://www.imdb.com/title/tt0032908/?ref_=sr_i_438,"['Harry Connors', 'Philip Klein', 'Stanley Rauh']",['Eugene Forde'],"['Lynn Bari', 'Lloyd Nolan', 'Joan Valerie', 'Douglas Fowley', 'Chick Chandler', ""Oscar O'Shea"", 'Adrian Morris', 'Louis Jean Heydt', 'Frank Orth', 'Charles D. Brown']",,,,,"August 23, 1940",['United States'],"['20th Century Fox Studios - 10201 Pico Blvd., Century City, Los Angeles, California, USA (Studio)']",['Twentieth Century Fox'],,"['Crime', 'Mystery']",['English']
439. We Who Are Young,1940,1h 20m,Approved,6.0,400,,"Two young office workers working at the same large firm secretly marry and defy their employer's policy against coworker fraternization. When the marriage is discovered, Margy (Turner) is fired. This causes the newlyweds to face serious financial struggles and Bill (Shelton) pursues desperate, perhaps even illegal, measures to make ends meet when the couple learn they are expecting their first baby!",https://www.imdb.com/title/tt0033246/?ref_=sr_i_439,['Dalton Trumbo'],['Harold S. Bucquet'],"['Lana Turner', 'John Shelton', 'Gene Lockhart', 'Grant Mitchell', 'Henry Armetta', 'Jonathan Hale', 'Clarence Wilson', 'Ian Wolfe', 'Hal K. Dawson', 'John Butler']","$362,000 (estimated)",,,,"July 19, 1940",['United States'],"['Metro-Goldwyn-Mayer Studios - 10202 W. Washington Blvd., Culver City, California, USA (Studio)']",['Metro-Goldwyn-Mayer (MGM)'],"Awards, 1 win total","['Drama', 'Mystery', 'Romance']",['English']
440. Opened by Mistake,1940,1h 7m,Approved,5.9,21,,A wise-guy reporter and a tippling sportswriter acquire an unclaimed trunk with a corpse inside.,https://www.imdb.com/title/tt0032876/?ref_=sr_i_440,"['Hal Hudson', 'Kenneth Earl', 'Stuart Palmer']",['George Archainbaud'],"['Charles Ruggles', 'Janice Logan', 'Robert Paige', 'William Frawley', 'Florence Shirley', 'Lawrence Grossmith', 'Rafael Corio', 'Esther Dale', 'James Burke', 'Jack Norton']",,,,,"May 10, 1940",['United States'],"['Paramount Studios - 5555 Melrose Avenue, Hollywood, Los Angeles, California, USA (Studio)']",['Paramount Pictures'],,"['Comedy', 'Crime', 'Mystery', 'Romance']",['English']
441. Cafe Hostess,1940,1h 5m,Approved,6.5,97,,"Jo (Ann Dvorak), a ""percentage girl"" at the notorious Club 46, is in despair. She can see no way out of the dreary and sordid routine of entertaining customers - called drinking and dancing in 1940 - and, at a signal from piano player Eddie Morgan (Douglas Fowley), rolling them for their money. Eddie, besides being brutal to her and spending all her money, is also carrying on an affair with another girl. Jo's only friend is Annie (Wynne Gibson), a former actress but now a drink-sodden derelict. Annie keeps to herself the knowledge that it was Eddie who threw the knife that killed a petty racketeer who was too attentive to Jo. Sailor Dan Walters (Preston Foster) and two of his pals arrive from a cruise and his good nature delights Joe, but at a wink from Eddie, Jo attempts to steal his money. Dan swallows his disillusionment and returns to the cafe, and he and Jo enjoy a day-long picnic together. She accepts his marriage proposal and go to an up-state town where he has a job waiting. Eddie does not accept this turn events any too well, and sets a trap for Dan when he comes after Jo. When he arrives, in an attempt to save his life, Jo denounces and ridicules him and he leaves angrily. He is met by Annie, who tells him of the set-up. Gathering his pals, Dan returns to the cafe and starts a brawl.",https://www.imdb.com/title/tt0032296/?ref_=sr_i_441,"['Harold Shumate', 'Tay Garnett', 'Howard Higgin']",['Sidney Salkow'],"['Preston Foster', 'Ann Dvorak', 'Douglas Fowley', 'Wynne Gibson', 'Arthur Loft', 'Bruce Bennett', 'Eddie Acuff', 'Bradley Page', 'Dorothy Comingore', 'Beatrice Blinn']",,,,,"January 11, 1940",['United States'],,['Columbia Pictures'],,"['Crime', 'Drama', 'Thriller']",['English']
442. In Old Missouri,1940,1h 11m,Approved,6.0,44,,The Weavers play sharecroppers. They confront their landlord with their tale of woe only to find he is in money trouble too. He also has a wastrel son and a socialite wife who wants a divorce. He begs the Weavers to trade places with him and fix things up.,https://www.imdb.com/title/tt0032629/?ref_=sr_i_442,"['Dorrell McGowan', 'Stuart E. McGowan']",['Frank McDonald'],"['Leon Weaver', 'Frank Weaver', 'June Weaver', 'June Storey', 'Marjorie Gateson', 'Thurston Hall', 'Alan Ladd', 'Andrew Tombes', 'Loretta Weaver', 'Mildred Shay']",,,,,"April 17, 1940",['United States'],"['Republic Studios - 4024 Radford Avenue, North Hollywood, Los Angeles, California, USA (Studio)']",['Republic Pictures (I)'],,"['Adventure', 'Comedy', 'Drama', 'Romance']",['English']
443. The Fight for Life,1940,1h 9m,Approved,5.4,97,,"An interne witnesses the death of a young mother in a maternity hospital delivery room. Disturbed that he might have overlooked something that could have prevented the death, he goes to a maternity clinic in a city slum in order to learn more about the mortality of motherhood and to find new ways to prevent it.",https://www.imdb.com/title/tt0032465/?ref_=sr_i_443,"['Pare Lorentz', 'Paul De Kruif']",['Pare Lorentz'],"['Myron McCormick', 'Storrs Haynes', 'Will Geer', 'Dudley Digges', 'Dorothy Adams', 'Dorothy Urban', 'Effie Anderson', 'Woody Guthrie']",,,,,"March 7, 1940",['United States'],"['Chicago Maternity Center, Chicago, Illinois, USA']",['United States Film Service'],"Nominated for 1 Oscar, 2 wins & 1 nomination total","['Drama', 'History']",['English']
444. Il ponte dei sospiri,1940,1h 47m,,5.1,23,,"Rolando, the chief of the Venetian fleet, is condemned after a highly unfair judicial process and locked up in prison. After succeeding to escape he will demonstrate his innocence to the Doge's daughter he is in love with.",https://www.imdb.com/title/tt0032920/?ref_=sr_i_444,"['Mario Bonnard', 'Tomaso Smith', 'Michel Zévaco']",['Mario Bonnard'],"['Paola Barbara', 'Otello Toso', 'Mariella Lotti', 'Giulio Donadio', 'Elli Parvo', 'Virgilio Riento', 'Erminio Spalla', 'Adele Garavaglia', 'Giorgio Capecchi', 'Giacomo Moschini']",,,,,"June 18, 1940",['Italy'],"['Scalera Studios, Rome, Lazio, Italy (Studio)']",['Scalera Film'],,['Drama'],['Italian']
445. Miente y serás feliz,1940,,,7.0,20,,"Juan's compulsive honesty causes chaos, especially when he disrupts his daughter Pilar's wedding. After a near-tragedy, Juan learns a valuable lesson. Ultimately, love prevails as Pilar marries Luis, and Juan finds happiness too.",https://www.imdb.com/title/tt0179975/?ref_=sr_i_445,"['Aurelio García Yévenes', 'Nicolás de las Llanderas', 'Arnaldo Malfatti']",['Raphael J. Sevilla'],"['Carlos Orellana', 'Sara García', 'Emilio Tuero', 'Josefina Escobedo', 'Eduardo Arozamena', 'Emma Roldán', 'José Ortiz de Zárate', 'Natalia Ortiz', 'José Pidal', 'Eufrosina García']",,,,,"May 31, 1940",['Mexico'],['Mexico'],['Films Mundiales'],,['Comedy'],['Spanish']
446. Im Schatten des Berges,1940,1h 30m,,6.5,16,,,https://www.imdb.com/title/tt0032627/?ref_=sr_i_446,"['Alois Johannes Lippl', 'Friedrich Perkonig', 'Rudo Ritter']",['Alois Johannes Lippl'],"['Attila Hörbiger', 'Hansi Knoteck', 'Franziska Kinz', 'Winnie Markus', 'Viktoria von Ballasko', 'Heinrich Heilinger', 'Eduard Koch', 'Arnulf Schröder', 'Richard Häussler', 'Otto Wenke']",,,,,"December 17, 1940",['Germany'],"['Bavaria Studios, Bavariafilmplatz 7, Geiselgasteig, Grünwald, Bavaria, Germany']","['Bavaria-Filmkunst', 'Bavaria Film']",,"['Adventure', 'Drama']",['German']
447. Krambambuli,1940,1h 12m,,7.6,36,,"It's all about the value of a beautiful thoroughbred hunting dog and his loyalty. The animal has to choose between love and duty. Love, as always, pervails.",https://www.imdb.com/title/tt0032678/?ref_=sr_i_447,"['Friedrich Perkonig', 'Rudo Ritter', 'Marie von Ebner-Eschenbach']",['Karl Köstlin'],"['Rudolf Prack', 'Sepp Rist', 'Elise Aulinger', 'Viktoria von Ballasko', 'Paula Pfluger', 'Eduard Köck', 'Karl Skraup', 'Wilhelm Schich', 'Oskar Wegrostek', 'Felix Dombrowsky']",,,,,"May 10, 1940","['Austria', 'Germany']","['Gosau, Upper Austria, Salzkammergut, Austria']","['Bavaria-Filmkunst', 'Wien-Film']",,[],['German']
448. Zindagi,1940,2h,,7.2,17,,The story of an unemployed graduate who falls in love with a woman who ran away from her cruel husband.,https://www.imdb.com/title/tt0156192/?ref_=sr_i_448,"['Javed Hussain', 'Kidar Nath Sharma']",['P.C. Barua'],"['K.L. Saigal', 'Pahadi Sanyal', 'Ashalata Wabgaonkar', 'Jamuna', 'Shyam Laha', 'Nemo', 'Sitara Devi', 'Vikram Kapoor', 'Rajani Rani', 'Manorama Devi']",,,,,"March 31, 1940",['India'],,['New Theatres Limited'],,['Drama'],"['Hindi', 'Urdu']"
449. Tanya,1940,1h 27m,,6.1,177,,The story of a Soviet Cinderella,https://www.imdb.com/title/tt0033119/?ref_=sr_i_449,['Viktor Ardov'],['Grigoriy Aleksandrov'],"['Lyubov Orlova', 'Evgeniy Samoylov', 'Elena Tyapkina', 'Vladimir Volodin', 'Osip Abdulov', 'Nikolai Konovalov', 'Anastasiya Zueva', 'Rina Zelyonaya', 'Pavel Olenev', 'Fyodor Seleznyov']",,,,,"March 4, 1942",['Soviet Union'],"['Mosfilm Studios, Moscow, Russia (Studio)']",['Mosfilm'],,"['Comedy', 'Musical']",['Russian']
450. Stagecoach War,1940,1h 3m,Approved,6.3,203,,Hoppy is busy chasing stagecoach bandits who sing as they rob.,https://www.imdb.com/title/tt0033099/?ref_=sr_i_450,"['Norman Houston', 'Harry F. Olmsted', 'Clarence E. Mulford']",['Lesley Selander'],"['William Boyd', 'Russell Hayden', 'Julie Carter', 'Harvey Stephens', 'J. Farrell MacDonald', 'Britt Wood', 'Rad Robinson', 'Eddy Waller', 'Frank Lackteen', 'Jack Rockwell']",,,,,"July 12, 1940",['United States'],"['Kernville, California, USA']",['Harry Sherman Productions'],,['Western'],['English']
451. 7 Jahre Pech,1940,1h 30m,,7.2,87,,"After breaking a mirror, a writer is convinced he will have seven years' bad luck. This complicates his romantic aspirations.",https://www.imdb.com/title/tt0033049/?ref_=sr_i_451,['Ernst Marischka'],['Ernst Marischka'],"['Hans Moser', 'Wolf Albach-Retty', 'Theo Lingen', 'Oskar Sima', 'Clara Tabody', 'Olly Holzmann', 'Ida Wüst', 'Gretl Wagner', 'Alfred Neugebauer', 'Robert Valberg']",,,,,"December 19, 1940",['Germany'],,['Styria-Film'],,"['Comedy', 'Romance']",['German']
452. The Showdown,1940,1h 5m,Approved,6.4,202,,European bad guy Baron Bendor leads some local townsmen in a plot to obtain horses through theft. Hoppy and his sidekicks Lucky and Speedy must find and expose the horse thieves.,https://www.imdb.com/title/tt0033047/?ref_=sr_i_452,"['Harold Daniel Kusel', 'Daniel Kusell', 'Jack Jungmeyer']",['Howard Bretherton'],"['William Boyd', 'Russell Hayden', 'Britt Wood', 'Morris Ankrum', 'Jan Clayton', 'Wright Kramer', 'Donald Kirke', 'Roy Barcroft', 'Eddie Dean', 'Kermit Maynard']",,,,,"March 8, 1940",['United States'],"['Chatsworth Station, Chatsworth, Los Angeles, California, USA']",['Harry Sherman Productions'],,"['Drama', 'Western']",['English']
453. The Secret Seven,1940,1h 2m,Passed,7.0,23,,"Scientists, assembled to prove their methods are effective in criminal investigation, try to solve a series of murders.",https://www.imdb.com/title/tt0033032/?ref_=sr_i_453,"['Robert Tasker', 'Dean Jennings']",['James Moore'],"['Florence Rice', 'Barton MacLane', 'Bruce Bennett', 'Joseph Crehan', 'Joe Downing', 'Howard Hickman', 'Edward Van Sloan', 'Don Beddoe', 'P.J. Kelly', 'William Forrest']",,,,,"August 15, 1940",['United States'],,['Columbia Pictures'],,"['Action', 'Crime', 'Drama', 'Romance']",['English']
454. Curtain Call,1940,1h 3m,Approved,5.8,241,,"A naive playwright sells her awful play, ""The End of Everything,"" to two Broadway producers who want to get even with an ungrateful star.",https://www.imdb.com/title/tt0032373/?ref_=sr_i_454,"['Dalton Trumbo', 'Howard J. Green']",['Frank Woodruff'],"['Barbara Read', 'Alan Mowbray', 'Helen Vinson', 'Donald MacBride', 'John Archer', 'Leona Maricle', 'Frank Faylen', 'Tom Kennedy', 'Ralph Forbes', 'J.M. Kerrigan']",,,,,"April 26, 1940",['United States'],"['RKO Studios - 780 N. Gower Street, Hollywood, Los Angeles, California, USA (Studio)']",['RKO Radio Pictures'],,"['Comedy', 'Romance']",['English']
455. Phantom Rancher,1940,1h 1m,Approved,5.1,173,,Cowboy puts on a black mask and a black outfit to fight a gang of land-grabbing crooks.,https://www.imdb.com/title/tt0032902/?ref_=sr_i_455,['William Lively'],['Harry L. Fraser'],"['Ken Maynard', 'Tarzan', 'Dorothy Short', 'Harry Harvey', 'Ted Adams', ""Dave O'Brien"", 'Tom London', 'John Elliott', 'Reed Howes', 'Steve Clark']","$15,000 (estimated)",,,,"March 31, 1940",['United States'],"['Brandeis Ranch, Chatsworth, Los Angeles, California, USA']",['M & A Alexander Productions Inc.'],,['Western'],['English']
456. Grand Ole Opry,1940,1h 7m,Approved,6.8,72,,"Abner Weaver, a small-town mayor in the Ozarks, through the music of performers from 'The Grand Ole Opry,"" and the antics and help of his family and the local citizens, manages to pass a legislative bill to help the farmers, and also wins the election for state government from a group of crooked politicians.",https://www.imdb.com/title/tt0032546/?ref_=sr_i_456,"['Dorrell McGowan', 'Stuart E. McGowan']",['Frank McDonald'],"['Leon Weaver', 'Frank Weaver', 'June Weaver', 'Lois Ranson', 'Allan Lane', 'Henry Kolker', 'John Hartley', 'Loretta Weaver', 'Purnell Pratt', 'Claire Carleton']",,,,,"June 25, 1940",['United States'],"['Republic Studios - 4024 Radford Avenue, North Hollywood, Los Angeles, California, USA (Studio)']",['Republic Pictures (I)'],,"['Comedy', 'Music']",['English']
457. Babicka,1940,1h 30m,,6.9,136,,"""Grandmother"" is a highly romanticized autobiographical novel by a Czech 19th century writer, Bozena Nemcova. It's a classical, compulsory reading in Czech schools, about a wise, working-class woman, happier in her simplicity and good heart than the nobles whom she serves.",https://www.imdb.com/title/tt0032230/?ref_=sr_i_457,"['Bozena Nemcová', 'Karel Hasler', 'Frantisek Cáp']",['Frantisek Cáp'],"['Terezie Brzková', 'Svetla Svozilová', 'Karel Tresnák', 'Natasa Tanská', 'Jirí Papez', 'Jan Krchnavý', 'Jitka Dusková', 'Jirina Stepnicková', 'Gustav Nezval', 'Marie Glázrová']",,,,,"November 15, 1940",['Czechoslovakia'],"['AB Barrandov Studios, Prague, Czech Republic (Studio)']",['Lucernafilm'],,"['Drama', 'Romance']",['Czech']
458. Enoken's Sun Wukong,1940,2h 16m,,8.0,40,,,https://www.imdb.com/title/tt0126071/?ref_=sr_i_458,"[""Cheng'en Wu"", 'Kajirô Yamamoto']",['Kajirô Yamamoto'],"[""Ken'ichi Enomoto"", 'Akira Kishii', 'Toshio Kanai', 'Sadaichi Yanagida', 'Takeo Kitamura', 'Minoru Takase', 'Zekô Nakamura', 'Kanta Kisaragi', 'Fukuo Dan', 'Hideko Takamine']",,,,,"November 6, 1940",['Japan'],,"['Toho Film (Eiga) Co. Ltd.', 'Toho']",,"['Slapstick', 'Comedy', 'Family', 'Fantasy', 'Musical']",['Japanese']
459. En tiempos de Don Porfirio,1940,2h 40m,,7.4,70,,"In a Mexican city at the end of the 19th century, Don Francisco, a gambler and a bohemian, almost forgets his wedding and is late. The bride, who is pregnant, is sent to Paris by the snubbed family.",https://www.imdb.com/title/tt0031271/?ref_=sr_i_459,"['Juan Bustillo Oro', 'Humberto Gómez Landero']",['Juan Bustillo Oro'],"['Fernando Soler', 'Marina Tamayo', 'Emilio Tuero', 'Joaquín Pardavé', 'Dolores Camarillo', 'Aurora Walker', 'Agustín Isunza', 'Lucha María Ávila', 'Victoria Argota', 'Conchita Gentil Arcos']",,,,,"April 4, 1940",['Mexico'],['Mexico'],"['Oro Films', 'Producciónes Grovas']",,"['Comedy', 'Drama', 'Musical', 'Romance']",['Spanish']
460. Glamour for Sale,1940,1h,Approved,6.1,108,,An undercover man (Roger Pryor) recruits an escort-service rookie (Anita Louise) to inform him of scams.,https://www.imdb.com/title/tt0032534/?ref_=sr_i_460,['John Bright'],['D. Ross Lederman'],"['Anita Louise', 'Roger Pryor', 'Frances Robinson', 'June MacCloy', 'Don Beddoe', 'Paul Fix', 'Arthur Loft', 'Veda Ann Borg', 'George Anderson', 'Harry Anderson']",,,,,"September 27, 1940",['United States'],,['Columbia Pictures'],,"['Drama', 'Romance']",['English']
461. Under Texas Skies,1940,57m,Approved,7.0,89,,"Stony Brooke returns to his home town only the learn that his father, Sheriff Brooke, has been murdered and that his boyhood friend, Tucson Smith has been convicted and is to hang for the killing. The killing was actually committed by Brooke's deputy Tom Blackton, when he feared that his activities as the secret head of a gang of cattle rustlers and bank robbers was about to be exposed. Blackton has taken over as sheriff. Rancher Jim Marsden helps Tucson escape, and Stony encounters the wounded Tucson and helps him back to his ranch, where Tucson's sister, Helen treats his wounds. When Blackton's posse arrive, Tucson escapes through a trap door and heads for the hills. Blackton convinces Stony of Tucson's guilt, and Stony becomes a deputy with the intent of hunting down his former friend. But he changes his mind when a circuit judge, coming to preside over a new trial for Tucson, is killed. Stony continues to work for Blackton, hoping to get the evidence needed to clear Tucson, and tells his jack-of-all-trades friend Lullaby, who has taken over the barber shop from Smithers, to try to get some information from his talkative customers.",https://www.imdb.com/title/tt0033204/?ref_=sr_i_461,"['William Colt MacDonald', 'Anthony Coldeway', 'Betty Burbridge']",['George Sherman'],"['Robert Livingston', 'Bob Steele', 'Rufe Davis', 'Lois Ranson', 'Henry Brandon', 'Wade Boteler', 'Rex Lease', 'Jack Ingram', 'Walter Tetley', 'Yakima Canutt']",,,,,"September 30, 1940",['United States'],"['Corriganville, Ray Corrigan Ranch, Simi Valley, California, USA']",['Republic Pictures (I)'],,"['Drama', 'Western']",['English']
462. Pour le maillot jaune,1940,1h 31m,,6.3,23,,The romantic relationship between a sports journalist and a cyclist during the Tour de France.,https://www.imdb.com/title/tt0031818/?ref_=sr_i_462,"['Jean Antoine', 'Michel Duran', 'Maurice Goddet']",['Jean Stelli'],"['Albert Préjean', 'Meg Lemonnier', 'René Génin', 'Robert Arnoux', 'Marcel Delaître', 'Paul Temps', 'Paul Demange', 'Louis Robert', 'Paul Barge', 'Gilberte Joney']",,,,,"October 23, 1940",['France'],,['Société de Production du Film Pour le Maillot Jaune'],,"['Romance', 'Sport']",['French']
463. Blyge Anton,1940,1h 48m,,4.2,16,,A shy bookkeeper must prove his worth when he is laid off from work.,https://www.imdb.com/title/tt0032265/?ref_=sr_i_463,"['Theodor Berthels', 'Henry Richter']",['Emil A. Lingheim'],"['Edvard Persson', 'Ingrid Luterkort', 'Britta Brunius', 'Karl-Arne Holmsten', 'Fritiof Billquist', 'Torsten Winge', 'Eric Malmberg', 'Elvin Ottoson', 'Axel Lindberg', 'Arthur Fischer']",,,,,"May 6, 1940",['Sweden'],,['Europa Film'],,['Comedy'],['Swedish']
464. L'émigrante,1940,1h 49m,,6.7,17,,"Fearing a gangster's vengeance,his moll sails away to South Africa ,where many emigrants intend to work in the mines there.",https://www.imdb.com/title/tt0191670/?ref_=sr_i_464,"['Yves Allégret', 'Jean Aurenche', 'Jacques Companéez']",['Léo Joannon'],"['Edwige Feuillère', 'Jean Chevrier', 'Georges Lannes', 'Foun-Sen', 'Palmyre Levasseur', 'Jacques Vitry', 'Edmond Van Daële', 'Philippe Richard', 'Serge Nadaud', 'Marcel Pérès']",,,,,"March 13, 1940",['France'],"['Studios Eclair - 10 Rue du Mont, Epinay-sur-Seine, Seine-Saint-Denis, France (Studio)']",['Films Vega'],,"['Comedy', 'Drama']",['French']
465. Cita en la frontera,1940,1h 30m,,7.1,11,,Two brothers who work in a quarry fall in love with the same woman.,https://www.imdb.com/title/tt0178336/?ref_=sr_i_465,"['Enrique Amorim', 'Carlos A. Olivari', 'Sixto Pondal Ríos']",['Mario Soffici'],"['Orestes Caviglia', 'Floren Delbene', 'Maria Esther Duckse', 'Elisa Galvé', 'Eliseo Herrero', 'Libertad Lamarque', 'Claudio Martino', 'José Otal', 'Oscar Valicelli']",,,,,"July 9, 1941",['Argentina'],,['Argentina Sono Film S.A.C.I.'],,"['Drama', 'Music']",['Spanish']
