Title,Year,Duration,MPA,Rating,Votes,méta_score,description,Movie Link,writers,directors,stars,budget,opening_weekend_Gross,grossWorldWWide,gross_US_Canada,release_date,countries_origin,filming_locations,production_company,awards_content,genres,Languages
1. Rogue One: A Star Wars Story,2016,2h 13m,PG-13,7.8,710K,65.0,"In a time of conflict, a group of unlikely heroes band together on a mission to steal the plans to the Death Star, the Empire's ultimate weapon of destruction.",https://www.imdb.com/title/tt3748528/?ref_=sr_i_1,"['Chris Weitz', 'Tony Gilroy', 'John Knoll']",['Gareth Edwards'],"['Felicity Jones', 'Diego Luna', 'Alan Tudyk', 'Donnie Yen', 'Wen Jiang', 'Ben Mendelsohn', 'Guy Henry', 'Forest Whitaker', 'Riz Ahmed', 'Mads Mikkelsen']","$200,000,000 (estimated)","$155,081,681","$1,058,684,742","$533,539,991","December 16, 2016",['United States'],"[""Reynisfjara, Iceland (Planet Lah'mu - opening scene)""]","['Lucasfilm', 'Allison Shearmur Productions']","Nominated for 2 Oscars, 24 wins & 85 nominations total","['Action Epic', 'Adventure Epic', 'Sci-Fi Epic', 'Space Sci-Fi', 'Tragedy', 'Action', 'Adventure', 'Sci-Fi']",['English']
2. Finding Dory,2016,1h 37m,PG,7.2,318K,77.0,Friendly but forgetful blue tang Dory begins a search for her long-lost parents and everyone learns a few things about the real meaning of family along the way.,https://www.imdb.com/title/tt2277860/?ref_=sr_i_2,"['Andrew Stanton', 'Victoria Strouse']","['Andrew Stanton', 'Angus MacLane']","['Ellen DeGeneres', 'Albert Brooks', ""Ed O'Neill"", 'Kaitlin Olson', 'Hayden Rolence', 'Ty Burrell', 'Diane Keaton', 'Eugene Levy', 'Sloane Murray', 'Idris Elba']","$200,000,000 (estimated)","$135,060,273","$1,029,266,989","$486,295,561","June 17, 2016",['United States'],"['Pixar Animation Studios - 1200 Park Avenue, Emeryville, California, USA']","['Pixar Animation Studios', 'Walt Disney Pictures']","Nominated for 1 BAFTA Award, 17 wins & 48 nominations total","['Animal Adventure', 'Computer Animation', 'Sea Adventure', 'Adventure', 'Animation', 'Comedy', 'Family', 'Fantasy', 'Mystery']","['English', 'Indonesian']"
3. Captain America: Civil War,2016,2h 27m,PG-13,7.8,883K,75.0,Political involvement in the Avengers' affairs causes a rift between Captain America and Iron Man.,https://www.imdb.com/title/tt3498820/?ref_=sr_i_3,"['Christopher Markus', 'Stephen McFeely', 'Joe Simon']","['Anthony Russo', 'Joe Russo']","['Chris Evans', 'Robert Downey Jr.', 'Scarlett Johansson', 'Sebastian Stan', 'Anthony Mackie', 'Don Cheadle', 'Jeremy Renner', 'Chadwick Boseman', 'Paul Bettany', 'Elizabeth Olsen']","$250,000,000 (estimated)","$179,139,142","$1,155,046,416","$408,084,349","May 6, 2016","['United States', 'Germany', 'Puerto Rico']",['Puerto Rico (as Lagos)'],"['Marvel Studios', 'Vita-Ray Dutch Productions (III)', 'Studio Babelsberg']","Awards, 16 wins & 73 nominations total","['Superhero', 'Action', 'Sci-Fi']","['English', 'German', 'Xhosa', 'Russian', 'Romanian']"
4. The Secret Life of Pets,2016,1h 26m,PG,6.5,226K,61.0,"The quiet life of a terrier named Max is upended when his owner takes in Duke, a stray whom Max instantly dislikes.",https://www.imdb.com/title/tt2709768/?ref_=sr_i_4,"['Cinco Paul', 'Ken Daurio', 'Brian Lynch']",['Chris Renaud'],"['Louis C.K.', 'Eric Stonestreet', 'Kevin Hart', 'Lake Bell', 'Jenny Slate', 'Ellie Kemper', 'Albert Brooks', 'Dana Carvey', 'Hannibal Buress', 'Bobby Moynihan']","$75,000,000 (estimated)","$104,352,905","$875,698,161","$368,623,860","July 8, 2016","['United States', 'France', 'Japan']","['New York City, New York, USA (All the action of the film)']","['Universal Pictures', 'Illumination Entertainment', 'Dentsu']","Awards, 4 wins & 15 nominations total","['Animal Adventure', 'Computer Animation', 'Urban Adventure', 'Adventure', 'Animation', 'Comedy', 'Family']",['English']
5. The Jungle Book,2016,1h 46m,PG,7.3,298K,77.0,"After a threat from the tiger Shere Khan forces him to flee the jungle, a man-cub named Mowgli embarks on a journey of self discovery with the help of panther Bagheera and free-spirited bear Baloo.",https://www.imdb.com/title/tt3040964/?ref_=sr_i_5,"['Justin Marks', 'Rudyard Kipling']",['Jon Favreau'],"['Neel Sethi', 'Bill Murray', 'Ben Kingsley', 'Idris Elba', ""Lupita Nyong'o"", 'Scarlett Johansson', 'Giancarlo Esposito', 'Christopher Walken', 'Garry Shandling', 'Brighton Rose Favreau']","$175,000,000 (estimated)","$103,261,464","$967,724,775","$364,001,123","April 15, 2016","['United Kingdom', 'United States', 'New Zealand', 'France', 'Canada', 'India']","['Los Angeles, California, USA']","['Walt Disney Pictures', 'Fairview Entertainment', 'Moving Picture Company (MPC)']","Won 1 Oscar, 33 wins & 56 nominations total","['Animal Adventure', 'Computer Animation', 'Jungle Adventure', 'Quest', 'Action', 'Adventure', 'Animation', 'Drama', 'Family', 'Fantasy']",['English']
6. Deadpool,2016,1h 48m,R,8.0,1.2M,65.0,"A wisecracking mercenary gets experimented on and becomes immortal yet hideously scarred, and sets out to track down the man who ruined his looks.",https://www.imdb.com/title/tt1431045/?ref_=sr_i_6,"['Rhett Reese', 'Paul Wernick']",['Tim Miller'],"['Ryan Reynolds', 'Morena Baccarin', 'T.J. Miller', 'Ed Skrein', 'Karan Soni', 'Michael Benyaer', 'Stefan Kapicic', 'Brianna Hildebrand', 'Style Dayne', 'Kyle Cassie']","$58,000,000 (estimated)","$132,434,639","$782,837,347","$363,070,709","February 12, 2016",['United States'],"['Vancouver, British Columbia, Canada']","['Twentieth Century Fox', 'Marvel Entertainment', 'Kinberg Genre']","Awards, 29 wins & 78 nominations total","['Dark Comedy', 'Gun Fu', 'Raunchy Comedy', 'Superhero', 'Action', 'Comedy', 'Sci-Fi']",['English']
7. Zootopia,2016,1h 48m,PG,8.0,576K,78.0,"In a city of anthropomorphic animals, a rookie bunny cop and a cynical con artist fox must work together to uncover a conspiracy.",https://www.imdb.com/title/tt2948356/?ref_=sr_i_7,"['Byron Howard', 'Rich Moore', 'Jared Bush']","['Byron Howard', 'Rich Moore', 'Jared Bush']","['Ginnifer Goodwin', 'Jason Bateman', 'Idris Elba', 'Jenny Slate', 'Nate Torrence', 'Bonnie Hunt', 'Don Lake', 'Tommy Chong', 'J.K. Simmons', 'Octavia Spencer']","$150,000,000 (estimated)","$75,063,401","$1,025,521,689","$341,268,248","March 4, 2016",['United States'],"['Walt Disney Animation Studios - 500 S. Buena Vista Street, Burbank, California, USA']","['Walt Disney Pictures', 'Walt Disney Animation Studios']","Won 1 Oscar, 49 wins & 75 nominations total","['Animal Adventure', 'Buddy Comedy', 'Computer Animation', 'Urban Adventure', 'Action', 'Adventure', 'Animation', 'Comedy', 'Crime', 'Family']",['English']
8. Batman v Superman: Dawn of Justice,2016,2h 31m,R,6.5,769K,44.0,Batman is manipulated by Lex Luthor to fear Superman. Superman´s existence is meanwhile dividing the world and he is framed for murder during an international crisis. The heroes clash and force the neutral Wonder Woman to reemerge.,https://www.imdb.com/title/tt2975590/?ref_=sr_i_8,"['Bob Kane', 'Bill Finger', 'Jerry Siegel']",['Zack Snyder'],"['Ben Affleck', 'Henry Cavill', 'Amy Adams', 'Jesse Eisenberg', 'Diane Lane', 'Laurence Fishburne', 'Jeremy Irons', 'Holly Hunter', 'Gal Gadot', 'Scoot McNairy']","$250,000,000 (estimated)","$166,007,347","$874,362,803","$330,360,194","March 25, 2016","['United States', 'Morocco']","['Detroit, Michigan, USA (Metropolis)']","['Warner Bros.', 'Atlas Entertainment', 'RatPac-Dune Entertainment']","Awards, 14 wins & 33 nominations total","['Superhero', 'Action', 'Adventure', 'Sci-Fi']",['English']
9. Suicide Squad,2016,2h 3m,PG-13,5.9,739K,40.0,A secret government agency recruits some of the most dangerous incarcerated super-villains to form a defensive task force. Their first mission: save the world from the apocalypse.,https://www.imdb.com/title/tt1386697/?ref_=sr_i_9,"['David Ayer', 'John Ostrander']",['David Ayer'],"['Will Smith', 'Jared Leto', 'Margot Robbie', 'Viola Davis', 'Jaime FitzSimons', 'Ike Barinholtz', 'Christopher Dyson', 'Bambadjan Bamba', 'Ted Whittall', 'David Harbour']","$175,000,000 (estimated)","$133,682,248","$749,200,054","$325,100,054","August 5, 2016",['United States'],"['Toronto, Ontario, Canada']","['Atlas Entertainment', 'DC Comics', 'DC Entertainment']","Won 1 Oscar, 18 wins & 41 nominations total","['Dark Comedy', 'Superhero', 'Action', 'Adventure', 'Fantasy', 'Sci-Fi']","['English', 'Japanese', 'Spanish']"
10. Sing,2016,1h 48m,PG,7.1,202K,59.0,"In a city of humanoid animals, a hustling theater impresario's attempt to save his theater with a singing competition becomes grander than he anticipates even as its finalists find that their lives will never be the same.",https://www.imdb.com/title/tt3470600/?ref_=sr_i_10,['Garth Jennings'],"['Garth Jennings', 'Christophe Lourdelet']","['Matthew McConaughey', 'Reese Witherspoon', 'Seth MacFarlane', 'Scarlett Johansson', 'John C. Reilly', 'Taron Egerton', 'Tori Kelly', 'Jennifer Saunders', 'Jennifer Hudson', 'Garth Jennings']","$75,000,000 (estimated)","$35,258,145","$634,338,409","$270,578,425","December 21, 2016","['Japan', 'United States', 'France']","['Illumination Entertainment - 1805 Colorado Avenue, Santa Monica, California, USA']","['Universal Pictures', 'Illumination Entertainment', 'Dentsu']","Awards, 3 wins & 25 nominations total","['Animal Adventure', 'Computer Animation', 'Jukebox Musical', 'Animation', 'Comedy', 'Family', 'Musical']","['English', 'Japanese']"
11. Moana,2016,1h 47m,PG,7.6,411K,81.0,"In ancient Polynesia, when a terrible curse incurred by the demigod Maui reaches Moana's island, she answers the Ocean's call to seek out Maui to set things right.",https://www.imdb.com/title/tt3521164/?ref_=sr_i_11,"['Jared Bush', 'Ron Clements', 'John Musker']","['Ron Clements', 'John Musker', 'Don Hall']","[""Auli'i Cravalho"", 'Dwayne Johnson', 'Rachel House', 'Temuera Morrison', 'Jemaine Clement', 'Nicole Scherzinger', 'Alan Tudyk', 'Oscar Kightley', 'Troy Polamalu', 'Puanani Cravalho']","$150,000,000 (estimated)","$56,631,401","$643,332,467","$248,757,044","November 23, 2016",['United States'],['Polynesia'],"['Hurwitz Creative', 'Walt Disney Animation Studios', 'Walt Disney Pictures']","Nominated for 2 Oscars, 22 wins & 90 nominations total","['Computer Animation', 'Quest', 'Sea Adventure', 'Adventure', 'Animation', 'Comedy', 'Family', 'Fantasy', 'Musical']","['English', 'French']"
12. Fantastic Beasts and Where to Find Them,2016,2h 12m,PG-13,7.2,523K,66.0,"In 1926, magizoologist Newt Scamander arrives in New York during his worldwide tour to research and rescue magical creatures as something mysterious leaves trails of destruction in the city, threatening to expose the wizarding world.",https://www.imdb.com/title/tt3183660/?ref_=sr_i_12,['J.K. Rowling'],['David Yates'],"['Eddie Redmayne', 'Katherine Waterston', 'Alison Sudol', 'Dan Fogler', 'Sam Redford', 'Scott Goldman', 'Tim Bentinck', 'Tristan Tait', 'Colin Farrell', 'Tom Clarke Hill']","$180,000,000 (estimated)","$74,403,387","$816,037,575","$234,037,575","November 18, 2016","['United Kingdom', 'United States', 'Canada']","[""St George's Hall, St George's Place, Liverpool, Merseyside, England, UK (City Hall of New York interior scene)""]","['Warner Bros.', 'Heyday Films']","Won 1 Oscar, 15 wins & 54 nominations total","['Supernatural Fantasy', 'Sword & Sorcery', 'Adventure', 'Family', 'Fantasy']","['English', 'Central Khmer']"
13. Doctor Strange,2016,1h 55m,PG-13,7.5,838K,72.0,"While on a journey of physical and spiritual healing, a brilliant neurosurgeon is drawn into the world of the mystic arts.",https://www.imdb.com/title/tt1211837/?ref_=sr_i_13,"['Jon Spaihts', 'Scott Derrickson', 'C. Robert Cargill']",['Scott Derrickson'],"['Benedict Cumberbatch', 'Chiwetel Ejiofor', 'Rachel McAdams', 'Benedict Wong', 'Mads Mikkelsen', 'Tilda Swinton', 'Michael Stuhlbarg', 'Benjamin Bratt', 'Scott Adkins', 'Zara Phythian']","$165,000,000 (estimated)","$85,058,311","$677,796,833","$232,641,920","November 4, 2016","['United States', 'Hong Kong', 'Nepal']","['Kathmandu, Nepal (on location)']",['Marvel Studios'],"Nominated for 1 Oscar, 21 wins & 68 nominations total","['Superhero', 'Action', 'Adventure', 'Fantasy', 'Sci-Fi']",['English']
14. Hidden Figures,2016,2h 7m,PG,7.8,272K,74.0,Three female African-American mathematicians play a pivotal role in astronaut John Glenn's launch into orbit while dealing with racial and gender discrimination.,https://www.imdb.com/title/tt4846340/?ref_=sr_i_14,"['Allison Schroeder', 'Theodore Melfi', 'Margot Lee Shetterly']",['Theodore Melfi'],"['Taraji P. Henson', 'Octavia Spencer', 'Janelle Monáe', 'Kevin Costner', 'Kirsten Dunst', 'Jim Parsons', 'Mahershala Ali', 'Aldis Hodge', 'Glen Powell', 'Kimberly Quinn']","$25,000,000 (estimated)","$515,499","$235,957,472","$169,607,287","January 6, 2017",['United States'],"[""East Point, Georgia, USA (Katherine's home)""]","['Fox 2000 Pictures', 'Chernin Entertainment', 'Levantine Films']","Nominated for 3 Oscars, 37 wins & 94 nominations total","['Docudrama', 'Biography', 'Drama', 'History']",['English']
15. Jason Bourne,2016,2h 3m,PG-13,6.6,249K,58.0,The CIA's most dangerous former operative is drawn out of hiding to uncover more explosive truths about his past.,https://www.imdb.com/title/tt4196776/?ref_=sr_i_15,"['Paul Greengrass', 'Christopher Rouse', 'Robert Ludlum']",['Paul Greengrass'],"['Matt Damon', 'Tommy Lee Jones', 'Alicia Vikander', 'Vincent Cassel', 'Julia Stiles', 'Riz Ahmed', 'Ato Essandoh', 'Scott Shepherd', 'Bill Camp', 'Vinzenz Kiefer']","$120,000,000 (estimated)","$59,215,365","$415,484,914","$162,434,410","July 29, 2016","['United States', 'China', 'Spain', 'Japan', 'Iceland', 'Germany', 'Italy']","['Berlin, Germany']","['Universal Pictures', 'Perfect World Pictures', 'The Kennedy/Marshall Company']","Awards, 3 wins & 20 nominations total","['Action', 'Thriller']","['English', 'Greek', 'German', 'Japanese']"
16. Star Trek Beyond,2016,2h 2m,PG-13,7.0,264K,68.0,"The crew of the USS Enterprise explores the furthest reaches of uncharted space, where they encounter a new ruthless enemy, who puts them, and everything the Federation stands for, to the test.",https://www.imdb.com/title/tt2660888/?ref_=sr_i_16,"['Simon Pegg', 'Doug Jung', 'Gene Roddenberry']",['Justin Lin'],"['Chris Pine', 'Zachary Quinto', 'Karl Urban', 'Zoe Saldaña', 'Simon Pegg', 'John Cho', 'Anton Yelchin', 'Idris Elba', 'Sofia Boutella', 'Joe Taslim']","$185,000,000 (estimated)","$59,253,211","$343,471,816","$158,848,340","July 22, 2016","['United States', 'China']","['Dubai, United Arab Emirates']","['Paramount Pictures', 'Skydance Media', 'Alibaba Pictures Group']","Nominated for 1 Oscar, 3 wins & 29 nominations total","['Space Sci-Fi', 'Action', 'Adventure', 'Sci-Fi', 'Thriller']",['English']
17. X-Men: Apocalypse,2016,2h 24m,PG-13,6.8,477K,52.0,"In the 1980s, the X-Men must defeat an ancient all-powerful mutant, En Sabah Nur, who intends to thrive by bringing destruction to the world.",https://www.imdb.com/title/tt3385516/?ref_=sr_i_17,"['Simon Kinberg', 'Bryan Singer', 'Michael Dougherty']",['Bryan Singer'],"['James McAvoy', 'Michael Fassbender', 'Jennifer Lawrence', 'Nicholas Hoult', 'Oscar Isaac', 'Rose Byrne', 'Evan Peters', 'Josh Helman', 'Sophie Turner', 'Tye Sheridan']","$178,000,000 (estimated)","$65,769,562","$543,934,105","$155,442,489","May 27, 2016",['United States'],"['Greenfield Park, Quebec, Canada']","['Twentieth Century Fox', 'Marvel Entertainment', 'TSG Entertainment']","Awards, 1 win & 19 nominations total","['Superhero', 'Action', 'Adventure', 'Sci-Fi']","['English', 'Polish', 'German', 'Arabic', 'Egyptian (Ancient)']"
18. Trolls,2016,1h 32m,PG,6.4,96K,55.0,"After the Bergens invade Troll Village, Poppy, the happiest Troll ever born, and the curmudgeonly Branch set off on a journey to rescue her friends.",https://www.imdb.com/title/tt1679335/?ref_=sr_i_18,"['Jonathan Aibel', 'Glenn Berger', 'Erica Rivinoja']","['Mike Mitchell', 'Walt Dohrn']","['Anna Kendrick', 'Justin Timberlake', 'Zooey Deschanel', 'Christopher Mintz-Plasse', 'Christine Baranski', 'Russell Brand', 'Gwen Stefani', 'John Cleese', 'James Corden', 'Jeffrey Tambor']","$125,000,000 (estimated)","$46,581,142","$347,337,803","$154,174,089","November 4, 2016","['United States', 'India', 'United Kingdom', 'Germany']","['Glendale, California, USA (DreamWorks Animation)']",['DreamWorks Animation'],"Nominated for 1 Oscar, 4 wins & 37 nominations total","['Computer Animation', 'Jukebox Musical', 'Adventure', 'Animation', 'Comedy', 'Family', 'Fantasy', 'Musical']",['English']
19. La La Land,2016,2h 8m,PG-13,8.0,714K,94.0,"When Sebastian, a pianist, and Mia, an actress, follow their passion and achieve success in their respective fields, they find themselves torn between their love for each other and their careers.",https://www.imdb.com/title/tt3783958/?ref_=sr_i_19,['Damien Chazelle'],['Damien Chazelle'],"['Ryan Gosling', 'Emma Stone', 'Rosemarie DeWitt', 'J.K. Simmons', 'Amiee Conn', 'Terry Walters', 'Thom Shelton', 'Cinda Adams', 'Callie Hernandez', 'Jessica Rothe']","$30,000,000 (estimated)","$881,104","$509,183,536","$151,101,803","December 25, 2016","['United States', 'Hong Kong']","['Griffith Observatory - 2800 E. Observatory Rd, Los Angeles, California, USA (love dance in the planetarium)']","['Summit Entertainment', 'Black Label Media', 'TIK Films']","Won 6 Oscars, 242 wins & 307 nominations total","['Pop Musical', 'Showbiz Drama', 'Comedy', 'Drama', 'Music', 'Musical', 'Romance']","['English', 'Cantonese']"
20. Kung Fu Panda 3,2016,1h 35m,PG,7.1,203K,66.0,"Continuing his ""legendary adventures of awesomeness"", Po must face two hugely epic, but different threats: one supernatural and the other a little closer to home.",https://www.imdb.com/title/tt2267968/?ref_=sr_i_20,"['Jonathan Aibel', 'Glenn Berger', 'Ethan Reiff']","['Alessandro Carloni', 'Jennifer Yuh Nelson']","['Jack Black', 'Bryan Cranston', 'Dustin Hoffman', 'Angelina Jolie', 'J.K. Simmons', 'Jackie Chan', 'Seth Rogen', 'Lucy Liu', 'David Cross', 'Kate Hudson']","$145,000,000 (estimated)","$41,282,042","$521,170,825","$143,528,619","January 29, 2016","['United States', 'China']",,"['DreamWorks Animation', 'Oriental DreamWorks', 'China Film Group Corporation (CFGC)']","Awards, 1 win & 10 nominations total","['Animal Adventure', 'Computer Animation', 'Kung Fu', 'Martial Arts', 'Action', 'Adventure', 'Animation', 'Comedy', 'Family', 'Fantasy']",['English']
21. Split,2016,1h 57m,PG-13,7.3,587K,63.0,Three girls are kidnapped by a man with a diagnosed 23 distinct personalities. They must try to escape before the apparent emergence of a frightful new 24th.,https://www.imdb.com/title/tt4972582/?ref_=sr_i_21,['M. Night Shyamalan'],['M. Night Shyamalan'],"['James McAvoy', 'Anya Taylor-Joy', 'Haley Lu Richardson', 'Jessica Sula', 'Betty Buckley', 'Izzie Coffey', 'Brad William Henke', 'Sebastian Arcelus', 'Neal Huff', 'Ukee Washington']","$9,000,000 (estimated)","$40,010,975","$278,454,417","$138,291,365","January 20, 2017","['United States', 'Japan']","['Philadelphia Zoo - 3400 W. Girard Avenue, Philadelphia, Pennsylvania, USA']","['Universal Pictures', 'Blinding Edge Pictures', 'Blumhouse Productions']","Awards, 10 wins & 27 nominations total","['Psychological Horror', 'Psychological Thriller', 'Horror', 'Thriller']",['English']
22. Ghostbusters,2016,1h 57m,PG-13,6.8,253K,60.0,"Following a ghost invasion of Manhattan, paranormal enthusiasts Erin Gilbert and Abby Yates, nuclear engineer Jillian Holtzmann, and subway worker Patty Tolan band together to stop the otherworldly threat.",https://www.imdb.com/title/tt1289401/?ref_=sr_i_22,"['Katie Dippold', 'Paul Feig', 'Ivan Reitman']",['Paul Feig'],"['Melissa McCarthy', 'Kristen Wiig', 'Kate McKinnon', 'Leslie Jones', 'Zach Woods', 'Ed Begley Jr.', 'Charles Dance', 'John Milhiser', 'Ben Harris', 'Karan Soni']","$144,000,000 (estimated)","$46,018,755","$229,147,509","$128,350,574","July 15, 2016","['United States', 'Australia']","['Boston, Massachusetts, USA']","['Columbia Pictures', 'LStar Capital', 'Village Roadshow Pictures']","Awards, 5 wins & 24 nominations total","['Slapstick', 'Supernatural Fantasy', 'Action', 'Comedy', 'Fantasy', 'Sci-Fi']",['English']
23. Central Intelligence,2016,1h 47m,PG-13,6.3,225K,52.0,"After he reconnects with an awkward pal from high school through Facebook, a mild-mannered accountant is lured into the world of international espionage.",https://www.imdb.com/title/tt1489889/?ref_=sr_i_23,"['Ike Barinholtz', 'David Stassen', 'Rawson Marshall Thurber']",['Rawson Marshall Thurber'],"['Dwayne Johnson', 'Kevin Hart', 'Danielle Nicolet', 'Amy Ryan', 'Jason Bateman', 'Aaron Paul', 'Ryan Hansen', 'Tim Griffin', 'Timothy John Smith', 'Sione Kelepi']","$50,000,000 (estimated)","$35,535,250","$216,940,871","$127,440,871","June 17, 2016","['United States', 'China']","['Boston, Massachusetts, USA (Boston Common)']","['New Line Cinema', 'Universal Pictures', 'RatPac-Dune Entertainment']","Awards, 2 wins & 8 nominations total","['Buddy Cop', 'Action', 'Comedy', 'Crime']",['English']
24. The Legend of Tarzan,2016,1h 50m,PG-13,6.2,193K,44.0,"Tarzan, having acclimated to life in London, is called back to his former home in the jungle to investigate the activities at a mining encampment.",https://www.imdb.com/title/tt0918940/?ref_=sr_i_24,"['Adam Cozad', 'Craig Brewer', 'Edgar Rice Burroughs']",['David Yates'],"['Alexander Skarsgård', 'Rory J Saper', 'Christian Stevens', 'Christoph Waltz', 'Samuel L. Jackson', 'Margot Robbie', 'Sidney Ralitsoele', 'Osy Ikhile', 'Mens-Sana Tamakloe', 'Antony Acheampong']","$180,000,000 (estimated)","$38,527,856","$357,243,061","$126,643,061","July 1, 2016","['United Kingdom', 'Canada', 'United States', 'Australia']",['Gabon (Aerial jungle scenes)'],"['Warner Bros.', 'Village Roadshow Pictures', 'RatPac-Dune Entertainment']","Awards, 2 wins & 4 nominations total","['Jungle Adventure', 'Action', 'Adventure', 'Drama', 'Fantasy', 'Romance']","['English', 'Lingala', 'French']"
25. Sully,2016,1h 36m,PG-13,7.4,310K,74.0,"When pilot Chesley ""Sully"" Sullenberger lands his damaged plane on the Hudson River in order to save the flight's passengers and crew, some consider him a hero while others think he was reckless.",https://www.imdb.com/title/tt3263904/?ref_=sr_i_25,"['Todd Komarnicki', 'Chesley Sullenberger', 'Jeffrey Zaslow']",['Clint Eastwood'],"['Tom Hanks', 'Aaron Eckhart', 'Laura Linney', 'Valerie Mahaffey', 'Delphi Harrington', ""Mike O'Malley"", 'Jamey Sheridan', 'Anna Gunn', 'Holt McCallany', 'Ahmed Lucan']","$60,000,000 (estimated)","$35,028,301","$243,870,033","$125,070,033","September 9, 2016",['United States'],"['Atlanta, Georgia, USA']","['Flashlight Films', 'Hurwitz Creative', 'Malpaso Productions']","Nominated for 1 Oscar, 14 wins & 36 nominations total","['Disaster', 'Docudrama', 'Biography', 'Drama']",['English']
26. Bad Moms,2016,1h 40m,R,6.2,138K,60.0,"When three overworked and under-appreciated moms are pushed beyond their limits, they ditch their conventional responsibilities for a jolt of long overdue freedom, fun and comedic self-indulgence.",https://www.imdb.com/title/tt4651520/?ref_=sr_i_26,"['Jon Lucas', 'Scott Moore']","['Jon Lucas', 'Scott Moore']","['Mila Kunis', 'Kathryn Hahn', 'Kristen Bell', 'Christina Applegate', 'Jada Pinkett Smith', 'Annie Mumolo', 'Oona Laurence', 'Emjay Anthony', 'David Walton', 'Clark Duke']","$20,000,000 (estimated)","$23,817,340","$183,936,074","$113,257,297","July 29, 2016","['United States', 'China']","['Chicago, Illinois, USA (several scenes in background)']","['STX Entertainment', 'Huayi Brothers Media', 'BillBlock Media']","Awards, 3 wins & 5 nominations total","['Slapstick', 'Comedy']",['English']
27. The Angry Birds Movie,2016,1h 37m,PG,6.3,110K,43.0,"When an island populated by happy, flightless birds is visited by mysterious green pigs, it's up to three unlikely outcasts to figure out what the pigs are up to.",https://www.imdb.com/title/tt1985949/?ref_=sr_i_27,"['Jon Vitti', 'Mikael Hed', 'Mikko Pöllä']","['Clay Kaytis', 'Fergal Reilly']","['Jason Sudeikis', 'Josh Gad', 'Danny McBride', 'Maya Rudolph', 'Bill Hader', 'Peter Dinklage', 'Sean Penn', 'Keegan-Michael Key', 'Kate McKinnon', 'Tony Hale']","$73,000,000 (estimated)","$38,155,177","$352,333,929","$107,509,366","May 20, 2016","['United States', 'Finland']","['Vancouver, British Columbia, Canada (, Finland)']","['Columbia Pictures', 'Rovio Entertainment', 'Sony Pictures Animation']","Awards, 3 wins & 8 nominations total","['Animal Adventure', 'Computer Animation', 'Action', 'Adventure', 'Animation', 'Comedy', 'Family']",['English']
28. Independence Day: Resurgence,2016,2h,PG-13,5.2,194K,32.0,"Two decades after the first Independence Day invasion, Earth is faced with a new extra-Solar threat. But will mankind's new space defenses be enough?",https://www.imdb.com/title/tt1628841/?ref_=sr_i_28,"['Gabriel Sherman', 'James A. Woods', 'Nicolas Wright']",['Roland Emmerich'],"['Liam Hemsworth', 'Jeff Goldblum', 'Bill Pullman', 'Maika Monroe', 'Jessie T. Usher', 'Sela Ward', 'William Fichtner', 'Judd Hirsch', 'Brent Spiner', 'Patrick St. Esprit']","$165,000,000 (estimated)","$41,039,944","$389,681,935","$103,144,286","June 24, 2016","['United States', 'India']","['Albuquerque, New Mexico, USA']","['Twentieth Century Fox', 'TSG Entertainment', 'Centropolis Entertainment']","Awards, 3 wins & 17 nominations total","['Adventure Epic', 'Alien Invasion', 'Action', 'Adventure', 'Sci-Fi']","['English', 'Mandarin', 'Russian']"
