Title,Year,Duration,MPA,Rating,Votes,méta_score,description,Movie Link,writers,directors,stars,budget,opening_weekend_Gross,grossWorldWWide,gross_US_Canada,release_date,countries_origin,filming_locations,production_company,awards_content,genres,Languages
265. Sol,2020,1h 38m,,6.0,224,,"Sol, a famous Argentine Tango performer, has lived in Buenos Aires for many years. Behind her excessive temper and her glowing smile, the Diva hides an injury from which she never really recovered: the loss of her only son, Raphaël.",https://www.imdb.com/title/tt11281142/?ref_=sr_i_265,"['Vincent Cappello', 'Faïza Guène', 'Jézabel Marques']",['Jézabel Marques'],"['Chantal Lauby', 'Camille Chamoux', 'Giovanni Pucci', 'Serge Bagdassarian', 'Yannick Renier', 'Dominique MacAvoy', 'Jézabel Marques', 'Irina Ninova', 'Thierry Lopez', 'Cyril Garnier']",,,"$882,035",$543,"March 3, 2021",['France'],,"['StudioCanal', 'Iliade and Films', 'JSG Entertainment']",,['Comedy'],['French']
266. Granny Nanny,2020,1h 44m,,6.5,979,,Three frustrated pensioners volunteer themselves as Grand-Godparents to three stressed children.,https://www.imdb.com/title/tt10252330/?ref_=sr_i_266,['Robert Löhr'],['Wolfgang Groos'],"['Maren Kroymann', 'Günther Maria Halmer', 'Maxime Diemer', 'Barbara Sukowa', 'Heiner Lauterbach', 'Serkan Kaya', 'Paula Kalenberg', 'Tim Oliver Schultz', 'Julia Gleich', 'Luise Gleich']",,$432,"$4,654,655",$432,"November 27, 2020",['Germany'],"['Essen, North Rhine-Westphalia, Germany (setting & main location)']","['Claussen + Putz Filmproduktion', 'Fresco Film Services']",,['Comedy'],['German']
267. It's for Your Own Good,2020,1h 31m,,5.4,729,,Three fathers who are also brothers-in-law make a pact to save their daughters from their boyfriends.,https://www.imdb.com/title/tt11570120/?ref_=sr_i_267,"['Hans G. Raeth', 'Felix Starck']",['Marc Rothemund'],"['Heiner Lauterbach', 'Jürgen Vogel', 'Hilmi Sözer', 'Janina Uhse', 'Lisa-Marie Koroll', 'Lara Aylin Winkler', 'Lisa Maria Potthoff', 'Marie-Lou Sellem', 'Inka Friedrich', 'Jacob Matschenz']","$6,000,000 (estimated)",$256,"$3,405,155",$256,"November 27, 2020",['Germany'],,"['Koryphäen Film', 'StudioCanal Germany', 'RCS Filmproduktion']",,"['Comedy', 'Romance']",['German']
268. The East,2020,2h 17m,TV-MA,6.8,7.3K,52.0,A young Dutch soldier deployed to suppress post-WWII independence efforts in the Netherlands' colony of Indonesia finds himself torn between duty and conscience when he joins an increasingly ruthless commander's elite squad.,https://www.imdb.com/title/tt8639136/?ref_=sr_i_268,"['Jim Taihuttu', 'Mustafa Duygulu']",['Jim Taihuttu'],"['Martijn Lakemeier', 'Marwan Kenzari', 'Jonas Smulders', 'Abel van Gijlswijk', 'Coen Bril', 'Reinout Scholten van Aschat', 'Jim Deddes', 'Jeroen Perceval', 'Mike Reus', 'Joenoes Polnaija']",,$46,"$160,187",$180,"August 13, 2021","['Netherlands', 'Belgium', 'Indonesia', 'United States', 'France']","['Java, Indonesia']","['New Amsterdam Film Company', 'Base Entertainment', 'France 2 Cinéma']","Awards, 2 wins & 9 nominations total","['Drama', 'Thriller', 'War']","['English', 'Japanese', 'Dutch', 'Indonesian']"
269. 365 Days,2020,1h 54m,TV-MA,3.3,103K,,"Massimo is a member of the Sicilian Mafia family and Laura is a sales director. She does not expect that on a trip to Sicily trying to save her relationship, Massimo will kidnap her and give her 365 days to fall in love with him.",https://www.imdb.com/title/tt10886166/?ref_=sr_i_269,"['Tomasz Klimala', 'Tomasz Mandes', 'Barbara Bialowas']","['Barbara Bialowas', 'Tomasz Mandes']","['Anna-Maria Sieklucka', 'Michele Morrone', 'Bronislaw Wroclawski', 'Otar Saralidze', 'Magdalena Lamparska', 'Natasza Urbanska', 'Grazyna Szapolowska', 'Tomasz Stockinger', 'Gianni Parisi', 'Mateusz Lasowski']",,,"$9,458,590",,"June 7, 2020",['Poland'],"['Warsaw, Mazowieckie, Poland']","['Ekipa', 'Future Space', 'Next Film']","Awards, 1 win & 5 nominations total","['Steamy Romance', 'Drama', 'Romance']","['Polish', 'English', 'Italian']"
270. You Should Have Left,2020,1h 33m,R,5.4,29K,46.0,"A former banker, his actress wife, and their spirited daughter book a vacation at an isolated modern home in the Welsh countryside where nothing is quite as it seems.",https://www.imdb.com/title/tt8201852/?ref_=sr_i_270,"['David Koepp', 'Daniel Kehlmann']",['David Koepp'],"['Kevin Bacon', 'Amanda Seyfried', 'Avery Tiiu Essex', 'Colin Blumenau', 'Lowri Ann Richards', 'Joshua C Jackson', 'Eli Powers']",,,,,"June 18, 2020","['United States', 'United Kingdom']","['Llanbister, Radnorshire, Wales, UK (Life House)']",['Blumhouse Productions'],,"['Psychological Horror', 'Supernatural Horror', 'Horror', 'Mystery', 'Thriller']",['English']
271. Hamilton,2020,2h 40m,PG-13,8.3,126K,88.0,"The real life of one of America's foremost founding fathers and first Secretary of the Treasury, Alexander Hamilton. Captured live on Broadway from the Richard Rodgers Theater with the original Broadway cast.",https://www.imdb.com/title/tt8503618/?ref_=sr_i_271,"['Lin-Manuel Miranda', 'Ron Chernow']",['Thomas Kail'],"['Lin-Manuel Miranda', 'Phillipa Soo', 'Leslie Odom Jr.', 'Renée Elise Goldsberry', 'Daveed Diggs', 'Jonathan Groff', 'Chris Jackson', 'Jasmine Cephas Jones', 'Okieriete Onaodowan', 'Anthony Ramos']",,,,,"July 3, 2020",['United States'],"['Richard Rodgers Theatre - 226 W. 46th Street, Manhattan, New York City, New York, USA']","['Walt Disney Pictures', '5000 Broadway Productions', 'Nevis Productions']","Won 2 Primetime Emmys, 19 wins & 46 nominations total","['Epic', 'Biography', 'Drama', 'History', 'Musical']","['English', 'French']"
272. Enola Holmes,2020,2h 3m,PG-13,6.6,232K,68.0,"When Enola Holmes, Sherlock's sister, discovers her mother is missing, she endeavors to find her, becoming a super-sleuth in her own right as she outwits her famous brother and unravels a dangerous conspiracy.",https://www.imdb.com/title/tt7846844/?ref_=sr_i_272,"['Jack Thorne', 'Nancy Springer', 'Arthur Conan Doyle']",['Harry Bradbeer'],"['Millie Bobby Brown', 'Henry Cavill', 'Sam Claflin', 'Helena Bonham Carter', 'Louis Partridge', 'Burn Gorman', 'Adeel Akhtar', 'Susan Wokoma', 'Hattie Morahan', 'David Bamber']","$20,000,000 (estimated)",,,,"September 23, 2020",['United States'],"['Severn Valley Railway Station, Kidderminster, Worcestershire, England, UK (railway Station when Enola runs away from home)']","['Netflix', 'Legendary Entertainment', 'PCMA Management and Productions']","Awards, 4 wins & 12 nominations total","['Cozy Mystery', 'Teen Adventure', 'Teen Drama', 'Adventure', 'Crime', 'Drama', 'Mystery']",['English']
273. The Devil All the Time,2020,2h 18m,R,7.1,161K,55.0,Sinister characters converge around a young man devoted to protecting those he loves in a postwar backwoods town teeming with corruption and brutality,https://www.imdb.com/title/tt7395114/?ref_=sr_i_273,"['Antonio Campos', 'Paulo Campos', 'Donald Ray Pollock']",['Antonio Campos'],"['Bill Skarsgård', 'Tom Holland', 'Banks Repeta', 'Emilio Subercaseaux Campos', 'Haley Bennett', 'Kristin Griffith', 'Sebastian Stan', 'Riley Keough', 'Jason Clarke', 'Harry Melling']",,,,,"September 10, 2020",['United States'],"['Main Street, Montevallo, Alabama, USA']","['Bronx Moving Co.', 'Nine Stories Productions']","Awards, 3 nominations total","['Psychological Thriller', 'Crime', 'Drama', 'Thriller']",['English']
274. Greenland,2020,1h 59m,PG-13,6.4,145K,64.0,A family struggles for survival in the face of a cataclysmic natural disaster.,https://www.imdb.com/title/tt7737786/?ref_=sr_i_274,['Chris Sparling'],['Ric Roman Waugh'],"['Gerard Butler', 'Morena Baccarin', 'Roger Dale Floyd', 'Scott Glenn', 'Randal Gonzalez', 'Rick Pasqualone', 'Nicola Lambo', 'Alan Pietruszewski', 'Scott Poythress', 'Claire Bronson']","$34,000,000 (estimated)",,"$52,300,000",,"December 18, 2020","['United States', 'United Kingdom']",['Iceland (Greenland scenes)'],"['STX Films', 'Anton', 'Thunder Road Pictures']","Awards, 1 win & 2 nominations total","['Disaster', 'Action', 'Thriller']","['English', 'Spanish', 'Russian']"
275. Hillbilly Elegy,2020,1h 56m,R,6.7,58K,38.0,"An urgent phone call pulls a Yale Law student back to his Ohio hometown, where he reflects on three generations of family history and his own future.",https://www.imdb.com/title/tt6772802/?ref_=sr_i_275,"['JD Vance', 'Vanessa Taylor']",['Ron Howard'],"['Amy Adams', 'Glenn Close', 'Gabriel Basso', 'Haley Bennett', 'Freida Pinto', 'Bo Hopkins', 'Owen Asztalos', 'Jesse C. Boyd', 'Stephen Kunken', 'Keong Sim']","$45,000,000 (estimated)",,,,"November 24, 2020",['United States'],"['Middletown, Ohio, USA (exterior scenes)']","['Imagine Entertainment', 'Netflix']","Nominated for 2 Oscars, 4 wins & 34 nominations total","['Biography', 'Drama']",['English']
276. Mulan,2020,1h 55m,PG-13,5.8,163K,66.0,"To keep her ailing father from serving in the Imperial Army, a fearless young woman disguises herself as a man and battles northern invaders in China.",https://www.imdb.com/title/tt4566758/?ref_=sr_i_276,"['Rick Jaffa', 'Amanda Silver', 'Lauren Hynek']",['Niki Caro'],"['Yifei Liu', 'Donnie Yen', 'Gong Li', 'Jet Li', 'Jason Scott Lee', 'Yoson An', 'Tzi Ma', 'Rosalind Chao', 'Pei-Pei Cheng', 'Xana Tang']","$200,000,000 (estimated)",,"$69,965,374",,"September 4, 2020","['United States', 'China']","['Kumeu Film Studios, 116 Access Road, Kumeu, Auckland, New Zealand (Studio)']","['Walt Disney Pictures', 'Jason T. Reed Productions', 'Good Fear Content']","Nominated for 2 Oscars, 11 wins & 42 nominations total","['Adventure Epic', 'Fantasy Epic', 'Martial Arts', 'Action', 'Adventure', 'Drama', 'Fantasy']","['English', 'Mandarin']"
277. Boss Level,2020,1h 40m,TV-MA,6.8,84K,56.0,"Trapped in a time loop that constantly repeats the day of his murder, a former special forces agent must unlock the mystery behind his untimely demise.",https://www.imdb.com/title/tt7638348/?ref_=sr_i_277,"['Chris Borey', 'Eddie Borey', 'Joe Carnahan']",['Joe Carnahan'],"['Frank Grillo', 'Mel Gibson', 'Naomi Watts', 'Michelle Yeoh', 'Will Sasso', 'Annabelle Wallis', 'Sheaun McKinney', 'Selina Lo', 'Ken Jeong', 'Meadow Williams']","$45,000,000 (estimated)",,"$1,753,823",,"March 5, 2021","['United States', 'Australia', 'United Kingdom']","['Atlanta, Georgia, USA']","['WarParty Films', 'Scott Free Productions', 'Emmett/Furla Oasis Films']",,"['Dark Comedy', 'One-Person Army Action', 'Time Travel', 'Action', 'Adventure', 'Comedy', 'Mystery', 'Sci-Fi', 'Thriller']",['English']
278. Another Round,2020,1h 57m,Not Rated,7.7,211K,79.0,Four high-school teachers consume alcohol on a daily basis to see how it affects their social and professional lives.,https://www.imdb.com/title/tt10288566/?ref_=sr_i_278,"['Thomas Vinterberg', 'Tobias Lindholm']",['Thomas Vinterberg'],"['Mads Mikkelsen', 'Thomas Bo Larsen', 'Magnus Millang', 'Lars Ranthe', 'Maria Bonnevie', 'Helene Reingaard Neumann', 'Susse Wold', 'Magnus Sjørup', 'Silas Cornelius Van', 'Albert Rudbeck Lindhardt']",,,"$12,745,392",,"December 18, 2020","['Denmark', 'Sweden', 'Netherlands', 'Belgium', 'France']","['Nordre Toldbod, Copenhagen, Denmark (harbor scene)']","['Zentropa Entertainments', 'Film i Väst', 'Zentropa International Sweden']","Won 1 Oscar, 60 wins & 72 nominations total","['Dark Comedy', 'Psychological Drama', 'Drama']","['Danish', 'Swedish', 'French', 'English', 'Russian']"
279. Run,2020,1h 30m,PG-13,6.7,104K,67.0,"Chloe, a teenager who is confined to a wheelchair, is homeschooled by her mother, Diane. Chloe soon becomes suspicious of her mother and begins to suspect that she may be harboring a dark secret.",https://www.imdb.com/title/tt8633478/?ref_=sr_i_279,"['Aneesh Chaganty', 'Sev Ohanian']",['Aneesh Chaganty'],"['Sarah Paulson', 'Kiera Allen', 'Sara Sohn', 'Pat Healy', 'Erik Athavale', 'BJ Harrison', 'Sharon Bajer', 'Onalee Ames', 'Joanne Rodriguez', 'Ernie Foort']",,,"$5,184,368",,"November 20, 2020","['United States', 'Canada']","['Winnipeg, Manitoba, Canada']","['Lionsgate', 'Search Party']","Awards, 3 wins & 6 nominations total","['Psychological Thriller', 'Suspense Mystery', 'Drama', 'Horror', 'Mystery', 'Thriller']",['English']
280. Greyhound,2020,1h 31m,PG-13,7.0,123K,64.0,"Several months after the U.S. entry into World War II, an inexperienced U.S. Navy commander must lead an Allied convoy being stalked by a German submarine wolf pack.",https://www.imdb.com/title/tt6048922/?ref_=sr_i_280,"['Tom Hanks', 'C.S. Forester']",['Aaron Schneider'],"['Tom Hanks', 'Elisabeth Shue', 'Stephen Graham', 'Matt Helm', 'Craig Tate', 'Rob Morgan', 'Travis Quentin', 'Jeff Burkes', 'Matthew Zuk', 'Joseph Poliquin']","$50,300,000 (estimated)",,,,"July 10, 2020","['United States', 'Canada', 'China']","['Baton Rouge, Louisiana, USA']","['Apple Original Films', 'Sony Pictures Releasing', 'Stage 6 Films']","Nominated for 1 Oscar, 1 win & 24 nominations total","['Period Drama', 'War Epic', 'Drama', 'History', 'War']",['English']
281. The Old Guard,2020,2h 5m,R,6.7,191K,70.0,"A covert group of tight-knit mercenaries with an inability to die have fought to protect the world for centuries. But when their abilities are suddenly exposed, they need to eliminate the threat of those who seek to replicate their power.",https://www.imdb.com/title/tt7556122/?ref_=sr_i_281,"['Greg Rucka', 'Leandro Fernandez']",['Gina Prince-Bythewood'],"['Charlize Theron', 'KiKi Layne', 'Matthias Schoenaerts', 'Marwan Kenzari', 'Luca Marinelli', 'Chiwetel Ejiofor', 'Harry Melling', 'Veronica Ngo', 'Natacha Karam', 'Mette Narrative']","$70,000,000 (estimated)",,,,"July 10, 2020","['United States', 'France', 'Iceland', 'United Kingdom', 'Morocco', 'Canada']","['Marrakech, Morocco']","['Netflix', 'Skydance Media', 'Denver and Delilah Productions']","Awards, 5 wins & 24 nominations total","['Globetrotting Adventure', 'Superhero', 'Action', 'Thriller']","['English', 'Arabic', 'French', 'Italian']"
282. The Banker,2020,2h,PG-13,7.3,39K,59.0,"In the 1960s, two African-American entrepreneurs hire a working-class white man to pretend to be the head of their business empire while they pose as a janitor and chauffeur.",https://www.imdb.com/title/tt6285944/?ref_=sr_i_282,"['Niceole R. Levy', 'George Nolfi', 'David Lewis Smith']",['George Nolfi'],"['Anthony Mackie', 'Samuel L. Jackson', 'Nicholas Hoult', 'Nia Long', 'Scott Daniel Johnson', 'Jessie T. Usher', 'Colm Meaney', 'Paul Ben-Victor', 'James DuMont', 'Taylor Black']",,,"$1,700,000",,"March 20, 2020",['United States'],"['Atlanta, Georgia, USA']","['Romulus Entertainment', 'Hyphenate Films', 'Iam21 Entertainment']","Awards, 3 wins & 7 nominations total","['Period Drama', 'Biography', 'Drama', 'Financial Drama']",['English']
283. I Care a Lot,2020,1h 58m,R,6.4,153K,66.0,A crooked legal guardian who drains the savings of her elderly wards meets her match when a woman she tries to swindle turns out to be more than she first appears.,https://www.imdb.com/title/tt9893250/?ref_=sr_i_283,['J Blakeson'],['J Blakeson'],"['Rosamund Pike', 'Peter Dinklage', 'Eiza González', 'Dianne Wiest', 'Chris Messina', 'Isiah Whitlock Jr.', 'Macon Blair', 'Alicia Witt', 'Damian Young', 'Nicholas Logan']","$14,000,000 (estimated)",,"$1,351,662",,"February 19, 2021","['United States', 'United Kingdom']","['Boston, Massachusetts, USA']","['Black Bear', 'Crimple Beck']","Awards, 1 win & 6 nominations total","['Dark Comedy', 'Comedy', 'Crime', 'Drama', 'Thriller']",['English']
284. Extraction,2020,1h 56m,R,6.8,276K,56.0,"Tyler Rake, a fearless black market mercenary, embarks on the most deadly extraction of his career when he's enlisted to rescue the kidnapped son of an imprisoned international crime lord.",https://www.imdb.com/title/tt8936646/?ref_=sr_i_284,"['Joe Russo', 'Ande Parks', 'Anthony Russo']",['Sam Hargrave'],"['Chris Hemsworth', 'Bryon Lerum', 'Ryder Lerum', 'Rudhraksh Jaiswal', 'Shivam Vichare', 'Piyush Khati', 'Sara Rumao', 'Randeep Hooda', 'Aarti Kulkarni', 'Umakant Patil']","$65,000,000 (estimated)",,,,"April 24, 2020","['United States', 'India']","['Dhaka, Bangladesh']","['Netflix', 'AGBO', 'T.G.I.M Films']","Awards, 4 wins & 15 nominations total","['Gun Fu', 'One-Person Army Action', 'Action', 'Crime', 'Thriller']","['English', 'Hindi', 'Bengali']"
285. Dinner in America,2020,1h 46m,,7.5,12K,80.0,An on-the-lam punk rocker and a young woman obsessed with his band unexpectedly fall in love and go on an epic journey together through America's decaying Midwestern suburbs.,https://www.imdb.com/title/tt9058654/?ref_=sr_i_285,['Adam Rehmeier'],['Adam Rehmeier'],"['Kyle Gallner', 'Yancey Fuqua', 'Jennifer Kincer', 'Hannah Marks', 'Ricky Wayne', 'Lea Thompson', 'Nick Chinlund', 'Sean Rogers', 'Emily Skeggs', 'Nico Greetham']",,,"$22,394",,"January 21, 2021",['United States'],,"['Atlas Industries', 'Bee-Hive Productions', 'Burn Later Productions']","Awards, 14 wins & 6 nominations total","['Quirky Comedy', 'Comedy', 'Drama', 'Music', 'Romance']",['English']
286. I'm Thinking of Ending Things,2020,2h 14m,R,6.5,104K,78.0,"Full of misgivings, a young woman travels with her new boyfriend to his parents' secluded farm. Upon arriving, she comes to question everything she thought she knew about him, and herself.",https://www.imdb.com/title/tt7939766/?ref_=sr_i_286,"['Charlie Kaufman', 'Iain Reid']",['Charlie Kaufman'],"['Jesse Plemons', 'Jessie Buckley', 'Toni Collette', 'David Thewlis', 'Guy Boyd', 'Hadley Robinson', 'Gus Birney', 'Abby Quinn', 'Colby Minifie', 'Anthony Robert Grasso']",,,,,"September 4, 2020",['United States'],"['Red Line Diner - 588 Route 9, Fishkill, New York, USA (""movie in a movie"" scene)']","['Likely Story', 'Projective Testing Service']","Awards, 15 wins & 107 nominations total","['Psychological Drama', 'Psychological Thriller', 'Drama', 'Thriller']","['English', 'Spanish']"
287. We Can Be Heroes,2020,1h 40m,PG,4.7,18K,51.0,"When alien invaders capture the Earth's superheroes, their kids must learn to work together to save their parents and the planet.",https://www.imdb.com/title/tt10600398/?ref_=sr_i_287,"['Robert Rodriguez', 'Racer Rodriguez']",['Robert Rodriguez'],"['YaYa Gosselin', 'Pedro Pascal', 'Priyanka Chopra Jonas', 'Lyon Daniels', 'Andy Walken', 'Hala Finley', 'Lotus Blossom', 'Dylan Henry Lau', 'Andrew Diaz', 'Isaiah Russell-Bailey']",,,,,"December 25, 2020",['United States'],"['Texas, USA']","['Double R Productions (II)', 'Quick Draw Productions', 'Troublemaker Studios']","Awards, 1 nomination total","['Alien Invasion', 'Space Sci-Fi', 'Superhero', 'Action', 'Animation', 'Comedy', 'Drama', 'Family', 'Fantasy', 'Sci-Fi']",['English']
288. Life in a Year,2020,1h 47m,PG-13,6.2,11K,,The movie follows 17-year-old Daryn who finds out that his girlfriend is dying. He sets out to give her an entire life in the last year she has left.,https://www.imdb.com/title/tt6598238/?ref_=sr_i_288,"['Jeffrey Addiss', 'Will Matthews']",['Mitja Okorn'],"['Jaden Smith', 'Cara Delevingne', 'Cuba Gooding Jr.', ""Chris D'Elia"", 'JT Neal', 'Stony Blyden', 'Peter MacNeill', 'RZA', 'Nia Long', 'Michelle Giroux']",,,"$43,862",,"November 27, 2020",['United States'],"['Toronto, Ontario, Canada (New Credit)']",['Overbrook Entertainment'],,"['Drama', 'Romance']",['English']
289. Inheritance,2020,1h 51m,TV-MA,5.6,22K,31.0,"The patriarch of a wealthy and powerful family suddenly passes away, leaving his daughter with a shocking secret inheritance that threatens to unravel and destroy the family.",https://www.imdb.com/title/tt7923220/?ref_=sr_i_289,['Matthew Kennedy'],['Vaughn Stein'],"['Lily Collins', 'Simon Pegg', 'Connie Nielsen', 'Chace Crawford', 'Patrick Warburton', 'Marque Richardson', 'Michael Beach', 'Rebecca Adams', 'Alec James', 'Josh Murray']",,,"$304,931",,"May 22, 2020","['United States', 'United Kingdom']","['Birmingham, Alabama, USA (on location)']","['Convergent Media.', 'Highland Film Group (HFG)', 'Ingenious Media']",,"['Drama', 'Mystery', 'Thriller']",['English']
290. Eurovision Song Contest: The Story of Fire Saga,2020,2h 3m,PG-13,6.5,106K,50.0,"When aspiring musicians Lars and Sigrit are given the opportunity to represent their country at the world's biggest song competition, they finally have a chance to prove that any dream worth having is a dream worth fighting for.",https://www.imdb.com/title/tt8580274/?ref_=sr_i_290,"['Will Ferrell', 'Harper Steele']",['David Dobkin'],"['Will Ferrell', 'Rachel McAdams', 'Dan Stevens', 'Mikael Persbrandt', 'Pierce Brosnan', 'Ólafur Darri Ólafsson', 'Melissanthi Mahut', 'Joi Johannsson', 'Björn Hlynur Haraldsson', 'Demi Lovato']",,,,,"June 26, 2020","['United States', 'Iceland', 'Canada']","['Húsavík, Iceland']","['European Broadcasting Union (EBU)', 'Gary Sanchez Productions', 'Gloria Sanchez Productions']","Nominated for 1 Oscar, 6 wins & 28 nominations total","['Comedy', 'Music']","['English', 'Icelandic', 'Portuguese', 'French']"
291. Mank,2020,2h 11m,R,6.8,85K,79.0,1930s Hollywood is re-evaluated through the eyes of scathing social critic and alcoholic screenwriter Herman J. Mankiewicz as he races to finish the screenplay of Citizen Kane (1941).,https://www.imdb.com/title/tt10618286/?ref_=sr_i_291,['Jack Fincher'],['David Fincher'],"['Gary Oldman', 'Amanda Seyfried', 'Lily Collins', 'Tom Pelphrey', 'Arliss Howard', 'Tuppence Middleton', 'Monika Gossmann', 'Joseph Cross', 'Sam Troughton', 'Toby Leonard Moore']","$25,000,000 (estimated)",,,,"December 4, 2020",['United States'],"['Victorville, California, USA']","['Blue Light', 'Flying Studio', 'Netflix Studios']","Won 2 Oscars, 66 wins & 274 nominations total","['Docudrama', 'Period Drama', 'Showbiz Drama', 'Biography', 'Drama']","['English', 'German', 'Latin']"
292. All the Bright Places,2020,1h 47m,TV-MA,6.6,41K,61.0,"The story of Violet and Theodore, who meet and change each other's lives forever. As they struggle with the emotional and physical scars of their past, they discover that even the smallest places and moments can mean something.",https://www.imdb.com/title/tt3907584/?ref_=sr_i_292,"['Jennifer Niven', 'Liz Hannah']",['Brett Haley'],"['Elle Fanning', 'Justice Smith', 'Alexandra Shipp', ""Kelli O'Hara"", 'Lamar Johnson', 'Virginia Gardner', 'Felix Mallard', 'Sofia Hasmik', 'Keegan-Michael Key', 'Luke Wilson']",,,,,"February 28, 2020",['United States'],"['Cleveland, Ohio, USA']","['Echo Lake Entertainment', 'The Mazur Kaplan Company']","Awards, 1 win total","['Drama', 'Romance']",['English']
293. Lost Girls and Love Hotels,2020,1h 37m,R,4.7,5.8K,57.0,"Disillusioned with the world she knows, a woman searches for meaning and affirmations of life with a dashing Yakuza gangster in Tokyo.",https://www.imdb.com/title/tt0920462/?ref_=sr_i_293,['Catherine Hanrahan'],['William Olsson'],"['Alexandra Daddario', 'Takehiro Hira', 'Carice van Houten', 'Andrew Rothney', 'Misuzu Kanno', 'Yasunari Takeshima', 'Kate Easton', 'Haruka Imô', 'Yu Mizuhara', 'Mariko Tsutsui']",,,"$106,045",,"September 18, 2020","['Japan', 'United States']","['Kyoto, Japan']","['Blackbird', 'Wandering Trail Pictures']",,"['Drama', 'Thriller']","['English', 'Japanese']"
294. Spenser Confidential,2020,1h 51m,R,6.2,102K,49.0,"When two Boston police officers are murdered, ex-cop Spenser teams up with his no-nonsense roommate Hawk to take down criminals.",https://www.imdb.com/title/tt8629748/?ref_=sr_i_294,"[""Sean O'Keefe"", 'Brian Helgeland', 'Robert B. Parker']",['Peter Berg'],"['Mark Wahlberg', 'Winston Duke', 'Alan Arkin', 'Iliza Shlesinger', 'Michael Gaston', 'Bokeem Woodbine', 'Marc Maron', 'James DuMont', 'Post Malone', 'Colleen Camp']","$95,000,000 (estimated)",,,,"March 6, 2020",['United States'],"['Raynham-Taunton Greyhound Park, Raynham, Massachusetts, USA (location)']","['Netflix', 'Original Film', 'Closest to the Hole Productions']","Awards, 2 nominations total","['Buddy Cop', 'Action', 'Comedy', 'Crime', 'Drama', 'Mystery', 'Thriller']","['English', 'Hindi']"
295. The Trial of the Chicago 7,2020,2h 9m,R,7.7,200K,76.0,"The story of 7 people on trial stemming from various charges surrounding the uprising at the 1968 Democratic National Convention in Chicago, Illinois.",https://www.imdb.com/title/tt1070874/?ref_=sr_i_295,['Aaron Sorkin'],['Aaron Sorkin'],"['Eddie Redmayne', 'Alex Sharp', 'Sacha Baron Cohen', 'Jeremy Strong', 'John Carroll Lynch', 'Yahya Abdul-Mateen II', 'Mark Rylance', 'Joseph Gordon-Levitt', 'Ben Shenkman', 'J.C. MacKenzie']","$35,000,000 (estimated)",,,,"October 16, 2020","['United States', 'United Kingdom', 'India']","['Chicago, Illinois, USA']","['Dreamworks Pictures', 'Amblin Partners', 'Aperture Media Partners']","Nominated for 6 Oscars, 59 wins & 196 nominations total","['Docudrama', 'Legal Drama', 'Political Drama', 'Drama', 'History', 'Thriller']","['English', 'Latin', 'French']"
296. An American Pickle,2020,1h 28m,PG-13,5.7,28K,58.0,An immigrant worker at a pickle factory is accidentally preserved for 100 years and wakes up in modern-day Brooklyn.,https://www.imdb.com/title/tt9059704/?ref_=sr_i_296,['Simon Rich'],['Brandon Trost'],"['Seth Rogen', 'Sarah Snook', 'Molly Evensen', 'Eliot Glazer', 'Kalen Allen', ""Kevin O'Rourke"", 'Sean Whalen', 'Geoffrey Cantor', 'Carol Leifer', 'Jorma Taccone']",,,"$499,649",,"August 6, 2020","['United States', 'United Kingdom']","['Pittsburgh, Pennsylvania, USA (location)']","['Point Grey Pictures', 'Gravitational Productions', 'Sony Pictures Releasing']","Awards, 1 win & 1 nomination total","['High-Concept Comedy', 'Comedy', 'Fantasy']","['English', 'Yiddish', 'Hebrew']"
