Title,Year,Duration,MPA,Rating,Votes,méta_score,description,Movie Link,writers,directors,stars,budget,opening_weekend_Gross,grossWorldWWide,gross_US_Canada,release_date,countries_origin,filming_locations,production_company,awards_content,genres,Languages
444. 3 Weeks in Yerevan,2016,1h 32m,,7.1,218,,"In this heartwarming comedy, two filmmakers (Armen and Raffi), from Los Angeles, go to Armenia to shoot a feature length movie about a third generation American Armenian who goes to Yerevan to adopt a 12 year old. Teaming up with a local impresario (Rubo), the team begins the arduous task of casting for the parts, scouting locations and securing the last leg of the funding. What seems to be a perfect plan becomes a perfect storm of absurd meetings, unexpected discoveries and hysterical events, which come together to sabotage the project. The Minister of Culture, The chief of police, the director of Hyefilm Studios, the oligarch...They all offer to help, and yet all of them have their conditions - changing the plot of the script, adopting it to another period, casting a relative for a part, and ultimately a proposal to turn the simple, touching story into a biopic of an oligarch. The chemistry between the Rubo, Armen and Raffi creates an amazing hilarity, and their journey to realize their dream brings them face to face with some colorful characters, fantastic situations, and beautiful backdrops.",https://www.imdb.com/title/tt5791932/?ref_=sr_i_444,"['Narbeh Nazarian', 'Vahe Berberian']","['Vahe Berberian', 'Vahik Pirhamzei']","['Vahik Pirhamzei', 'Hrant Tokhatyan', 'Vahe Berberian', 'Nanor Petrosyan', 'Khoren Levonyan', 'Ani Galstyan', 'Narek Duryan', 'Vahan Nersisyan', 'Ashot Ghazaryan', 'Armen Hambardzumyan']",,"$29,245","$45,536","$45,536","August 4, 2016",['United States'],['Armenia'],"['Richmond Media Entertainment', 'Wet Paint Production', 'Combinat Production']",,['Comedy'],['Armenian']
445. We Are X,2016,1h 33m,R,7.5,1.1K,64.0,A documentary film about the legendary Japanese rock band X JAPAN.,https://www.imdb.com/title/tt4835086/?ref_=sr_i_445,"['Yoshiki', 'Hiroshi Morie', 'Sugizo']",['Stephen Kijak'],"['Yoshiki', 'Hiroshi Morie', 'Sugizo', 'Toshimitsu Deyama', 'Tomoaki Ishizuka', 'Hideto Matsumoto', 'Taiji Sawada', 'Gene Simmons', 'Wes Borland', 'Richard Fortus']",,"$7,526","$548,126","$45,270","January 23, 2018","['United Kingdom', 'United States']","['Madison Square Garden, New York City, New York, USA']","['Passion Pictures', 'Prettybird']","Awards, 2 wins & 4 nominations total","['Documentary', 'Music']","['English', 'Japanese']"
446. A Melody to Remember,2016,2h 4m,,7.1,425,,"During the Korean War, Second Lieutenant Sang-Yeol encounters a group of orphans while leading his platoon. Empathizing with their pain, he makes a choir with the children to protect them.",https://www.imdb.com/title/tt5093754/?ref_=sr_i_446,"['Cha Ju-Han', 'Song Seon-Chan', 'Lee Woo-tak']","['Lee Han', 'Lee Jae-Jin', 'Shin Jae Myung']","['Yim Si-wan', 'Ko Ah-sung', 'Lee Hee-joon', 'Kim Ah-hyun', 'Daniel Joey Albright', 'Kwon Ban-suk', 'Kang Bo-kyeong', 'Kim Bum-tae', 'Kim Dae-hyun', 'Park Dae-Won']",,,"$6,559,996","$44,263","January 21, 2016",['South Korea'],['South Korea'],['Joy Rabbit'],"Awards, 1 win total","['Action', 'Drama', 'War']",['Korean']
447. Nuts!,2016,1h 19m,Unrated,7.1,899,82.0,"The mostly true story of Dr. John Romulus Brinkley, an eccentric genius who built an empire with his goat-testicle impotence cure and a million-watt radio station.",https://www.imdb.com/title/tt5236900/?ref_=sr_i_447,['Thom Stylinski'],['Penny Lane'],"['Gene Tognacci', 'Andy Boswell', 'John Causby', 'Kelly Mizell', 'Jeff Pillars', 'Thom Stylinski', 'Fran Taylor', 'Pope Brok', 'Gene Fowler', 'James Reardon']",,,"$44,230","$44,230","January 22, 2016",['United States'],,"['Cartuna', 'Gland Power Films']","Awards, 3 wins & 6 nominations total","['Animation', 'Biography', 'Documentary']",['English']
448. Phantom of the Theatre,2016,1h 43m,13+,5.2,432,47.0,"A haunted theatre, filled with the vengeful spirits of a tragically-trapped performance troupe murdered in a fire 13 years ago, waits for the once-grand palatial playhouse to re-open with a new show - and bring in new victims.",https://www.imdb.com/title/tt5639650/?ref_=sr_i_448,"['Jingling Li', 'Manfred Wong', 'Mei Yuan Yang']",['Wai-Man Yip'],"['Ruby Lin', 'Yo Yang', 'Simon Yam', 'Gangshan Jing', 'Huan Huang', 'Jiangguo Lin', 'Ming Hu', 'Natalie Yao Meng', 'Xudong Wu', 'Patricia Ha']",,"$21,001","$13,526,843","$43,955","April 29, 2016",['China'],"['Shanghai, China (location)']","['Distribution Workshop', 'Bona International Film Group', 'Dong Yang Huan Yu Media']",,"['Supernatural Fantasy', 'Supernatural Horror', 'Drama', 'Fantasy', 'Horror', 'Mystery', 'Romance', 'Thriller']","['Mandarin', 'Chinese']"
449. The Land,2016,1h 44m,R,6.4,1.9K,50.0,"Four teenage boys in Cleveland, Ohio pursue dreams of professional skateboarding over the summer to escape inner city life but entanglement with a local crime boss endangers their brotherhood and lives.",https://www.imdb.com/title/tt5164412/?ref_=sr_i_449,['Steven Caple Jr.'],['Steven Caple Jr.'],"['Jorge Lendeborg Jr.', 'Moises Arias', 'Rafi Gavron', 'Ezri Walker', 'Colson Baker', 'Robert Hunter', 'Melvin Gregg', 'Christopher Amitrano', 'Nadia Simms', 'Ashleigh Morghan']",,"$17,958","$43,756","$43,756","August 4, 2016",['United States'],"['Cleveland, Ohio, USA']","['Priority Pictures', 'Low Spark Films', 'MACRO']","Awards, 2 wins & 3 nominations total",['Drama'],['English']
450. The Death of Louis XIV,2016,1h 55m,,6.8,2.7K,76.0,"Upon returning from a hunting expedition, King Louis XIV feels a sharp pain in his leg. He begins to die, surrounded by loyal followers in the royal chambers.",https://www.imdb.com/title/tt5129510/?ref_=sr_i_450,"['Thierry Lounas', 'Albert Serra']",['Albert Serra'],"['Jean-Pierre Léaud', ""Patrick d'Assumçao"", 'Marc Susini', 'Bernard Belin', 'Irène Silvagni', 'Jacques Henric', 'Vicenç Altaió', 'Alain Lajoinie', 'Olivier Cadiot', 'Philippe Crespeau']",,"$8,002","$209,715","$43,635","November 2, 2016","['France', 'Portugal', 'Spain']","['Château de Hautefort, Hautefort, Dordogne, France (interiors and exteriors)']","['Capricci Films', 'Rosa Filmes', 'Andergraun Films']","Awards, 14 wins & 29 nominations total","['Biography', 'Drama', 'History']","['French', 'Latin']"
451. Mastizaade,2016,1h 59m,Not Rated,2.5,3.1K,,Sunny Kele and Aditya Chothia are two spoiled bachelors who are sex addicts. Their life takes an unexpected turn after they meet twin sisters Lily and Laila who treat sex addicts at their clinic.,https://www.imdb.com/title/tt3726012/?ref_=sr_i_451,"['Mushtaq Shiekh', 'Milap Zaveri']",['Milap Zaveri'],"['Tusshar Kapoor', 'Vir Das', 'Sunny Leone', 'Govardhan Asrani', 'Shaad Randhawa', 'Suresh Menon', 'Sushmita Mukherjee', 'Riteish Deshmukh', 'Harshada Kulkarni', 'Rina Charaniya']",,"$29,878","$2,535,207","$43,403","January 29, 2016",['India'],,['Pritish Nandy Communications (PNC)'],,"['Raunchy Comedy', 'Comedy']",['Hindi']
452. Hermia & Helena,2016,1h 27m,Not Rated,5.9,501,79.0,"Hermia & Helena is a film of dead ends and new beginnings, navigating different hemispheres and languages with amorous detours, where the written words of Shakespeare clash with the entanglements of modern, digital life.",https://www.imdb.com/title/tt5880296/?ref_=sr_i_452,['Matías Piñeiro'],['Matías Piñeiro'],"['Agustina Muñoz', 'María Villar', 'Mati Diop', 'Keith Poulson', 'Julián Larquier Tellarini', 'Dustin Guy Defa', 'Laura Paredes', 'Gabriela Saidon', 'Pablo Sigal', 'Romina Paula']",,"$12,986","$44,156","$43,152","August 3, 2017","['Argentina', 'United States']","['New York City, New York, USA']","['Trapecio Cine', 'Ravenser Odd', 'Cinema Conservancy']","Awards, 5 nominations total","['Comedy', 'Drama']","['English', 'Spanish']"
453. Restored Me,2016,2h 15m,Not Rated,6.4,77,,"A troubled ex-con joins the colorful crew of an old movie theater and begins to rebuild his life, only to find his faith in God tested when he learns the theater he has grown to love is not what it seems.",https://www.imdb.com/title/tt3477172/?ref_=sr_i_453,"['Jon Knitter', 'Rhyan LaMarr', 'Joe Turner']",['Rhyan LaMarr'],"['Will Yun Lee', 'Richard T. Jones', 'Steven Bauer', 'Noel Gugliemi', 'Matt Gerald', 'Bill Duke', 'Malik Yoba', 'Nafessa Williams', 'Percy Daggs III', 'Casper Smart']","$750,000 (estimated)","$1,316","$42,173","$42,173","June 6, 2016",['United States'],,"['NYC Films', 'Red Guerilla Productions']",,['Drama'],['English']
454. One Week and a Day,2016,1h 38m,,6.7,987,72.0,"As Eyal finishes the traditional Jewish week of mourning for his late son, his wife Vicky urges him to return to their routine -- but just because the shiva has ended doesn't mean it's life as usual.",https://www.imdb.com/title/tt4777584/?ref_=sr_i_454,['Asaph Polonsky'],['Asaph Polonsky'],"['Sharon Alexander', 'Shai Avivi', 'Tomer Capone', 'Evgenia Dodina', 'Uri Gavriel', 'Amit Itzcar', 'Carmit Mesilati Kaplan', 'Alona Shauloff', 'Nili Tserruya']",,"$6,833","$152,178","$41,614","September 8, 2016",['Israel'],,"['Black Sheep Film Productions', 'Rabinovich Film Fund Cinema Project', 'Reshet TV']","Awards, 12 wins & 16 nominations total","['Comedy', 'Drama']",['Hebrew']
455. The Settlers,2016,1h 47m,,7.5,298,75.0,An intimate look at life inside the Jewish settlements in the West Bank.,https://www.imdb.com/title/tt5278914/?ref_=sr_i_455,"['Oron Adar', 'Shimon Dotan']",['Shimon Dotan'],,,,"$41,562","$41,562","June 16, 2016","['France', 'Israel', 'Canada', 'Germany']",,"['Les Films du Poisson', 'Talisma Productions', 'Filmoption International']","Awards, 5 nominations total",['Documentary'],"['English', 'Hebrew', 'Arabic']"
456. Karl Marx City,2016,1h 29m,,6.5,263,73.0,A filmmaker journey through the former East Germany looking into her father's 1999 suicide.,https://www.imdb.com/title/tt5952526/?ref_=sr_i_456,"['Petra Epperlein', 'Michael Tucker']","['Petra Epperlein', 'Michael Tucker']","['Christa Epperlein', 'Petra Epperlein', 'Uwe Epperlein', 'Volker Epperlein', 'Udo Grashoff', 'Hubertus Knabe', 'Douglas Selvage']",,,"$41,072","$41,072","March 29, 2017",['Germany'],"['Chemnitz, Saxony, Germany (formerly Karl-Marx-Stadt)']",,"Awards, 3 nominations total","['Documentary', 'History']","['German', 'English']"
457. Wild Oats,2016,1h 26m,PG-13,5.7,4.9K,,Everything changes for Eva when she receives a life insurance check accidentally made out for five million dollars instead of the expected fifty thousand dollars. She and her best friend take the money and head out for the adventure of a lifetime.,https://www.imdb.com/title/tt1655461/?ref_=sr_i_457,"['Claudia Myers', 'Gary Kanew']",['Andy Tennant'],"['Shirley MacLaine', 'Jessica Lange', 'Demi Moore', 'Ptolemy Slocum', 'Colin Walker', 'Robert Collier', 'Geraldine Singer', 'Susan Parker', 'Vincent De Paul', 'Rachel Deacon']","$10,000,000 (estimated)","$21,554","$247,949","$40,598","September 16, 2016","['Germany', 'United States']","['Gran Canaria, Canary Islands, Spain']","['Wild Pictures', 'Defiant Pictures', 'Alliance Cinema']",,"['Action', 'Adventure', 'Comedy', 'Drama']","['English', 'Spanish', 'German']"
458. Is That a Gun in Your Pocket?,2016,1h 35m,R,4.9,2.1K,7.0,"If there's one thing that the men of Rockford Texas love as much as their women, it's their guns. But when a gun incident at a neighborhood school spurs one stay at home mom, Jenna (Andrea Anders), to rethink Rockford's obsessive gun culture, life in this idyllic town is turned upside-down. Much to the chagrin of her husband, (Matt Passmore), Jenna ignites a movement by recruiting the women to withhold sex from the men until every gun in Rockford is vanquished. A wild and hilarious showdown ensues between the sexes. As tensions and libidos rise, the men and women of Rockford must decide what's really important: keeping the peace or getting a piece.",https://www.imdb.com/title/tt4196832/?ref_=sr_i_458,['Matt Cooper'],['Matt Cooper'],"['Andrea Anders', 'Matt Passmore', 'Cloris Leachman', 'Katherine McNamara', 'John Michael Higgins', 'Horatio Sanz', 'Lauren Bowles', 'John Heard', 'Christine Estabrook', 'Kevin Conway']",,"$10,422","$39,928","$39,928","September 16, 2016",['United States'],"['Los Angeles, California, USA']",['The Vault'],"Awards, 3 wins total","['Satire', 'Comedy']",['English']
459. Paradise,2016,2h 10m,,7.0,2.1K,52.0,"Follows three people whose paths cross during a terrible time of war: Olga, a Russian aristocratic emigrant and member of the French Resistance; Jules, a French collaborator; and Helmut, a high-ranking German SS officer.",https://www.imdb.com/title/tt4551318/?ref_=sr_i_459,"['Andrei Konchalovsky', 'Elena Kiseleva']",['Andrei Konchalovsky'],"['Peter Kurth', 'Yuliya Khlynina', 'Yuliya Vysotskaya', 'Jakob Diehl', 'Viktor Sukhorukov', 'Philippe Duquesne', 'Ramona Kunze-Libnow', 'Vera Voronkova', 'Katharina Blaschke', 'Caroline Piette']","€4,635,000 (estimated)","$2,401","$945,991","$39,622","January 19, 2017","['Russia', 'Germany']",['Germany'],"['Production Center of Andrei Konchalovsky', 'Drife Filmproduktion (I)', 'Ministerstvo kultury Rossiyskoy Federatsii']","Awards, 18 wins & 19 nominations total","['Drama', 'War']","['Russian', 'German', 'French', 'Yiddish']"
460. The Commune,2016,1h 51m,Not Rated,6.4,8.5K,60.0,"A story about the clash between personal desires, solidarity and tolerance in a Danish commune in the 1970s.",https://www.imdb.com/title/tt3082854/?ref_=sr_i_460,"['Tobias Lindholm', 'Mogens Rukov', 'Thomas Vinterberg']",['Thomas Vinterberg'],"['Fares Fares', 'Trine Dyrholm', 'Ulrich Thomsen', 'Magnus Millang', 'Julie Agnete Vang', 'Lars Ranthe', 'Helene Reingaard Neumann', 'Jakob Højlev Jørgensen', 'Ida Maria Vinterberg', 'Mads Reuther']",,"$9,249","$4,410,339","$38,737","May 19, 2017","['Denmark', 'Sweden', 'Netherlands']","['Hellerup, Sjælland, Denmark (location)']","['Zentropa Entertainments', 'Danmarks Radio (DR)', 'Det Danske Filminstitut']","Awards, 6 wins & 21 nominations total","['Coming-of-Age', 'Period Drama', 'Drama']",['Danish']
461. Spa Night,2016,1h 33m,Unrated,6.1,1.4K,76.0,"A closeted Korean-American teenager takes a job at a Korean spa to help his struggling family, only to discover an underground world of gay sex at the spa that both scares and excites him.",https://www.imdb.com/title/tt5254640/?ref_=sr_i_461,['Andrew Ahn'],['Andrew Ahn'],"['Joe Seo', 'Youn Ho Cho', 'Haerry Kim', 'Topher Park', 'Jose A. Solorio', 'Il Ahn', 'Linda Han', 'Yong Kim', 'Tae Song', 'Angie Kim']",,"$7,056","$38,578","$38,578","November 2, 2017",['United States'],"['Wilshire Spa - 661 South Mariposa Avenue, Los Angeles, California, USA (location)']","['Nonetheless Productions', 'Extraordinary Renditions']","Awards, 6 wins & 6 nominations total",['Drama'],"['Korean', 'English', 'Spanish']"
462. Germans & Jews,2016,1h 16m,,7.6,83,73.0,"Germany is one of the most democratic societies in the world, and has the fastest growing Jewish community in Europe. This never could have been imagined in 1945. Through personal stories, the film explores the country's transformation from silence about the Holocaust to facing it head on.",https://www.imdb.com/title/tt5718290/?ref_=sr_i_462,[],['Janina Quint'],,,"$5,024","$38,100","$38,100","June 10, 2016",['United States'],,,,['Documentary'],['English']
463. The Heart of Nuba,2016,1h 25m,,8.4,147,66.0,"In the war-torn Nuba Mountains of Sudan, American doctor Tom Catena selflessly and courageously serves the needs of a forgotten people, while the region is bombed relentlessly by an indicted war criminal, Omar Al-Bashir. Two things remain constant: Dr. Tom's faith and his enduring love for the Nuba people.",https://www.imdb.com/title/tt6255478/?ref_=sr_i_463,"['Cornelio Catena', 'Gene Catena', 'Nancy Catena']",['Kenneth A. Carlson'],"['Cornelio Catena', 'Gene Catena', 'Nancy Catena', 'Paul Catena', 'Tom Catena', 'Corry Chapman', 'Macram Max Gassis', 'Maqbul Karasin', 'Steve Kettelberger', 'Anggalu Kitinyi']",,"$4,016","$37,788","$37,788","April 6, 2018",['United States'],['Sudan'],['Carlson Films'],"Awards, 2 wins & 1 nomination total","['Biography', 'Documentary', 'War']",['English']
464. A Woman's Life,2016,1h 59m,Not Rated,6.4,1.4K,74.0,A fragmented account of the life of Jeanne as she sets out on the path of adult life and gradually experiences the harsh realities of a woman's life in the 19th-century.,https://www.imdb.com/title/tt5078134/?ref_=sr_i_464,"['Stéphane Brizé', 'Florence Vignon', 'Guy de Maupassant']",['Stéphane Brizé'],"['Judith Chemla', 'Jean-Pierre Darroussin', 'Yolande Moreau', 'Swann Arlaud', 'Nina Meurisse', 'Olivier Perrier', 'Clotilde Hesme', 'Alain Beigel', 'Finnegan Oldfield', 'Lucette Beudin']",,"$11,483","$895,944","$37,626","November 16, 2016","['France', 'Belgium']",,"['TS Productions', 'France 3 Cinéma', 'Versus Production']","Awards, 3 wins & 10 nominations total",['Drama'],"['French', 'Latin']"
465. School Life,2016,1h 39m,PG-13,7.4,329,73.0,"Long careers are drawing to a close for John and Amanda, who teach Latin, English, and guitar at a stately home-turned-school, where they are legends with a mantra: ""Reading. 'Rithmetic. Rock 'n' roll!"" But leaving is the hardest lesson.",https://www.imdb.com/title/tt5475022/?ref_=sr_i_465,"['Neasa Ní Chianáin', 'David Rane']","['Neasa Ní Chianáin', 'David Rane']","['Dermot Dix', 'Amanda Leyden', 'John Leyden']",,"$2,332","$86,616","$37,381","September 8, 2017","['Ireland', 'Spain']",['Ireland'],"['Gris Medio', 'Radio Televisión Española (RTVE)', 'Soilsu Films']","Awards, 3 wins & 4 nominations total",['Documentary'],"['English', 'Spanish']"
466. Trust Fund,2016,1h 47m,PG,4.8,302,,"Reese Donahue leads a seemingly ideal life, with a bright future ahead of her. But when she discovers the truth, that her mother left enough money for her to choose her own path, she's faced with a dilemma.",https://www.imdb.com/title/tt3969208/?ref_=sr_i_466,['Sandra L. Martin'],['Sandra L. Martin'],"['Jessica Rothe', 'Willie Garson', 'Ana Ortiz', 'Matthew Alan', 'Rose Abdoo', 'Kevin Kilner', 'Louise Dylan', 'Louisa Mignone', 'Sean Wing', 'Esther Scott']",,"$18,023","$36,885","$36,885","July 18, 2017",['United States'],,['KC Film Office'],,['Drama'],['English']
467. How to Let Go of the World: and Love All the Things Climate Can't Change,2016,2h 7m,TV-14,7.1,385,50.0,"Documentarian Josh Fox (""Gasland"") travels the globe to meet with global climate change ""warriors"" who are committed to reversing the tide of global warming. Funny and tragic, inspiring and enlightening, the film examines the intricately woven forces that threaten the stability of the planet and the lives of its inhabitants.",https://www.imdb.com/title/tt5246328/?ref_=sr_i_467,['Josh Fox'],['Josh Fox'],"['Lester Brown', 'Ella Chou', 'Tim DeChristopher', 'Wu Di', 'Aria Doe', 'Josh Fox', 'Eriberto Gualinga', 'Franco Tulio Viteri Gualinga', 'Nina Gualinga', 'Youming Huang']","$1,600,000 (estimated)","$5,800","$36,386","$36,386","April 20, 2016",['United States'],,['International WOW Company'],"Awards, 4 wins & 2 nominations total",['Documentary'],['English']
468. The Road Movie,2016,1h 7m,,6.4,956,66.0,A documentary comprised entirely of footage from dashboard cameras from Russian cars.,https://www.imdb.com/title/tt6235786/?ref_=sr_i_468,[],['Dmitrii Kalashnikov'],,,"$17,175","$35,757","$35,757","January 19, 2018",['Belarus'],['Russia'],"['Eight and A Half Studio', 'Light Cone Pictures', 'Novi Film']","Awards, 2 wins & 4 nominations total",['Documentary'],['Russian']
469. Rat Film,2016,1h 22m,,6.9,1K,83.0,"Across walls, fences, and alleys, rats not only expose our boundaries of separation but make homes in them. This documentary uses the rat to explore the history of Baltimore.",https://www.imdb.com/title/tt5840448/?ref_=sr_i_469,['Theo Anthony'],['Theo Anthony'],"['Theo Anthony', 'Dan Deacon', 'Matt Fouse', 'Will Kearney III']",,"$7,793","$35,195","$35,195","October 3, 2017",['United States'],,['Memory'],"Awards, 4 wins & 14 nominations total",['Documentary'],['English']
470. Sophie and the Rising Sun,2016,1h 45m,R,6.7,1.5K,55.0,"Autumn of 1941 in Salty Creek, a fishing village in South Carolina, two interracial lovers are swept up in the tides of history.",https://www.imdb.com/title/tt4532818/?ref_=sr_i_470,"['Maggie Greenwald', 'Augusta Trobaugh']",['Maggie Greenwald'],"['Julianne Nicholson', 'Takashi Yamaguchi', 'Margo Martindale', 'Diane Ladd', 'Lorraine Toussaint', 'Karen Wheeling Reynolds', 'Robert Henline', 'Mickey Dodge', 'Don Henderson Baker', 'Annette Gill']",,,"$34,630","$34,630","January 22, 2016",['United States'],"['McClellanville, South Carolina, USA']","['Sophie Film', 'Talent One']","Awards, 3 nominations total",['Drama'],['English']
471. Sweet Sixteen,2016,1h 33m,PG-13,4.8,322,,"Xia Mu is a troubled child whose salvation comes in the form of Shu Yawang. When something terrible happens to her, he seeks revenge. Nothing is the same in their lives after that.",https://www.imdb.com/title/tt4171876/?ref_=sr_i_471,"['Kris Wu', 'Geng Han', 'Shan Lu']",['Jin-gyu Cho'],"['Kris Wu', 'Geng Han', 'Shan Lu', 'Joo Won', 'Yao Zhang', 'Shawn Huang', ""Bei'er Bao"", 'Sung Yoo-bin']",,"$21,439","$22,819,702","$34,327","August 17, 2016",['China'],,['Beijing Ruyi Xinxin Film Investment'],,"['Drama', 'Romance']",['Chinese']
472. Off the Rails,2016,1h 26m,TV-14,7.2,366,80.0,How one man's love of transport led to a lifetime of incarceration.,https://www.imdb.com/title/tt5131960/?ref_=sr_i_472,"['Tchavdar Georgiev', 'Adam Irving']",['Adam Irving'],"['Charles Bilal', 'Courtney Brown', 'Sally Butler', 'Jervis Cameron', 'Michael John Carley', 'Shaun Clarke', 'Evan Croft', 'Rey Cusicanqui', 'Shapour Daneshmand', 'Jude Domski']",,"$8,795","$34,249","$34,249","February 7, 2017","['Canada', 'United States']","['Bay Lower Subway Station, 135 Cumberland Street, Toronto, Ontario, Canada']",['Zipper Bros Films'],"Awards, 10 wins & 3 nominations total",['Documentary'],['English']
473. The Map Against the World,2016,2h 9m,,5.9,153,,"At a time when maps weren't readily accessible for the public, 'Gosanja KIM Jeong-ho' (CHA Seoung-won) sets out to walk across the Korean peninsula to make the Daedongyeojido - the Great Map of the East Land, with hopes of providing an accurate and accessible map for the ordinary people. He has all but forgotten about his daughter KIM Sunsil, who grew to be 16 years old in his absence, as he focuses on completing his map. People say he is crazy, but driven by his goal, KIM Jeong-ho endeavors to complete the template for woodblock printing of the map. However, Daewongun, the King Father (YU Jun-sang) seeks to take KIM Jeong-ho's map to gain the upper hand in his power struggle with the House of Kim of Andong.",https://www.imdb.com/title/tt5973508/?ref_=sr_i_473,"['Jung-mi Choi', 'Park Beom-shin']",['Kang Woo-suk'],"['Cha Seung-won', 'Yoo Joon-sang', 'Ha Do-kwon', 'Baek Dong-hyeon', 'Shin Dong-mi', 'Kim In-kwon', 'Dong-ju Ji', 'Nam Ji-hyun', 'Eom Ji-man', 'In-Sook Kim']",,"$9,962","$7,035,812","$34,034","September 9, 2016",['South Korea'],,['Cinema Service'],"Awards, 2 nominations total","['Drama', 'History']",['Korean']
474. Afterimage,2016,1h 38m,,7.0,3.4K,75.0,"The story of charismatic painter Wladyslaw Strzeminski, who opposed social realism and maintained his own artistic freedom in spite of political obstacles.",https://www.imdb.com/title/tt5186236/?ref_=sr_i_474,"['Andrzej Wajda', 'Andrzej Mularczyk']",['Andrzej Wajda'],"['Boguslaw Linda', 'Zofia Wichlacz', 'Bronislawa Zamachowska', 'Andrzej Konopka', 'Christoph Pieczynski', 'Mariusz Bonaszewski', 'Szymon Bobrowski', 'Aleksander Fabisiak', 'Paulina Galazka', 'Irena Melcer']",,"$5,832","$1,032,768","$33,443","January 13, 2017",['Poland'],"['Lódz, Lódzkie, Poland']","['Akson Studio', 'EC1 Lódz - Miasto Kultury', 'NINA']","Awards, 2 wins & 12 nominations total","['Biography', 'Drama', 'History']",['Polish']
475. Alone in Berlin,2016,1h 43m,R,6.5,10K,52.0,"After a Nazi German working class couple loses their son in World War II, they decide to retaliate by secretly leafletting handwritten cards in Berlin denouncing their government.",https://www.imdb.com/title/tt3026488/?ref_=sr_i_475,"['Hans Fallada', 'Achim von Borries', 'Vincent Perez']",['Vincent Perez'],"['Louis Hofmann', 'Emil von Schönfels', 'Katrin Pollitt', 'Sammy Scheuritzel', 'Joachim Bißmeier', 'Uwe Preuss', 'Joshua Grothe', 'Brendan Gleeson', 'Emma Thompson', 'Monique Chaumette']",,"$8,869","$1,205,598","$33,125","January 13, 2017","['Germany', 'France', 'United Kingdom']","['Görlitz, Saxony, Germany']","['X-Filme Creative Pool', 'Master Movies', 'FilmWave']","Awards, 3 nominations total","['Drama', 'History', 'War']",['English']
476. The Intervention,2016,1h 30m,R,6.0,6.7K,57.0,A weekend getaway for four couples takes a sharp turn when one of the couples discovers the entire trip was orchestrated to host an intervention on their marriage.,https://www.imdb.com/title/tt4872078/?ref_=sr_i_476,['Clea DuVall'],['Clea DuVall'],"['Melanie Lynskey', 'Jason Ritter', 'Skylar Bernon', 'Kira Pozehl', 'David Bernon', 'Natasha Lyonne', 'Clea DuVall', 'Ben Schwartz', 'Alia Shawkat', 'Vincent Piazza']",,"$23,316","$32,919","$32,919","August 26, 2016",['United States'],"['Savannah, Georgia, USA']",['Burn Later Productions'],"Awards, 1 win & 2 nominations total","['Comedy', 'Drama']",['English']
