Title,Year,Duration,MPA,Rating,Votes,méta_score,description,Movie Link,writers,directors,stars,budget,opening_weekend_Gross,grossWorldWWide,gross_US_Canada,release_date,countries_origin,filming_locations,production_company,awards_content,genres,Languages
117. Bad Santa 2,2016,1h 32m,R,5.6,30K,38.0,"Fueled by cheap whiskey, greed and hatred, Willie teams up once again with his angry little sidekick, Marcus, to knock off a Chicago charity on Christmas Eve.",https://www.imdb.com/title/tt1798603/?ref_=sr_i_117,"['Johnny Rosenthal', 'Shauna Cross', 'Glenn Ficarra']",['Mark Waters'],"['Billy Bob Thornton', 'Kathy Bates', 'Tony Cox', 'Christina Hendricks', 'Brett Kelly', 'Ryan Hansen', 'Jenny Zigrino', 'Jeff Skowron', 'Cristina Rosato', 'Mike Starr']","$26,000,000 (estimated)","$6,176,680","$24,079,268","$17,782,178","November 23, 2016","['United States', 'United Kingdom', 'Canada']","['Montréal, Québec, Canada']","['Broad Green Pictures', 'Ingenious Media', 'Miramax']","Awards, 1 win & 2 nominations total","['Holiday Comedy', 'Comedy', 'Crime', 'Drama', 'Holiday', 'Mystery']",['English']
118. Norm of the North,2016,1h 30m,PG,3.4,10K,21.0,"When a real estate development invades his Arctic home, Norm and his three lemming friends head to New York City, where Norm becomes the mascot of the corporation in an attempt to bring it down from the inside and protect his homeland.",https://www.imdb.com/title/tt1594972/?ref_=sr_i_118,"['Malcolm T. Goldman', 'Steven Altiere', 'Daniel Altiere']","['Trevor Wall', 'Lisa Ortiz']","['Rob Schneider', 'Heather Graham', 'Ken Jeong', 'Bill Nighy', 'Colm Meaney', 'Loretta Devine', 'Michael McElhatton', 'Maya Kay', 'Gabriel Iglesias', 'Salome Jens']","$7,000,000 (estimated)","$6,844,137","$30,734,502","$17,062,499","January 15, 2016","['United States', 'India', 'Ireland', 'China']",,"['Assemblage Entertainment', 'Lionsgate', 'Splash Entertainment']",,"['Computer Animation', 'Slapstick', 'Adventure', 'Animation', 'Comedy', 'Family']",['English']
119. The Birth of a Nation,2016,2h,R,6.5,22K,69.0,"Nat Turner, a literate slave and preacher in the antebellum South, orchestrates an uprising.",https://www.imdb.com/title/tt4196450/?ref_=sr_i_119,"['Nate Parker', 'Jean McGianni Celestin']",['Nate Parker'],"['Nate Parker', 'Armie Hammer', 'Penelope Ann Miller', 'Jackie Earle Haley', 'Mark Boone Junior', 'Colman Domingo', 'Aunjanue Ellis-Taylor', 'Dwight Henry', 'Aja Naomi King', 'Esther Scott']","$8,500,000 (estimated)","$7,004,254","$16,779,212","$15,861,566","October 7, 2016","['United States', 'Canada']","['Savannah, Georgia, USA']","['BRON Studios', 'Phantom Four Films', 'Mandalay Pictures']","Awards, 5 wins & 32 nominations total","['Biography', 'Drama', 'History']",['English']
120. A Beautiful Planet,2016,46m,G,7.3,1.5K,75.0,An exploration of Earth and beyond as seen from the International Space Station. Narrated by Jennifer Lawrence.,https://www.imdb.com/title/tt2800050/?ref_=sr_i_120,['Toni Myers'],['Toni Myers'],"['Jennifer Lawrence', 'Samantha Cristoforetti', 'Scott Kelly', 'Kjell Lindgren', 'Anton Shkaplerov', 'Terry Virts', 'Barry Wilmore']",,"$223,983","$26,285,301","$15,650,615","April 29, 2016",['United States'],,"['IMAX', 'Walt Disney Studios']","Awards, 1 win & 1 nomination total",['Documentary'],['English']
121. The Infiltrator,2016,2h 7m,R,7.0,82K,66.0,A U.S. Customs official uncovers a money laundering scheme involving Colombian drug lord Pablo Escobar.,https://www.imdb.com/title/tt1355631/?ref_=sr_i_121,"['Ellen Furman', 'Robert Mazur']",['Brad Furman'],"['Bryan Cranston', 'John Leguizamo', 'Diane Kruger', 'Amy Ryan', 'Leanne Best', 'Daniel Mays', 'Tom Vaughan-Lawlor', 'Niall Hayes', 'Lara Decaro', 'Juliet Aubrey']","$28,000,000 (estimated)","$5,303,775","$21,011,110","$15,436,808","July 13, 2016","['United Kingdom', 'United States']","['Tampa Bay, Florida, USA']","['George Films', 'Good Films Collective', 'Lipsync Productions']","Awards, 1 nomination total","['Drug Crime', 'True Crime', 'Biography', 'Crime', 'Drama', 'Thriller']","['English', 'Spanish']"
122. Keeping Up with the Joneses,2016,1h 45m,PG-13,5.9,70K,34.0,A suburban couple becomes embroiled in an international espionage plot when they discover that their seemingly perfect new neighbors are government spies.,https://www.imdb.com/title/tt2387499/?ref_=sr_i_122,['Michael LeSieur'],['Greg Mottola'],"['Zach Galifianakis', 'Isla Fisher', 'Jon Hamm', 'Gal Gadot', 'Patton Oswalt', 'Ming Zhao', 'Matt Walsh', 'Maribeth Monroe', 'Michael Liu', 'Kevin Dunn']","$40,000,000 (estimated)","$5,461,475","$29,918,745","$14,904,426","October 21, 2016",['United States'],"['Hyatt Regency Atlanta - 265 Peachtree Street NE, Atlanta, Georgia, USA (Odyssey Hotel)']","['Fox 2000 Pictures', 'Parkes/MacDonald Image Nation', 'TSG Entertainment']","Awards, 3 nominations total","['Action', 'Comedy']","['English', 'Hebrew', 'Mandarin']"
123. Criminal,2016,1h 53m,R,6.3,73K,36.0,A dangerous convict receives an implant containing the memories and skills of a dead CIA agent.,https://www.imdb.com/title/tt3014866/?ref_=sr_i_123,"['Douglas Cook', 'David Weisberg']",['Ariel Vromen'],"['Kevin Costner', 'Ryan Reynolds', 'Gal Gadot', 'Gary Oldman', 'Tommy Lee Jones', 'Jordi Mollà', 'Michael Pitt', 'Amaury Nolasco', 'Alice Eve', 'Antje Traue']","$31,500,000 (estimated)","$5,767,278","$38,803,993","$14,708,696","April 15, 2016","['United States', 'United Kingdom', 'Bulgaria']","['Croydon College, College Road, Croydon, London, England, UK (medical research labs and CIA operations centre)']","['Summit Entertainment', 'BenderSpink', 'Campbell Grobman Films']",,"['Spy', 'Action', 'Sci-Fi', 'Thriller']","['English', 'Russian', 'French']"
124. The Edge of Seventeen,2016,1h 44m,R,7.3,146K,77.0,"High-school life gets even more unbearable for Nadine when her best friend, Krista, starts dating her older brother.",https://www.imdb.com/title/tt1878870/?ref_=sr_i_124,['Kelly Fremon Craig'],['Kelly Fremon Craig'],"['Hailee Steinfeld', 'Haley Lu Richardson', 'Blake Jenner', 'Kyra Sedgwick', 'Woody Harrelson', 'Hayden Szeto', 'Alexander Calvert', 'Eric Keenleyside', 'Nesta Cooper', 'Daniel Bacon']","$9,000,000 (estimated)","$4,754,215","$19,370,020","$14,431,633","November 18, 2016","['United States', 'China']","['Guildford Park Secondary School, Surrey, British Columbia, Canada']","['Gracie Films', 'Huayi Brothers Media', 'Robert Simonds Productions']","Awards, 8 wins & 29 nominations total","['Coming-of-Age', 'Teen Comedy', 'Teen Drama', 'Comedy', 'Drama']",['English']
125. Love & Friendship,2016,1h 30m,PG,6.4,27K,87.0,"Lady Susan Vernon takes up temporary residence at her in-laws' estate and, while there, is determined to be a matchmaker for her daughter Frederica--and herself too, naturally.",https://www.imdb.com/title/tt3068194/?ref_=sr_i_125,"['Whit Stillman', 'Jane Austen']",['Whit Stillman'],"['Kate Beckinsale', 'Chloë Sevigny', 'Xavier Samuel', 'Emma Greenwell', 'Morfydd Clark', 'Tom Bennett', 'Jenn Murray', ""Lochlann O'Mearáin"", 'Sophie Radermacher', 'Stephen Fry']","$3,000,000 (estimated)","$133,513","$21,401,949","$14,016,568","June 3, 2016","['United Kingdom', 'Ireland', 'France', 'Netherlands']","['Newbridge House & Farm, Donabate, County Dublin, Ireland']","['Westerly Films', 'Blinder Films', 'Chic Films']","Awards, 7 wins & 54 nominations total","['Costume Drama', 'Period Drama', 'Comedy', 'Drama', 'Romance']","['English', 'French']"
126. Jackie,2016,1h 40m,R,6.6,85K,81.0,"Following the assassination of President John F. Kennedy, First Lady Jacqueline Kennedy fights through grief and trauma to regain her faith, console her children, and define her husband's historic legacy.",https://www.imdb.com/title/tt1619029/?ref_=sr_i_126,['Noah Oppenheim'],['Pablo Larraín'],"['Natalie Portman', 'Peter Sarsgaard', 'Greta Gerwig', 'Billy Crudup', 'John Hurt', 'Richard E. Grant', 'Caspar Phillipson', 'John Carroll Lynch', 'Beth Grant', 'Max Casella']","$9,000,000 (estimated)","$278,715","$29,778,202","$13,960,394","December 2, 2016","['United States', 'France', 'Chile', 'China']","['Studios de Paris, La Cité du Cinéma, Saint-Denis, Seine-Saint-Denis, France']","['Fox Searchlight Pictures', 'LD Entertainment', 'Wild Bunch']","Nominated for 3 Oscars, 44 wins & 170 nominations total","['Tragedy', 'Biography', 'Drama']","['English', 'Spanish']"
127. Born in China,2016,1h 19m,G,7.2,4.2K,57.0,"Venturing into the wilds of China, ""Born in China"" captures intimate moments with a panda and her growing cub, a young golden monkey who feels displaced by his baby sister, and a mother snow leopard struggling to raise her two cubs.",https://www.imdb.com/title/tt4629266/?ref_=sr_i_127,"['David Fowler', 'Brian Leith', 'Phil Chapman']",['Chuan Lu'],"['John Krasinski', 'Claire Keim', 'Xun Zhou']","$10,000,000 (estimated)","$4,790,367","$25,081,168","$13,873,211","April 21, 2017","['United Kingdom', 'China', 'United States']",['China'],"['Disneynature', 'Chuan Films', 'Brian Leith Productions']","Awards, 2 wins & 3 nominations total","['Nature Documentary', 'Documentary']","['English', 'Chinese']"
128. Hillary's America: The Secret History of the Democratic Party,2016,1h 46m,PG-13,4.8,8.1K,2.0,Documentarian Dinesh D'Souza analyzes the history of the Democratic Party and what he thinks are Hillary Clinton's true motivations.,https://www.imdb.com/title/tt5646136/?ref_=sr_i_128,"[""Dinesh D'Souza"", 'Bruce Schooley']","[""Dinesh D'Souza"", 'Bruce Schooley']","[""Dinesh D'Souza"", 'Jonah Goldberg', 'David Guyette', 'Andrea Cohen', 'Peter Schweizer', 'Mikaela Krantz', 'Carol Swain', 'Rebekah Turner', 'Jayvaugn Brown', 'Richard L. Olsen']","$5,000,000 (estimated)","$74,814","$13,099,931","$13,099,931","July 22, 2016",['United States'],"['Point Loma, San Diego, California, USA (Exterior)']","[""D'Souza Media""]","Awards, 4 wins & 1 nomination total","['Biography', 'Documentary', 'History']",['English']
129. The Founder,2016,1h 55m,PG-13,7.2,191K,66.0,"The story of Ray Kroc, a salesman who turned two brothers' innovative fast food eatery, McDonald's, into the biggest restaurant business in the world, with a combination of ambition, persistence, and ruthlessness.",https://www.imdb.com/title/tt4276820/?ref_=sr_i_129,['Robert Siegel'],['John Lee Hancock'],"['Michael Keaton', 'Nick Offerman', 'John Carroll Lynch', 'Linda Cardellini', 'B.J. Novak', 'Laura Dern', 'Justin Randell Brooke', 'Kate Kneeland', 'Patrick Wilson', 'Griff Furst']","$25,000,000 (estimated)","$3,404,102","$24,121,245","$12,786,053","January 20, 2017",['United States'],"['Coweta County, Georgia Administration Building parking lot - 22 East Broad Street, Newnan, Georgia, USA (The original octagonal McDonald brothers restaurant)']","['The Weinstein Company', 'FilmNation Entertainment', 'Faliro House Productions']","Awards, 1 win & 5 nominations total","['Docudrama', 'Period Drama', 'Workplace Drama', 'Biography', 'Drama', 'Financial Drama']","['English', 'Yiddish']"
130. Triple 9,2016,1h 55m,R,6.3,80K,52.0,A gang of criminals and corrupt cops plan the murder of a police officer in order to pull off their biggest heist yet across town.,https://www.imdb.com/title/tt1712261/?ref_=sr_i_130,['Matt Cook'],['John Hillcoat'],"['Casey Affleck', 'Chiwetel Ejiofor', 'Anthony Mackie', 'Aaron Paul', 'Woody Harrelson', 'Kate Winslet', 'Gal Gadot', 'Norman Reedus', 'Teresa Palmer', 'Michael Kenneth Williams']","$20,000,000 (estimated)","$6,109,085","$23,177,948","$12,639,297","February 26, 2016",['United States'],"['Decatur, Georgia, USA']","['Worldview Entertainment', 'Anonymous Content', 'MadRiver Pictures']","Awards, 4 nominations total","['Heist', 'Action', 'Crime', 'Drama', 'Thriller']","['English', 'Spanish', 'Russian']"
131. The Light Between Oceans,2016,2h 13m,PG-13,7.2,62K,60.0,A lighthouse keeper and his wife living off the coast of Western Australia raise a baby they rescue from a drifting rowing boat.,https://www.imdb.com/title/tt2547584/?ref_=sr_i_131,"['Derek Cianfrance', 'M.L. Stedman']",['Derek Cianfrance'],"['Michael Fassbender', 'Alicia Vikander', 'Rachel Weisz', 'Florence Clery', 'Jack Thompson', 'Thomas Unger', 'Jane Menelaus', 'Garry McDonald', 'Anthony Hayes', 'Benedict Hardie']","$20,000,000 (estimated)","$4,765,838","$25,975,621","$12,545,979","September 2, 2016","['United Kingdom', 'India', 'Australia', 'New Zealand', 'United States', 'Canada']","['Stanley, Tasmania, Australia']","['Heyday Films', 'Touchstone Pictures', 'LBO Productions (II)']","Awards, 2 wins & 19 nominations total","['Drama', 'Romance']",['English']
132. Dangal,2016,2h 41m,Not Rated,8.3,223K,,"Mahavir Singh Phogat, a former wrestler, decides to fulfill his dream of winning a gold medal for his country by training his daughters for the Commonwealth Games despite the existing social stigmas.",https://www.imdb.com/title/tt5074352/?ref_=sr_i_132,"['Piyush Gupta', 'Shreyas Jain', 'Nikhil Mehrotra']",['Nitesh Tiwari'],"['Aamir Khan', 'Sakshi Tanwar', 'Fatima Sana Shaikh', 'Sanya Malhotra', 'Aparshakti Khurana', 'Zaira Wasim', 'Suhani Bhatnagar', 'Ritvik Sahore', 'Girish Kulkarni', 'Ravi Aneja']","₹700,000,000 (estimated)","$3,248,481","$303,726,694","$12,391,761","December 21, 2016","['India', 'United States']","['Pune, Maharashtra, India']","['Aamir Khan Productions', 'UTV Motion Pictures', 'Walt Disney Pictures']","Awards, 41 wins & 38 nominations total","['Action', 'Biography', 'Drama', 'Sport']","['Hindi', 'English']"
133. Fifty Shades of Black,2016,1h 32m,R,3.5,24K,28.0,An inexperienced college student meets a wealthy businessman whose sexual practices put a strain on their relationship.,https://www.imdb.com/title/tt4667094/?ref_=sr_i_133,"['Marlon Wayans', 'Rick Alvarez']",['Michael Tiddes'],"['Marlon Wayans', 'Kali Hawk', 'Fred Willard', 'Mike Epps', 'Affion Crockett', 'Jane Seymour', 'Florence Henderson', 'Andrew Bachelor', 'Jenny Zigrino', 'Kate Miner']","$5,000,000 (estimated)","$5,900,528","$22,227,514","$11,686,940","January 29, 2016","['United States', 'United Kingdom']","['Los Angeles, California, USA']","['Fermion Films', 'IM Global', 'Ingenious Media']","Awards, 2 wins & 4 nominations total","['Parody', 'Slapstick', 'Comedy']",['English']
134. No Manches Frida,2016,1h 54m,PG-13,5.5,2.8K,,"Zequi, a recently released bank robber who goes to recover stolen money buried by his ditzy accomplice before going to jail.",https://www.imdb.com/title/tt5259966/?ref_=sr_i_134,"['Laurence Rosenthal', 'Claudio Herrera', 'Sergio Sánchez']",['Nacho G. Velilla'],"['Omar Chaparro', 'Martha Higareda', 'Mónica Dionne', 'Rocio Garcia', 'Regina Pavón', 'Mario Morán', 'Fernanda Castillo', 'Pamela Moreno', 'Adal Ramones', 'Carla Adell']",,"$3,676,235","$23,540,937","$11,528,613","September 2, 2016","['United States', 'Mexico', 'Germany']",,"['Pantelion Films', 'Alcon Entertainment', 'Constantin Film']","Awards, 1 win total","['Comedy', 'Romance']",['Spanish']
135. Café Society,2016,1h 36m,PG-13,6.6,83K,64.0,"In the 1930s, a Bronx native moves to Hollywood and falls in love with a young woman who is seeing a married man.",https://www.imdb.com/title/tt4513674/?ref_=sr_i_135,['Woody Allen'],['Woody Allen'],"['Jesse Eisenberg', 'Kristen Stewart', 'Steve Carell', 'Blake Lively', 'Sheryl Lee', 'Todd Weeks', 'Paul Schackman', 'Jodi Carlisle', 'Jeannie Berlin', 'Ken Stott']","$30,000,000 (estimated)","$359,289","$43,763,247","$11,103,205","August 5, 2016",['United States'],"['Pasadena, California, USA']","['Gravier Productions', 'Perdido Productions', 'FilmNation Entertainment']","Awards, 8 nominations total","['Period Drama', 'Romantic Comedy', 'Comedy', 'Drama', 'Romance']","['English', 'Hebrew']"
136. Pride and Prejudice and Zombies,2016,1h 48m,PG-13,5.8,62K,45.0,Five sisters in 19th century England must cope with the pressures to marry while protecting themselves from a growing population of zombies.,https://www.imdb.com/title/tt1374989/?ref_=sr_i_136,"['Burr Steers', 'Jane Austen', 'Seth Grahame-Smith']",['Burr Steers'],"['Lily James', 'Sam Riley', 'Jack Huston', 'Bella Heathcote', 'Ellie Bamber', 'Millie Brady', 'Suki Waterhouse', 'Douglas Booth', 'Sally Phillips', 'Charles Dance']","$28,000,000 (estimated)","$5,324,240","$16,457,494","$10,938,134","February 5, 2016","['United States', 'United Kingdom']","['Hatfield House, Hatfield, Hertfordshire, England, UK (Rosings Park)']","['Cross Creek Pictures', 'MadRiver Pictures', 'QC Entertainment']","Awards, 1 win & 3 nominations total","['Dark Comedy', 'Zombie Horror', 'Action', 'Comedy', 'Fantasy', 'Horror', 'Romance']","['English', 'Japanese', 'Chinese']"
137. The Darkness,2016,1h 32m,PG-13,4.5,17K,27.0,"A family unknowingly awakens an ancient supernatural entity on a Grand Canyon vacation, and must fight for survival when it follows them home.",https://www.imdb.com/title/tt1878841/?ref_=sr_i_137,"['Greg McLean', 'Shayne Armstrong', 'S.P. Krause']",['Greg McLean'],"['Kevin Bacon', 'Radha Mitchell', 'David Mazouz', 'Lucy Fry', 'Matt Walsh', 'Jennifer Morrison', 'Parker Mack', 'Paul Reiser', 'Ming-Na Wen', 'Trian Long Smith']","$4,000,000 (estimated)","$4,950,859","$10,898,293","$10,753,574","May 13, 2016",['United States'],"['Red Rock Canyon State Park - Highway 14, Cantil, California, USA (desert sequences)']","['Blumhouse Productions', 'Chapter One Films']",,"['Supernatural Horror', 'Horror', 'Thriller']",['English']
138. Nocturnal Animals,2016,1h 56m,R,7.4,327K,67.0,"A wealthy art gallery owner is haunted by her ex-husband's novel, a violent thriller she interprets as a symbolic revenge tale.",https://www.imdb.com/title/tt4550098/?ref_=sr_i_138,"['Tom Ford', 'Austin Wright']",['Tom Ford'],"['Amy Adams', 'Jake Gyllenhaal', 'Michael Shannon', 'Aaron Taylor-Johnson', 'Isla Fisher', 'Ellie Bamber', 'Armie Hammer', 'Karl Glusman', 'Robert Aramayo', 'Laura Linney']","$22,500,000 (estimated)","$492,648","$30,311,857","$10,663,357","December 9, 2016","['United States', 'China']","['The Trap Bar - 2822 E Avenue I, Lancaster, California, USA']","['Focus Features', 'Fade to Black Productions', 'Artina Films']","Nominated for 1 Oscar, 21 wins & 154 nominations total","['Psychological Thriller', 'Tragedy', 'Drama', 'Thriller']",['English']
139. Live by Night,2016,2h 9m,R,6.4,61K,49.0,"A group of Boston-bred gangsters set up shop in balmy Florida during the Prohibition era, facing off against the competition and the Ku Klux Klan.",https://www.imdb.com/title/tt2361317/?ref_=sr_i_139,"['Ben Affleck', 'Dennis Lehane']",['Ben Affleck'],"['Ben Affleck', 'Elle Fanning', 'Brendan Gleeson', 'Chris Messina', 'Remo Girone', 'Robert Glenister', 'Matthew Maher', 'Sienna Miller', 'Miguel', 'Zoe Saldaña']","$65,000,000 (estimated)","$33,336","$22,778,555","$10,378,555","January 13, 2017",['United States'],"['1331 Newcastle Street, Brunswick, Georgia, USA (street scenes)']","['Appian Way', 'Pearl Street Films', 'RatPac-Dune Entertainment']","Awards, 4 nominations total","['Dark Comedy', 'Gangster', 'Action', 'Crime', 'Drama', 'Thriller']","['English', 'Spanish']"
140. The Belko Experiment,2016,1h 29m,R,6.2,63K,44.0,"In a twisted social experiment, eighty Americans are locked in their high-rise corporate office in Bogotá, Colombia, and ordered by an unknown voice coming from the company's intercom system to participate in a deadly game of kill or be killed.",https://www.imdb.com/title/tt1082807/?ref_=sr_i_140,['James Gunn'],['Greg McLean'],"['John Gallagher Jr.', 'Tony Goldwyn', 'Adria Arjona', 'John C. McGinley', 'Melonie Diaz', 'Owain Yeoman', 'Sean Gunn', 'Brent Sexton', 'Josh Brener', 'David Dastmalchian']","$5,000,000 (estimated)","$4,137,230","$11,084,630","$10,166,820","March 17, 2017","['United States', 'Colombia']","['Bogotá, Colombia']","['Orion Pictures', 'Troll Court Entertainment', 'The Safran Company']",,"['Dark Comedy', 'Horror', 'Thriller']",['English']
141. The Perfect Match,2016,1h 36m,R,4.9,4.5K,41.0,"A playboy named Charlie, convinced that all his relationships are dead, meets the beautiful and mysterious Eva. Agreeing to a casual affair, Charlie then wants a bit more from their relationship.",https://www.imdb.com/title/tt4871980/?ref_=sr_i_141,"['Brandon Broussard', 'Gary Hardwick', 'Dana Verde']",['Bille Woodruff'],"['Terrence Jenkins', 'Cassie Ventura', 'Paula Patton', 'Kali Hawk', 'Donald Faison', 'Dascha Polanco', 'Robert Christopher Riley', 'Lauren London', 'Layla Jama', 'Casper Smart']","$5,000,000 (estimated)","$4,294,232","$10,414,738","$9,669,521","March 11, 2016",['United States'],"['Los Angeles, California, USA']","['Codeblack Films', 'Electric Republic', 'Flavor Unit Entertainment']",,"['Comedy', 'Romance']",['English']
142. Popstar: Never Stop Never Stopping,2016,1h 27m,R,6.7,71K,68.0,"When it becomes clear that his solo album is a failure, a former boy band member does everything in his power to maintain his celebrity status.",https://www.imdb.com/title/tt3960412/?ref_=sr_i_142,"['Andy Samberg', 'Akiva Schaffer', 'Jorma Taccone']","['Akiva Schaffer', 'Jorma Taccone']","['Andy Samberg', 'Jorma Taccone', 'Akiva Schaffer', 'Sarah Silverman', 'Tim Meadows', 'Maya Rudolph', 'Joan Cusack', 'Imogen Poots', 'Chris Redd', 'Edgar Blackmon']","$20,000,000 (estimated)","$4,698,715","$9,680,029","$9,639,125","June 3, 2016","['United States', 'China']",,"['Universal Pictures', 'Perfect World Pictures', 'Apatow Productions']","Awards, 1 win & 6 nominations total","['Mockumentary', 'Raunchy Comedy', 'Comedy', 'Drama', 'Music', 'Musical']",['English']
143. Rock Dog,2016,1h 30m,PG,6.0,6.2K,48.0,"When a radio falls from the sky into the hands of a wide-eyed Tibetan Mastiff, he leaves home to fulfill his dream of becoming a musician, setting into motion a series of completely unexpected events.",https://www.imdb.com/title/tt2822672/?ref_=sr_i_143,"['Ash Brannon', 'Kurt Voelker', 'Jun Zheng']",['Ash Brannon'],"['Luke Wilson', 'Eddie Izzard', 'J.K. Simmons', 'Lewis Black', 'Kenan Thompson', 'Mae Whitman', 'Jorge Garcia', 'Matt Dillon', 'Sam Elliott', 'Will Finn']","$60,000,000 (estimated)","$3,704,749","$23,270,926","$9,420,546","February 24, 2017","['China', 'United States', 'United Kingdom']","['Los Angeles, California, USA (Reel FX Santa Monica)']","['Huayi Brothers Media', 'Summit Premiere', 'Tencent Pictures']","Awards, 1 win & 3 nominations total","['Computer Animation', 'Adventure', 'Animation', 'Comedy', 'Family', 'Music']","['Chinese', 'English']"
144. Meet the Blacks,2016,1h 34m,R,4.8,38K,26.0,"As Carl Black gets the opportunity to move his family out of Chicago in hope of a better life, their arrival in Beverly Hills is timed with that city's annual purge, where all crime is legal for twelve hours.",https://www.imdb.com/title/tt4191580/?ref_=sr_i_144,"['Deon Taylor', 'Nicole DeMasi']",['Deon Taylor'],"['Mike Epps', 'Zulay Henao', 'Alex Henderson', 'Bresha Webb', 'Gary Owen', 'Lil Duval', 'Paul Mooney', 'Charlie Murphy', 'Phil Austin', 'Andrew Bachelor']","$900,000 (estimated)","$4,055,940","$9,097,072","$9,097,072","April 1, 2016",['United States'],"['El Dorado County, California, USA']","['Hidden Empire Film Group (HEFG)', 'McIntosh Films']",,"['Parody', 'Comedy', 'Horror']",['English']
145. Queen of Katwe,2016,2h 4m,PG,7.4,19K,73.0,"Living in the slum of Katwe in Kampala, Uganda, is a constant struggle for 10-year-old Phiona and her family. Her world changes one day when she meets Robert Katende, a missionary who teaches children how to play chess.",https://www.imdb.com/title/tt4341582/?ref_=sr_i_145,"['William Wheeler', 'Tim Crothers']",['Mira Nair'],"['Madina Nalwanga', 'David Oyelowo', ""Lupita Nyong'o"", 'Martin Kabanza', 'Taryn Kyaze', 'Ivan Jacobo', 'Nicolas Levesque', 'Ronald Ssemaganda', 'Ethan Nazario Lubega', 'Nikita Waligwa']","$15,000,000 (estimated)","$304,933","$10,368,126","$8,874,389","September 30, 2016",['United States'],"['Kampala, Uganda (Slums of Katwe)']","['ESPN Films', 'Walt Disney Pictures']","Awards, 4 wins & 30 nominations total","['Biography', 'Drama', 'Sport']",['English']
146. Ratchet & Clank,2016,1h 34m,PG,5.5,12K,29.0,"When the galaxy comes under the threat of a nefarious space captain, a mechanic and his newfound robot ally join an elite squad of combatants to save the universe.",https://www.imdb.com/title/tt2865120/?ref_=sr_i_146,"['T.J. Fixman', 'Kevin Munroe', 'Gerry Swallow']","['Kevin Munroe', 'Jericca Cleland']","['James Arnold Taylor', 'David Kaye', 'Jim Ward', 'Sylvester Stallone', 'Paul Giamatti', 'John Goodman', 'Bella Thorne', 'Rosario Dawson', 'Armin Shimerman', 'Vincent Tong']","$20,000,000 (estimated)","$4,869,278","$13,385,737","$8,821,329","April 29, 2016","['Hong Kong', 'Canada', 'United States', 'China']","['Vancouver, British Columbia, Canada']","['Gramercy Pictures (I)', 'Screen Gems', 'Film Financial Services']","Awards, 1 win & 6 nominations total","['Buddy Comedy', 'Computer Animation', 'Action', 'Adventure', 'Animation', 'Comedy', 'Family', 'Fantasy', 'Sci-Fi']",['English']
147. The Lost City of Z,2016,2h 21m,PG-13,6.6,102K,78.0,"A true-life drama, centering on British explorer Major Percival Fawcett, who disappeared whilst searching for a mysterious city in the Amazon in the 1920s.",https://www.imdb.com/title/tt1212428/?ref_=sr_i_147,"['James Gray', 'David Grann']",['James Gray'],"['Charlie Hunnam', 'Robert Pattinson', 'Sienna Miller', 'Tom Holland', 'Edward Ashley', 'Angus Macfadyen', 'Ian McDiarmid', 'Clive Francis', 'Pedro Coello', 'Matthew Sunderland']","$30,000,000 (estimated)","$110,175","$19,263,938","$8,580,410","April 21, 2017",['United States'],['Colombia'],"['Keep Your Head', 'MICA Entertainment', 'MadRiver Pictures']","Awards, 5 wins & 31 nominations total","['Adventure Epic', 'Docudrama', 'Epic', 'Jungle Adventure', 'Period Drama', 'Adventure', 'Biography', 'Drama', 'History']","['English', 'Portuguese', 'Tupi', 'Spanish', 'German']"
