Title,Year,Duration,MPA,Rating,Votes,méta_score,description,Movie Link,writers,directors,stars,budget,opening_weekend_Gross,grossWorldWWide,gross_US_Canada,release_date,countries_origin,filming_locations,production_company,awards_content,genres,Languages
283. The Ringer,1952,1h 18m,,6.4,357,,A criminal master of disguise nicknamed The Ringer is out for deadly revenge against a treacherous London lawyer who is under police protection.,https://www.imdb.com/title/tt0045092/?ref_=sr_i_283,"['Lesley Storm', 'Val Valentine', 'Edgar Wallace']",['Guy Hamilton'],"['Herbert Lom', 'Donald Wolfit', 'Mai Zetterling', 'Greta Gynt', 'William Hartnell', 'Norman Wooland', 'Denholm Elliott', 'Dora Bryan', 'Charles Victor', 'Walter Fitzgerald']",,,,,"November 24, 1952",['United Kingdom'],"['Shepperton Studios, Shepperton, Surrey, England, UK (Studio)']",['London Film Productions'],,"['Comedy', 'Crime', 'Drama', 'Mystery', 'Thriller']",['English']
284. Without Warning!,1952,1h 17m,Approved,6.6,619,,"Quiet, unobtrusive LA citizen Carl Martin picks up look-alikes for his estranged blonde wife and murders them with garden shears.",https://www.imdb.com/title/tt0045334/?ref_=sr_i_284,['William Raynor'],['Arnold Laven'],"['Adam Williams', 'Meg Randall', 'Edward Binns', 'Harlan Warde', 'John Maxwell', 'Angela Stevens', 'Byron Kane', 'Charles Tannen', 'Marilee Phelps', 'Robert Foulk']",,,,,"May 8, 1952",['United States'],"[""Chavez Ravine, Elysian Park, Los Angeles, California, USA (As Carl's hilltop home., overlooking the freeway and Los Angeles skyline.)""]",['Allart Productions'],,"['Film Noir', 'Crime', 'Drama', 'Thriller']",['English']
285. Hong Kong,1952,1h 34m,Approved,5.3,266,,The theft of a jeweled treasure is within an adventurer's grasp when he is restrained by his love for a good woman. Now he must help her and the kid he was hired to rob escape as the Chinese Civil War nears Hong Kong.,https://www.imdb.com/title/tt0043654/?ref_=sr_i_285,"['Winston Miller', 'Lewis R. Foster']",['Lewis R. Foster'],"['Ronald Reagan', 'Rhonda Fleming', 'Nigel Bruce', 'Marvin Miller', 'Mary Somerville', 'Lowell Gilmore', 'Claud Allister', 'Danny Chang', 'Paul Bradley', 'Spencer Chan']",,,,,"April 18, 1952",['United States'],['Hong Kong (location shooting)'],['Pine-Thomas Productions'],,"['Adventure', 'Comedy', 'Drama', 'Thriller', 'War']",['English']
286. When in Rome,1952,1h 18m,Approved,6.6,340,,An American fugitive flees to Rome and tries to elude capture by masquerading as a priest.,https://www.imdb.com/title/tt0045324/?ref_=sr_i_286,"['Dorothy Kingsley', 'Charles Schnee', 'Robert Buckner']",['Clarence Brown'],"['Van Johnson', 'Paul Douglas', 'Joseph Calleia', 'Carlo Rizzo', 'Tudor Owen', 'Dino Nardi', 'Aldo Silvani', 'Mario Siletti', 'Argentina Brunetti', 'Mimi Aguglia']","$1,313,000 (estimated)",,,,"July 10, 1952",['United States'],"['Rome, Lazio, Italy']",['Metro-Goldwyn-Mayer (MGM)'],,"['Buddy Comedy', 'Comedy', 'Crime', 'Drama']",['English']
287. Return of the Texan,1952,1h 28m,Approved,6.7,201,,"During the 1950s, after many years in Kansas City, widower Sam Crockett, his 2 children and his grandpa return to their abandoned family farm in Texas and face many difficulties.",https://www.imdb.com/title/tt0045083/?ref_=sr_i_287,"['Fred Gipson', 'Dudley Nichols']",['Delmer Daves'],"['Dale Robertson', 'Joanne Dru', 'Walter Brennan', 'Richard Boone', 'Tom Tully', 'Robert Horton', 'Helen Westcott', 'Lonnie Thomas', 'Dennis Ross', 'Robert Adler']",,,,,"June 16, 1952",['United States'],"['Springerville, Arizona, USA (as Texas, USA)']",['Twentieth Century Fox'],,"['Drama', 'Western']",['English']
288. Murder on Monday,1952,1h 25m,,6.8,863,,"David Preston, a banker, has a 24-hour memory lapse. Accused of robbery and murder, he can't account for his lost time. With no alibi, police press him to explain the missing hours, jeopardizing his freedom.",https://www.imdb.com/title/tt0044718/?ref_=sr_i_288,"['Anatole de Grunwald', 'R.C. Sherriff']",['Ralph Richardson'],"['Ralph Richardson', 'Margaret Leighton', 'Jack Hawkins', 'Campbell Singer', 'Michael Shepley', 'Margaret Withers', 'Frederick Piper', 'Meriel Forbes', 'Gerald Case', 'Diana Beaumont']",,,,,"October 7, 1953",['United Kingdom'],"['Shepperton Studios, Shepperton, Surrey, England, UK (Studio)']","['London Film Productions', 'British Lion Film Corporation', 'Maurice Cowan Productions']",,"['Crime', 'Drama', 'Mystery']",['English']
289. Flottare med färg,1952,1h 22m,,3.7,33,,"The three brothers Nils, Lars and Ivar are members of a log-floater team. Ivar feels that he does not really belong there, he prefers thief hunting and flirting with women.",https://www.imdb.com/title/tt0044623/?ref_=sr_i_289,['Lennart Palme'],['Ragnar Frisk'],"['Peter Lindgren', 'Artur Rolén', 'Dagmar Ebbesen', 'Willy Tappert Jr.', 'Erna Groth', 'Ulla Smidje', 'Topsy Håkansson', 'Ragnar Lundkvist', 'Wiktor Andersson', 'Josua Bengtson']",,,,,"December 26, 1952",['Sweden'],,['Svensk Talfilm'],,['Drama'],['Swedish']
290. The Pathfinder,1952,1h 18m,Approved,5.5,256,,"Follows a white man raised by Mohicans who joins British forces to avenge his people against Mingo and French enemies. He infiltrates a French fort to retrieve secret plans, navigating battles and personal vendettas.",https://www.imdb.com/title/tt0045013/?ref_=sr_i_290,"['Robert E. Kent', 'James Fenimore Cooper']",['Sidney Salkow'],"['George Montgomery', 'Helena Carter', 'Jay Silverheels', 'Walter Kingsford', 'Rodd Redwing', 'Stephen Bekassy', 'Elena Verdugo', 'Bruce Lester', 'Chief Yowlachie', 'Lyle Talbot']",,,,,"December 9, 1952",['United States'],"['Walker Ranch - 19152 Placerita Canyon Road, Newhall, California, USA (exterior location)']",['Sam Katzman Productions'],,"['Adventure', 'Drama', 'War', 'Western']",['English']
291. The Devil Makes Three,1952,1h 36m,Approved,6.2,595,,"In 1947, an American pilot returns to Germany to find a family that saved his life during WW2 but he stumbles upon a secret Neo-Nazi group.",https://www.imdb.com/title/tt0044547/?ref_=sr_i_291,"['Lawrence P. Bachmann', 'Jerry Davis']",['Andrew Marton'],"['Gene Kelly', 'Pier Angeli', 'Richard Rober', 'Richard Egan', 'Claus Clausen', 'Wilfried Seyferth', 'Margot Hielscher', 'Annie Rosar', 'Harold Benedict', 'Otto Gebühr']","$1,005,000 (estimated)",,,,"September 19, 1952",['United States'],"['Berchtesgaden, Bavaria, Germany']",['Metro-Goldwyn-Mayer (MGM)'],,"['Crime', 'Romance', 'Thriller']","['English', 'German']"
292. Por ellas aunque mal paguen,1952,1h 42m,TV-14,7.1,59,,"Mr. Anastacio, an aristocrat who is going through a bad patch, marries his daughter Isabel to a wealthy rancher. Isabel and her family refuse to work, so Jose Manuel takes them to the ranch, where they are forced to work to be able to eat.",https://www.imdb.com/title/tt0045043/?ref_=sr_i_292,"['Juan Bustillo Oro', 'Augusto Martínez Olmedilla']",['Juan Bustillo Oro'],"['Fernando Soler', 'Pedro Infante', 'Ángel Infante', 'Silvia Pinal', 'Irma Dorantes', 'Alfonso Bedoya', 'Tito Gómez', 'Fanny Schiller', 'Miguel Ángel López', 'Nicolás Rodríguez']",,,,,"August 15, 1952",['Mexico'],['Mexico'],['Cinematográfica Grovas'],,"['Comedy', 'Drama', 'Music']",['Spanish']
293. The Assassin,1952,1h 30m,Approved,6.3,575,,"Travelling to Venice to locate an ex-partisan on behalf of a French insurance company, a British private detective gets mixed-up in a political assassination conspiracy.",https://www.imdb.com/title/tt0044378/?ref_=sr_i_293,['Victor Canning'],['Ralph Thomas'],"['Richard Todd', 'Eva Bartok', 'John Gregson', 'George Coulouris', 'Margot Grahame', 'Walter Rilla', 'John Bailey', 'Sidney James', 'Martin Boddey', 'Michael Balfour']",,,,,"April 22, 1953",['United Kingdom'],"['Venice, Veneto, Italy']",['British Film-Makers'],,"['Crime', 'Mystery', 'Thriller']","['English', 'Italian']"
294. Brave Warrior,1952,1h 13m,Approved,4.9,202,,"In Indiana of the early 1800s, conflict once again arises between the United States and Great Britain over territory and boundaries. Each side endeavors to gain the support of the Shawnee Indian tribes in the area. Governor William Henry Harrison enlists the aid of Steve Ruddell, whose friendship with the Shawnee chief Tecumseh goes back to childhood. Tecumseh's leadership of the Shawnee is contested by his brother, known as The Prophet, who sides with the British. Tecumseh, who grew up as a childhood playmate of Steve and of Laura McGregor, loves Steve as a brother and hopes to marry Laura. But Laura is in love with Steve. Laura's father, Shayne McGregor, secretly leads local support of the British against the Americans, even though it risks the life and love of his daughter. Everything comes to a head at the battle of Tippecanoe.",https://www.imdb.com/title/tt0044444/?ref_=sr_i_294,['Robert E. Kent'],['Spencer Gordon Bennet'],"['Jon Hall', 'Christine Larson', 'Jay Silverheels', 'Michael Ansara', 'Harry Cording', 'James Seay', 'George Eldredge', 'Leslie Denison', 'Rory Mallinson', 'Rusty Wescoatt']",,,,,"June 1, 1952",['United States'],"['Agoura Ranch, Agoura, California, USA (MacGregor house)']",['Sam Katzman Productions'],,['Western'],['English']
295. El derecho de nacer,1952,1h 30m,,6.8,77,,"In Santiago de Cuba in the early 1950s, history begins. A young woman of high society becomes pregnant with a false love, her father orders his black maid (Dolores) to kill the baby (Alberto), but she flees to Havana where Alberto becomes a renowned doctor.",https://www.imdb.com/title/tt0043460/?ref_=sr_i_295,"['Félix B. Caignet', 'Ramón Pérez Peláez', 'Jesús Galindo']",['Zacarías Gómez Urquiza'],"['Gloria Marín', 'Jorge Mistral', 'Martha Roth', 'José Baviera', 'José María Linares-Rivas', 'Bárbara Gil', 'Matilde Palou', 'Queta Lavat', 'Tito Novaro', 'Salvador Quiroz']",,,,,"June 27, 1952",['Mexico'],"['Havana, Cuba (exterior scenes)']",['Producciones Galindo Hermanos'],,['Drama'],['Spanish']
296. Three Girls from Rome,1952,1h 25m,Approved,6.7,301,,"Three beautiful seamstresses from one of the fashionable dress salons near the Piazza de Spagna in Rome gather on the steps of the square to eat lunch and talk of their love lives. Marisa, the oldest in a large family, is engaged to a truck driver; Elena lives with her widowed mother and is in love with an opportunist, Alberto, who is also romancing the boss's daughter; Lucia lives on the outskirts of Rome, where a small-in-stature jockey worships her but, she, however has eyes for only tall men, and keeps many of those on a string.",https://www.imdb.com/title/tt0045066/?ref_=sr_i_296,"['Sergio Amidei', 'Fausto Tozzi', 'Karin Valde']",['Luciano Emmer'],"['Lucia Bosè', 'Cosetta Greco', 'Marcello Mastroianni', 'Ave Ninchi', 'Leda Gloria', 'Liliana Bonfatti', 'Renato Salvatori', 'Annamaria Bugliari', 'Giorgio Bassani', 'Franco Brunoni']",,,,,August 1953,['Italy'],"['Rome, Lazio, Italy']",['Cine Produzione Astoria'],,"['Comedy', 'Drama', 'Romance']",['Italian']
"297. Stop, You're Killing Me",1952,1h 26m,Approved,6.1,356,,"After the repeal of Prohibition, a beer-maker decides to sell beer legally, but no one wants to buy his revolting beer, and he does not want to force sales.",https://www.imdb.com/title/tt0045193/?ref_=sr_i_297,"[""James O'Hanlon"", 'Damon Runyon', 'Howard Lindsay']",['Roy Del Ruth'],"['Broderick Crawford', 'Claire Trevor', 'Virginia Gibson', 'Bill Hayes', 'Charles Cantor', 'Sheldon Leonard', 'Howard St. John', 'Harry Morgan', 'Margaret Dumont', 'Stephen Chase']",,,,,"June 17, 1953",['United States'],"['Warner Brothers Burbank Studios - 4000 Warner Boulevard, Burbank, California, USA (Studio)']",['Warner Bros.'],,"['Comedy', 'Musical']",['English']
298. No Room for the Groom,1952,1h 22m,Approved,6.0,563,,"Alvah, a young GI who happens to own a vineyard, elopes to Las Vegas with Lee, his housekeeper's daughter. But Alvah's chicken pox postpone the wedding night. The rest revolves around more delays to the consummation, caused by Lee's manipulative Mama and the flock of mostly obnoxious relatives with whom she's filled the house.",https://www.imdb.com/title/tt0044970/?ref_=sr_i_298,"['Joseph Hoffman', 'Darwin L. Teilhet']",['Douglas Sirk'],"['Tony Curtis', 'Piper Laurie', 'Don DeFore', 'Spring Byington', 'Lillian Bronson', 'Paul McVey', 'Stephen Chase', 'Lee Aaker', 'Jack Kelly', 'Frank Sully']",,,,,"June 13, 1952",['United States'],"['Universal Studios - 100 Universal City Plaza, Universal City, California, USA (Studio)']",['Universal International Pictures (UI)'],,['Comedy'],['English']
299. The Four Poster,1952,1h 43m,Approved,6.5,247,,"Adapted from the prize-winning Broadway play that featured two people and a four-poster bed, in which the couple enacts their marriage, from 1897, until he dies some time after she has died from cancer. It is a love that endured wars, another woman and the death of their favorite son.",https://www.imdb.com/title/tt0044631/?ref_=sr_i_299,"['Jan de Hartog', 'Allan Scott']","['Irving Reis', 'John Hubley']","['Rex Harrison', 'Lilli Palmer']",,,,,"October 8, 1952",['United States'],,['Stanley Kramer Productions'],"Nominated for 1 Oscar, 1 win & 3 nominations total","['Comedy', 'Drama', 'Romance', 'War']",['English']
300. Holiday Week,1952,1h 22m,Approved,6.2,222,,A cotton mill worker in Lancashire falls for her boss's son while on a Wakes Week holiday in Blackpool but enlists the aid of her girlfriend to keep it a secret to hide it from her interfering parents.,https://www.imdb.com/title/tt0044708/?ref_=sr_i_300,"['John Baines', 'Stanley Houghton']",['Arthur Crabtree'],"['Leslie Dwyer', 'Lisa Daniely', 'Brian Worth', 'Sandra Dorne', 'Ronald Adam', 'Joan Hickson', 'Michael Medwin', 'Mary Clare', 'Bill Travers', 'Beatrice Varley']",,,,,"November 10, 1952",['United Kingdom'],"['Great Orme Tramway, Victoria Station, Church Walks, Llandudno, Conwy, Wales, UK (Jenny and Alan spend a week in Llandudno)']","['Monarch Productions Limited', 'William Gell Productions']",,"['Drama', 'Romance']",['English']
301. Totò e le donne,1952,1h 43m,,6.5,399,,"Scaparro, who works in a fabric store, must deal with irritating clients, and when he comes home he finds an unsatisfied, intrusive wife.",https://www.imdb.com/title/tt0045248/?ref_=sr_i_301,"['Agenore Incrocci', 'Furio Scarpelli', 'Steno']","['Steno', 'Mario Monicelli']","['Totò', 'Lea Padovani', 'Franca Faldini', 'Ave Ninchi', 'Giovanna Pala', 'Clelia Matania', 'Alda Mangini', 'Primarosa Battistella', 'Teresa Pellati', 'Mario Castellani']",,,,,"December 7, 1954",['Italy'],"['Ponti-De Laurentiis Studios, Rome, Lazio, Italy (Studio)']",['Rosa Film'],,['Comedy'],['Italian']
302. Francis Goes to West Point,1952,1h 21m,Approved,6.3,510,,Francis the talking mule gets his owner in and out of trouble while he is taking basic training at West Point.,https://www.imdb.com/title/tt0044633/?ref_=sr_i_302,"['Oscar Brodney', 'Dorothy Davenport', 'David Stern']",['Arthur Lubin'],"[""Donald O'Connor"", 'Lori Nelson', 'Alice Kelley', 'Gregg Palmer', 'William Reynolds', 'Les Tremayne', 'Otto Hulett', 'David Janssen', 'James Best', 'Molly']",,,,,July 1952,['United States'],"['Universal Studios - 100 Universal City Plaza, Universal City, California, USA (Studio)']",['Universal International Pictures (UI)'],,"['Comedy', 'Family', 'Fantasy']",['English']
303. Thief of Damascus,1952,1h 18m,Approved,5.3,206,,A young man gathers a group of friends and adventurers to help battle an evil sultan.,https://www.imdb.com/title/tt0045229/?ref_=sr_i_303,['Robert E. Kent'],['Will Jason'],"['Paul Henreid', 'John Sutton', 'Jeff Donnell', 'Lon Chaney Jr.', 'Elena Verdugo', 'Helen Gilbert', 'Robert Clary', 'Edward Colmans', 'Nelson Leigh', 'Philip Van Zandt']",,,,,April 1952,['United States'],"['Vasquez Rocks Natural Area Park - 10700 W. Escondido Canyon Rd., Agua Dulce, California, USA']",['Sam Katzman Productions'],,"['Adventure', 'Fantasy', 'Romance']",['English']
304. Ena votsalo sti limni...,1952,1h 42m,,7.7,464,,A nice comedy about a miserly man who cheats on his wife one night. A series of misunderstandings make him change his life forever.,https://www.imdb.com/title/tt0140019/?ref_=sr_i_304,"['Hristos Giannakopoulos', 'Alekos Sakellarios']",['Alekos Sakellarios'],"['Vasilis Logothetidis', 'Ilia Livykou', 'Mary Lalopoulou', 'Vangelis Protopappas', 'Kaiti Lambropoulou', 'Stefanos Stratigos', 'Dina Stathatou', 'Anna Roussou', 'Mihalis Papadakis', 'Bebi Moraitopoulou']",,,,,"December 30, 1952","['Greece', 'Egypt']","['Studio Nassibian, Cairo, Egypt']","['Millas Film', 'Nahas Films']",,['Comedy'],['Greek']
305. The Treasure of Lost Canyon,1952,1h 22m,Approved,6.2,248,,"In California, a boy and his adoptive father find an outlaw's hidden treasure but the news leaks out, sending unscrupulous characters after the gold.",https://www.imdb.com/title/tt0044144/?ref_=sr_i_305,"['Brainerd Duffield', 'Emerson Crocker', 'Robert Louis Stevenson']",['Ted Tetzlaff'],"['William Powell', 'Julie Adams', 'Charles Drake', 'Rosemary DeCamp', 'Tommy Ivo', 'Henry Hull', 'Chubby Johnson', 'John Doucette', 'Marvin Press', 'Griff Barnett']",,,,,"March 1, 1952",['United States'],"['Universal Studios - 100 Universal City Plaza, Universal City, California, USA (Studio)']",['Universal International Pictures (UI)'],,"['Adventure', 'Drama', 'Western']",['English']
306. My Six Convicts,1952,1h 44m,Approved,6.6,421,,"A psychologist pioneers a research study at a prison. He seeks the help of six savvy inmates including a safe-cracker, a mobster, a pair of armed robbers and psychopath. Could he trust them? What's in it for them?",https://www.imdb.com/title/tt0044940/?ref_=sr_i_306,"['Michael Blankfort', 'Donald Powell Wilson']",['Hugo Fregonese'],"['Millard Mitchell', 'Gilbert Roland', 'John Beal', 'Marshall Thompson', 'Alf Kjellin', 'Harry Morgan', 'Jay Adler', 'Regis Toomey', 'Fay Roope', 'Carleton Young']",,,,,"March 20, 1952",['United States'],"['San Quentin State Prison, San Quentin, California, USA']",['Stanley Kramer Productions'],"Awards, 5 wins & 1 nomination total","['Comedy', 'Drama']","['English', 'Italian', 'Latin']"
307. Burlesque in Hawaii,1952,,,5.0,12,,,https://www.imdb.com/title/tt0193788/?ref_=sr_i_307,"['Hermie Rose', 'Harry Vine']",['Harry Vine'],"['Hermie Rose', 'Harry Vine', 'Grace Hathaway', 'Jeanne Starr', 'Robin Savoy', 'Susan Marshall', 'Diane Walker', 'Margery Ehrhardt', 'Val de Val', 'Joseph Y. Kim']",,,,,,['United States'],"[""Waikiki Beach, Honolulu, O'ahu, Hawaii, USA""]",['Pacific Pictures (II)'],,"['Comedy', 'Music', 'Musical']",['English']
308. Captive Women,1952,1h 4m,Approved,5.0,163,,"In a post-apocalyptic New York City, three tribes of mutants (the Norms, the Mutates and the Upriver people) battle each other to survive.",https://www.imdb.com/title/tt0044477/?ref_=sr_i_308,"['Jack Pollexfen', 'Aubrey Wisberg']",['Stuart Gilmore'],"['Robert Clarke', 'Margaret Field', 'Gloria Saunders', 'Ron Randell', 'Stuart Randall', 'Paula Dorety', 'Robert Bice', 'Chili Williams', 'William Schallert', 'Eric Colmar']","$85,000 (estimated)",,,,"October 10, 1952",['United States'],,"['Albert Zugsmith Productions', 'American Pictures']",,['Sci-Fi'],['English']
309. Caribbean,1952,1h 31m,Approved,5.8,245,,"Francis Barclay, a former member of the British Admiralty, who was captured in the early 1700s and sold into slavery by Andrew MacAllister, and forced into piracy, enlists the aid of Dick Lindsay, to help him invade MacAllister's fortified island. The latter falls in love with MacAllister's daughter Christine. Complications arise as the man thought to be a nephew of one man may not be, and the daughter of one man may be the other man's daughter.",https://www.imdb.com/title/tt0044481/?ref_=sr_i_309,"['Ellery H. Clark', 'Frank L. Moss', 'Edward Ludwig']",['Edward Ludwig'],"['John Payne', 'Arlene Dahl', 'Cedric Hardwicke', 'Francis L. Sullivan', 'Willard Parker', 'Dennis Hoey', 'Clarence Muse', 'William Pullen', 'Walter Reed', 'Ramsay Hill']",,,,,September 1952,['United States'],"['Paramount Studios - 5555 Melrose Avenue, Hollywood, Los Angeles, California, USA (Studio)']",['Pine-Thomas Productions'],,"['Action', 'Adventure', 'Romance']",['English']
310. Just This Once,1952,1h 30m,Approved,6.3,482,,"Mark MacLene owes the IRS, the banks, and others a lot of money. The problem is that his trust makes $1,000,000 a year, but he spends $150,000 every month. His trustee Sam uses the power of attorney and the spendthrift clause to hire frugal Lucille Duncan to manage Mark's finances. Presented with thousands of dollars for gifts and charges from the previous night, she immediately cancels his charge accounts and returns as many gifts as she can. Then she puts Mark on a allowance of $50 a week, which upsets him even more. To get rid of Lucy, Mark moves in with her and makes sure that her boyfriend Tom receives a huge raise, thinking that Tom will marry Lucy and free him from her tight control.",https://www.imdb.com/title/tt0044781/?ref_=sr_i_310,"['Sidney Sheldon', 'Max Trell']",['Don Weis'],"['Janet Leigh', 'Peter Lawford', 'Lewis Stone', 'Marilyn Erskine', 'Richard Anderson', 'Douglas Fowley', 'Hanley Stafford', 'Henry Slate', 'Jerry Hausner', 'Benny Rubin']","$547,000 (estimated)",,,,"May 30, 1952",['United States'],"['Metro-Goldwyn-Mayer Studios - 10202 W. Washington Blvd., Culver City, California, USA (Studio)']",['Metro-Goldwyn-Mayer (MGM)'],"Awards, 1 win total","['Satire', 'Comedy']","['English', 'German']"
311. Chhatrapati Shivaji,1952,2h 50m,,9.2,96,,"This film chronicles key events in the life of Chhatrapati Shivaji Maharaj, founder of the Maratha Empire from his birth to his Coronation as ""Chhatrapati""",https://www.imdb.com/title/tt0252316/?ref_=sr_i_311,['Bhalji Pendharkar'],['Bhalji Pendharkar'],"['Parshwanath Yeshwant Altekar', 'Chandrakant', 'Gajanan Jagirdar', 'Prithviraj Kapoor', 'Sulochana Latkar', 'Lata Mangeshkar', 'Lalita Pawar', 'Master Vithal']",,,,,1952,['India'],,,,"['Drama', 'History']","['Hindi', 'Marathi']"
312. A Woman Without Love,1952,1h 25m,Not Rated,6.4,914,,"After indulging in an affair with a man (a friend of the family) she truly loves, a woman returns to her young son and husband for good, and loses contact with the man. Her husband is unaware of the affair. Twenty years later, there is news that the friend has died and left all of his money to the younger son in the family, which leads us to question this younger son's biological origin...",https://www.imdb.com/title/tt0043824/?ref_=sr_i_312,"['Guy de Maupassant', 'Jaime Salvador', 'Rodolfo Usigli']",['Luis Buñuel'],"['Rosario Granados', 'Julio Villarreal', 'Tito Junco', 'Joaquín Cordero', 'Xavier Loyá', 'Elda Peralta', 'Jaime Calpe', 'Eva Calvo', 'Miguel Manzano', 'Ricardo Adalid']",,,"$2,163",,"July 31, 1952",['Mexico'],"['Bosque de Chapultepec, Mexico City, Distrito Federal, Mexico (exterior scenes)']",['Internacional Cinematográfica'],,['Drama'],['Spanish']
313. Down Among the Sheltering Palms,1952,1h 27m,Approved,5.5,168,,War-weary Captain Willoby and his men are the occupation force on an island of lovely women...and are forbidden to fraternize.,https://www.imdb.com/title/tt0045702/?ref_=sr_i_313,"['Edward Hope', 'Claude Binyon', 'Albert E. Lewin']",['Edmund Goulding'],"['William Lundigan', 'Jane Greer', 'Mitzi Gaynor', 'David Wayne', 'Gloria DeHaven', 'Gene Lockhart', 'Jack Paar', 'Alvin Greenman', 'Billy Gilbert', 'Henry Kulky']",,,,,"March 1, 1953",['United States'],"['20th Century Fox Studios - 10201 Pico Blvd., Century City, Los Angeles, California, USA (Studio)']",['Twentieth Century Fox'],,"['Comedy', 'Musical', 'Romance']",['English']
314. Violetas imperiales,1952,1h 34m,,5.3,120,,"Violeta, an Andalusian gypsy, foretells a lady she will become empress. The lady is Eugenia de Montijo, and when she marries emperor Luis Napoleón of France she takes the young girl with her. The empress'cousin readily makes her his focus of attention, then she discovers a criminal attempt against the empress. Musical color version of a story previously played by Raquel Meller.",https://www.imdb.com/title/tt0045295/?ref_=sr_i_314,"['Henry Roussel', 'Marc-Gilbert Sauvajon', 'Jesús María de Arozamena']",['Richard Pottier'],"['Luis Mariano', 'Carmen Sevilla', 'Simone Valère', 'Marie Sabouret', 'Colette Régis', 'Louis Arbessier', 'Micheline Francey', 'María Riquelme', 'Véra Norman', 'Raymond Girard']",,,,,"December 12, 1952","['Spain', 'France']","['Franstudio, Saint-Maurice, Val-de-Marne, France']","['Les Films Modernes (I)', 'Producciones Benito Perojo', 'Productions Emile Natan']",,"['Comedy', 'Drama', 'Musical']",['French']
315. Navajo,1952,1h 10m,Approved,5.9,179,,A young Navajo Indian boy is caught up in the conflict of cultures when he rejects the white man's school. Told in semi-documentary style.,https://www.imdb.com/title/tt0044955/?ref_=sr_i_315,['Norman Foster'],['Norman Foster'],"['Francis Kee Teller', 'John Mitchell', 'Mrs. Kee Teller', 'Billy Draper', 'Hall Bartlett', 'Virgil Miller', 'Cozy McSparron', 'Sammy Ogg', 'Eloise Teller', 'Linda Teller']",,,,,"February 12, 1952",['United States'],"['Arizona, USA']",['Bartlett-Foster Productions'],"Nominated for 2 Oscars, 1 win & 2 nominations total",['Drama'],['English']
316. Folly to Be Wise,1952,1h 31m,Approved,6.1,374,,Newly arrived Army chaplin Captain Paris (Alastair Sim) attempts to book various acts for the entertainment of a troop of soldiers.,https://www.imdb.com/title/tt0044626/?ref_=sr_i_316,"['James Bridie', 'Frank Launder', 'John Dighton']",['Frank Launder'],"['Alastair Sim', 'Elizabeth Allan', 'Roland Culver', 'Colin Gordon', 'Martita Hunt', 'Janet Brown', 'Peter Martyn', 'Miles Malleson', 'Edward Chapman', 'Cyril Chamberlain']",,,,,"December 6, 1953",['United Kingdom'],"['Shepperton Studios, Shepperton, Surrey, England, UK (Studio)']","['London Film Productions', 'British Lion Film Corporation']","Nominated for 1 BAFTA Award, 1 nomination total","['Comedy', 'Drama']",['English']
