Title,Year,Duration,MPA,Rating,Votes,méta_score,description,Movie Link,writers,directors,stars,budget,opening_weekend_Gross,grossWorldWWide,gross_US_Canada,release_date,countries_origin,filming_locations,production_company,awards_content,genres,Languages
140. Youth of the Beast,1963,1h 32m,Not Rated,7.3,4.1K,,A violent thug plays opposing yakuza bosses against each other.,https://www.imdb.com/title/tt0057697/?ref_=sr_i_140,"['Ichirô Ikeda', 'Tadaaki Yamazaki', 'Haruhiko Ôyabu']",['Seijun Suzuki'],"['Jô Shishido', 'Misako Watanabe', 'Tamio Kawaji', 'Minako Katsuki', 'Daisaburô Hirata', 'Eiji Gô', 'Kôichi Uenoyama', 'Akiji Kobayashi', 'Yûzô Kiura', 'Naomi Hoshi']",,,,,"April 21, 1963",['Japan'],,['Nikkatsu'],,"['Action', 'Crime', 'Mystery']",['Japanese']
141. Doctor of Doom,1963,1h 17m,,4.9,397,,A mad scientist terrorizes a city by kidnapping young women with his ape-man Gomar and then using them as subjects in sadistic brain transplant experiments. A female wrestler whose sister was one of the victims swears vengeance against the Mad Doctor.,https://www.imdb.com/title/tt0056201/?ref_=sr_i_141,['Alfredo Salazar'],"['René Cardona', 'Manuel San Fernando']","['Lorena Velázquez', 'Armando Silvestre', 'Elizabeth Campbell', 'Roberto Cañedo', 'Sonia Infante', 'Chucho Salinas', 'Chabela Romero', ""Martha 'Güera' Solís"", 'Magdalina Caballero', 'Tona La Tapatia']",,,,,"May 24, 1963",['Mexico'],"['Estudios Churubusco Azteca, Mexico City, Distrito Federal, Mexico (Studio, as Churubusco-Azteca, Mexico)']","['Young America Productions Inc.', 'Cinematográfica Calderón S.A.']",,"['Action', 'Crime', 'Horror', 'Sci-Fi']",['Spanish']
142. Doctor in Distress,1963,1h 42m,,5.6,740,,"Dr. Simon Sparrow's love life improves dramatically when lovely Delia Mallor is brought into casualty with a sprained ankle. As a model she's relieved at the diagnosis, and she's as attracted to Sparrow as he is to her. Meanwhile, Sparrow finds himself treating Sir Lancelot Spratt, who has started sleep-walking. He has also suddenly lost his gruff manner, and is being nice to everyone. Sparrow quickly diagnoses Spratt's condition: he's fallen in love. The object of his affection is Physiotherapist Iris Merchant. Sparrow urges him on, but she has another suitor: Major Tommy French. Spratt tries to hire a private detective to follow her, but when that doesn't work out, he follows her himself.",https://www.imdb.com/title/tt0057004/?ref_=sr_i_142,"['Nicholas Phipps', 'Ronald Scott Thorn', 'Richard Gordon']",['Ralph Thomas'],"['Dirk Bogarde', 'James Robertson Justice', 'Samantha Eggar', 'Barbara Murray', 'Mylène Demongeot', 'Donald Houston', 'Jessie Evans', 'Ann Lynn', 'Leo McKern', 'Rodney Cardiff']",,,,,"August 2, 1963",['United Kingdom'],"[""Hall Barn Cottage, 30 Windsor End, Beaconsfield, Buckinghamshire, England, UK (exterior of Sir Lancelot Spratt's house)""]","['The Rank Organisation', 'Betty E. Box-Ralph Thomas Productions']",,['Comedy'],['English']
143. The Gun Hawk,1963,1h 32m,Approved,5.9,497,,"When his town-drunk father is killed by the Sully brothers, gunfighter Blaine Madden exacts his revenge but has to flee, aided by a young aspiring gunslinger, when the sheriff tries to arrest him.",https://www.imdb.com/title/tt0057121/?ref_=sr_i_143,"['Jo Heims', 'Richard Bernstein', 'Max Steeber']",['Edward Ludwig'],"['Rory Calhoun', 'Rod Cameron', 'Ruta Lee', 'Rod Lauren', 'Morgan Woodward', 'Robert J. Wilke', 'John Litel', 'Jody Daniels', 'Ron Whelan', 'Rodolfo Hoyos Jr.']",,,,,"August 28, 1963",['United States'],"['Bronson Caves, Bronson Canyon, Griffith Park - 4730 Crystal Springs Drive, Los Angeles, California, USA (Sheriff Corey enters outlaw hideout)']",['Bern-Field Productions'],,"['Classical Western', 'Western']",['English']
144. The Blancheville Monster,1963,1h 28m,Unrated,5.4,914,,The beautiful young daughter of a crazed count fears that she will fall victim to the family curse - to be sacrificed to fulfill an ancient family legend.,https://www.imdb.com/title/tt0057155/?ref_=sr_i_144,"['Giovanni Grimaldi', 'Bruno Corbucci', 'Edgar Allan Poe']",['Alberto De Martino'],"['Gérard Tichy', 'Leo Anchóriz', 'Ombretta Colli', 'Helga Liné', 'Irán Eory', 'Vanni Materassi', 'Paco Morán', 'Emilia Wolkowicz', 'Harry Winter']",,,,,"June 6, 1963","['Italy', 'Spain']","['San Martín de Valdeiglesias, Madrid, Spain']","['Film Columbus', 'Llama Films']",,"['Drama', 'Horror']",['Italian']
145. Goldilocks and the Three Bares,1963,1h 9m,,3.2,478,,"""Nudie-cutie"" considered the first nudie-musical (filmed in ""Buffocolor"" and ""Seemorescope"") displays scads of female nudity as folks go about their business in a nudist camp, including a ten-minute horseback (bareback) riding scene.",https://www.imdb.com/title/tt0057111/?ref_=sr_i_145,['William R. Johnson'],['Herschell Gordon Lewis'],"['Rex Marlow', 'Louise Downe', 'William Kerwin', 'Netta Mallina', 'Gene Berk', 'Judy Parsons', 'Craig Maudslay Jr.', 'William R. Johnson', 'Joey Maxim', 'Toni Toomey']","$25,000 (estimated)",,,,"September 6, 1963",['United States'],"['Coral Gables, Florida, USA (Sunshine Park scenes)']",['D&R Pictures'],,"['Comedy', 'Musical']",['English']
146. Unearthly Stranger,1963,1h 18m,,6.4,1.1K,,"Mysterious woman marries government scientist Davidson despite his lack of knowledge about her past. His bosses are suspicious of her unusual traits. After it's clear she does love Davidson, the pair come under attack.",https://www.imdb.com/title/tt0057623/?ref_=sr_i_146,"['Rex Carlton', 'Jeffrey Stone']",['John Krish'],"['John Neville', 'Philip Stone', 'Gabriella Licudi', 'Patrick Newell', 'Jean Marsh', 'Warren Mitchell']",,,,,April 1964,['United Kingdom'],"['Independent Artists Studios, Beaconsfield, Buckinghamshire, England, UK (studio: made at Independent Artists Studios Beaconsfield, London, England.)']",['Independent Artists'],,"['Horror', 'Mystery', 'Sci-Fi']",['English']
147. Zlaté kapradí,1963,1h 55m,,7.0,166,,"Czech fairy tale about a shepherd who finds a golden fern with magical powers. He can ensure his continued happiness if he does the right thing, but will he?",https://www.imdb.com/title/tt0176345/?ref_=sr_i_147,"['Jan Drda', 'Jirí Weiss']",['Jirí Weiss'],"['Vít Olmer', 'Daniela Smutná', 'Karla Chadimová', 'Frantisek Smolík', 'Radoslav Brzobohatý', 'Zdenek Braunschläger', 'Cestmír Randa', 'Josef Bek', 'Otomar Krejca', 'Bohumil Svarc']",,,,,"November 22, 1963",['Czechoslovakia'],,['Ceskoslovenský Státní Film'],"Awards, 1 nomination total","['Fairy Tale', 'Adventure', 'Fantasy', 'Romance']",['Czech']
148. Saladin,1963,3h 14m,TV-MA,7.5,3K,,"After Saladin's victory over the King of Jerusalem, a peace treaty is signed between them, but the commander of the Crusader army, Renaud de Chatillon, slaughters a group of pilgrims going to Mecca. Saladin then decides to take revenge.",https://www.imdb.com/title/tt0057357/?ref_=sr_i_148,"['Mohamed Abdel Gawad', 'Youssef Chahine', 'Abderrahman Charkawi']",['Youssef Chahine'],"['Ahmad Mazhar', 'Salah Zulfikar', 'Nadia Lutfi', 'Mohamed Abdel Gawad', 'Tawfik El Deken', 'Mahmoud El Meligy', 'Umar El-Hariri', 'Ibrahim Emarah', 'Layla Fawzi', 'Hamdy Gheith']",,,,,"February 25, 1963",['Egypt'],,['Lotus Films Internacional'],"Awards, 1 nomination total","['Docudrama', 'Historical Epic', 'Sword & Sandal', 'Action', 'Adventure', 'Biography', 'Drama', 'History', 'Romance', 'War']",['Arabic']
149. 13 Frightened Girls,1963,1h 28m,Approved,5.3,946,,"While attending a school for diplomats' daughters, the teen-aged daughter of the American ambassador uses her access to various embassies to engage in espionage.",https://www.imdb.com/title/tt0056796/?ref_=sr_i_149,"['Robert Dillon', 'Otis L. Guernsey Jr.']",['William Castle'],"['Murray Hamilton', 'Joyce Taylor', 'Hugh Marlowe', 'Kathy Dunn', 'Khigh Dhiegh', 'Charlie Briggs', 'Norma Varden', 'Garth Benton', 'María Cristina Servera', 'Janet Mary Prance']",,,,,July 1963,['United States'],"['Big Bear Lake, Big Bear Valley, San Bernardino National Forest, California, USA']",['William Castle Productions'],"Awards, 1 nomination total","['Adventure', 'Comedy', 'Crime', 'Mystery', 'Thriller']","['English', 'Spanish', 'French', 'Cantonese', 'German']"
150. Twice-Told Tales,1963,2h,Approved,6.6,3.7K,,"Three horror stories based on the writings of Nathaniel Hawthorne. In the first story titled ""Dr. Heidegger's Experiment"", Heidegger attempts to restore the youth of himself, his fiancee and his best friend. In ""Rappaccini's Daughter"", Vincent Price plays a demented father inoculating his daughter with poison so she may never leave her garden of poisonous plants. In the final story ""The House of the Seven Gables"", the Pyncheon family suffers from a hundred year old curse and the Pyncheon brother returns to his home to search for a hidden vault.",https://www.imdb.com/title/tt0057608/?ref_=sr_i_150,"['Nathaniel Hawthorne', 'Robert E. Kent']",['Sidney Salkow'],"['Vincent Price', 'Sebastian Cabot', 'Brett Halsey', 'Beverly Garland', 'Richard Denning', 'Mari Blanchard', 'Abraham Sofaer', 'Jacqueline deWit', 'Joyce Taylor', 'Edith Evanson']",,,,,"October 30, 1963",['United States'],,['Robert E. Kent Productions'],"Awards, 1 nomination total","['Horror', 'Mystery', 'Romance', 'Sci-Fi']",['English']
151. L'Immortelle,1963,1h 41m,M,7.2,1.5K,,"A sad man meets a beautiful, secretive woman who may or may not be involved in some conspiracy ring dealing in kidnapped women used as prostitutes. After several days of their sadly passionate relationship she disappears. The sad man is unable to locate her as all the local Turkish people pretend not to remember any such woman. He suddenly finds her again (she finds him?) and before she can explain her disappearance she is killed in a car crash while he is in the passenger seat. He replays the accident over and over in his mind trying to remember how she died if he caused the accident himself by grabbing the wheel.",https://www.imdb.com/title/tt0057176/?ref_=sr_i_151,['Alain Robbe-Grillet'],['Alain Robbe-Grillet'],"['Françoise Brion', 'Jacques Doniol-Valcroze', 'Guido Celano', 'Catherine Carayon', 'Ayfer Feray', 'Nuri Genç', 'Belkis Mutlu', 'Vahi Öz', 'Catherine Robbe-Grillet', 'Sezer Sezin']",,,,,"March 27, 1963","['France', 'Italy']","['Istanbul, Turkey']","['Les Films Tamara', 'Como Films', 'Cocinor']","Awards, 1 win & 1 nomination total","['Drama', 'Mystery']","['French', 'Turkish']"
152. The Conjugal Bed,1963,1h 25m,Not Rated,7.0,861,,A forty-year-old employee marries a seemingly quiet girl who turns into a mantis after the wedding.,https://www.imdb.com/title/tt0057532/?ref_=sr_i_152,"['Goffredo Parise', 'Rafael Azcona', 'Marco Ferreri']",['Marco Ferreri'],"['Ugo Tognazzi', 'Marina Vlady', 'Walter Giller', 'Linda Sini', 'Riccardo Fellini', 'Gian Luigi Polidoro', 'Nino Vingelli', 'Achille Majeroni', 'Renato Montalbano', 'Vera Ragazzi']",,,,,"April 24, 1963","['Italy', 'France']","['Spoleto, Perugia, Umbria, Italy (cemetery)']","['Sancro Film', 'Cocinor', 'Les Films Marceau']","Awards, 2 wins & 3 nominations total","['Comedy', 'Drama']",['Italian']
153. Gidget Goes to Rome,1963,1h 44m,Approved,5.1,832,,"Gidget, in Rome for a holiday, misinterprets attention she receives from a famous journalist. Discovering he is ""chaperoning"" her at Dad's request she resumes interest in her boyfriend. Based upon characters created by Frederick Kohner.",https://www.imdb.com/title/tt0057100/?ref_=sr_i_153,"['Ruth Brooks Flippen', 'Katherine Albert', 'Dale Eunson']",['Paul Wendkos'],"['James Darren', 'Cindy Carol', 'Jessie Royce Landis', 'Cesare Danova', 'Danielle De Metz', 'Joby Baker', 'Trudi Ames', 'Noreen Corcoran', 'Peter Brooks', 'Lisa Gastoni']",,,,"$4,360,000","August 7, 1963",['United States'],"['Forum Romanum, Rome, Lazio, Italy (Ruins of the Senate Forum)']",['Jerry Bresler Productions'],,"['Adventure', 'Comedy', 'Romance']","['English', 'Italian']"
154. Raven's End,1963,1h 41m,Not Rated,7.3,1.8K,,An aspiring young writer lives in a bleak working class block in the late 1930s.,https://www.imdb.com/title/tt0057237/?ref_=sr_i_154,['Bo Widerberg'],['Bo Widerberg'],"['Thommy Berggren', 'Keve Hjelm', 'Emy Storm', 'Ingvar Hirdwall', 'Christina Frambäck', 'Agneta Prytz', 'Louise Gustafsson', 'Fritiof Nilsson Piraten', 'Hugo Tunnbindare', 'Nina Widerberg']",,,,,"May 21, 1970",['Sweden'],"['Malmö, Skåne län, Sweden']",['Europa Film'],"Nominated for 1 Oscar, 1 win & 2 nominations total",['Drama'],['Swedish']
155. The Slime People,1963,1h 16m,Approved,2.9,1.7K,,"After Los Angeles is invaded by an army of subterranean monsters, a small group of people must fight for survival in the deserted metropolis.",https://www.imdb.com/title/tt0056499/?ref_=sr_i_155,"['Blair Robertson', 'Vance Skarstedt']",['Robert Hutton'],"['Robert Hutton', 'Les Tremayne', 'Robert Burton', 'Susan Hart', 'William Boyce', 'Judee Morton', 'John Close', 'Edward Finch Abrams', ""John 'Pee Wee' Carter"", 'Bob Herron']","$56,000 (estimated)",,,,"February 24, 1966",['United States'],"['San Fernando Airport - Dronfield Avenue & Aviation Place, San Fernando, California, USA (airport)']",['Joseph F. Robertson Productions'],,"['Horror', 'Sci-Fi']",['English']
156. The Girl Hunters,1963,1h 38m,Not Rated,5.9,850,,"Legendary detective Mike Hammer has spent seven years in an alcoholic funk after the supposed death of his secretary, Velda. He is brought back to the land of the living by his old friendly enemy, police lieutenant Pat Chambers.",https://www.imdb.com/title/tt0057102/?ref_=sr_i_156,"['Mickey Spillane', 'Roy Rowland', 'Robert Fellows']",['Roy Rowland'],"['Mickey Spillane', 'Shirley Eaton', 'Scott Peters', 'Guy Kingsley Poynter', 'James Dyrenforth', 'Charles Farrell', 'Kim Tracy', 'Hy Gardner', 'Benny Lee', 'Murray Kash']",,,,,"July 16, 1964",['United Kingdom'],"['Elstree, Hertfordshire, England, UK']",['Fellane'],,"['Crime', 'Drama', 'Mystery', 'Thriller']",['English']
157. Maniac,1963,1h 26m,Approved,5.9,1.7K,,"An American painter has an affair with a bar owner in a French village. To free her from her marriage, the painter must help the estranged husband escape from an asylum.",https://www.imdb.com/title/tt0056219/?ref_=sr_i_157,['Jimmy Sangster'],['Michael Carreras'],"['Kerwin Mathews', 'Nadia Gray', 'Donald Houston', 'Liliane Brousse', 'George Pastell', 'Arnold Diamond', 'Norman Bird', 'Justine Lord', 'Jerold Wells', 'Daniel Brown']",,,,,"October 30, 1963",['United Kingdom'],"[""Montfrin, Gard, France (Eve and Jeff meet at this town's WWI memorial)""]",['Hammer Films'],,"['Crime', 'Horror', 'Mystery', 'Romance', 'Thriller']","['English', 'French']"
158. Symphonie pour un massacre,1963,1h 55m,,7.2,707,,Five men tied to businesses with varying degrees of legality pool their money to go in on one huge narcotics deal that can set them up for life - and test their loyalties.,https://www.imdb.com/title/tt0057549/?ref_=sr_i_158,"['Alain Reynaud-Fourton', 'José Giovanni', 'Claude Sautet']",['Jacques Deray'],"['Michel Auclair', 'Claude Dauphin', 'José Giovanni', 'Michèle Mercier', 'Daniela Rocca', 'Jean Rochefort', 'Charles Vanel', 'Claude Cerval', 'Jean Degrave', 'Maurice Garrel']",,,,,"May 27, 1965","['France', 'Italy']","['Gare de Lyon, Paris 12, Paris, France (on location)']","['Compagnie Industrielle et Commerciale Cinématographique (CICC)', 'PECF', 'Dear Film Produzione']","Awards, 1 nomination total","['Crime', 'Drama', 'Thriller']",['French']
159. Twilight of Honor,1963,1h 44m,Approved,6.3,720,,"USAF vet Ben Brown is charged with killing Cole Clinton, a leading Durango County citizen who was making time with Brown's wife Laura. An unwinnable case is given to young D.A. Dave Mitchell, who asks expert lawyer Art Harper for help.",https://www.imdb.com/title/tt0057609/?ref_=sr_i_159,"['Henry Denker', 'Al Dewlen']",['Boris Sagal'],"['Richard Chamberlain', 'Nick Adams', 'Claude Rains', 'Joan Blackman', 'James Gregory', 'Joey Heatherton', 'Pat Buttram', 'Jeanette Nolan', 'Edgar Stehli', 'James Bell']",,,,,"February 6, 1964",['United States'],"['Metro-Goldwyn-Mayer Studios - 10202 W. Washington Blvd., Culver City, California, USA (Studio)']",['Perlberg-Seaton Productions'],"Nominated for 2 Oscars, 3 nominations total","['Crime', 'Drama']",['English']
160. Ladybug Ladybug,1963,1h 22m,Not Rated,7.1,1K,,"Staff and students at a rural school react to a warning of an imminent nuclear attack, not knowing whether it is real or a mistake.",https://www.imdb.com/title/tt0057242/?ref_=sr_i_160,"['Eleanor Perry', 'Lois Dickert']",['Frank Perry'],"['Jane Connell', 'William Daniels', 'James Frawley', 'Richard Hamilton', 'Kathryn Hays', 'Jane Hoffman', 'Elena Karam', 'Judith Lowry', 'Nancy Marchand', 'Estelle Parsons']",,,,,"December 13, 1963",['United States'],"['Gradyville, Pennsylvania, USA']",['Frank Perry Films Inc.'],,['Drama'],['English']
161. An Actor's Revenge,1963,1h 55m,Not Rated,7.3,3K,,"Yukinojo, a Kabuki actor, seeks revenge by destroying the three men who caused the deaths of his parents. Also involved are the daughter of one of Yukinojo's targets, two master thieves, and a swordsman who himself is out to kill Yukinojo.",https://www.imdb.com/title/tt0057710/?ref_=sr_i_161,"['Kon Ichikawa', 'Hiroaki Fujii', 'Tomio Takamori']",['Kon Ichikawa'],"['Kazuo Hasegawa', 'Fujiko Yamamoto', 'Ayako Wakao', 'Eiji Funakoshi', 'Narutoshi Hayashi', 'Eijirô Yanagi', 'Chûsha Ichikawa', 'Ganjirô Nakamura', 'Yutaka Nakayama', 'Chitose Maki']",,,,,"June 16, 1971",['Japan'],,['Daiei Studios'],"Awards, 1 win total","['Period Drama', 'Action', 'Comedy', 'Drama']",['Japanese']
162. The Wrong Arm of the Law,1963,1h 34m,Unrated,6.7,2.5K,,"In London, Australian gangsters disguised as Bobbies rob the local criminals, making the panicked British mobsters seek an alliance with Scotland Yard in order to eliminate the foreign competition and return things to ""normal"".",https://www.imdb.com/title/tt0056704/?ref_=sr_i_162,"['Ray Galton', 'Alan Simpson', 'John Antrobus']",['Cliff Owen'],"['Peter Sellers', 'Lionel Jeffries', 'Bernard Cribbins', 'Davy Kaye', 'Nanette Newman', 'Bill Kerr', 'Ed Devereaux', 'Reg Lye', 'John Le Mesurier', 'Graham Stark']",,,,,"March 29, 1963",['United Kingdom'],"['Cowley Mill Road, Uxbridge, Greater London, England, UK (scene of the staged robbery, corner of Cowley Mill Road and Waterloo Road)']","['Robert Velaise Productions', 'Romulus Films']",,"['Comedy', 'Crime']",['English']
163. Dr. Crippen,1963,1h 38m,TV-PG,6.4,871,,"The real-life story of Dr. Hawley Harvey Crippen, who was hanged in London in 1910 for poisoning his wife so he could be with his young lover. But was he truly guilty of murder?",https://www.imdb.com/title/tt0055927/?ref_=sr_i_163,['Leigh Vance'],['Robert Lynn'],"['Donald Pleasence', 'Samantha Eggar', 'Coral Browne', 'Donald Wolfit', 'James Robertson Justice', 'John Arnatt', 'Paul Carpenter', 'Oliver Johnston', 'John Lee', 'Olga Lindo']",,,,,"May 21, 1964",['United Kingdom'],"['Central Criminal Court of England and Wales, Old Bailey, London, England, UK (building exterior in opening credits)']",['Torchlight Productions'],,"['True Crime', 'Crime', 'Drama', 'History']",['English']
164. Bitter Harvest,1963,1h 31m,,6.2,336,,A pretty young woman will do anything to escape her deadly dull existence in the backlots of Wales. But when she reaches the bright lights of London is the price too high?,https://www.imdb.com/title/tt0056870/?ref_=sr_i_164,"['Patrick Hamilton', 'Ted Willis']",['Peter Graham Scott'],"['Janet Munro', 'John Stride', 'Alan Badel', 'Anne Cunningham', 'Terence Alexander', 'Richard Thorp', 'Barbara Ferris', 'Colin Gordon', 'Francis Matthews', 'William Lucas']",,,,,"October 10, 1963",['United Kingdom'],"[""54 Kensington Gardens Square, Westminster, Greater London, England, UK (exterior of Bob's flat)""]",['Independent Artists'],,['Drama'],['English']
165. Women of the World,1963,1h 50m,Not Rated,5.5,421,,"From love in the streets of Paris to death on the African plain, the acclaimed MONDO CANE masters turn their unflinching eye on all the things never before known - and never before shown - about WOMEN OF THE WORLD.",https://www.imdb.com/title/tt0055923/?ref_=sr_i_165,['Gualtiero Jacopetti'],"['Paolo Cavara', 'Gualtiero Jacopetti', 'Franco Prosperi']","['Stefano Sibaldi', 'Belinda Lee', 'Peter Ustinov']",,,,,"January 30, 1963",['Italy'],,"['Cinematografica RI.RE', 'Cineriz', 'Tempo Film']",,['Documentary'],['Italian']
166. The Stripper,1963,1h 35m,Approved,6.6,467,,"Lila Green is an insecure and aging showgirl for Madame Olga's stage shows. When her boyfriend, Rick, runs off with the show's money, Madame Olga and Ronny let Lila go. Lila goes to stay with her old neighbors, Helen Bard and her teenage son, Kenny. Lila decides to go out and get a regular job and try and live a normal life. All seems well, until Lila and Kenny stop fighting their attraction for one another.",https://www.imdb.com/title/tt0057537/?ref_=sr_i_166,"['William Inge', 'Meade Roberts']",['Franklin J. Schaffner'],"['Joanne Woodward', 'Richard Beymer', 'Claire Trevor', 'Carol Lynley', 'Robert Webber', 'Louis Nye', 'Gypsy Rose Lee', 'Michael J. Pollard', 'Sondra Blake', 'Susan Brown']",,,,,"June 14, 1963",['United States'],"['20th Century Fox Studios - 10201 Pico Blvd., Century City, Los Angeles, California, USA (Studio)']","['Jerry Wald Productions', 'Twentieth Century Fox']","Nominated for 1 Oscar, 2 nominations total","['Drama', 'Romance']",['English']
167. The Baby Carriage,1963,1h 35m,Not Rated,6.7,701,,"Following his manifesto for a new Swedish cinema, director Widerberg started his career with this realist tale of young woman, Britt, who has two flings, but finds herself with difficult decisions when she finds herself pregnant.",https://www.imdb.com/title/tt0056854/?ref_=sr_i_167,['Bo Widerberg'],['Bo Widerberg'],"['Inger Taube', 'Thommy Berggren', 'Lars Passgård', 'Ulla Akselson', 'Lena Brundin', 'Marianne Hedengrahn', 'Ulla Rodhe', 'Stig Torstensson', 'Gunnar Öhlund', 'Bill Jönsson']","SEK200,000 (estimated)",,,,"March 18, 1963",['Sweden'],"['Europa Studios, Sundbyberg, Stockholms län, Sweden (Studio)']",['Europa Film'],,['Drama'],['Swedish']
168. The Monsters,1963,1h 27m,Not Rated,7.4,2.9K,,The myths of the sixties are satirized in 20 episodes.,https://www.imdb.com/title/tt0057323/?ref_=sr_i_168,"['Agenore Incrocci', 'Furio Scarpelli', 'Elio Petri']",['Dino Risi'],"['Ugo Tognazzi', 'Vittorio Gassman', 'Lando Buzzanca', 'Marino Masé', 'Marisa Merlini', 'Rika Dialyna', 'Michèle Mercier', 'Ricky Tognazzi', 'Franco Castellani', 'Maria Mannelli']",,,"$5,743",,"April 10, 1968","['Italy', 'France']","[""Ponte Sant'Angelo, Rome, Lazio, Italy (in L'educazione sentimentale)""]","['Fair Film', 'Incei Film', 'L.C.J Editions & Productions']","Awards, 2 wins & 2 nominations total","['Dark Comedy', 'Satire', 'Comedy']",['Italian']
169. Atragon,1963,1h 34m,TV-Y7,5.8,1.6K,,"When an ancient underground civilization and their snake-like guardian plots to reclaim the surface world, those of the surface fights back.",https://www.imdb.com/title/tt0057215/?ref_=sr_i_169,"[""Shin'ichi Sekizawa"", 'Shunrô Oshikawa', 'Shigeru Komatsuzaki']","['Ishirô Honda', 'Shûe Matsubayashi']","['Tadao Takashima', 'Yôko Fujiyama', 'Yû Fujiki', 'Kenji Sahara', 'Ken Uehara', 'Hiroshi Koizumi', 'Jun Tazaki', 'Yoshifumi Tajima', 'Akihiko Hirata', 'Hideyo Amamoto']",,,,,"March 11, 1965",['Japan'],,['Toho'],,"['Kaiju', 'Supernatural Fantasy', 'Adventure', 'Fantasy', 'Sci-Fi']",['Japanese']
170. Rampage,1963,1h 38m,Approved,5.5,835,,"In colonial Malaysia, British big game-hunter Otto Abbot and American trapper Harry Stanton clash over the ethics of catching versus killing animals and over Abbot's mistress, Anna.",https://www.imdb.com/title/tt0057447/?ref_=sr_i_170,"['Robert I. Holt', 'Marguerite Roberts', 'Alan Caillou']",['Phil Karlson'],"['Robert Mitchum', 'Elsa Martinelli', 'Jack Hawkins', 'Sabu', 'Cely Carillo', 'Émile Genest', 'Stefan Schnabel', 'David Cadiente', 'Sylva Koscina', 'Allyson Ames']",,,,,"October 9, 1963",['United States'],"['San Diego Zoo - 2920 Zoo Drive, San Diego, California, USA']","['Talbot Productions', '7 Arts']",,"['Adventure', 'Romance']",['English']
171. Os Verdes Anos,1963,1h 31m,,7.4,1K,,"19-year-old Julio has just left the provinces to settle down in the outskirts of Lisbon. He lives in a poor area with his uncle Afonso and starts working as an apprentice shoemaker. At the shop he gets to know Ilda, a young housemaid and regular customer. Ilda is pretty, joyful, and modern, and Julio falls for her. The two young people, although very different from each other, embark on an idyll.",https://www.imdb.com/title/tt0057642/?ref_=sr_i_171,"['Nuno Bragança', 'Paulo Rocha']",['Paulo Rocha'],"['Isabel Ruth', 'Rui Gomes', 'Paulo Renato', 'Alberto Ghira', 'Cândida Lacerda', 'Carlos José Teixeira', 'Harry Wheeland', 'Irene Dyne', 'Julio Cleto', 'Manoel de Oliveira']",,,,,"November 29, 1963",['Portugal'],"['Elevador de Santa Justa, Lisbon, Portugal']",['Produções Cunha Telles'],"Awards, 1 win total","['Drama', 'Romance']","['Portuguese', 'English']"
172. 13 Assassins,1963,2h 5m,Not Rated,7.4,1.1K,,A group of samurai plan to assassinate a sadistic feudal lord.,https://www.imdb.com/title/tt0057212/?ref_=sr_i_172,['Kaneo Ikegami'],['Eiichi Kudô'],"['Takayuki Akutagawa', 'Chiezô Kataoka', 'Kôtarô Satomi', 'Ryôhei Uchida', 'Tetsurô Tanba', 'Satomi Oka', 'Yuriko Mishima', 'Sumiko Fuji', 'Chôichirô Kawarasaki', 'Michitarô Mizushima']",,,,,"December 7, 1963",['Japan'],,['Toei Company'],,"['Samurai', 'Action', 'Adventure']",['Japanese']
