Title,Year,Duration,MPA,Rating,Votes,méta_score,description,Movie Link,writers,directors,stars,budget,opening_weekend_Gross,grossWorldWWide,gross_US_Canada,release_date,countries_origin,filming_locations,production_company,awards_content,genres,Languages
1. The Hunger Games: Catching Fire,2013,2h 26m,PG-13,7.5,744K,76.0,Katniss Everdeen and Peeta Mellark become targets of the Capitol after their victory in the 74th Hunger Games sparks a rebellion in the Districts of Panem.,https://www.imdb.com/title/tt1951264/?ref_=sr_i_1,"['Simon Beaufoy', 'Michael Arndt', 'Suzanne Collins']",['Francis Lawrence'],"['Jennifer Lawrence', 'Josh Hutcherson', 'Liam Hemsworth', 'Philip Seymour Hoffman', 'Jack Quaid', 'Taylor St. Clair', 'Sandra Ellis Lafferty', 'Woody Harrelson', 'Paula Malcomson', 'Willow Shields']","$130,000,000 (estimated)","$158,074,286","$865,011,746","$424,668,047","November 22, 2013",['United States'],"[""Swan House - 3101 Andrews Drive Northwest, Atlanta, Georgia, USA (party at President Snow's estate)""]","['Color Force', 'Lionsgate']","Awards, 22 wins & 68 nominations total","['Dystopian Sci-Fi', 'Action', 'Adventure', 'Sci-Fi', 'Thriller']",['English']
2. Iron Man 3,2013,2h 10m,PG-13,7.1,927K,62.0,"When Tony Stark's world is torn apart by a formidable terrorist called the Mandarin, he starts an odyssey of rebuilding and retribution.",https://www.imdb.com/title/tt1300854/?ref_=sr_i_2,"['Drew Pearce', 'Shane Black', 'Stan Lee']",['Shane Black'],"['Robert Downey Jr.', 'Guy Pearce', 'Gwyneth Paltrow', 'Don Cheadle', 'Rebecca Hall', 'Jon Favreau', 'Ben Kingsley', 'James Badge Dale', 'Stephanie Szostak', 'Paul Bettany']","$200,000,000 (estimated)","$174,144,585","$1,266,152,644","$409,013,994","May 3, 2013",['United States'],"['Kenansville, North Carolina, USA (Miss Chattanooga Christmas Pageant)']","['Marvel Studios', 'Paramount Pictures', 'DMG Entertainment']","Nominated for 1 Oscar, 20 wins & 63 nominations total","['Superhero', 'Urban Adventure', 'Action', 'Adventure', 'Sci-Fi']",['English']
3. Frozen,2013,1h 42m,PG,7.4,685K,75.0,"Fearless optimist Anna teams up with rugged mountain man Kristoff and his loyal reindeer Sven in an epic journey to find Anna's sister Elsa, whose icy powers have trapped the kingdom of Arendelle in eternal winter.",https://www.imdb.com/title/tt2294629/?ref_=sr_i_3,"['Jennifer Lee', 'Hans Christian Andersen', 'Chris Buck']","['Chris Buck', 'Jennifer Lee']","['Kristen Bell', 'Idina Menzel', 'Jonathan Groff', 'Josh Gad', 'Santino Fontana', 'Alan Tudyk', 'Ciarán Hinds', 'Chris Williams', 'Stephen J. Anderson', 'Maia Wilson']","$150,000,000 (estimated)","$243,390","$1,306,450,154","$400,953,009","November 27, 2013",['United States'],"['Norway, Norge']","['Walt Disney Animation Studios', 'Walt Disney Pictures']","Won 2 Oscars, 83 wins & 60 nominations total","['Computer Animation', 'Fairy Tale', 'Mountain Adventure', 'Pop Musical', 'Adventure', 'Animation', 'Comedy', 'Family', 'Fantasy', 'Musical']",['English']
4. Despicable Me 2,2013,1h 38m,PG,7.3,442K,62.0,"When a new criminal comes to town, the Anti-Villain League decides to hire Gru in order to fight him off. While Gru initially refuses, he eventually agrees after his aide goes back to his evil ways.",https://www.imdb.com/title/tt1690953/?ref_=sr_i_4,"['Cinco Paul', 'Ken Daurio']","['Pierre Coffin', 'Chris Renaud']","['Steve Carell', 'Kristen Wiig', 'Benjamin Bratt', 'Miranda Cosgrove', 'Russell Brand', 'Ken Jeong', 'Steve Coogan', 'Elsie Fisher', 'Dana Gaier', 'Moises Arias']","$76,000,000 (estimated)","$83,517,315","$970,766,005","$368,065,385","July 3, 2013","['United States', 'France']",,"['Universal Pictures', 'Illumination Entertainment']","Nominated for 2 Oscars, 12 wins & 66 nominations total","['Computer Animation', 'Urban Adventure', 'Adventure', 'Animation', 'Comedy', 'Crime', 'Family', 'Sci-Fi']","['English', 'Ukrainian']"
5. Man of Steel,2013,2h 23m,PG-13,7.1,831K,55.0,An alien child is evacuated from his dying world and sent to Earth to live among humans. His peace is threatened when other survivors of his home planet invade Earth.,https://www.imdb.com/title/tt0770828/?ref_=sr_i_5,"['David S. Goyer', 'Christopher Nolan', 'Jerry Siegel']",['Zack Snyder'],"['Henry Cavill', 'Amy Adams', 'Michael Shannon', 'Diane Lane', 'Russell Crowe', 'Antje Traue', 'Harry Lennix', 'Richard Schiff', 'Christopher Meloni', 'Kevin Costner']","$225,000,000 (estimated)","$116,619,362","$670,145,518","$291,045,518","June 14, 2013","['United States', 'United Kingdom']","['Ucluelet, British Columbia, Canada (Alaskan fishing town)']","['Warner Bros.', 'Legendary Entertainment', 'Syncopy']","Nominated for 1 BAFTA Award, 7 wins & 46 nominations total","['Alien Invasion', 'Superhero', 'Urban Adventure', 'Action', 'Adventure', 'Sci-Fi']",['English']
6. Gravity,2013,1h 31m,PG-13,7.7,879K,96.0,"Dr Ryan Stone, an engineer on her first space mission, and Matt Kowalski, an astronaut on his final expedition, have to survive in space after they are hit by debris while spacewalking.",https://www.imdb.com/title/tt1454468/?ref_=sr_i_6,"['Alfonso Cuarón', 'Jonás Cuarón']",['Alfonso Cuarón'],"['Sandra Bullock', 'George Clooney', 'Ed Harris', 'Orto Ignatiussen', 'Phaldut Sharma', 'Amy Warren', 'Basher Savage']","$100,000,000 (estimated)","$55,785,112","$723,719,539","$274,092,705","October 4, 2013","['United Kingdom', 'United States']","[""Space (Earth's orbit)""]","['Warner Bros.', 'Esperanto Filmoj', 'Heyday Films']","Won 7 Oscars, 240 wins & 188 nominations total","['Disaster', 'Sci-Fi Epic', 'Space Sci-Fi', 'Survival', 'Drama', 'Sci-Fi', 'Thriller']","['English', 'Greenlandic']"
7. Monsters University,2013,1h 44m,G,7.2,407K,65.0,"A look at the relationship between Mike Wazowski and James P. ""Sully"" Sullivan during their days at Monsters University, when they weren't necessarily the best of friends.",https://www.imdb.com/title/tt1453405/?ref_=sr_i_7,"['Dan Scanlon', 'Daniel Gerson', 'Robert L. Baird']",['Dan Scanlon'],"['Billy Crystal', 'John Goodman', 'Steve Buscemi', 'Helen Mirren', 'Peter Sohn', 'Joel Murray', 'Sean Hayes', 'Dave Foley', 'Charlie Day', 'Alfred Molina']","$200,000,000 (estimated)","$82,429,469","$743,559,645","$268,492,764","June 21, 2013","['United States', 'Japan']","['Walt Disney Animation Studios - 2100 Riverside Drive, Burbank, California, USA']","['Walt Disney Pictures', 'Pixar Animation Studios']","Nominated for 2 BAFTA Awards, 9 wins & 58 nominations total","['Computer Animation', 'Adventure', 'Animation', 'Comedy', 'Family', 'Fantasy']",['English']
8. The Hobbit: The Desolation of Smaug,2013,2h 41m,PG-13,7.8,729K,66.0,"The dwarves, along with Bilbo Baggins and Gandalf the Grey, continue their quest to reclaim the Lonely Mountain, their homeland, from the dragon Smaug.",https://www.imdb.com/title/tt1170358/?ref_=sr_i_8,"['Fran Walsh', 'Philippa Boyens', 'Peter Jackson']",['Peter Jackson'],"['Ian McKellen', 'Martin Freeman', 'Richard Armitage', 'Ken Stott', 'Graham McTavish', 'William Kircher', 'James Nesbitt', 'Stephen Hunter', ""Dean O'Gorman"", 'Aidan Turner']","$225,000,000 (estimated)","$73,645,197","$959,079,095","$258,387,334","December 13, 2013","['New Zealand', 'United States']","['Paradise, Glenorchy, Otago, New Zealand']","['Metro-Goldwyn-Mayer (MGM)', 'New Line Cinema', 'WingNut Films']","Nominated for 3 Oscars, 19 wins & 90 nominations total","['Adventure Epic', 'Fantasy Epic', 'Quest', 'Sword & Sorcery', 'Adventure', 'Fantasy']",['English']
9. Fast & Furious 6,2013,2h 10m,PG-13,7.0,427K,61.0,"Hobbs has Dominic and Brian reassemble their crew to take down a team of mercenaries, but Dominic unexpectedly gets sidetracked with facing his presumed deceased girlfriend, Letty.",https://www.imdb.com/title/tt1905041/?ref_=sr_i_9,"['Chris Morgan', 'Gary Scott Thompson']",['Justin Lin'],"['Vin Diesel', 'Paul Walker', 'Dwayne Johnson', 'Michelle Rodriguez', 'Jordana Brewster', 'Tyrese Gibson', 'Sung Kang', 'Gal Gadot', 'Ludacris', 'Luke Evans']","$160,000,000 (estimated)","$97,375,245","$788,683,342","$238,679,850","May 24, 2013","['United States', 'Japan', 'Spain', 'Hong Kong']","['Tenerife, Canary Islands, Spain (on location)']","['Universal Pictures', 'Relativity Media', 'Original Film']","Awards, 12 wins & 22 nominations total","['Action Epic', 'Car Action', 'Action', 'Thriller']","['English', 'Spanish', 'Russian', 'Japanese', 'Cantonese', 'Dutch', 'Danish', 'Ukrainian']"
10. Oz the Great and Powerful,2013,2h 10m,PG,6.3,218K,44.0,A small-time magician is swept away to an enchanted land and is forced into a power struggle among three witches.,https://www.imdb.com/title/tt1623205/?ref_=sr_i_10,"['Mitchell Kapner', 'David Lindsay-Abaire', 'L. Frank Baum']",['Sam Raimi'],"['James Franco', 'Michelle Williams', 'Rachel Weisz', 'Mila Kunis', 'Zach Braff', 'Bill Cobbs', 'Joey King', 'Tony Cox', 'Stephen R. Hart', 'Abigail Spencer']","$215,000,000 (estimated)","$79,110,453","$493,311,825","$234,911,825","March 8, 2013",['United States'],"['Michigan Motion Picture Studios, 1999 Centerpoint Parkway, Pontiac, Michigan USA']","['Walt Disney Pictures', 'Roth Films']","Awards, 6 wins & 31 nominations total","['Adventure Epic', 'Fairy Tale', 'Adventure', 'Family', 'Fantasy']",['English']
11. Star Trek Into Darkness,2013,2h 12m,PG-13,7.7,503K,72.0,"After the crew of the Enterprise find an unstoppable force of terror from within their own organization, Captain Kirk leads a manhunt to a war-zone world to capture a one-man weapon of mass destruction.",https://www.imdb.com/title/tt1408101/?ref_=sr_i_11,"['Roberto Orci', 'Alex Kurtzman', 'Damon Lindelof']",['J.J. Abrams'],"['Chris Pine', 'Zachary Quinto', 'Zoe Saldaña', 'Benedict Cumberbatch', 'Leonard Nimoy', 'Karl Urban', 'Simon Pegg', 'John Cho', 'Anton Yelchin', 'Bruce Greenwood']","$190,000,000 (estimated)","$70,165,559","$467,365,246","$228,778,661","May 16, 2013",['United States'],"['The Getty Center - 1200 Getty Center Drive, Brentwood, Los Angeles, California, USA (Star Fleet Headquarters)']","['Paramount Pictures', 'Skydance Media', 'Bad Robot']","Nominated for 1 Oscar, 7 wins & 58 nominations total","['Space Sci-Fi', 'Action', 'Adventure', 'Sci-Fi']","['English', 'Klingon']"
12. Thor: The Dark World,2013,1h 52m,PG-13,6.7,748K,54.0,"When the Dark Elves attempt to plunge the universe into darkness, Thor must embark on a perilous and personal journey that will reunite him with doctor Jane Foster.",https://www.imdb.com/title/tt1981115/?ref_=sr_i_12,"['Christopher L. Yost', 'Christopher Markus', 'Stephen McFeely']",['Alan Taylor'],"['Chris Hemsworth', 'Natalie Portman', 'Tom Hiddleston', 'Stellan Skarsgård', 'Anthony Hopkins', 'Christopher Eccleston', 'Jaimie Alexander', 'Zachary Levi', 'Ray Stevenson', 'Tadanobu Asano']","$170,000,000 (estimated)","$85,737,841","$644,783,140","$206,362,140","November 8, 2013",['United States'],"['Skógarfoss Waterfall, Iceland (on location)']",['Marvel Studios'],"Awards, 4 wins & 21 nominations total","['Dark Fantasy', 'Quest', 'Superhero', 'Action', 'Adventure', 'Fantasy', 'Sci-Fi']",['English']
13. World War Z,2013,1h 56m,PG-13,7.0,749K,63.0,Former United Nations employee Gerry Lane traverses the world in a race against time to stop a zombie pandemic that is toppling armies and governments and threatens to destroy humanity itself.,https://www.imdb.com/title/tt0816711/?ref_=sr_i_13,"['Matthew Michael Carnahan', 'Drew Goddard', 'Damon Lindelof']",['Marc Forster'],"['Brad Pitt', 'Mireille Enos', 'Daniella Kertesz', 'James Badge Dale', 'Ludi Boeken', 'Matthew Fox', 'Fana Mokoena', 'David Morse', 'Elyes Gabel', 'Peter Capaldi']","$190,000,000 (estimated)","$66,411,834","$540,455,876","$202,807,711","June 21, 2013","['United States', 'United Kingdom']","['Blaenau Ffestiniog, Gwynedd, Wales, UK']","['Paramount Pictures', 'Skydance Media', 'Hemisphere Media Capital']","Awards, 3 wins & 25 nominations total","['Disaster', 'Globetrotting Adventure', 'Zombie Horror', 'Action', 'Adventure', 'Horror', 'Sci-Fi']","['English', 'Spanish', 'Hebrew', 'Arabic']"
14. The Croods,2013,1h 38m,PG,7.1,241K,55.0,"In the primeval era, Grug and his family risk the dangers of their surroundings to find a new dwelling place. Along the way, they meet a modern boy who woos them with his adventurous ways.",https://www.imdb.com/title/tt0481499/?ref_=sr_i_14,"['Kirk DeMicco', 'Chris Sanders', 'John Cleese']","['Kirk DeMicco', 'Chris Sanders']","['Nicolas Cage', 'Ryan Reynolds', 'Emma Stone', 'Catherine Keener', 'Cloris Leachman', 'Clark Duke', 'Chris Sanders', 'Randy Thom']","$135,000,000 (estimated)","$43,639,736","$587,266,745","$187,168,425","March 22, 2013",['United States'],,['DreamWorks Animation'],"Nominated for 1 Oscar, 5 wins & 46 nominations total","['Computer Animation', 'Supernatural Fantasy', 'Survival', 'Adventure', 'Animation', 'Comedy', 'Family', 'Fantasy']",['English']
15. The Heat,2013,1h 57m,R,6.6,185K,60.0,An uptight FBI Special Agent is paired with a foul-mouthed Boston cop to take down a ruthless drug lord.,https://www.imdb.com/title/tt2404463/?ref_=sr_i_15,['Katie Dippold'],['Paul Feig'],"['Sandra Bullock', 'Michael McDonald', 'Melissa McCarthy', 'Demián Bichir', 'Marlon Wayans', 'Michael Rapaport', 'Jane Curtin', 'Spoken Reasons', 'Dan Bakkedahl', 'Taran Killam']","$43,000,000 (estimated)","$39,115,043","$229,930,771","$159,582,188","June 28, 2013","['United States', 'United Kingdom']","['Boston, Massachusetts, USA']","['Twentieth Century Fox', 'Chernin Entertainment', 'TSG Entertainment']","Awards, 7 wins & 16 nominations total","['Buddy Cop', 'Action', 'Comedy', 'Crime']","['English', 'Spanish', 'Bulgarian']"
16. We're the Millers,2013,1h 50m,R,7.0,504K,44.0,A veteran pot dealer creates a fake family as part of his plan to move a huge shipment of weed into the U.S. from Mexico.,https://www.imdb.com/title/tt1723121/?ref_=sr_i_16,"['Bob Fisher', 'Steve Faber', 'Sean Anders']",['Rawson Marshall Thurber'],"['Jason Sudeikis', 'Jennifer Aniston', 'Emma Roberts', 'Ed Helms', 'Will Poulter', 'Nick Offerman', 'Kathryn Hahn', 'Molly C. Quinn', 'Tomer Sisley', 'Matthew Willig']","$37,000,000 (estimated)","$26,419,396","$269,994,119","$150,394,119","August 7, 2013","['United States', 'United Kingdom']","['Albuquerque, New Mexico, USA']","['New Line Cinema', 'Newman/Tooley Films', 'Slap Happy Productions (II)']","Awards, 4 wins & 17 nominations total","['Road Trip', 'Comedy', 'Crime']","['English', 'Spanish']"
17. American Hustle,2013,2h 18m,R,7.2,509K,90.0,"A con man, Irving Rosenfeld, along with his seductive partner Sydney Prosser, is forced to work for a wild F.B.I. Agent, Richie DiMaso, who pushes them into a world of Jersey powerbrokers and the Mafia.",https://www.imdb.com/title/tt1800241/?ref_=sr_i_17,"['Eric Warren Singer', 'David O. Russell']",['David O. Russell'],"['Christian Bale', 'Amy Adams', 'Bradley Cooper', 'Jennifer Lawrence', 'Jeremy Renner', 'Louis C.K.', 'Jack Huston', 'Michael Peña', 'Shea Whigham', 'Alessandro Nivola']","$40,000,000 (estimated)","$740,455","$251,171,807","$150,117,807","December 20, 2013","['United States', 'China']","['Boston, Massachusetts, USA (as Philadelphia)']","['Columbia Pictures', 'Annapurna Pictures', 'Atlas Entertainment']","Nominated for 10 Oscars, 70 wins & 228 nominations total","['Period Drama', 'True Crime', 'Crime', 'Drama']","['English', 'Arabic']"
18. The Great Gatsby,2013,2h 23m,PG-13,7.2,618K,55.0,"A writer and wall street trader, Nick Carraway, finds himself drawn to the past and lifestyle of his mysterious millionaire neighbor, Jay Gatsby, amid the riotous parties of the Jazz Age.",https://www.imdb.com/title/tt1343092/?ref_=sr_i_18,"['Baz Luhrmann', 'Craig Pearce', 'F. Scott Fitzgerald']",['Baz Luhrmann'],"['Leonardo DiCaprio', 'Carey Mulligan', 'Joel Edgerton', 'Tobey Maguire', 'Lisa Adam', 'Frank Aldridge', 'Amitabh Bachchan', 'Steve Bisley', 'Richard Carter', 'Jason Clarke']","$105,000,000 (estimated)","$50,085,185","$353,660,028","$144,857,996","May 10, 2013","['Australia', 'United States']","[""Centennial Park, Sydney, New South Wales, Australia (Gatsby's Estate and Nick Carraway's house set)""]","['Warner Bros.', 'Village Roadshow Pictures', 'A+E Networks']","Won 2 Oscars, 51 wins & 86 nominations total","['Period Drama', 'Tragedy', 'Tragic Romance', 'Drama', 'Romance']",['English']
19. The Conjuring,2013,1h 52m,R,7.5,581K,68.0,Paranormal investigators Ed and Lorraine Warren work to help a family terrorized by a dark presence in their farmhouse.,https://www.imdb.com/title/tt1457767/?ref_=sr_i_19,"['Chad Hayes', 'Carey W. Hayes']",['James Wan'],"['Patrick Wilson', 'Vera Farmiga', 'Ron Livingston', 'Lili Taylor', 'Shanley Caswell', 'Hayley McFarland', 'Joey King', 'Mackenzie Foy', 'Kyla Deaver', 'Shannon Kook']","$20,000,000 (estimated)","$41,855,326","$320,415,166","$137,446,368","July 19, 2013",['United States'],"['North Carolina, USA']","['New Line Cinema', 'The Safran Company', 'Evergreen Media Group']","Awards, 15 wins & 22 nominations total","['Supernatural Horror', 'Suspense Mystery', 'Horror', 'Mystery', 'Thriller']","['English', 'Latin']"
20. Identity Thief,2013,1h 51m,R,5.7,144K,35.0,Mild mannered businessman Sandy Patterson travels from Denver to Florida to confront the deceptively harmless looking woman who has been living it up after stealing Sandy's identity.,https://www.imdb.com/title/tt2024432/?ref_=sr_i_20,"['Craig Mazin', 'Jerry Eeten']",['Seth Gordon'],"['Jason Bateman', 'Melissa McCarthy', 'John Cho', 'Amanda Peet', 'Jon Favreau', ""Tip 'T.I.' Harris"", 'Genesis Rodriguez', 'Morris Chestnut', 'Robert Patrick', 'Eric Stonestreet']","$35,000,000 (estimated)","$34,551,025","$173,965,010","$134,506,920","February 8, 2013",['United States'],"['Chattanooga, Tennessee, USA (Market Street Bridge)']","['Aggregate Films', 'Bluegrass Films', 'DumbDumb']","Awards, 1 win & 9 nominations total","['Road Trip', 'Slapstick', 'Comedy', 'Crime', 'Drama']","['English', 'Spanish']"
21. Grown Ups 2,2013,1h 41m,PG-13,5.4,178K,19.0,"After moving his family back to his hometown to be with his friends and their kids, Lenny finds out that between old bullies, new bullies, schizo bus drivers, drunk cops on skis, and four hundred costumed party crashers sometimes crazy follows you.",https://www.imdb.com/title/tt2191701/?ref_=sr_i_21,"['Fred Wolf', 'Adam Sandler', 'Tim Herlihy']",['Dennis Dugan'],"['Adam Sandler', 'Kevin James', 'Chris Rock', 'David Spade', 'Salma Hayek', 'Maya Rudolph', 'Maria Bello', 'Nick Swardson', 'Steve Buscemi', 'Colin Quinn']","$80,000,000 (estimated)","$41,508,572","$246,984,278","$133,668,525","July 12, 2013",['United States'],"['Lynn, Massachusetts, USA']","['Columbia Pictures', 'Happy Madison Productions', 'Sony Pictures Releasing']","Awards, 5 wins & 15 nominations total",['Comedy'],"['English', 'Spanish', 'Ukrainian']"
22. The Wolverine,2013,2h 6m,PG-13,6.7,510K,61.0,"Wolverine comes to Japan to meet an old friend whose life he saved years ago, and gets embroiled in a conspiracy involving yakuza and mutants.",https://www.imdb.com/title/tt1430132/?ref_=sr_i_22,"['Mark Bomback', 'Scott Frank']",['James Mangold'],"['Hugh Jackman', 'Will Yun Lee', 'Tao Okamoto', 'Rila Fukushima', 'Hiroyuki Sanada', 'Svetlana Khodchenkova', 'Brian Tee', 'Hal Yamanouchi', 'Ken Yamamura', 'Famke Janssen']","$120,000,000 (estimated)","$53,113,752","$414,828,246","$132,556,852","July 26, 2013","['United States', 'United Kingdom', 'Japan']","['Omishima Island, Imabari, Ehime Prefecture, Japan (Logan chops up a tree)']","['Twentieth Century Fox', 'Marvel Entertainment', ""Donners' Company""]","Awards, 2 wins & 11 nominations total","['Samurai', 'Superhero', 'Action', 'Sci-Fi']","['English', 'Japanese']"
23. Anchorman 2: The Legend Continues,2013,1h 59m,PG-13,6.3,197K,61.0,"With the 1970s behind him, Ron Burgundy, San Diego's former top-rated newsreader, returns to take New York City's first twenty-four-hour news channel by storm.",https://www.imdb.com/title/tt1229340/?ref_=sr_i_23,"['Will Ferrell', 'Adam McKay']",['Adam McKay'],"['Will Ferrell', 'Christina Applegate', 'Paul Rudd', 'Steve Carell', 'David Koechner', 'Dylan Baker', 'Meagan Good', 'Judah Nelson', 'James Marsden', 'Greg Kinnear']","$50,000,000 (estimated)","$26,232,425","$173,649,931","$127,352,707","December 18, 2013",['United States'],"['St. Simons Island, Georgia, USA']","['Paramount Pictures', 'Apatow Productions', 'Digital Image Associates']","Awards, 1 win & 23 nominations total","['Farce', 'Satire', 'Comedy']",['English']
24. Lone Survivor,2013,2h 1m,R,7.5,315K,60.0,"Marcus Luttrell and his team set out on a mission to capture or kill notorious Taliban leader Ahmad Shah, in late June 2005. Marcus and his team are left to fight for their lives in one of the most valiant efforts of modern warfare.",https://www.imdb.com/title/tt1091191/?ref_=sr_i_24,"['Peter Berg', 'Marcus Luttrell', 'Patrick Robinson']",['Peter Berg'],"['Mark Wahlberg', 'Taylor Kitsch', 'Emile Hirsch', 'Ben Foster', 'Yousuf Azami', 'Ali Suliman', 'Eric Bana', 'Alexander Ludwig', 'Rich Ting', 'Dan Bilzerian']","$40,000,000 (estimated)","$90,872","$154,802,912","$125,095,601","January 10, 2014","['United States', 'United Kingdom']","['Albuquerque, New Mexico, USA']","['Film 44', 'Emmett/Furla Oasis Films', 'Spikings Entertainment']","Nominated for 2 Oscars, 6 wins & 16 nominations total","['Docudrama', 'One-Person Army Action', 'Action', 'Biography', 'Drama', 'War']","['English', 'Pashtu', 'Arabic']"
25. G.I. Joe: Retaliation,2013,1h 50m,PG-13,5.7,190K,41.0,The G.I. Joes are not only fighting their mortal enemy Cobra; they are forced to contend with threats from within the government that jeopardize their very existence.,https://www.imdb.com/title/tt1583421/?ref_=sr_i_25,"['Rhett Reese', 'Paul Wernick']",['Jon M. Chu'],"['Dwayne Johnson', 'Channing Tatum', 'Adrianne Palicki', 'Lee Byung-hun', 'Jonathan Pryce', 'Elodie Yung', 'Ray Stevenson', 'D.J. Cotrona', 'Ray Park', 'Luke Bracey']","$130,000,000 (estimated)","$40,501,814","$375,740,705","$122,523,060","March 28, 2013","['United States', 'Canada']","['Fort Pike, New Orleans, Louisiana, USA']","['Paramount Pictures', 'Metro-Goldwyn-Mayer (MGM)', 'Skydance Media']","Awards, 1 win & 12 nominations total","['Action', 'Adventure', 'Sci-Fi', 'Thriller']",['English']
26. Cloudy with a Chance of Meatballs 2,2013,1h 35m,PG,6.3,120K,59.0,"Flint Lockwood now works at The Live Corp Company for his idol Chester V. But he's forced to leave his post when he learns that his most infamous machine is still operational, and is churning out menacing food-animal hybrids.",https://www.imdb.com/title/tt1985966/?ref_=sr_i_26,"['Erica Rivinoja', 'John Francis Daley', 'Jonathan Goldstein']","['Cody Cameron', 'Kris Pearn']","['Bill Hader', 'Anna Faris', 'Will Forte', 'Neil Patrick Harris', 'James Caan', 'Andy Samberg', 'Benjamin Bratt', 'Terry Crews', 'Kristen Schaal', 'Cody Cameron']","$78,000,000 (estimated)","$34,017,930","$274,325,949","$119,793,567","September 27, 2013","['United States', 'Canada']","['Sony Pictures Studios - 10202 W. Washington Blvd., Culver City, California, USA (Studio)']","['Columbia Pictures', 'Sony Pictures Animation']","Nominated for 1 BAFTA Award, 16 nominations total","['Computer Animation', 'Adventure', 'Animation', 'Comedy', 'Family', 'Fantasy', 'Sci-Fi']","['English', 'Chinese']"
27. Now You See Me,2013,1h 55m,PG-13,7.2,733K,50.0,"An FBI agent and an Interpol detective track a team of illusionists who pull off bank heists during their performances, and reward their audiences with the money.",https://www.imdb.com/title/tt1670345/?ref_=sr_i_27,"['Ed Solomon', 'Boaz Yakin', 'Edward Ricourt']",['Louis Leterrier'],"['Jesse Eisenberg', 'Common', 'Mark Ruffalo', 'Woody Harrelson', 'Isla Fisher', 'Dave Franco', 'Mélanie Laurent', 'Morgan Freeman', 'Michael Caine', 'Michael Kelly']","$75,000,000 (estimated)","$29,350,389","$351,723,989","$117,723,989","May 31, 2013","['United States', 'France']","['5 Pointz - 45-46 Davis St, Long Island City, Queens, New York City, New York, USA']","['Summit Entertainment', 'K/O Paper Products', 'SOIXAN7E QUIN5E']","Awards, 1 win & 3 nominations total","['Caper', 'Heist', 'Crime', 'Mystery', 'Thriller']","['English', 'French']"
28. The Wolf of Wall Street,2013,3h,R,8.2,1.7M,75.0,"Based on the true story of Jordan Belfort, from his rise to a wealthy stock-broker living the high life to his fall involving crime, corruption and the federal government.",https://www.imdb.com/title/tt0993846/?ref_=sr_i_28,"['Terence Winter', 'Jordan Belfort']",['Martin Scorsese'],"['Leonardo DiCaprio', 'Jonah Hill', 'Margot Robbie', 'Matthew McConaughey', 'Kyle Chandler', 'Rob Reiner', 'Jon Bernthal', 'Jon Favreau', 'Jean Dujardin', 'Joanna Lumley']","$100,000,000 (estimated)","$18,361,578","$407,039,432","$116,900,694","December 25, 2013",['United States'],"['Portofino, Genoa, Liguria, Italy (when Jordan and Naomi receive news of death of aunt Emma)']","['Red Granite Pictures', 'Appian Way', 'Sikelia Productions']","Nominated for 5 Oscars, 38 wins & 180 nominations total","['Dark Comedy', 'Docudrama', 'Epic', 'Raunchy Comedy', 'Satire', 'True Crime', 'Biography', 'Comedy', 'Crime', 'Drama']","['English', 'French']"
