Title,Year,Duration,MPA,Rating,Votes,méta_score,description,Movie Link,writers,directors,stars,budget,opening_weekend_Gross,grossWorldWWide,gross_US_Canada,release_date,countries_origin,filming_locations,production_company,awards_content,genres,Languages
279. My Wife's Husband,1963,1h 21m,,6.5,976,,"After 13 years in Germany, Fernand is returning to his wife and his restaurant. But since his disappearance, his wife has started over with a Norman chef, sympathetic but a specialist of cooking with butter when Fernand cooks only with oil.",https://www.imdb.com/title/tt0056969/?ref_=sr_i_279,"['Pierre Lévy-Corti', 'Jean Le Vitte', 'Jean Manse']",['Gilles Grangier'],"['Fernandel', 'Bourvil', 'Claire Maurier', 'Andrex', 'Mag-Avril', 'Edmond Ardisson', 'Henri Arius', 'Laurence Lignières', 'Evelyne Séléna', 'Gaston Rey']",,,,,"December 20, 1963","['France', 'Italy']","['Paris Studios Cinéma, Billancourt, Hauts-de-Seine, France (Studio)']","['Agnes Delahaie Productions', 'Dear Film Produzione', 'Les Films Corona']",,['Comedy'],['French']
280. Slnko v sieti,1963,1h 30m,,7.4,1K,,"Oldrich ""Fajolo"" Fajták (Marián Bielik), a student who directs quasi-existentialist verbal abuse at his girlfriend Bela Blazejová (Jana Beláková), takes off to a formally volunteer summer work camp at a farm where he meets her grandfather.",https://www.imdb.com/title/tt0176155/?ref_=sr_i_280,['Alfonz Bednár'],['Stefan Uher'],"['Marián Bielik', 'Jana Beláková', 'Olga Salagová', 'Pavol Chrobák', 'Adam Janco', 'Eliska Nosálová', 'Andrej Vandlík', 'Peter Lobotka', 'Vladimír Malina', 'Zuzana Ruskova']",,,,,"February 15, 1963",['Czechoslovakia'],"['Bratislava, Slovakia']",['Filmové Studio Bratislava'],,['Drama'],"['Slovak', 'Czech']"
281. Bachpan,1963,,,5.8,7,,,https://www.imdb.com/title/tt0364218/?ref_=sr_i_281,"['Bhudo Advani', 'David', 'Jeevan Dhar']",['Nazir'],"['Bhudo Advani', 'David', 'Jeevan Dhar', 'Daisy Irani', 'Menka Irani', 'Salim Khan', 'Manorama', 'Salim']",,,,,,['India'],,,,['Drama'],['Hindi']
282. Nudes on Credit,1963,46m,,3.9,34,,Two con men in London discover a briefcase with several documents and credit cards. After they rack up enormous debt on the credit cards they realize the case belonged to a murdered spy who was in possession of sensitive Russian documents.,https://www.imdb.com/title/tt0391367/?ref_=sr_i_282,"['Joey Benson', 'Dan Hyland', 'Henry Miller']",['Nick Millard'],"['Joey Benson', 'Dan Hyland', 'Henry Miller', 'Lisa Palmer', 'Hermie Rose', 'Nicholas Savari']",,,,,"May 10, 1966",['United States'],"['San Francisco, California, USA']",,,['Comedy'],['English']
283. The Hook,1963,1h 38m,Approved,6.5,823,,"In the final days of the Korean War, an enemy airman is captured by three American soldiers who cannot bring themselves to follow the order to execute their prisoner.",https://www.imdb.com/title/tt0057152/?ref_=sr_i_283,"['Henry Denker', 'Vahé Katcha']",['George Seaton'],"['Kirk Douglas', 'Robert Walker Jr.', 'Nick Adams', 'Pancho Magalona', 'Nehemiah Persoff', 'Frank Richards', 'Barnaby Hale', 'John Alderson', 'Anders Andelius', 'Mark Miller']",,,,,"February 15, 1963",['United States'],"['Santa Catalina Island, Channel Islands, California, USA (location shooting)']",['Perlberg-Seaton Productions'],,"['Psychological Drama', 'Drama', 'War']","['English', 'Korean', 'Hebrew']"
284. Cairo,1963,1h 31m,,5.5,435,,An assortment of international criminals plans to steal priceless Egyptian artifacts from a Cairo museum.,https://www.imdb.com/title/tt0056894/?ref_=sr_i_284,"['Joan Scott', 'W.R. Burnett']",['Wolf Rilla'],"['George Sanders', 'Richard Johnson', 'Faten Hamama', 'John Meillon', 'Ahmad Mazhar', 'Eric Pohlmann', 'Walter Rilla', 'Kamal El-Shinnawi', 'Salah Nazmi', 'Shouweikar']",,,,,January 1963,"['United States', 'Egypt', 'United Kingdom']","['Cairo, Egypt']","['Lawrence P. Bachmann Productions', 'Metro-Goldwyn-Mayer British Studios']",,"['Caper', 'Crime', 'Drama']",['English']
285. The Yellow Canary,1963,1h 33m,,6.6,130,,"Arrogant pop singer Andy (Pat Boone) is about to be divorced by his wife (Barbara Eden), who treats his staff badly. On the same night he starts a job at a theater in Los Angeles, his infant son is kidnapped. Despite requests from the lead police officer on the case, Lieutenant Bonner (Jack Klugman), Paxton plays along with the kidnappers as they string him along although they are willing to kill.",https://www.imdb.com/title/tt0057700/?ref_=sr_i_285,"['Whit Masterson', 'Rod Serling']",['Buzz Kulik'],"['Pat Boone', 'Barbara Eden', 'Steve Forrest', 'Jack Klugman', 'Jesse White', 'Steve Harris', 'Milton Selzer', 'Jeff Corey', 'Jo Helton', 'Vici Raaf']",,,,,"August 9, 1963",['United States'],,"['Cooga Mooga', 'Twentieth Century Fox']",,"['Drama', 'Mystery', 'Thriller']",['English']
286. Deya Neya,1963,1h 47m,Not Rated,8.2,566,,The son of a wealthy industrialist aspires to be a singer against the wishes of his father.,https://www.imdb.com/title/tt3918808/?ref_=sr_i_286,['Bidhayak Bhattacharya'],"['Sunil Bannerjee', 'Sabbir Hossain Raj']","['Uttam Kumar', 'Tanuja Samarth', 'Ratan Banerjee', 'Sudhir Basu', 'Bidhayak Bhattacharya', 'Anil Bhowmik', 'Premangshu Bose', 'Sushil Chakraborty', 'Lily Chakravarty', 'Chunilal Chatterjee']",,,,,1963,['India'],,['Rupchhaya Chitra'],,['Drama'],['Bengali']
287. A Ticklish Affair,1963,1h 28m,Approved,5.8,634,,"When the kids of a young widow inadvertently send an SOS while playing with their uncle Cy's Navy Signal Lamp, the Navy sends their top man to investigate and he falls for their mother.",https://www.imdb.com/title/tt0057583/?ref_=sr_i_287,"['Ruth Brooks Flippen', 'Barbara Luther']",['George Sidney'],"['Shirley Jones', 'Gig Young', 'Red Buttons', 'Carolyn Jones', 'Edgar Buchanan', 'Eddie Applegate', 'Edward Platt', 'Bill Mumy', 'Bryan Russell', 'Robert Foulk']",,,,,"August 18, 1963",['United States'],"['San Diego, California, USA']",['Euterpe'],"Awards, 1 nomination total","['Romantic Comedy', 'Comedy', 'Romance']",['English']
288. Grahasti,1963,2h 34m,Not Rated,7.4,70,,"Harish, an auto factory owner, commutes between Delhi and Meerut, where his wife Maya, 8 kids, widowed sister Jamna, and her son Jaggu reside. The family rejoices when Harish visits on weekends.",https://www.imdb.com/title/tt0268342/?ref_=sr_i_288,"['Ashok Kumar', 'Nirupa Roy', 'Pushpavalli']",['Kishore Sahu'],"['Ashok Kumar', 'Nirupa Roy', 'Pushpavalli', 'Rajesh Kumar', 'Bharati Malwankar', 'Sudesh Kumar', 'Indrani Mukherjee', 'Manoj Kumar', 'Rajshree', 'Mehmood']",,,,,,['India'],,,,"['Drama', 'Family']",['Hindi']
289. Aliki My Love,1963,1h 40m,,4.7,150,,"A young but poor Casanova who inherits from his deceased uncle--the king of gravy--nothing but a small island in the Aegean, meets a beautiful islander and her mother who holds an unexpected secret that may fulfil everyone's dreams.",https://www.imdb.com/title/tt0252844/?ref_=sr_i_289,['George St. George'],['Rudolph Maté'],"['Aliki Vougiouklaki', 'Wilfrid Hyde-White', 'Jess Conrad', 'Katherine Kath', 'Paris Alexander', 'Giannis Pardos', 'Roland George', 'Aspa Nakapoulou']",,,,,"December 11, 1963","['United Kingdom', 'Greece']","['Ios Island, Greece']","['Aquarius Film', 'Finos Film']",,"['Comedy', 'Romance']",['English']
290. Something Different,1963,1h 25m,,6.9,910,,"Two stories are simultaneously told. One dutiful mother progressively becomes a frustrated woman who is the only one assuming the family responsibilities of working at home and looking after her only son, whereas her husband works all day, does not appreciate his wife's efforts and the only thing he does by the time he gets home is to read the newspaper and watch soccer matches. On the other hand, a female gymnast prepares for her last competition before her career retirement, but faces pressure from her trainer and a lack of motivation to keep going. The film depicts frustration on both sides, and parallels two worlds dominated by men, where women do not receive any recognition, and in case they do, it is momentary.",https://www.imdb.com/title/tt0057374/?ref_=sr_i_290,['Vera Chytilová'],['Vera Chytilová'],"['Eva Bosáková', 'Vera Uzelacová', 'Josef Langmiler', 'Jirí Kodet', 'Milivoj Uzelac Jr.', 'Miroslava Matlochová', 'Lubos Ogoun', 'Vladimir Bosak', 'Dagmar Cejnkova', 'Jirí Cejnek']",,,,,"December 20, 1963",['Czechoslovakia'],,"['Ceskoslovenský Státní Film', 'Filmové studio Barrandov']","Awards, 1 win total",['Drama'],['Czech']
291. La parmigiana,1963,1h 51m,,7.3,361,,"Dora, driven away from her town by malicious gossip following her first love affair, has a series of short-lived adventures until she falls in love with Nino, a small time crook. In Parma, a police officer courts her but she keeps thinking of Nino and makes up her mind to join him. But he has found a new lover.",https://www.imdb.com/title/tt0122207/?ref_=sr_i_291,"['Ruggero Maccari', 'Ettore Scola', 'Stefano Strucchi']",['Antonio Pietrangeli'],"['Nino Manfredi', 'Catherine Spaak', 'Didi Perego', 'Lando Buzzanca', 'Vanni De Maigret', ""Umberto D'Orsi"", 'Rosalia Maggio', 'Ugo Fangareggi', 'Nando Angelini', 'Salvo Randone']",,,,,"October 3, 1963",['Italy'],"['Dino De Laurentiis Cinematografica Studios, Rome, Lazio, Italy']",['Documento Film'],"Awards, 1 win & 2 nominations total","['Comedy', 'Drama']",['Italian']
292. Sextet,1963,1h 34m,,5.0,23,,"Six people randomly meets at a cottage. They pass through a series of conflicts connected to their past, and the events reveals the truth about them.",https://www.imdb.com/title/tt0058570/?ref_=sr_i_292,"['Poul Bach', 'Annelise Hovmand']",['Annelise Hovmand'],"['John Kelland', 'Ghita Nørby', 'Axel Strøbye', 'Ingrid Thulin', 'Hanne Ulrich', 'Ole Wegener']",,,,,"November 23, 1964",['Denmark'],,['Flamingo Film'],"Awards, 1 win total",['Drama'],['Danish']
293. That Kind of Girl,1963,1h 18m,Not Rated,5.3,176,,"London is in full '60s swing in ""That Kind of Girl,"" a shamelessly entertaining exploitation film that revels in sexual titillation while moralizing about the dangers of STDs.",https://www.imdb.com/title/tt0057574/?ref_=sr_i_293,['Jan Read'],"[""Gerry O'Hara""]","['Margaret Rose Keil', 'Linda Marlowe', 'David Weston', 'Peter Burton', 'Frank Jarvis', 'Richard Bebb', 'Graeme Bruce', 'Alexandra Dane', 'David Davenport', 'Max Faulkner']",,,,,June 1963,['United Kingdom'],"['Regent Street, London, England, UK (Eva exits the Polytechnic)']","['Animated Motion Pictures', 'Tekli British Productions']",,['Drama'],['English']
294. Vice and Virtue,1963,1h 48m,Not Rated,6.0,438,,"Set against the backdrop of the Nazi occupation of France, VICE AND VIRTURE is a stylized retelling of the Marquis de Sade's Justine, as envisioned by one of cinema's most provocative filmmakers Roger Vadim.",https://www.imdb.com/title/tt0056658/?ref_=sr_i_294,"['Roger Vailland', 'Roger Vadim', 'Claude Choublier']",['Roger Vadim'],"['Annie Girardot', 'Robert Hossein', 'Catherine Deneuve', 'O.E. Hasse', 'Valeria Ciangottini', 'Paul Gégauff', 'Serge Marquand', 'Georges Poujouly', 'Michel de Ré', 'Howard Vernon']",,,,,"March 1, 1963","['France', 'Italy']","['Franstudio, Saint-Maurice, Val-de-Marne, France (Studio)']","['S.N.E. Gaumont', 'Trianon Films', 'Ultra Film']",,"['Drama', 'War']",['French']
295. Enough Rope,1963,1h 44m,,6.3,220,,"Based on Patricia Highsmith's novel The Blunderer. In this drama, two total strangers suspect each other of murdering their own wives.",https://www.imdb.com/title/tt0057303/?ref_=sr_i_295,"['Jean Aurenche', 'Pierre Bost', 'Patricia Highsmith']",['Claude Autant-Lara'],"['Gert Fröbe', 'Marina Vlady', 'Robert Hossein', 'Harry Meyen', 'Maurice Ronet', 'Yvonne Furneaux', 'Laurence Badie', 'Paulette Dubost', 'Clara Gansard', 'Jacques Monod']",,,,,"July 14, 1966","['France', 'West Germany', 'Italy']","['Menton, Alpes-Maritimes, France (concert hall exterior)']","['Cocinor', 'Corona Filmproduktion', 'Galatea Film']",,"['Crime', 'Drama', 'Thriller']",['French']
296. Der Sittlichkeitsverbrecher,1963,1h 30m,,5.4,41,,"In exploring sex offenses, particularly against children, this film reveals the inner workings of the Zurich police and INTERPOL as they pursue persons accused of voyeurism, rape, fetishism, sadism, and masochism. After the criminals are arrested and given psychological tests, they may be sentenced to an institution or undergo brain surgery (with their consent) in order to be rehabilitated.",https://www.imdb.com/title/tt0143884/?ref_=sr_i_296,"['Wolfgang Menge', 'Franz Schnyder', 'Richard Schweizer']",['Franz Schnyder'],"['Peter Markus', 'Peter Arens', 'Freddy Karsten', 'Julia Vonderlinn', 'Rosalinde Renn', 'Franz Matter', 'Fred Tanner', 'Ellen Widmann', 'Hans Gaugler', 'Alex Freihart']",,,,,"March 26, 1964",['Switzerland'],"['Zurich, Switzerland']",['Praesens-Film'],,"['Crime', 'Drama']","['German', 'Swiss German']"
297. Ecco,1963,1h 40m,,5.4,143,,"A documentary highlighting some of the oddest, strangest and more grotesque examples of human behavior. Included are a tour of the Grand Guignol theater in Paris, a man who sticks long needles through his body, footage of reindeer being castrated, and more footage of lesbians and strippers.",https://www.imdb.com/title/tt0145091/?ref_=sr_i_297,"['Gianni Proia', 'Ugo Liberatore', 'Francesco Mazzei']",['Gianni Proia'],"['George Sanders', 'Alexander', 'Maria Ansaldi', 'Laura Betti', 'Léo Campion', 'Jacques Chazot', 'Mario De Simone', 'Eberhard Diepgen', 'Peter Kittelmann', 'Klaus-Rüdiger Landowsky']",,,,,"October 27, 1965",['Italy'],"['Exeter, Devon, England, UK']","['Julia Film', 'Cresa Roma', 'LCR Films']",,"['Documentary', 'Musical']","['Italian', 'Portuguese', 'English', 'French', 'Japanese', 'Latin']"
298. Parasmani,1963,2h 17m,Not Rated,6.5,60,,Paras delights the Emperor with his singing. He is granted a wish by the Emperor and he asks for the hand of the princess in marriage. The Emperor agrees to do so if Paras brings him a rare gem.,https://www.imdb.com/title/tt0242760/?ref_=sr_i_298,"['Pandit Madhur', 'C.K. Mast', 'Vishwanath Pande']",['Babubhai Mistry'],"['Gitanjali', 'Mahipal', 'Nalini Chonkar', 'Maruti', 'Uma Dutt', 'Naazi', 'Aruna Irani', 'Jugal Kishore', 'Shekhar Purohit', 'Ajit Soni']",,,,,,['India'],"['Basant Studio, Chembur, Mumbai, Maharashtra, India (Studio)']",['Movieland'],,"['Adventure', 'Drama', 'Fantasy', 'Musical']",['Hindi']
299. Il successo,1963,1h 44m,,7.0,310,,"With the desire to be rich gnawing at him, an arriviste pursues a golden real-estate opportunity at the expense of friends and family. Now, he has to renounce his dignity. What's the good of chasing success when you are left all alone?",https://www.imdb.com/title/tt0057540/?ref_=sr_i_299,"['Ruggero Maccari', 'Ettore Scola']","['Mauro Morassi', 'Dino Risi']","['Vittorio Gassman', 'Anouk Aimée', 'Jean-Louis Trintignant', 'Cristina Gaioni', 'Riccardo Garrone', 'Filippo Scelzo', 'Maria Grazia Spina', ""Umberto D'Orsi"", 'Leopoldo Trieste', 'Gastone Moschin']",,,,,"August 5, 1965","['Italy', 'France']","['Sardinia, Italy']","['Cinétel', 'Fair Film', 'Incei Film']",,['Comedy'],['Italian']
300. The Young Racers,1963,1h 24m,Not Rated,4.9,370,47.0,"A former race car driver-turned-writer attempts to expose a ruthless, womanizing Grand Prix racer - who may actually be sensitive and misunderstood.",https://www.imdb.com/title/tt0057706/?ref_=sr_i_300,['R. Wright Campbell'],['Roger Corman'],"['Mark Damon', 'William Campbell', 'Luana Anders', 'Patrick Magee', 'John McLaren', 'R. Wright Campbell', 'Milo Quesada', 'Anthony Marsh', 'Marie Versini', 'Margrete Robsahm']","$150,000 (estimated)",,,,January 1963,['United States'],"['Monte Carlo, Monaco']",['Alta Vista Productions'],,"['Action', 'Drama']",['English']
301. To Bed or Not to Bed,1963,1h 43m,,6.2,381,,Sordi gives a deep and touching comic performance as an Italian fur merchant who is going to Sweden for the first time to attend the annual fur auctions in Stockholm. The movie depicts the clash between his fantasies about sex in Sweden with the reality of what he finds.,https://www.imdb.com/title/tt0056995/?ref_=sr_i_301,['Rodolfo Sonego'],['Gian Luigi Polidoro'],"['Alberto Sordi', 'Gunilla Elm-Tornkvist', 'Anne-Charlotte Sjöberg', 'Barbro Wastenson', 'Monica Wastenson', 'Ulla Smidje', 'Ulf Palme', 'Lauritz Falk', 'Ulla Andersson', 'Nando Angelini']",,,,,"April 12, 1963",['Italy'],"['Lida Friluftsgård, Tullinge, Sweden (Exterior)']",['Dino de Laurentiis Cinematografica'],"Awards, 2 wins & 1 nomination total","['Comedy', 'Fantasy']",['Italian']
302. Anger,1963,1h 44m,Not Rated,6.7,556,,"""La Rabbia"" employs documentary footage (from the 1950s) and accompanying commentary to attempt to answer the existential question, Why are our lives characterized by discontent, anguish, and fear? The film is in two completely separate parts, and the directors of these respective sections, left-wing Pier Paolo Pasolini and conservative Giovanni Guareschi, offer the viewer contrasting analyses of and prescriptions for modern society. Part I, by Pasolini, is a denunciation of the offenses of Western culture, particularly those against colonized Africa. It is at the same time a chronicle of the liberation and independence of the former African colonies, portraying these peoples as the new protagonists of the world stage, holding up Marxism as their ""salvation,"" and suggesting that their ""innocent ferocity"" will be the new religion of the era. Guareschi's part, by contrast, constitutes a defense of Western civilization and a word of hope, couched in traditional Christian terms, for man's future.",https://www.imdb.com/title/tt0057442/?ref_=sr_i_302,"['Giovanni Guareschi', 'Pier Paolo Pasolini']","['Giovanni Guareschi', 'Pier Paolo Pasolini']","['Giorgio Bassani', 'Renato Guttuso', 'Gigi Artuso', 'Carlo Romano', 'Charles de Gaulle', 'Dwight D. Eisenhower', 'Yuri Gagarin', 'Ava Gardner', 'Nikita Khrushchev', 'Vladimir Lenin']",,,,,"April 13, 1963",['Italy'],,['Opus Films'],,['Documentary'],['Italian']
303. The Visit,1963,1h 26m,,7.4,687,,Twenty-four hours in the life of Pina and Adolfo. The story of a 36-year-old woman and the flashbacks that show the pair's lives and fills in some details of their other relationships.,https://www.imdb.com/title/tt0057664/?ref_=sr_i_303,"['Gino De Santis', 'Giuseppe De Santis', 'Ruggero Maccari']",['Antonio Pietrangeli'],"['Sandra Milo', 'François Périer', 'Mario Adorf', 'Gastone Moschin', 'Angela Minervini', 'Ettore Baraldi', 'Giancarlo Bellagamba', 'Bruno Benatti', 'Paola Del Bon', 'Ferdinando Gerra']",,,,,"June 21, 1965","['Italy', 'France']","['Borgoforte, Mantua, Lombardia, Italy']","['Aera Films', 'Zebra Films']","Awards, 1 win & 4 nominations total","['Comedy', 'Romance']","['Italian', 'English', 'Latin']"
304. A Place to Go,1963,1h 26m,,6.5,324,,A young man employed by a cigarette factory is tired of his working class status and joins a gang planning to rob the factory warehouse.,https://www.imdb.com/title/tt0057415/?ref_=sr_i_304,"['Michael Fisher', 'Michael Relph', 'Clive Exton']",['Basil Dearden'],"['Rita Tushingham', 'Michael Sarne', 'Bernard Lee', 'Doris Hare', 'John Slater', 'Barbara Ferris', 'David Andrews', 'William Marlowe', 'Roy Kinnear', 'Michael Wynne']","£155,000 (estimated)",,,,July 1963,['United Kingdom'],"['Bethnal Green, London, England, UK (studio: made on location in)']","['Excalibur Films', 'British Lion Film Corporation']",,"['Crime', 'Drama']",['English']
305. Naked Among Wolves,1963,1h 40m,Not Rated,7.2,859,,"In the last weeks of World War II, inmates of Buchenwald concentration camp hide a Polish child from the SS guards, hoping that the advance of the American forces will set them free.",https://www.imdb.com/title/tt0056271/?ref_=sr_i_305,"['Bruno Apitz', 'Frank Beyer']",['Frank Beyer'],"['Erwin Geschonneck', 'Armin Mueller-Stahl', 'Krystyn Wójcik', 'Fred Delmare', 'Viktor Avdyushko', 'Gerry Wolff', 'Boleslaw Plotnicki', 'Peter Sturm', 'Peter Paul Goes', 'Albert Zahn']",,,,,"April 10, 1963",['East Germany'],"['Buchenwald memorial, Thuringia, Germany']","['DEFA-Studio für Spielfilme', ""Künstlerische Arbeitsgruppe ''Roter Kreis''""]","Awards, 1 win & 1 nomination total","['Drama', 'War']","['German', 'Polish', 'Czech', 'French', 'Russian', 'English']"
306. The Man from Galveston,1963,57m,Not Rated,6.0,147,,"In 1800s Texas, during the early days of circuit-courts, lawyers had to be handy with their guns as well as with their law books when facing lynch mobs bent on administering frontier justice.",https://www.imdb.com/title/tt0057283/?ref_=sr_i_306,"['Dean Riesner', 'Michael Zagor']",['William Conrad'],"['Jeffrey Hunter', 'Preston Foster', 'James Coburn', 'Joanna Moore', 'Edward Andrews', 'Kevin Hagen', 'Martin West', 'Ed Nelson', 'Karl Swenson', 'Grace Lee Whitney']",,,,,"December 18, 1963",['United States'],"['Warner Brothers Burbank Studios - 4000 Warner Boulevard, Burbank, California, USA (Studio)']",['Warner Bros.'],,['Western'],['English']
307. Three Ruthless Ones,1963,1h 37m,,6.0,195,,Three unequal brothers seek revenge for the murder of their father. Each of them goes a different way.,https://www.imdb.com/title/tt0057464/?ref_=sr_i_307,"['Joaquín Luis Romero Marchent', 'Jesús Navarro Carrión', 'Rafael Romero Marchent']",['Joaquín Luis Romero Marchent'],"['Richard Harrison', 'Fernando Sancho', 'Gloria Milland', 'Robert Hundar', 'Miguel Palenzuela', 'Gloria Osuna', 'Luis Induni', 'Carlos Romero Marchent', 'José Manuel Martín', 'José Truchado']",,,,,"December 19, 1963","['Spain', 'Italy']","['Almeria, Andalucia, Spain']","['Centauro Films', 'Produzioni Europee Associate (PEA)']","Awards, 1 win total","['Spaghetti Western', 'Western']","['Italian', 'Spanish']"
308. Tamahine,1963,1h 35m,,5.9,168,,"A free-spirited young Polynesian girl is sent to live with her uncle in England. The many social and other rules new to her that she encounters there, as well as attention from student body of a local school cause much hilarity.",https://www.imdb.com/title/tt0058636/?ref_=sr_i_308,"['Denis Cannan', 'Thelma Niklaus']",['Philip Leacock'],"['Nancy Kwan', 'John Fraser', 'Dennis Price', 'Coral Browne', 'Dick Bentley', 'Derek Nimmo', 'Justine Lord', 'Michael Gough', 'Allan Cuthbertson', 'Noel Hood']",,,,,"May 3, 1964",['United Kingdom'],"['Bora Bora, Leeward Islands, French Polynesia']",['Associated British Picture Corporation (ABPC)'],"Nominated for 1 BAFTA Award, 1 nomination total","['Comedy', 'Sport']",['English']
309. Gumrah,1963,2h 35m,,6.9,183,,"Meena is in love with a singer, Rajendra, but when her sister, Kamla, dies in an accident, she is forced to marry her late sister's husband for the sake of her sister's children.",https://www.imdb.com/title/tt0057120/?ref_=sr_i_309,['Akhtar-Ul-Iman'],['B.R. Chopra'],"['Ashok Kumar', 'Mala Sinha', 'Sunil Dutt', 'Nirupa Roy', 'Shashikala Jawalkar', 'Deven Verma', 'Nana Palsikar', 'Moolchand', 'Karan Dewan', 'Shyama']",,,,,"January 1, 1963",['India'],,['NH Studioz'],"Awards, 4 wins & 5 nominations total","['Drama', 'Romance']",['Hindi']
310. The Ceremony,1963,1h 45m,Not Rated,5.7,260,,"A bank robber is sentenced to prison for committing a murder during the robbery. His brother comes up with a plan to break him out of prison--but on the condition that his brother's girlfriend ""date"" him first.",https://www.imdb.com/title/tt0056918/?ref_=sr_i_310,"['Frédéric Grendel', 'Ben Barzman', 'Laurence Harvey']",['Laurence Harvey'],"['Laurence Harvey', 'Sarah Miles', 'Robert Walker Jr.', 'Lee Patterson', 'Jack MacGowran', 'Noel Purcell', 'Carlos Casaravilla', 'Xan das Bolas', 'John Ireland', 'Ross Martin']",,,,,"April 3, 1964","['Spain', 'United States']","['Tangier, Morocco']","['Magla', 'Laurence Harvey Productions']","Awards, 1 win & 1 nomination total","['Crime', 'Drama']",['English']
311. The Dark Room of Damocles,1963,1h 59m,Not Rated,6.9,797,,"The fainthearted cigar trader Ducker keeps himself quiet during World War II. That changes when parachutist Dorbeck lands in his backyard. It turns out the parachutist bears a remarkable resemblance to Ducker. Ducker follows Dorbeck blindly, becomes involved in the Dutch resistance and soon starts killing people. When he escapes through German lines to the freed South Netherlands, no one has ever heard of Dorbeck.",https://www.imdb.com/title/tt0056823/?ref_=sr_i_311,"['Willem Frederik Hermans', 'Fons Rademakers']",['Fons Rademakers'],"['Lex Schoorel', 'Nan Los', 'Van Doude', 'Guus Verstraete', 'Ko Arnoldi', 'Frits Butzelaar', 'Jos Gevers', 'Mia Goossen', 'Elise Hoomans', 'Hans Polman']","NLG620,000 (estimated)",,,,"February 21, 1963",['Netherlands'],,"['Cineurope', 'Heineken Branded Entertainment']","Awards, 1 nomination total","['Drama', 'War']","['Dutch', 'German']"
312. Wall of Noise,1963,1h 52m,Approved,6.0,296,,"Joel Tarrant is an ambitious horse trainer working at the Hollywood Race Track. He works for the coarse Matt Rubio, whose wife Laura expresses a special interest in Joel's social life.",https://www.imdb.com/title/tt0057667/?ref_=sr_i_312,"['Daniel Michael Stein', 'Joseph Landon']",['Richard Wilson'],"['Suzanne Pleshette', 'Ty Hardin', 'Dorothy Provine', 'Ralph Meeker', 'Simon Oakland', 'Jimmy Murphy', 'Murray Matheson', 'Robert F. Simon', 'George Petrie', 'Jean Byron']",,,,,"November 29, 1963",['United States'],"['Hollywood Park, Ingelwood, California, USA (racetrack)']",['Warner Bros.'],,"['Workplace Drama', 'Drama', 'Romance']",['English']
