Title,Year,Duration,MPA,Rating,Votes,méta_score,description,Movie Link,writers,directors,stars,budget,opening_weekend_Gross,grossWorldWWide,gross_US_Canada,release_date,countries_origin,filming_locations,production_company,awards_content,genres,Languages
167. Request Concert,1940,1h 43m,,6.0,200,,"At the Olympic games in Berlin 1936 Inge Wagner falls in love with Luftwaffenleutnant (Airforce Lieutenant) Herbert Koch. They want to marry, but he receives orders to go to Spain - incognito, without permission for any contacts to his friends and relatives. Inge is still waiting for him. After the beginning of WW II, German radio starts broadcasting the ""Wunschkonzert für die Wehrmacht"" - a program made of wishes from the soldiers. He hears the song, he wanted to hear, and so does Inge. A friend of Inge, who hopes she is willing to marry him, comes to the same squadron where Koch flies. Koch and Inge arrange a date at a Hamburg restaurant, but he and Ilse's friend are shot down the day before. In the hospital Koch finds out, that he and his friend love the same girl. He thinks they are already engaged and is willing to give her up.",https://www.imdb.com/title/tt0033275/?ref_=sr_i_167,"['Joseph Goebbels', 'Felix Lützkendorf', 'Eduard von Borsody']",['Eduard von Borsody'],"['Hedwig Bleibtreu', 'Joachim Brennecke', 'Heinz Goedecke', 'Paul Hörbiger', 'Carl Raddatz', 'Heinz Rühmann', 'Ilse Werner', 'Ida Wüst', 'Hans Hermann Schaufuß', 'Hans Adalbert Schlettow']",,,,,"December 30, 1940",['Germany'],"['Berlin, Germany']","['Cine-Allianz Tonfilmproduktions GmbH', 'Universum Film (UFA)']","Awards, 1 nomination total","['Musical', 'Romance', 'War']",['German']
168. The Durango Kid,1940,1h 1m,Approved,6.2,192,,"Bill Lowry returns just as his father is killed. He suspects Ballard and in the guise of the Durango Kid, starts robbing him. He gives the money to the burned out homesteaders but Ballard catches Nancy with the money. Ballard suspects Lowry is the Kid and tells him he has retrieved the money. Thinking the Kid will try to get the money back, he sets a trap for him.",https://www.imdb.com/title/tt0032423/?ref_=sr_i_168,['Paul Franklin'],['Lambert Hillyer'],"['Charles Starrett', 'Luana Walters', 'Kenneth MacDonald', 'Francis Walker', 'Forrest Taylor', 'Melvin Lang', 'Bob Nolan', 'Pat Brady', 'Frank LaRue', 'Sons of the Pioneers']",,,,,"August 15, 1940",['United States'],"['Agoura Ranch, Agoura, California, USA']",['Columbia Pictures'],,['Western'],['English']
169. South of Pago Pago,1940,1h 38m,Approved,6.4,167,,"The son of an island chieftain, young Kehane defiantly opposes the efforts by crooked pearl hunter Bucko Larson to invade his domain. Larson and his minions hope to dissuade the young man by introducing him to seductive Ruby.",https://www.imdb.com/title/tt0033082/?ref_=sr_i_169,"['George Bruce', 'Kenneth Gamet']",['Alfred E. Green'],"['Victor McLaglen', 'Jon Hall', 'Frances Farmer', 'Olympe Bradna', 'Gene Lockhart', 'Douglass Dumbrille', 'Francis Ford', 'Ben Welden', 'Abner Biberman', 'Pedro de Cordoba']","$800,000 (estimated)",,,,"July 19, 1940",['United States'],"['Santa Catalina Island, Channel Islands, California, USA (underwater scenes)']",['Edward Small Productions'],"Awards, 1 win total","['Action', 'Adventure', 'Crime', 'Romance']",['English']
170. Spring Parade,1940,1h 29m,Approved,6.7,397,,"A young Hungarian woman whose fortune card predicts that she will marry, may find it coming true after she meets an army drummer.",https://www.imdb.com/title/tt0033095/?ref_=sr_i_170,"['Bruce Manning', 'Felix Jackson', 'Ernst Marischka']",['Henry Koster'],"['Deanna Durbin', 'Robert Cummings', 'Mischa Auer', 'Henry Stephenson', 'S.Z. Sakall', 'Billy Lenhart', 'Kenneth Brown', 'Walter Catlett', 'Anne Gwynne', 'Allyn Joslyn']",,,,,"September 27, 1940",['United States'],"['Universal Studios - 100 Universal City Plaza, Universal City, California, USA']",['Universal Pictures'],"Nominated for 4 Oscars, 2 wins & 4 nominations total","['Comedy', 'Musical', 'Romance']",['English']
171. Dead Man's Shoes,1940,1h 10m,,7.9,36,,"An amnesia victim is a well liked and respected member of his community--until one day someone from his past shows up with evidence that in ""the old days"" he had been a notorious criminal, and threatens to expose him unless he pays off.",https://www.imdb.com/title/tt0031217/?ref_=sr_i_171,"['Nina Jarvis', 'John H. Kafka']",['Thomas Bentley'],"['Leslie Banks', 'Joan Marion', 'Geoffrey Atkins', 'Wilfrid Lawson', 'Judy Kelly', 'Nancy Price', 'Walter Hudd', 'Peter Bull', 'Henry Oscar', 'Ludwig Stössel']",,,,,"May 5, 1940",['United Kingdom'],,['Associated British Picture Corporation (ABPC)'],,['Drama'],['English']
172. The Villain Still Pursued Her,1940,1h 6m,Approved,5.4,392,,A widow and her daughter are threatened with eviction by an unscrupulous lawyer.,https://www.imdb.com/title/tt0033224/?ref_=sr_i_172,"['Elbert Franklin', 'Ethel La Blanche']",['Edward F. Cline'],"['Hugh Herbert', 'Anita Louise', 'Alan Mowbray', 'Buster Keaton', 'Joyce Compton', 'Richard Cromwell', 'Billy Gilbert', 'Margaret Hamilton', 'Diane Fisher', 'Charles Judels']",,,,,"October 11, 1940",['United States'],,['Franklin-Blank Productions'],,['Comedy'],"['French', 'English']"
173. Colorado,1940,57m,Approved,5.9,307,,"Trouble in Colorado is tying up Union troops needed back east during the Civil War and Lieut. Burke is sent to investigate. Macklin and his gang are causing the problems and Capt. Mason joins them. When Burke catches up with them he also finds Mason, his brother.",https://www.imdb.com/title/tt0032346/?ref_=sr_i_173,"['Louis Stevens', 'Harrison Jacobs']",['Joseph Kane'],"['Roy Rogers', ""George 'Gabby' Hayes"", 'Pauline Moore', 'Milburn Stone', 'Maude Eburne', 'Arthur Loft', 'Hal Taliaferro', 'Vester Pegg', 'Fred Burns', 'Lloyd Ingraham']",,,,,"September 15, 1940",['United States'],"['Agoura Ranch, Agoura, California, USA']",['Republic Pictures (I)'],,['Western'],['English']
174. Lillian Russell,1940,2h 7m,Approved,6.4,604,,"The life story of the musical star from her discovery in 1890 by bandleader Tony Pastor until her retirement in 1912, when she married newspaperman Alexander Moore.",https://www.imdb.com/title/tt0032710/?ref_=sr_i_174,['William Anthony McGuire'],['Irving Cummings'],"['Alice Faye', 'Don Ameche', 'Henry Fonda', 'Edward Arnold', 'Warren William', 'Leo Carrillo', 'Helen Westley', 'Dorothy Peterson', 'Ernest Truex', 'Nigel Bruce']",,,,,"May 24, 1940",['United States'],"['T.J. Bradford Estate, Pasadena, California, USA']",['Twentieth Century Fox'],"Nominated for 1 Oscar, 2 wins & 1 nomination total","['Biography', 'Drama', 'History', 'Music']",['English']
175. Irene,1940,1h 41m,Approved,6.3,808,,"Sent by her employers on an errand to the home of the wealthy Mrs. Vincent, Irene O'Dare meets Don, a friend of Mrs. Vincent's son Bob. Attracted to Irene, Don decides to invest some money in Bob's latest venture, the ""Madame Lucy"" dress shop, in order to give Irene a job there as a model. She is very successful and Bob also becomes attracted to her. Smith, the manager, assigns Irene and other models to display gowns at Mrs. Vincent's charity ball, but Irene ruins the gown she was to wear, and appears instead in a quaint blue dress that had belonged to her mother--and it is a big hit. A guest, Princess Minetti, places her as the niece of Ireland's Lady O'Dare, and Irene does not deny the relationship. Smith decides to set her up in a Park Avenue suite as Lady O'Dare's niece so she can attend socially-important gatherings, wearing and displaying ""Madame Lucy"" gowns. A jealous model tells the truth to a newspaper columnist who writes an expose' that strains the relationship between Irene and Don, who had been away and was unaware of the scheme--and is the real owner behind the ""Madame Lucy"" front.",https://www.imdb.com/title/tt0032638/?ref_=sr_i_175,"['Alice Duer Miller', 'James Montgomery']",['Herbert Wilcox'],"['Anna Neagle', 'Ray Milland', 'Roland Young', 'Alan Marshal', 'May Robson', 'Billie Burke', 'Arthur Treacher', 'Marsha Hunt', 'Isabel Jewell', 'Doris Nolan']","$578,000 (estimated)",,,,"May 3, 1940",['United States'],"['Manhattan, New York City, New York, USA (establishing shots - archive footage)']",['Imperadio Pictures Ltd.'],"Nominated for 1 Oscar, 2 wins & 1 nomination total","['Comedy', 'Musical', 'Mystery', 'Romance']","['English', 'French']"
176. Wildcat Bus,1940,1h 4m,Approved,5.2,226,,"A small bus company run by a father/daughter team comes under attack by a group of ""wildcatters"" who want to put the company out of business so they can take over the profitable Los Angeles-to-San Francisco route.",https://www.imdb.com/title/tt0033265/?ref_=sr_i_176,['Lou Lusty'],['Frank Woodruff'],"['Fay Wray', 'Charles Lang', 'Paul Guilfoyle', 'Don Costello', 'Paul McGrath', 'Joe Sawyer', 'Roland Drew', 'Leona Roberts', ""Oscar O'Shea"", 'Frank Shannon']",,,,,"August 23, 1940",['United States'],"['Sunset Tower Hotel - 8358 Sunset Blvd, West Hollywood, California, USA (Iroquois Apartments)']",['RKO Radio Pictures'],,"['Action', 'Crime', 'Drama', 'Mystery', 'Romance', 'Thriller']","['English', 'Spanish']"
177. Torrid Zone,1940,1h 28m,Approved,6.7,1.5K,,"Plagued by revolutionaries that harass his plantation in a banana republic, fruit company exec Steve Case rehires former nemesis Nick Butler to restore order and profits.",https://www.imdb.com/title/tt0033175/?ref_=sr_i_177,"['Richard Macaulay', 'Jerry Wald']",['William Keighley'],"['James Cagney', 'Ann Sheridan', ""Pat O'Brien"", 'Andy Devine', 'Helen Vinson', 'Jerome Cowan', 'George Tobias', 'George Reeves', 'Victor Kilian', 'Frank Puglia']",,,,,"May 25, 1940",['United States'],"['Warner Brothers Burbank Studios - 4000 Warner Boulevard, Burbank, California, USA (Studio)']",['Warner Bros.'],"Awards, 2 wins total","['Screwball Comedy', 'Action', 'Adventure', 'Comedy', 'Romance']","['English', 'Spanish']"
178. New Moon,1940,1h 45m,Approved,6.6,676,,"On a Louisiana-bound ship, a nobleman planning a campaign for liberty encounters an heiress.",https://www.imdb.com/title/tt0032840/?ref_=sr_i_178,"['Oscar Hammerstein II', 'Frank Mandel', 'Laurence Schwab']","['Robert Z. Leonard', 'W.S. Van Dyke']","['Jeanette MacDonald', 'Nelson Eddy', 'Mary Boland', 'George Zucco', 'H.B. Warner', 'Grant Mitchell', 'Stanley Fields', 'Dick Purcell', 'John Miljan', 'Ivan F. Simpson']",,,,,"June 28, 1940",['United States'],"['Santa Catalina Island, Channel Islands, California, USA']",['Metro-Goldwyn-Mayer (MGM)'],"Awards, 1 win total","['Adventure', 'Musical', 'Romance']",['English']
179. Little Old New York,1940,1h 40m,Approved,6.4,275,,"Steamboat inventor Robert Fulton shows up in New York in 1807. Tavern keeper Pat O'Day believes in him, but her boyfriend doesn't. All seems lost after sailors, afraid of losing their jobs, burn his boat.",https://www.imdb.com/title/tt0032719/?ref_=sr_i_179,"['Harry Tugend', 'John L. Balderston', 'Rida Johnson Young']",['Henry King'],"['Alice Faye', 'Fred MacMurray', 'Richard Greene', 'Brenda Joyce', 'Andy Devine', 'Henry Stephenson', 'Fritz Feld', 'Ward Bond', 'Clarence Wilson', 'Robert Middlemass']",,,,,"February 9, 1940",['United States'],"['Stage 9, 20th Century Fox Studios - 10201 Pico Blvd., Century City, Los Angeles, California, USA (Studio)']",['Twentieth Century Fox'],,"['Biography', 'Comedy', 'Drama', 'History', 'Romance']",['English']
180. Maryland,1940,1h 32m,Approved,6.1,175,,"A woman tormented by the hunting death of her husband forbids her son to have anything to do with horses. But after he falls for the daughter of his father's trainer, he defies his mother by entering the Maryland Hunt.",https://www.imdb.com/title/tt0032766/?ref_=sr_i_180,"['Jack Andrews', 'Ethel Hill']",['Henry King'],"['Walter Brennan', 'Fay Bainter', 'Brenda Joyce', 'John Payne', 'Charles Ruggles', 'Hattie McDaniel', 'Marjorie Weaver', 'Sidney Blackmer', 'Ben Carter', 'Ernest Whitman']",,,,,"July 19, 1940",['United States'],"['20th Century Fox Studios - 10201 Pico Blvd., Century City, Los Angeles, California, USA (Studio)']",['Twentieth Century Fox'],"Awards, 2 wins total","['Drama', 'Mystery', 'Romance']",['English']
181. Anne of Windy Poplars,1940,1h 26m,Approved,6.3,237,,"Anne Shirley, now betrothed to her childhood sweetheart Gilbert Blythe, takes a teaching position in a prestigious school far from her home on Prince Edward Island. While she is quickly accepted by her host family, the rest of the town, headed by the clannish Pringle family, refuses to accept her, on the orders of the head of the Pringle tribe, Hester Pringle.",https://www.imdb.com/title/tt0032211/?ref_=sr_i_181,"['Michael Kanin', 'Jerome Cady', 'Lucy Maud Montgomery']",['Jack Hively'],"['Anne Shirley', 'James Ellison', 'Henry Travers', 'Patric Knowles', 'Slim Summerville', 'Elizabeth Patterson', 'Louise Campbell', 'Joan Carroll', 'Katharine Alexander', 'Minnie Dupree']",,,,,"June 28, 1940",['United States'],"['RKO Studios - 780 N. Gower Street, Hollywood, Los Angeles, California, USA (Studio)']",['RKO Radio Pictures'],,"['Drama', 'Romance']",['English']
182. The Boys from Syracuse,1940,1h 13m,Approved,5.8,172,,"The action takes place in Ephesus in ancient Asia Minor, and the story concerns the efforts of two boys from Syracuse, Antipholus and his servant Dromio, to find their long-lost twins who, for reason of plot confusion, are also named Antipholus and Dromio. Complications arise when the wives of Ephesians, Adriana and her servant Luce, mistake the two strangers for their husbands, though the couples eventually get sorted out after Adriana's sister Phyllis and the Syracusan Antipholus admit their love.",https://www.imdb.com/title/tt0032276/?ref_=sr_i_182,"['George Abbott', 'Charles Grayson', 'Titus Maccius Plautus']",['A. Edward Sutherland'],"['Allan Jones', 'Irene Hervey', 'Martha Raye', 'Joe Penner', 'Alan Mowbray', 'Charles Butterworth', 'Rosemary Lane', 'Samuel S. Hinds', 'Tom Dugan', 'Spencer Charters']",,,,,"August 9, 1940",['United States'],"['Universal Studios - 100 Universal City Plaza, Universal City, California, USA (Studio)']",['Mayfair Productions Inc.'],"Nominated for 2 Oscars, 2 nominations total","['Comedy', 'Musical']",['English']
183. Dr. Kildare's Strange Case,1940,1h 17m,Approved,6.0,665,,Young Dr. Kildare tries to help an unlucky brain surgeon and his seemingly insane patient.,https://www.imdb.com/title/tt0032416/?ref_=sr_i_183,"['Harry Ruskin', 'Willis Goldbeck', 'Max Brand']",['Harold S. Bucquet'],"['Lew Ayres', 'Lionel Barrymore', 'Laraine Day', 'Shepperd Strudwick', 'Samuel S. Hinds', 'Emma Dunn', 'Nat Pendleton', 'Walter Kingsford', 'Alma Kruger', 'John Eldredge']",,,,,"April 12, 1940",['United States'],"['Metro-Goldwyn-Mayer Studios - 10202 W. Washington Blvd., Culver City, California, USA']","[""Loew's""]",,"['Medical Drama', 'Workplace Drama', 'Crime', 'Drama']",['English']
184. Music in My Heart,1940,1h 10m,Approved,6.0,650,,"Rita Hayworth co-stars with famed recording artist Tony Martin in this musical comedy featuring the music of Andre Kostelanetz and his orchestra. Following various comic misunderstandings, the two meet and fall for each other, but will lose their chance at happiness unless destiny calls.",https://www.imdb.com/title/tt0032823/?ref_=sr_i_184,['James Edward Grant'],['Joseph Santley'],"['Tony Martin', 'Rita Hayworth', 'Edith Fellows', 'Andre Kostelanetz and His Orchestra', 'Alan Mowbray', 'Eric Blore', 'George Tobias', 'Joseph Crehan', 'George Humbert', 'Joey Ray']",,,,,"January 10, 1940",['United States'],,['Columbia Pictures'],"Nominated for 1 Oscar, 1 nomination total","['Musical', 'Romance']",['English']
185. Young Tom Edison,1940,1h 26m,Approved,6.8,1.3K,,"Since he was a child, Thomas Alba Edison began carrying out his first chemical experiments in the basement of his house. In addition, he had to practice multiple occupations before he could register his first patent.",https://www.imdb.com/title/tt0033289/?ref_=sr_i_185,"['Bradbury Foote', 'Dore Schary', 'Hugo Butler']",['Norman Taurog'],"['Mickey Rooney', 'Fay Bainter', 'George Bancroft', 'Virginia Weidler', 'Eugene Pallette', 'Victor Kilian', 'Bobby Jordan', 'J.M. Kerrigan', 'Lloyd Corrigan', 'John Kellogg']",,,,,"March 15, 1940",['United States'],"['California, USA']","[""Loew's""]","Awards, 2 wins total","['Biography', 'Drama', 'Family']",['English']
186. Wagon Train,1940,59m,Approved,5.9,287,,"Pecos businessman Matt Gardner is buying up freighters, or wagon trains of food supplies, at cheap prices through intimidation, and charging high prices by deliberately causing phony food shortages at his trading posts. The only one refusing to sell his supplies is Zack Sibley, who is dead set on maintaining his freighter business as well as tracking down his father's murderer, his ex-business partner. Gardner plans on eliminating any competition Sibley presents by sending his thugs to kill him and raid his wagon train.",https://www.imdb.com/title/tt0033234/?ref_=sr_i_186,"['Morton Grant', 'Bernard McConville']",['Edward Killy'],"['Tim Holt', 'Ray Whitley', 'Emmett Lynn', ""Martha O'Driscoll"", ""Malcolm 'Bud' McTaggart"", 'Cliff Clark', 'Ellen Lowe', 'Wade Crosby', 'Ethan Laidlaw', 'Monte Montague']",,,,,"October 4, 1940",['United States'],"['Kanab, Utah, USA']",['RKO Radio Pictures'],,"['Drama', 'Western']",['English']
187. Blondie on a Budget,1940,1h 12m,Approved,6.5,569,,"Dagwood wants to join the trout club and Blondie wants a fur coat. Jealousy reigns when Dag's old girlfriend Joan shows up, but nothing else matters when a drawing at the movie theatre provides money for the coat.",https://www.imdb.com/title/tt0032263/?ref_=sr_i_187,"['Richard Flournoy', 'Charles M. Brown', 'Chic Young']",['Frank R. Strayer'],"['Penny Singleton', 'Arthur Lake', 'Larry Simms', 'Daisy', 'Rita Hayworth', 'Danny Mummert', 'Don Beddoe', 'John Qualen', 'Fay Helm', 'Irving Bacon']",,,,,"February 29, 1940",['United States'],"['4227 Agnes Avenue, Studio City, Los Angeles, California, USA (Bumstead house)']",['Columbia Pictures'],,"['Comedy', 'Family']",['English']
188. Familien Olsen,1940,1h 31m,,6.0,34,,Greengrocer Olsen is called for jury duty in a case against a CEO. It burdens him extra finding out his son stole DKK500 from the CEO's company and his daughter is secretly dating the CEO's son.,https://www.imdb.com/title/tt0032452/?ref_=sr_i_188,"['Oluf Bang', 'Fleming Lynge', 'Svend Rindom']","['Lau Lauritzen', ""Alice O'Fredericks""]","['Osvald Helmuth', 'Maria Garland', 'Berthe Qvistgaard', 'Karl Gustav Ahlefeldt', 'Ib Schønberg', 'Axel Frische', 'Sigfred Johansen', 'Jon Iversen', 'Ejner Federspiel', 'Viggo Brodthagen']",,,,,"March 18, 1940",['Denmark'],,['ASA Film'],,"['Comedy', 'Crime', 'Drama', 'Family']",['Danish']
189. Return to Yesterday,1940,1h 9m,,6.4,161,,"Robert Maine is torn between returning to the glamour of Hollywood or working with a small theatre company in England. When she falls in love with Maine, Carol has the same dilemma.",https://www.imdb.com/title/tt0031853/?ref_=sr_i_189,"['Robert Morley', 'Robert Stevenson', 'Roland Pertwee']",['Robert Stevenson'],"['Clive Brook', 'Anna Lee', 'May Whitty', 'Hartley Power', 'Milton Rosmer', 'David Tree', 'Olga Lindo', 'Garry Marsh', 'Arthur Margetson', 'Elliott Mason']",,,,,"October 26, 1942",['United Kingdom'],"['Teignmouth, Devon, England, UK']","['CAPAD', 'Ealing Studios']",,['Drama'],['English']
190. Hired Wife,1940,1h 36m,Approved,6.6,479,,"CEO Stephen marries his secretary Kendal in name only, an arrangement made to protect his finances from an attempt at a hostile business takeover. Once the threat is neutralized, he asks Kendal for a divorce - but she refuses.",https://www.imdb.com/title/tt0032596/?ref_=sr_i_190,"['Richard Connell', 'Gladys Lehman', 'George Beck']",['William A. Seiter'],"['Rosalind Russell', 'Brian Aherne', 'Virginia Bruce', 'Robert Benchley', 'John Carroll', 'Hobart Cavanaugh', 'Richard Lane', 'William B. Davidson', 'Monica Bannister', 'Brooks Benedict']",,,,,"September 13, 1940",['United States'],"['Universal Studios - 100 Universal City Plaza, Universal City, California, USA (Studio)']",['Universal Pictures'],"Awards, 4 wins total","['Comedy', 'Romance']","['Spanish', 'English']"
191. Bitter Sweet,1940,1h 34m,Approved,5.7,579,,"A woman runs away with her music teacher in order to escape an arranged marriage, but they struggle to make ends meet.",https://www.imdb.com/title/tt0032256/?ref_=sr_i_191,"['Noël Coward', 'Lesser Samuels']",['W.S. Van Dyke'],"['Jeanette MacDonald', 'Nelson Eddy', 'George Sanders', 'Ian Hunter', 'Felix Bressart', 'Edward Ashley', 'Lynne Carver', 'Diana Lewis', 'Curt Bois', 'Fay Holden']",,,,,"November 8, 1940",['United States'],"['Metro-Goldwyn-Mayer Studios - 10202 W. Washington Blvd., Culver City, California, USA']",['Metro-Goldwyn-Mayer (MGM)'],"Nominated for 2 Oscars, 1 win & 2 nominations total","['Drama', 'Musical', 'Romance']",['English']
192. Crimes at the Dark House,1940,1h 9m,Not Rated,6.2,650,,"A madman kills a man who has just inherited a large estate, then impersonates his victim to gain entrance to the estate so he can murder his enemies.",https://www.imdb.com/title/tt0032366/?ref_=sr_i_192,"['Wilkie Collins', 'Frederick Hayward', 'Edward Dryhurst']",['George King'],"['Tod Slaughter', 'Sylvia Marriott', 'Hilary Eaves', 'Geoffrey Wardwell', 'Hay Petrie', 'Margaret Yarde', 'Rita Grant', 'David Horne', 'Elsie Wagstaff', 'David Keir']",,,,,"January 1, 1942",['United Kingdom'],,['George King Productions'],,['Drama'],['English']
193. Marked Men,1940,1h 6m,Approved,5.4,210,,"Bill, a wrongly imprisoned doctor, escapes jail and finds refuge in an Arizona town, but his freedom is threatened when the gangster who framed him forces Bill to guide his criminal crew across the desert.",https://www.imdb.com/title/tt0032763/?ref_=sr_i_193,"['Harold Greene', 'George Bricker']",['Sam Newfield'],"['Warren Hull', 'Isabel Jewell', 'John Dilson', 'Paul Bryar', 'Charles Williams', 'Al St. John', 'Budd Buster', 'Art Miles', 'Eddie Fetherston', 'Ted Erwin']",,,,,"September 30, 1940",['United States'],"['Tempe, Arizona, USA']","['Producers Releasing Corporation (PRC)', 'Sigmund Neufeld Productions']",,"['Action', 'Crime', 'Mystery', 'Romance', 'Western']",['English']
194. The Man Who Talked Too Much,1940,1h 16m,Approved,6.3,364,,"Assistant District Attorney Stephen Forbes, an impressive orator with a long list of convictions, resigns after an innocent young man is convicted and the real murderer confesses too late. He opens a cheap law office and his secretary Joan Reed goes with him. Business is bad until he ties up with J.B. Roscoe, the contact man between city hall and the underworld. Forbes moves to a swanky office and adds two people to his staff - his younger brother John, who he helped through law school, and Celia Farraday. Celia helps John win his first case and the two fall in love. John realizes his brother's firm isn't honest and wants to break the underworld contact. He opens Steve's safe for federal authorities hunting evidence against Roscoe. But the latter plants enough circumstantial evidence against John that he is convicted of murder and sent to death row.",https://www.imdb.com/title/tt0032747/?ref_=sr_i_194,"['Walter DeLeon', 'Earl Baldwin', 'Frank J. Collins']",['Vincent Sherman'],"['George Brent', 'Virginia Bruce', 'Brenda Marshall', 'Richard Barthelmess', 'William Lundigan', 'George Tobias', 'John Litel', 'Henry Armetta', 'Alan Baxter', 'David Bruce']",,,,,"July 16, 1940",['United States'],"['Warner Brothers Burbank Studios - 4000 Warner Boulevard, Burbank, California, USA (Studio)']",['Warner Bros.'],,"['Legal Drama', 'Drama']",['English']
195. Der Postmeister,1940,1h 32m,,6.8,228,,"A troubled father, working as a postmaster in province, worries about his daughter taken to the capital by a rich officer.",https://www.imdb.com/title/tt0032935/?ref_=sr_i_195,"['Alexander Pushkin', 'Gerhard Menzel']",['Gustav Ucicky'],"['Heinrich George', 'Hilde Krahl', 'Siegfried Breuer', 'Hans Holt', 'Ruth Hellberg', 'Margit Symo', 'Erik Frey', 'Alfred Neugebauer', 'Franz Pfaudler', 'Leo Peukert']",,,,,"April 24, 1940","['Austria', 'Germany']","['Scharndorf, Lower Austria, Austria']",['Wien-Film'],"Awards, 1 win total",['Drama'],['German']
196. The Green Hornet Strikes Again!,1940,4h 53m,Approved,6.6,453,,A wealthy publisher uses a disguise and calls himself the Green Hornet to fight crime in his city.,https://www.imdb.com/title/tt0032559/?ref_=sr_i_196,"['George H. Plympton', 'Basil Dickey', 'Sherman L. Lowe']","['Ford Beebe', 'John Rawlins']","['Warren Hull', 'Wade Boteler', 'Anne Nagel', 'Keye Luke', 'Eddie Acuff', 'Pierre Watkin', 'James Seay', 'Arthur Loft', 'Joe Devlin', 'William Hall']",,,,,"December 24, 1940",['United States'],"['Universal Studios - 100 Universal City Plaza, Universal City, California, USA']",['Universal Pictures'],,"['Superhero', 'Action', 'Adventure', 'Crime', 'Family', 'Sci-Fi']",['English']
197. The Border Legion,1940,58m,Approved,6.0,144,,"An Eastern doctor is on the run from authorities in New York. Out west he comes to the aid of friends besieged by an outlaw gang known as the border legion. In the end, he is cleared of any wrong-doing back east.",https://www.imdb.com/title/tt0032274/?ref_=sr_i_197,"['Zane Grey', 'Olive Cooper', 'Louis Stevens']",['Joseph Kane'],"['Roy Rogers', ""George 'Gabby' Hayes"", 'Carol Hughes', 'Joe Sawyer', 'Maude Eburne', 'Jay Novello', 'Hal Taliaferro', 'Dick Wessel', 'Paul Porcasi', 'Robert Emmett Keane']",,,,,"December 5, 1940",['United States'],"['Iverson Ranch - 1 Iverson Lane, Chatsworth, Los Angeles, California, USA']",['Republic Pictures (I)'],,"['Drama', 'Music', 'Western']",['English']
