Title,Year,Duration,MPA,Rating,Votes,méta_score,description,Movie Link,writers,directors,stars,budget,opening_weekend_Gross,grossWorldWWide,gross_US_Canada,release_date,countries_origin,filming_locations,production_company,awards_content,genres,Languages
1. The Greatest Show on Earth,1952,2h 32m,Approved,6.5,17K,76.0,"The dramatic lives of trapeze artists, a clown, and an elephant trainer are told against a background of circus spectacle.",https://www.imdb.com/title/tt0044672/?ref_=sr_i_1,"['Fredric M. Frank', 'Barré Lyndon', 'Theodore St. John']",['Cecil B. DeMille'],"['James Stewart', 'Charlton Heston', 'Betty Hutton', 'Cornel Wilde', 'Dorothy Lamour', 'Gloria Grahame', 'Henry Wilcoxon', 'Lyle Bettger', 'Lawrence Tierney', 'Emmett Kelly']","$4,000,000 (estimated)",,"$36,000,000","$36,000,000",May 1952,['United States'],"['Sarasota, Florida, USA']",['Paramount Pictures'],"Won 2 Oscars, 13 wins & 5 nominations total","['Drama', 'Family', 'Romance']","['English', 'Russian']"
2. Singin' in the Rain,1952,1h 43m,G,8.3,271K,99.0,A silent film star falls for a chorus girl just as he and his delusionally jealous screen partner are trying to make the difficult transition to talking pictures in 1920s Hollywood.,https://www.imdb.com/title/tt0045152/?ref_=sr_i_2,"['Betty Comden', 'Adolph Green']","['Stanley Donen', 'Gene Kelly']","['Gene Kelly', ""Donald O'Connor"", 'Debbie Reynolds', 'Jean Hagen', 'Millard Mitchell', 'Cyd Charisse', 'Douglas Fowley', 'Rita Moreno', 'Dawn Addams', 'John Albright']","$2,540,800 (estimated)","$13,643","$2,094,272","$1,884,537","April 10, 1952",['United States'],"['Metro-Goldwyn-Mayer Studios - 10202 W. Washington Blvd., Culver City, California, USA (New York City Streets)']","[""Loew's""]","Nominated for 2 Oscars, 11 wins & 11 nominations total","['Classic Musical', 'Feel-Good Romance', 'Jukebox Musical', 'Romantic Comedy', 'Satire', 'Comedy', 'Musical', 'Romance']",['English']
3. Umberto D.,1952,1h 29m,Not Rated,8.2,29K,92.0,An elderly man and his dog struggle to survive on his government pension in Rome.,https://www.imdb.com/title/tt0045274/?ref_=sr_i_3,['Cesare Zavattini'],['Vittorio De Sica'],"['Carlo Battisti', 'Maria Pia Casilio', 'Lina Gennari', 'Ileana Simova', 'Elena Rea', 'Memmo Carotenuto', 'Alberto Albani Barbieri', 'Pasquale Campagnola', 'Riccardo Ferri', 'Lamberto Maggiorani']",,,"$72,433","$71,816","November 7, 1955",['Italy'],"['The Pantheon, Piazza della Rotonda, Rome, Lazio, Italy']","['Dear Film', 'Rizzoli Film', 'Produzione Films Vittorio De Sica']","Nominated for 1 Oscar, 3 wins & 3 nominations total","['Tragedy', 'Drama']",['Italian']
4. Ikiru,1952,2h 23m,Not Rated,8.3,95K,92.0,A bureaucrat tries to find meaning in his life after he discovers he has terminal cancer.,https://www.imdb.com/title/tt0044741/?ref_=sr_i_4,"['Akira Kurosawa', 'Shinobu Hashimoto', 'Hideo Oguni']",['Akira Kurosawa'],"['Takashi Shimura', 'Nobuo Kaneko', ""Shin'ichi Himori"", 'Haruo Tanaka', 'Minoru Chiaki', 'Miki Odagiri', 'Bokuzen Hidari', 'Minosuke Yamada', 'Kamatari Fujiwara', 'Makoto Kobori']",,"$2,149","$113,821","$60,239","March 25, 1956",['Japan'],"['Tokyo, Japan']",['Toho'],"Nominated for 1 BAFTA Award, 6 wins & 2 nominations total","['Psychological Drama', 'Tragedy', 'Drama']","['Japanese', 'Latin', 'English', 'French']"
5. The White Sheik,1952,1h 23m,Not Rated,7.2,7.2K,,"During a day of their honeymoon, newlyweds are separated by the city's lust and the desires it produces.",https://www.imdb.com/title/tt0044000/?ref_=sr_i_5,"['Michelangelo Antonioni', 'Federico Fellini', 'Tullio Pinelli']",['Federico Fellini'],"['Alberto Sordi', 'Giulietta Masina', 'Brunella Bovo', 'Leopoldo Trieste', 'Ernesto Almirante', 'Lilia Landi', 'Fanny Marchiò', 'Gina Mascetti', 'Jole Silvani', 'Enzo Maggio']",,"$5,562","$70,699","$50,850","April 25, 1956",['Italy'],"['FERT Studios, Turin, Piedmont, Italy (Studio)']","['OFI', 'P.D.C.']","Awards, 1 nomination total","['Comedy', 'Drama', 'Romance']",['Italian']
6. Fanfan la Tulipe,1952,1h 42m,Not Rated,7.1,3.6K,69.0,Swashbuckling adventures of young army recruit Fanfan la Tulipe during the reign of King Louis XV in 18th Century France.,https://www.imdb.com/title/tt0044602/?ref_=sr_i_6,"['René Wheeler', 'René Fallet', 'Christian-Jaque']",['Christian-Jaque'],"['Gérard Philipe', 'Gina Lollobrigida', 'Marcel Herrand', 'Olivier Hussenot', 'Henri Rollan', 'Nerio Bernardi', 'Jean-Marc Tennberg', 'Geneviève Page', 'Sylvie Pelayo', 'Lolita De Silva']",,"$6,070","$30,590","$30,590","May 4, 1953","['France', 'Italy']","['Cinecittà Studios, Cinecittà, Rome, Lazio, Italy (Studio)']","['Filmsonor', 'Les Films Ariane', 'Amato Produzione']","Awards, 2 wins & 1 nomination total","['Costume Drama', 'Period Drama', 'Swashbuckler', 'Adventure', 'Comedy', 'Romance', 'War']",['French']
7. Sudden Fear,1952,1h 50m,Approved,7.5,8K,,"After an ambitious actor insinuates himself into the life of a wealthy middle-aged playwright and marries her, he plots with his mistress to murder her.",https://www.imdb.com/title/tt0045205/?ref_=sr_i_7,"['Lenore J. Coffee', 'Robert Smith', 'Edna Sherry']",['David Miller'],"['Joan Crawford', 'Jack Palance', 'Gloria Grahame', 'Bruce Bennett', 'Virginia Huston', 'Mike Connors', 'Rodney Bell', 'Lulu Mae Bohrman', 'George Chan', 'Estelle Etterre']","$720,000 (estimated)","$11,126","$24,759","$24,476","August 15, 1952",['United States'],"[""2800 Scott Street, San Francisco, California, USA (Myra's residence)""]",['Joseph Kaufman Productions'],"Nominated for 4 Oscars, 2 wins & 6 nominations total","['Film Noir', 'Psychological Thriller', 'Thriller']",['English']
8. Forbidden Games,1952,1h 26m,Not Rated,8.0,14K,,"A young French girl orphaned in a German air attack is befriended by the son of a poor farmer, and together they try to come to terms with the realities of death.",https://www.imdb.com/title/tt0043686/?ref_=sr_i_8,"['François Boyer', 'Jean Aurenche', 'Pierre Bost']",['René Clément'],"['Georges Poujouly', 'Brigitte Fossey', 'Amédée', 'Laurence Badie', 'Madeleine Barbulée', 'Suzanne Courtal', 'Lucien Hubert', 'Jacques Marin', 'Marcel Mérovée', 'Violette Monnier']",,"$4,316","$19,889","$19,889","December 8, 1952",['France'],"['Studios de la Victorine - 16 avenue Edouard Grinda, Nice, Alpes-Maritimes, France (Studio)']","['Silver Films', 'Filmax']","Nominated for 1 Oscar, 8 wins & 2 nominations total","['Drama', 'War']",['French']
9. The Quiet Man,1952,2h 9m,Approved,7.7,44K,85.0,"A retired American boxer returns to the village of his birth in 1920s Ireland, where he falls for a spirited redhead whose brother is contemptuous of their union.",https://www.imdb.com/title/tt0045061/?ref_=sr_i_9,"['Frank S. Nugent', 'Maurice Walsh', 'John Ford']",['John Ford'],"['John Wayne', ""Maureen O'Hara"", 'Barry Fitzgerald', 'Ward Bond', 'Victor McLaglen', 'Mildred Natwick', 'Francis Ford', 'Eileen Crowe', 'May Craig', 'Arthur Shields']","$1,750,000 (estimated)",,,,"September 14, 1952",['United States'],"['Cong, County Mayo, Ireland (Inisfree)']",['Argosy Pictures'],"Won 2 Oscars, 15 wins & 10 nominations total","['Romantic Comedy', 'Comedy', 'Drama', 'Romance']","['English', 'Irish Gaelic']"
10. High Noon,1952,1h 25m,PG,7.9,113K,89.0,"A town Marshal, despite the disagreements of his newlywed bride and the townspeople around him, must face a gang of deadly killers alone at ""high noon"" when the gang leader, an outlaw he ""sent up"" years ago, arrives on the noon train.",https://www.imdb.com/title/tt0044706/?ref_=sr_i_10,"['Carl Foreman', 'John W. Cunningham']",['Fred Zinnemann'],"['Gary Cooper', 'Grace Kelly', 'Thomas Mitchell', 'Lloyd Bridges', 'Katy Jurado', 'Otto Kruger', 'Lon Chaney Jr.', 'Harry Morgan', 'Ian MacDonald', 'Eve McVeagh']","$730,000 (estimated)",,$217,,"July 30, 1952",['United States'],"['Railtown 1897 State Historic Park - Jamestown, California, USA']",['Stanley Kramer Productions'],"Won 4 Oscars, 18 wins & 12 nominations total","['Classical Western', 'Drama', 'Thriller', 'Western']","['English', 'Spanish']"
11. Clash by Night,1952,1h 45m,Approved,7.0,7.8K,,"Mae Doyle comes back to her hometown a cynical woman. Her brother Joe fears that his love, fish cannery worker Peggy, may wind up like Mae. Mae marries Jerry and has a baby; she is happy but restless, drawn to Jerry's friend Earl.",https://www.imdb.com/title/tt0044502/?ref_=sr_i_11,"['Alfred Hayes', 'Clifford Odets']",['Fritz Lang'],"['Barbara Stanwyck', 'Robert Ryan', 'Paul Douglas', 'Marilyn Monroe', 'J. Carrol Naish', 'Silvio Minciotti', 'Keith Andes', 'William Bailey', 'Harry Baum', 'Dan Bernaducci']",,,$62,,"June 6, 1952",['United States'],"['Monterey, California, USA']",['Wald/Krasna Productions'],"Awards, 3 wins total","['Film Noir', 'Drama', 'Romance']","['English', 'Italian']"
12. The Iron Mistress,1952,1h 50m,Approved,6.2,1K,,The exploits of nineteenth-century pioneer Jim Bowie after settling in New Orleans.,https://www.imdb.com/title/tt0044753/?ref_=sr_i_12,"['James R. Webb', 'Paul Wellman']",['Gordon Douglas'],"['Alan Ladd', 'Virginia Mayo', 'Joseph Calleia', 'Phyllis Kirk', 'Alf Kjellin', 'Douglas Dick', 'Anthony Caruso', 'Nedrick Young', 'George Voskovec', 'John Alban']",,,,,"March 12, 1953",['United States'],"['Warner Brothers Burbank Studios - 4000 Warner Boulevard, Burbank, California, USA (Studio)']",['Warner Bros.'],,"['Classical Western', 'Action', 'Adventure', 'Biography', 'Drama', 'History', 'Western']","['English', 'Spanish']"
13. Bend of the River,1952,1h 31m,Approved,7.2,10K,,"When a town boss confiscates homesteaders' supplies after gold is discovered nearby, a tough cowboy risks his life to try and get it to them.",https://www.imdb.com/title/tt0044413/?ref_=sr_i_13,"['Borden Chase', 'William Gulick']",['Anthony Mann'],"['James Stewart', 'Rock Hudson', 'Arthur Kennedy', 'Julie Adams', 'Jay C. Flippen', 'Lori Nelson', 'Chubby Johnson', 'Stepin Fetchit', 'Harry Morgan', 'Howard Petrie']",,,"$5,194",,"January 29, 1952",['United States'],"['Mount Hood, Oregon, USA']",['Universal International Pictures (UI)'],"Awards, 3 wins & 3 nominations total","['Classical Western', 'Mountain Adventure', 'Quest', 'Action', 'Adventure', 'Drama', 'Romance', 'Western']",['English']
14. The Bad and the Beautiful,1952,1h 58m,Approved,7.8,17K,86.0,"An unscrupulous movie producer uses an actress, a director and a writer to achieve success.",https://www.imdb.com/title/tt0044391/?ref_=sr_i_14,"['Charles Schnee', 'George Bradshaw']",['Vincente Minnelli'],"['Lana Turner', 'Kirk Douglas', 'Walter Pidgeon', 'Dick Powell', 'Barry Sullivan', 'Gloria Grahame', 'Gilbert Roland', 'Leo G. Carroll', 'Vanessa Brown', 'Paul Stewart']","$1,558,000 (estimated)",,"$2,025",,"February 9, 1953",['United States'],"['Beverly Hills Hotel & Bungalows - 9641 Sunset Blvd., Beverly Hills, California, USA']",['Metro-Goldwyn-Mayer (MGM)'],"Won 5 Oscars, 7 wins & 7 nominations total","['Drama', 'Romance']",['English']
15. Ivanhoe,1952,1h 46m,Approved,6.7,11K,75.0,A knight seeks to free the captive King Richard and put him back on the throne.,https://www.imdb.com/title/tt0044760/?ref_=sr_i_15,"['Noel Langley', 'Æneas MacKenzie', 'Marguerite Roberts']",['Richard Thorpe'],"['Robert Taylor', 'Elizabeth Taylor', 'Joan Fontaine', 'George Sanders', 'Emlyn Williams', 'Robert Douglas', 'Finlay Currie', 'Felix Aylmer', 'Francis De Wolff', 'Norman Wooland']","$3,842,000 (estimated)",,,,"February 20, 1953","['United Kingdom', 'United States']","['MGM British Studios, Borehamwood, Hertfordshire, England, UK (studio: interiors and exteriors: Torquilstone Castle and lists at Ashby La Zouche)']","[""Loew's""]","Nominated for 3 Oscars, 2 wins & 9 nominations total","['Swashbuckler', 'Action', 'Adventure', 'Drama', 'Romance']",['English']
16. Limelight,1952,2h 17m,G,8.0,23K,84.0,A fading comedian and a suicidally despondent ballet dancer must look to each other to find purpose and hope in their lives.,https://www.imdb.com/title/tt0044837/?ref_=sr_i_16,['Charles Chaplin'],['Charles Chaplin'],"['Charles Chaplin', 'Claire Bloom', 'Nigel Bruce', 'Buster Keaton', 'Sydney Chaplin', 'Norman Lloyd', 'Andre Eglevsky', 'Melissa Hayden', 'Marjorie Bennett', 'Wheeler Dryden']",,,"$9,291",,"October 31, 1952",['United States'],"['RKO-Pathé Studios - 9336 Washington Blvd., Culver City, California, USA (Studio)']",['Charles Chaplin Productions'],"Won 1 Oscar, 7 wins & 4 nominations total","['Drama', 'Music', 'Romance']",['English']
17. Moulin Rouge,1952,1h 59m,Approved,7.0,6.9K,,Fictional account of French artist Henri de Toulouse-Lautrec.,https://www.imdb.com/title/tt0044926/?ref_=sr_i_17,"['Pierre La Mure', 'Anthony Veiller', 'John Huston']",['John Huston'],"['José Ferrer', 'Zsa Zsa Gabor', 'Suzanne Flon', 'Claude Nollier', 'Katherine Kath', 'Muriel Smith', 'Mary Clare', 'Walter Crisham', 'Harold Kasket', 'Georges Lannes']","$1,500,000 (estimated)",,"$3,188",,"April 10, 1953",['United Kingdom'],"['Montmartre, Paris 18, Paris, France']","['Romulus Films', 'Moulin Productions Inc.']","Won 2 Oscars, 6 wins & 10 nominations total","['Period Drama', 'Tragic Romance', 'Biography', 'Drama', 'Music', 'Romance']","['English', 'French']"
18. Angels One Five,1952,1h 38m,TV-G,6.5,1.4K,,The story of an RAF fighter squadron at the height of the Battle of Britain.,https://www.imdb.com/title/tt0046714/?ref_=sr_i_18,"['Derek N. Twist', 'Pelham Groom']","[""George More O'Ferrall""]","['Jack Hawkins', 'Michael Denison', 'Andrew Osborn', 'Cyril Raymond', 'Humphrey Lestocq', 'John Gregson', 'Ronald Adam', 'Dulcie Gray', 'Veronica Hurst', 'Amy Veness']",,,,,"April 30, 1954",['United Kingdom'],"['RAF Kenley, Kenley, Surrey, England, UK']",['Templar Film Studios'],"Nominated for 2 BAFTA Awards, 2 nominations total","['Drama', 'War']",['English']
19. Angel Face,1952,1h 31m,Approved,7.2,9.6K,,Ambulance driver Frank Jessup is ensnared in the schemes of the sensuous but dangerous Diane Tremayne.,https://www.imdb.com/title/tt0044357/?ref_=sr_i_19,"['Frank S. Nugent', 'Oscar Millard', 'Chester Erskine']",['Otto Preminger'],"['Robert Mitchum', 'Jean Simmons', 'Mona Freeman', 'Herbert Marshall', 'Leon Ames', ""Barbara O'Neil"", 'Kenneth Tobey', 'Raymond Greenleaf', 'Griff Barnett', 'Robert Gist']","$1,039,000 (estimated)",,,,"February 11, 1953",['United States'],"['Beverly Hills Fire Department, Beverly Hills, California, USA']",['RKO Radio Pictures'],,"['Film Noir', 'Crime', 'Drama', 'Romance', 'Thriller']","['English', 'Japanese']"
20. The Importance of Being Earnest,1952,1h 35m,Approved,7.4,6.6K,,"After Algernon discovers that his friend Ernest, has created a fictional brother for whenever he needs a reason to escape dull country life, Algernon poses as the brother, resulting in ever-increasing confusion.",https://www.imdb.com/title/tt0044744/?ref_=sr_i_20,"['Oscar Wilde', 'Anthony Asquith']",['Anthony Asquith'],"['Michael Redgrave', 'Richard Wattis', 'Michael Denison', 'Joan Greenwood', 'Dorothy Tutin', 'Edith Evans', 'Margaret Rutherford', 'Miles Malleson', 'Walter Hudd', 'Aubrey Mather']",,,,,"August 15, 1952",['United Kingdom'],"['Pinewood Studios, Iver Heath, Buckinghamshire, England, UK (Studio)']","['Javelin Films', 'British Film-Makers']","Nominated for 1 BAFTA Award, 1 win & 2 nominations total","['Period Drama', 'Comedy', 'Drama']","['English', 'French']"
21. Hangman's Knot,1952,1h 21m,Approved,6.7,1.9K,,"A Confederate Major and his troops are falsely led to believe the Civil War is not over, and become wanted men after they attack a Union Army wagon train in Nevada.",https://www.imdb.com/title/tt0044683/?ref_=sr_i_21,['Roy Huggins'],['Roy Huggins'],"['Randolph Scott', 'Donna Reed', 'Claude Jarman Jr.', 'Frank Faylen', 'Glenn Langan', 'Richard Denning', 'Lee Marvin', 'Jeanette Nolan', 'Clem Bevans', 'Ray Teal']",,,,"$1,250,000","November 15, 1952",['United States'],"['Alabama Hills, Lone Pine, California, USA']","['Producers-Actors Corporation', 'Scott-Brown Productions']",,['Western'],['English']
22. Deadline - U.S.A.,1952,1h 27m,Approved,7.2,4.5K,,"With his newspaper about to be sold, crusading editor Ed Hutcheson tries to complete an exposé on gangster Rienzi.",https://www.imdb.com/title/tt0044533/?ref_=sr_i_22,"['Richard Brooks', 'Jacques Monteux']",['Richard Brooks'],"['Humphrey Bogart', 'Ethel Barrymore', 'Kim Hunter', 'Ed Begley', 'Warren Stevens', 'Paul Stewart', 'Martin Gabel', 'Joe De Santis', 'Joyce Mackenzie', 'Audrey Christie']",,,"$5,228",,"May 10, 1952",['United States'],"['New York Daily News Building - 42nd Street, Manhattan, New York City, New York, USA']",['Twentieth Century Fox'],"Awards, 2 wins total","['Film Noir', 'Crime', 'Drama']","['English', 'Latin']"
23. Fear and Desire,1952,1h 2m,Not Rated,5.3,14K,,Four soldiers trapped behind enemy lines must confront their fears and desires.,https://www.imdb.com/title/tt0045758/?ref_=sr_i_23,['Howard Sackler'],['Stanley Kubrick'],"['Frank Silvera', 'Kenneth Harp', 'Paul Mazursky', 'Stephen Coit', 'Virginia Leith', 'David Allen', 'Toba Kubrick']","$33,000 (estimated)",,$953,,"April 1, 1953",['United States'],"['San Gabriel Mountains, California, USA']",['Kubrick Family'],"Awards, 1 nomination total","['Drama', 'Thriller', 'War']","['English', 'Spanish']"
24. Monkey Business,1952,1h 37m,Approved,6.9,16K,,A chemist finds his personal and professional life turned upside down when one of his chimpanzees finds the fountain of youth.,https://www.imdb.com/title/tt0044916/?ref_=sr_i_24,"['Ben Hecht', 'Charles Lederer', 'I.A.L. Diamond']",['Howard Hawks'],"['Cary Grant', 'Ginger Rogers', 'Marilyn Monroe', 'Charles Coburn', 'Hugh Marlowe', 'Henri Letondal', 'Robert Cornthwaite', 'Larry Keating', 'Douglas Spencer', 'Esther Dale']",,,$265,,"September 5, 1952",['United States'],"['Old Executive Building, 20th Century Fox Studios - 10201 Pico Blvd., Century City, Los Angeles, California, USA (Oxley Chemical Co. exteriors)']",['Twentieth Century Fox'],"Awards, 1 nomination total","['Screwball Comedy', 'Comedy', 'Sci-Fi']",['English']
25. Viva Zapata!,1952,1h 53m,Approved,7.2,13K,,"The story of Mexican revolutionary Emiliano Zapata, who led a rebellion against the corrupt, oppressive dictatorship of President Porfirio Díaz in the early 20th century.",https://www.imdb.com/title/tt0045296/?ref_=sr_i_25,"['John Steinbeck', 'Edgecumb Pinchon']",['Elia Kazan'],"['Marlon Brando', 'Jean Peters', 'Anthony Quinn', 'Joseph Wiseman', 'Arnold Moss', 'Alan Reed', 'Margo', 'Harold Gordon', 'Lou Gilbert', 'Frank Silvera']","$1,800,000 (estimated)",,,,"February 13, 1952","['United States', 'Mexico']","['Denver & Rio Grande Western Railroad, Durango, Colorado, USA']","['Twentieth Century Fox', 'Estudios Churubusco Azteca S.A.']","Won 1 Oscar, 5 wins & 9 nominations total","['Biography', 'Drama', 'History', 'Western']","['English', 'Spanish']"
26. Kansas City Confidential,1952,1h 39m,Approved,7.3,8.6K,,An ex-con trying to go straight is framed for a million dollar armored car robbery and must go to Mexico in order to unmask the real culprits.,https://www.imdb.com/title/tt0044789/?ref_=sr_i_26,"['George Bruce', 'Harry Essex', 'Harold Greene']",['Phil Karlson'],"['John Payne', 'Coleen Gray', 'Preston Foster', 'Neville Brand', 'Lee Van Cleef', 'Jack Elam', 'Dona Drake', 'Mario Siletti', 'Howard Negley', 'Carleton Young']",,,,,"November 11, 1952",['United States'],"['Two Harbors, Santa Catalina Island, Channel Islands, California, USA (scenes in ""Borados"")']","['Associated Players & Producers', 'Edward Small Productions']",,"['Conspiracy Thriller', 'Film Noir', 'Heist', 'Crime', 'Drama', 'Thriller']","['English', 'Spanish']"
27. The Big Trees,1952,1h 29m,Approved,5.7,1.9K,,A Quaker colony tries to save the giant sequoias from a timber baron.,https://www.imdb.com/title/tt0044420/?ref_=sr_i_27,"['John Twist', 'James R. Webb', 'Kenneth Earl']",['Felix E. Feist'],"['Kirk Douglas', 'Eve Miller', 'Patrice Wymore', 'Edgar Buchanan', 'John Archer', 'Alan Hale Jr.', 'Roy Roberts', 'Charles Meredith', 'Harry Cording', 'Ellen Corby']",,,,,"March 30, 1952",['United States'],"['Eureka, California, USA']",['Warner Bros.'],,"['Classical Western', 'Legal Drama', 'Period Drama', 'Western Epic', 'Drama', 'Western']",['English']
28. The Snows of Kilimanjaro,1952,1h 54m,Approved,6.1,6.2K,62.0,Writer Harry Street reflects on his life as he lies dying from an infection while on safari in the shadow of Mount Kilamanjaro.,https://www.imdb.com/title/tt0045162/?ref_=sr_i_28,"['Casey Robinson', 'Ernest Hemingway']","['Henry King', 'Roy Ward Baker']","['Gregory Peck', 'Susan Hayward', 'Ava Gardner', 'Hildegard Knef', 'Leo G. Carroll', 'Torin Thatcher', 'Ava Norring', 'Helene Stanley', 'Marcel Dalio', 'Vicente Gómez']",,,"$16,620",,"December 25, 1952",['United States'],"['Paris, France']",['Twentieth Century Fox'],"Nominated for 2 Oscars, 1 win & 4 nominations total","['Adventure', 'Drama', 'Romance', 'War']","['English', 'French', 'Spanish', 'Swahili']"
29. The Narrow Margin,1952,1h 11m,Approved,7.6,9.1K,,A woman planning to testify against the mob must be protected against potential assassins on the train trip from Chicago to Los Angeles.,https://www.imdb.com/title/tt0044954/?ref_=sr_i_29,"['Earl Felton', 'Martin Goldsmith', 'Jack Leonard']","['Richard Fleischer', 'William Cameron Menzies']","['Charles McGraw', 'Marie Windsor', 'Jacqueline White', 'Gordon Gebert', 'Queenie Leonard', 'David Clarke', 'Peter Virgo', 'Don Beddoe', 'Paul Maxey', 'Harry Harvey']","$188,000 (estimated)",,,,"June 27, 1952",['United States'],"['Santa Fe Railroad Depot - 1170 W. 3rd Street, San Bernardino, California, USA']",['RKO Radio Pictures'],"Nominated for 1 Oscar, 1 nomination total","['Film Noir', 'Gangster', 'Crime', 'Drama', 'Thriller']",['English']
30. Scaramouche,1952,1h 55m,Approved,7.5,6.6K,,"In France during the late 18th Century, a man sets out to avenge the death of his friend at the hands of a master swordsman.",https://www.imdb.com/title/tt0045125/?ref_=sr_i_30,"['Ronald Millar', 'George Froeschel', 'Rafael Sabatini']",['George Sidney'],"['Stewart Granger', 'Janet Leigh', 'Eleanor Parker', 'Mel Ferrer', 'Henry Wilcoxon', 'Nina Foch', 'Richard Anderson', 'Robert Coote', 'Lewis Stone', 'Elisabeth Risdon']","$3,500,000 (estimated)",,,,"June 27, 1952",['United States'],"['Golden Gate Park, San Francisco, California, USA']",['Metro-Goldwyn-Mayer (MGM)'],"Awards, 3 nominations total","['Slapstick', 'Swashbuckler', 'Action', 'Adventure', 'Comedy', 'Drama', 'Romance']",['English']
31. Hans Christian Andersen,1952,1h 52m,Approved,6.9,4.4K,,"The opening scene of the movie describes it best: ""Once upon a time there lived in Denmark a great storyteller named Hans Christian Andersen. This is not the story of his life, but a fairy tale about the great spinner of fairy tales.""",https://www.imdb.com/title/tt0044685/?ref_=sr_i_31,"['Moss Hart', 'Myles Connolly', 'Ben Hecht']",['Charles Vidor'],"['Danny Kaye', 'Farley Granger', 'Zizi Jeanmaire', 'Joseph Walsh', 'Philip Tonge', 'Erik Bruhn', 'Roland Petit', 'John Brown', 'John Qualen', 'Jeanne Lafayette']","$4,000,000 (estimated)",,,,"August 14, 1953",['United States'],"['Samuel Goldwyn Studios - 7200 Santa Monica Boulevard, West Hollywood, California, USA (Studio)']",['The Samuel Goldwyn Company'],"Nominated for 6 Oscars, 10 nominations total","['Biography', 'Family', 'Musical', 'Romance']",['English']
32. The Marrying Kind,1952,1h 32m,Approved,6.9,1.7K,,"Florence and Chet Keefer have had a troublesome marriage. Whilst in the middle of a divorce hearing, the judge encourages them to remember the good times they have had, hoping that the marriage can be saved.",https://www.imdb.com/title/tt0044888/?ref_=sr_i_32,"['Ruth Gordon', 'Garson Kanin']",['George Cukor'],"['Judy Holliday', 'Aldo Ray', 'Madge Kennedy', 'Sheila Bond', 'John Alexander', 'Rex Williams', 'Phyllis Povah', 'Mickey Shaughnessy', 'Griff Barnett', 'Wallace Acton']",,,,,April 1952,['United States'],"['339 Greenwich St, New York City, New York, USA (A.L. Bazzini Co. - where Flo goes back to work)']",['Columbia Pictures'],"Nominated for 1 BAFTA Award, 3 wins & 2 nominations total","['Comedy', 'Drama']",['English']
33. So Little Time,1952,1h 28m,,6.8,292,,"During World War II, German soldiers occupy the home of a beautiful Belgian girl and her mother.",https://www.imdb.com/title/tt0045163/?ref_=sr_i_33,"['Noelle Henry', 'John Cresswell']",['Compton Bennett'],"['Maria Schell', 'Marius Goring', 'Lucie Mannheim', 'Gabrielle Dorziat', 'Barbara Mullen', 'John Bailey', 'David Hurst', 'Stanley Van Beers', 'Oscar Quitak', 'Andree Melly']",,,,,"August 14, 1953",['United Kingdom'],"['Léau, Belgium (Town near the Château de Malvines)']",['Mayflower Productions'],,"['Drama', 'Romance', 'War']","['English', 'German']"
34. Rancho Notorious,1952,1h 29m,Approved,6.8,5.8K,,"After the murder of his fiancée, a Wyoming ranch hand sets out to find her killer.",https://www.imdb.com/title/tt0045070/?ref_=sr_i_34,"['Daniel Taradash', 'Silvia Richards']",['Fritz Lang'],"['Marlene Dietrich', 'Arthur Kennedy', 'Mel Ferrer', 'Gloria Henry', 'William Frawley', 'Lisa Ferraday', 'John Raven', 'Jack Elam', 'George Reeves', 'Frank Ferguson']","$900,000 (estimated)",,$63,,"May 12, 1952",['United States'],"['Republic Studios - 4024 Radford Avenue, North Hollywood, Los Angeles, California, USA (Studio)']",['Fidelity Pictures Corporation'],,"['Classical Western', 'Western']",['English']
