Title,Year,Duration,MPA,Rating,Votes,méta_score,description,Movie Link,writers,directors,stars,budget,opening_weekend_Gross,grossWorldWWide,gross_US_Canada,release_date,countries_origin,filming_locations,production_company,awards_content,genres,Languages
463. Outrageous!,1977,1h 36m,R,6.9,1.1K,,A story about a female impersonator who rooms with a pregnant schizophrenic.,https://www.imdb.com/title/tt0076513/?ref_=sr_i_463,"['Richard Benner', 'Margaret Gibson Gilboord']",['Richard Benner'],"['Craig Russell', 'Hollis McLaren', 'Richert Easley', 'Allan Moyle', 'David McIlwraith', 'Gerry Salsberg', 'Andrée Pelletier', 'Helen Shaver', 'Martha Gibson', 'Helen Hughes']","CA$165,000 (estimated)",,,,"July 31, 1977",['Canada'],"['Toronto, Ontario, Canada']","['Film Consortium of Canada', 'Canadian Film Development Corporation (CFDC)']","Awards, 3 wins & 4 nominations total","['Comedy', 'Drama']",['English']
464. Es pecado... pero me gusta,1977,1h 30m,,4.8,56,,,https://www.imdb.com/title/tt0075998/?ref_=sr_i_464,"['Juan Bosch', 'Fabio Pittorru', 'Sérgio Ricci']",['Juan Bosch'],"['Carmen Villani', 'Carlo Giuffrè', 'Esperanza Roy', 'Simón Andreu', 'Josele Román', 'Aldo Maccione', 'Fedra Lorente', 'José Antonio Ceinos', 'Irene Bancells', 'Francisco Jarque']",,,,,July 1977,"['Spain', 'Italy']",,"['Estela Films', 'Interfinace Corporation']",,['Comedy'],['Spanish']
465. Terror of Frankenstein,1977,1h 32m,Not Rated,5.8,350,,Victor Frankenstein's search for the secret of life leads to the creation of a monster that consumes his life and family.,https://www.imdb.com/title/tt0076881/?ref_=sr_i_465,"['Calvin Floyd', 'Yvonne Floyd', 'Mary Shelley']",['Calvin Floyd'],"['Leon Vitali', 'Per Oscarsson', 'Nicholas Clay', 'Stacy Dorning', 'Jan Ohlsson', 'Olof Bergström', 'Mathias Henrikson', ""Archie O'Sullivan"", 'Harry Brogan', 'Dermott Toughy']",,,,,"February 16, 1977","['Sweden', 'Ireland']",['Ireland'],"['Aspect', 'National Film Society of Ireland']",,"['Drama', 'Horror', 'Sci-Fi']",['English']
466. Mrigayaa,1977,1h 59m,,6.8,172,,"In the 1930s, a group of tribals live in a small village in a forest in Odisha. A British administrator arrives at the village who is passionate about hunting. He befriends Ghinua, an exceptional archer.",https://www.imdb.com/title/tt0074926/?ref_=sr_i_466,"['Mohit Chatterjee', 'Bhagavati Charan Panigrahi', 'Mrinal Sen']",['Mrinal Sen'],"['Mithun Chakraborty', 'Mamata Shankar', 'Robert Wright', 'Ajit Banerjee', 'Samit Bhanja', 'Shekhar Chatterjee', 'Reba Roy Chowdhury', 'Sujal Roy Chowdhury', 'Anoop Kumar', 'Sadhu Meher']",,,,,July 1977,['India'],,['Udaya Bhaskar International'],"Awards, 3 wins & 1 nomination total",['Drama'],['Hindi']
467. Disposta a tutto,1977,1h 34m,,5.8,109,,Young Anna discovers her masochistic streak during her affair with the older Marco.,https://www.imdb.com/title/tt0077441/?ref_=sr_i_467,"['Roberto Gianviti', 'Giorgio Stegani']",['Giorgio Stegani'],"['Eleonora Giorgi', 'Bekim Fehmiu', 'Laura De Marchi', 'Barbara Magnolfi', 'Vittorio Duse', 'Maria Bonolis', 'Felicita Fanny', 'Gloria Serbo', 'Max Delys']",,,,,"February 24, 1977",['Italy'],"['Incir De Paolis Studios, Rome, Lazio, Italy']",['ATA Cine TV Produzione'],,"['Drama', 'Romance']",['Italian']
468. Woo fook,1977,1h 47m,TV-MA,5.2,193,,"In Hong Kong, a Chinese cook swallows a microfilm by accident and becomes a target.",https://www.imdb.com/title/tt0076049/?ref_=sr_i_468,"['Philip Chan', 'Po-Chih Leong', 'Les Roberts']",['Po-Chih Leong'],"['Henry Silva', 'Vonetta McGee', 'Rik Van Nutter', 'Roy Chiao', 'James Yi Lui', 'Gigo Tevzadze', 'Melvin Wong', 'Hung Wong', 'Fred Marshall', 'Nick Wai Kei Lam']",,,,,"December 15, 1977",['Hong Kong'],['Hong Kong'],['Bang Bang Film Productions'],,"['Action', 'Drama']",['English']
469. Cai zi ming hua xing ma,1977,,,4.6,12,,,https://www.imdb.com/title/tt0291787/?ref_=sr_i_469,['Chi Lu'],['Chi Lu'],"['Ti Ai', 'Dai Ling', 'Na Chin', 'Helen Poon', 'Wei-Ying Chen', 'Ling Yi', 'Lap Ban Chan', 'Hui Chen', 'Lei Chin', 'Ta Kao']",,,,,"September 16, 1977",['Hong Kong'],,"['Golden (Lu Chi) Film Company', 'Shaw Brothers']",,[],"['Cantonese', 'Mandarin']"
470. Shirdi Ke Sai Baba,1977,2h 20m,,7.5,277,,"An excellent film on the life and legacy of the legendary mystic and guru, Sai Baba of Shirdi.",https://www.imdb.com/title/tt0300475/?ref_=sr_i_470,"['Sudhir Dalvi', 'Manoj Kumar', 'Hema Malini']",['Ashok'],"['Sudhir Dalvi', 'Manoj Kumar', 'Hema Malini', 'Rajendra Kumar Tuli', 'Shatrughan Sinha', 'Raj Mehra', 'Birbal', 'Usha Chavan', 'C.S. Dubey', 'Manmohan Krishna']",,,,,,['India'],,['Sarla Charities Trust'],,"['Biography', 'Drama']",['Hindi']
471. The 7 Grandmasters,1977,1h 29m,Unrated,7.0,1K,,"An aging martial arts expert is gifted a plaque from the Emperor declaring him the Kung Fu World Champion. Unsure of whether or not be is deserving of this title, he embarks on a journey to defeat the 7 Grandmasters.",https://www.imdb.com/title/tt0182666/?ref_=sr_i_471,"['Da-Wei Kuo', 'Joseph Kuo', 'Ching-Kang Yao']",['Joseph Kuo'],"['Yi-Min Li', 'Jack Long', 'Kuan-Wu Lung', 'Nancy Yen', 'Chung-Hsing Chao', 'Chin-Hai Chen', 'Chiu Chen', 'Ching-Feng Chiang', 'Yuet-Sang Chin', 'Ma Chin-Ku']",,,,,June 1982,['Taiwan'],,['Hong Hwa Motion Picture Company'],,"['Kung Fu', 'Martial Arts', 'Action', 'Comedy', 'Drama']",['Mandarin']
472. Jack,1977,1h 59m,,5.6,542,,"Jack, a bohemian in Stockholm with writer and musician dreams and his wild life with friends in Stockholm and on Gotland in 1970's - early years",https://www.imdb.com/title/tt0074704/?ref_=sr_i_472,"['Ulf Lundell', 'Jan Halldoff']",['Jan Halldoff'],"['Göran Stangertz', 'Kjell Bergqvist', 'Örjan Ramberg', 'Ingalill Rydberg', 'Robert Sjöblom', 'Gunnel Fred', 'Tove Linde', 'Bibbi Unge', 'Åke Lindström', 'Nils Eklund']",,,,,"March 4, 1977",['Sweden'],"['Stockholm, Stockholms län, Sweden']","['Europa Film', 'Stockholm Film']",,['Drama'],['Swedish']
473. Doosara Aadmi,1977,2h 17m,Not Rated,6.6,360,,"Kanu, Timsi and Nisha find themselves entangled in an emotional saga, the struggle of Nisha's past, Kanu and Timsi's present and an uncertain future.",https://www.imdb.com/title/tt0301215/?ref_=sr_i_473,"['Raju Saigal', 'Sagar Sarhadi']",['Ramesh Talwar'],"['Shashi Kapoor', 'Rishi Kapoor', 'Neetu Singh', 'Rakhee Gulzar', 'Deven Verma', 'Parikshit Sahni', 'Satyendra Kapoor', 'Geeta Kak', 'Beena Banerjee', 'Ramesh Tiwari']",,,,,"October 14, 1977",['India'],"['Rajkamal Studios, Parel, Mumbai, Maharashtra, India (Studio)']",['Yash Raj Films'],"Awards, 1 nomination total","['Drama', 'Family', 'Romance']",['Hindi']
474. Dynasty,1977,1h 34m,R,5.9,150,,"The prince of the Emperor must fight for his life, accused of treason against the throne.",https://www.imdb.com/title/tt0165742/?ref_=sr_i_474,['Kuo-Hsiung Liu'],['Mei-Chun Chang'],"['Tao-Liang Tan', 'Ying Bai', 'David Wei Tang', 'Taiko Rin', 'Kang Chin', 'Chang Ma', 'Yung-Hsiang Chin', 'Chiang Han', 'Chia-Chuan Tang', 'Fei Wang']",,,,,September 1977,"['Taiwan', 'Hong Kong']",,"['Tung Chuan Films', 'Eastern Media', 'Foo Hwa Cinema Co.']","Awards, 1 win & 1 nomination total","['Action', 'Drama']",['Mandarin']
475. Tänzerinnen für Tanger,1977,1h 21m,,3.8,92,,"In the ""Oasis"" in Tangier, the emissaries of the oil sheiks meet and, in addition to the ""white skin"", also trade other goods such as weapons and drugs.",https://www.imdb.com/title/tt0124180/?ref_=sr_i_475,['Jack Guy'],['Jack Guy'],"['Gina Janssen', 'Esther Studer', 'Jacques Stany', 'Eric Falk', 'Dagmar Bürger', 'Josyane Gibert', 'Vicky Mesmin', 'Mike Montana', 'Mireille Rüegg', 'Margrit Siegel']",,,,,"May 20, 1977",['West Germany'],"['Amsterdam, Noord-Holland, Netherlands']",,,"['Crime', 'Drama']",['German']
476. Age of Innocence,1977,1h 41m,,5.7,220,,A troubled love story brews in a town where a conscientious objector comes to stay.,https://www.imdb.com/title/tt0075640/?ref_=sr_i_476,"['Bruce Martin', 'Ratch Wallace']",['Alan Bridges'],"['David Warner', 'Honor Blackman', 'Trudy Young', 'Lois Maxwell', 'Tim Henry', 'Cec Linder', 'Joey Davidson', 'Robert Hawkins', 'Jon Granik', 'Michael Tait']","$850,000 (estimated)",,,,"April 28, 1977","['United Kingdom', 'Canada']","['Lang Pioneer Village, Peterborough, Ontario, Canada (Opening scene)']","['Judson Pictures Incorporated', 'The Rank Organisation']",,['Drama'],['English']
477. Swami,1977,2h 9m,,6.8,264,,"After she enters into an arranged marriage, a spirited and intellectual young woman tries to adjust to life with a man who was not her choice.",https://www.imdb.com/title/tt0152720/?ref_=sr_i_477,"['Mannu Bhandari', 'Basu Chatterjee', 'Sarat Chandra Chattopadhyay']",['Basu Chatterjee'],"['Shabana Azmi', 'Girish Karnad', 'Utpal Dutt', 'Dheeraj Kumar', 'Shashikala Jawalkar', 'Vikram Makandar', 'Deepak Kumar', 'Ritu Kamal', 'Preeti Ganguli', 'Sudha Shivpuri']",,,,,,['India'],,['Jayasarathy Combine'],"Awards, 3 wins total",['Drama'],['Hindi']
478. 10 Brothers of Shaolin,1977,1h 30m,Not Rated,5.3,161,,"The martial-arts action film 10 Brothers of Shaolin tells the tale of ten specially trained fighters, five monks, five laymen, who have been taught their skills in order to protect Master Chu, who needs all the help he can while attempting to bring down the Mings.",https://www.imdb.com/title/tt0201236/?ref_=sr_i_478,"['Si Tou Ming', 'Min Szeto']",['Chung Ting'],"['Don Wong', 'Yi Chang', 'Phillip Ko', 'Wei Tung', 'Chen-Huan Chang', 'Chung Yen', 'Kuang Hu', 'Min Min', 'Ming Chin', 'Wang Nan Lin']",,,,,1977,"['Hong Kong', 'Taiwan']",['Taiwan'],,,"['Action', 'Adventure', 'Drama']",['Mandarin']
479. Dulhan Wahi Jo Piya Man Bhaaye,1977,2h 45m,Not Rated,8.2,98,,"Wealthy businessman, Harkishan, lives in a palatial house, with his womanizing and alcoholic grandson, Prem. He would like Prem to get married, settle down, and look after the business, but Prem refuses to do so, unless and until he is permitted to wed his girlfriend, Rita. Harkishan reluctantly agrees and wants to set a date for the marriage. Before that could happen Harkishan's health fails and he suffers a heart attack. Fearing that he is not going to live long enough, he asks Prem to introduce him to his bride-to-be. Prem accordingly brings Rita home, where she is welcomed by everyone. Harkishan approves of her instantly, she begins to look after him, he starts to recover, and eventually ends up entrusting her with the keys to the household, as well as to the safe. What Harkishan does not know is that Rita is not who she claims to be, but is, in fact, a street florist named Kammo. Watch what happens when Kammo decides to run the lives of Harkishan and Prem on her own terms.",https://www.imdb.com/title/tt0150417/?ref_=sr_i_479,"['Vrajendra Gaur', 'Madhusudan Kalelkar', 'Lekh Tandon']",['Lekh Tandon'],"['Rameshwari', 'Premkrishen Malhotra', 'Madan Puri', 'Shyamali', 'Iftekhar', 'Jagdeep', 'Leela Mishra', 'Sunder', 'Shivraj', 'Viju Khote']",,,,,"September 25, 1977",['India'],,['Rajshri Productions'],"Awards, 2 wins total","['Drama', 'Family', 'Musical']",['Hindi']
480. Day for My Love,1977,1h 31m,,6.8,164,,"The young married couple - photographer Marie (Marta Vancurová) and civil engineering student Petr (Vlastimil Harapes) - live in a cozy attic flat with their four-year-old daughter Maruska. Petr sometimes goes out for a beer with other students and one night brings a couple of them - hungry and loud - back home with him in early morning hours, much to Marie's discontent. But the two young people have a strong and loving relationship and when Maruska suddenly falls ill they are very distressed.",https://www.imdb.com/title/tt0074393/?ref_=sr_i_480,"['Juraj Herz', 'Markéta Zinnerová']",['Juraj Herz'],"['Marta Vancurová', 'Vlastimil Harapes', 'Sylva Kamenická', 'Dana Medrická', 'Jirina Sejbalová', 'Eva Sitteová', 'Lubomír Cerník', 'Zofie Kanyzová-Veselá', 'Jan Hartl', 'Eva Svobodová']",,,,,"June 1, 1977",['Czechoslovakia'],,['Filmové studio Barrandov'],"Awards, 1 win & 2 nominations total","['Drama', 'Romance']",['Czech']
481. Rape! 13th Hour,1977,1h 13m,,5.8,313,,A serial rapist takes on a young protégé to his craft as he is pursued by a homosexual gang seeking vengeance for an attack on their leader.,https://www.imdb.com/title/tt0287648/?ref_=sr_i_481,"['Chiho Katsura', 'Yoshio Shirasaka']",['Yasuharu Hasebe'],"['Yuri Yamashina', 'Yûdai Ishiyama', 'Hidetoshi Kageyama', 'Tamaki Katsura', 'Ikunosuke Koizumi', 'Hiroshi Kôno', 'Naomi Oka', 'Rei Okamoto', 'Yoshihiko Tabata', 'Akira Takahashi']",,,,,"January 22, 1977",['Japan'],['Japan'],['Nikkatsu'],,"['Action', 'Crime', 'Horror', 'Thriller']",['Japanese']
482. Kleinhoff Hotel,1977,1h 45m,R,5.2,272,,"Pascale, married to an architect, misses her flight to London and is forced to stay in Berlin, at the Kleinhoff Hotel where she stayed as a student. Karl, a would-be revolutionary, lives in the adjoining room and Pascale spies on him and his ex-girlfriend through a hole, then follows him to a questionable place where she is arrested by the police during a revolutionists' raid. When she returns to the Kleinhoff Hotel, Pascale finds Karl crying, enters his room to console him and they have a love affair. While she sleeps, he kills himself; upon awakening, she coldly dresses and leaves the hotel.",https://www.imdb.com/title/tt0076275/?ref_=sr_i_482,"['Valentino Orsini', 'Faliero Rosati']",['Carlo Lizzani'],"['Corinne Cléry', 'Bruce Robinson', 'Katja Rupé', 'Rodolfo Dal Pra', 'Werner Pochath', 'Peter Kern', 'Carole Fouanon', 'Gino Marturano', 'Michele Placido', 'Enrico Cesaretti']",,,,,"October 28, 1977","['Italy', 'Monaco']","['Berlin, Germany']","['Roxy Films', 'Trust International Films']",,['Drama'],['English']
483. Il ginecologo della mutua,1977,1h 18m,,4.5,220,,"Dr. The White is a famous gynecologist who, for some bad speculations, is covered with debts and to avoid problems decides to go abroad for a few months. But could not close the study doctor decides to contact dr. Giovanardi, good and honest gynecologist mutual and very libertine to have married a lesbian. These s'ambienta immediately in the new study, asserting itself both as a doctor and as a lover. Shortly after, in fact, all customers are queuing up to take advantage of its special services. Recommended by the wily secretary Pamela, Dr. Giovanardi gives his utmost towards its customers, especially to Tina, the young wife of Arlotti, a wealthy entrepreneur, who wants at all costs to a son. In love with the wife of Arlotti, who becomes pregnant, Dr. Giovanardi succeeds in getting finance the construction of a new clinic with the help of Tina and her husband, who ignores it is not the natural father of the unborn child. It made the clinic, Dr. Giovanardi settled here now and get a real triumph and decided to sell the old studio to a young fellow, always in white with women. Dr. Lo Bianco, finally, remains abroad to do the gynecologist in the tropical island where had fled.",https://www.imdb.com/title/tt0076083/?ref_=sr_i_483,"[""Joe D'Amato"", 'Tito Carpi']","[""Joe D'Amato""]","['Renzo Montagnani', 'Paola Senatore', 'Massimo Serato', 'Daniela Doria', 'Loretta Persichetti', 'Toni Ucci', 'Riccardo Salvino', 'Isabella Biagini', 'Mario Carotenuto', 'Aldo Fabrizi']",,,,,"February 11, 1977",['Italy'],,['Kristal Film'],,['Comedy'],['Italian']
484. Thieves,1977,1h 32m,PG,4.7,194,,Dramedy of a native New York married couple who splits up in an attempt to rediscover their sanity.,https://www.imdb.com/title/tt0076815/?ref_=sr_i_484,['Herb Gardner'],"['John Berry', 'Alfred Viola']","['Marlo Thomas', 'Charles Grodin', 'Irwin Corey', 'Hector Elizondo', 'Mercedes McCambridge', 'John McMartin', 'Gary Merrill', 'Ann Wedgeworth', 'Larry B. Scott', 'Bob Fosse']",,,,,"May 29, 1978",['United States'],,['Brut Productions'],,"['Comedy', 'Drama', 'Romance']",['English']
485. Clark,1977,1h 44m,,6.3,22,,The notorious Swedish criminal Clark Olofsson's activities from his first serious conviction in 1966 and ten years on of bank robberies and fraud.,https://www.imdb.com/title/tt0123691/?ref_=sr_i_485,"['Poul Martinsen', 'Clark Olofsson']",['Poul Martinsen'],"['Mats Norryd', 'Anja Landgré', 'Anita Hedell', 'Carina Hedell', 'Ingemar Lindh', 'Martin Svensson', 'Michael Danielsson', 'Ulf Edelbrandt', 'Erik Ahlin', 'Roger Axelsson']",,,,,"September 19, 1977",['Denmark'],,['Steen Herdel Filmproduktion'],,"['Biography', 'Documentary']",['Swedish']
486. The Grateful Dead,1977,2h 11m,PG,7.9,966,,The Grateful Dead performs live at Winterland in San Francisco in October 1974.,https://www.imdb.com/title/tt0076104/?ref_=sr_i_486,"['Jerry Garcia', 'Donna Godchaux', 'Keith Godchaux']",['Jerry Garcia'],"['Jerry Garcia', 'Donna Godchaux', 'Keith Godchaux', 'Mickey Hart', 'Bill Kreutzmann', 'Phil Lesh', 'Bob Weir']",,,,,"June 2, 1977",['United States'],"['San Francisco, California, USA']",['Electrascope'],,"['Documentary', 'Music']",['English']
487. Lady Dracula,1977,1h 19m,Not Rated,4.1,189,,"A beautiful blonde bitten by Count Dracula 100 years previously is unearthed in Vienna, and soon she goes on a killing spree. The skeptical cop on the case falls for her.",https://www.imdb.com/title/tt0076290/?ref_=sr_i_487,"['Brad Harris', 'Redis Read']",['Franz Josef Gottlieb'],"['Evelyne Kraft', 'Brad Harris', 'Theo Lingen', 'Eddi Arent', 'Christine Buchegger', 'Walter Giller', 'Klaus Höhne', 'Roberto Blanco', 'Stephen Boyd', 'Marion Kracht']",,,,,"February 10, 1978",['West Germany'],"['Vienna, Austria (main location)']","['IFV Produktion', 'TV13 Filmproduktion']",,"['Supernatural Horror', 'Comedy', 'Horror']",['German']
488. Target of an Assassin,1977,1h 45m,PG,4.8,441,,"An ailing African leader is admitted to a hospital. A male nurse at the hospital kidnaps him, but it turns out that things aren't exactly what they seem to be.",https://www.imdb.com/title/tt0075307/?ref_=sr_i_488,"['Jon Burmeister', 'Scot Finch']",['Peter Collinson'],"['Anthony Quinn', 'John Phillip Law', 'Simon Sabela', 'Marius Weyers', 'Sandra Prinsloo', 'Joe Stewardson', 'Ken Gampu', 'Janet du Plessis', 'Barry Trengove', 'Chris du Toit']",,,,,"November 17, 1977",['South Africa'],['South Africa'],['Heyns Film Productions'],,"['Political Thriller', 'Thriller']","['English', 'Afrikaans']"
489. Fatso Catastrophe,1977,1h 45m,,6.1,61,,"The good-hearted but clumsy Catrasca causes accidents and mayhem wherever he goes. The kindly Graciela gets Catrasca a job as an assistant to her father, Dr. Galindez. Three groups of international spies compete to steal a formula Galindez has invented, but confuse it with Catrasca's secret family recipe for an alcoholic punch.",https://www.imdb.com/title/tt0195754/?ref_=sr_i_489,"['Hugo Moser', 'Jorge Porcel']",['Hugo Moser'],"['Jorge Porcel', 'Moria Casán', 'Osvaldo Terranova', 'Graciela Alfano', 'Adolfo García Grau', 'Beto Gianola', 'Perla Caron', 'Nathán Pinzón', 'Juan Carlos Galván', 'Jacques Arndt']",,,,,"September 8, 1977",['Argentina'],"['Buenos Aires, Federal District, Argentina']",['Aries Cinematográfica Argentina'],,['Comedy'],['Spanish']
490. La bourgeoise et le loubard,1977,1h 23m,,5.8,8,,,https://www.imdb.com/title/tt1255968/?ref_=sr_i_490,['Jean-Louis Daniel'],['Jean-Louis Daniel'],"['Jacques Burloux', 'Catherine Lecocq', 'Carla Marlier', 'Daniel Langlet', 'François Michaux', 'Philippe du Janerand', 'Mostéfa Stiti', 'Eliezer Mellule', 'Joël Cudennec', 'Rebecca']",,,,,"November 21, 1979",['France'],,['Les Films du Point du Jour'],,['Drama'],['French']
491. Bloody Monkey Master,1977,1h 35m,Not Rated,6.4,466,,"Iron is the son of a rebel leader, but prefers to spend his days gambling and getting into fights. When his father's group is arrested and executed, Iron is forced to flee and hide in the woods as a beggar and thief. After being taken in by a Shaolin monastery and trained in the art of Monkey-Style Kung Fu, Iron vows to hunt down his father's killer and avenge his death.",https://www.imdb.com/title/tt0076822/?ref_=sr_i_491,['Kuang Ni'],['Chen Kuan-Tai'],"['Chen Kuan-Tai', 'Kuan-Chun Chi', 'Chia-Lin Sun', 'Kang Chin', 'Chung-Tien Shih', 'Ka-Yan Leung', 'Yi-Kuei Chang', 'Chin-Hai Chen', 'Hui-Lou Chen', 'Mu-Chuan Chen']",,,,,1983,"['Hong Kong', 'Taiwan']",,"['Chin Hua Film Company', 'Wung Tai']",,['Action'],"['Mandarin', 'Cantonese']"
492. Pas koji je voleo vozove,1977,1h 31m,Unrated,7.2,610,,"A fugitive girl, a stuntman and a young man who lost his dog quite some time before, are joining together on a trip to reach each of their own destination. A youngster gets emotionally connected to the girl, and he'd try to help her to leave the bossy stuntman, to get false passport and escape to Paris.",https://www.imdb.com/title/tt0124825/?ref_=sr_i_492,['Gordan Mihic'],['Goran Paskaljevic'],"['Svetlana Bojkovic', 'Irfan Mensur', ""Velimir 'Bata' Zivojinovic"", 'Pavle Vuisic', ""Danilo 'Bata' Stojkovic"", 'Ljiljana Jovanovic', 'Dusan Janicijevic', 'Dragomir Cumic', 'Katica Zeli', 'Miroslava Bobic']",,,,,"December 12, 1977",['Yugoslavia'],,"['Centar Film', 'Radiotelevizija Beograd']","Awards, 2 wins & 1 nomination total","['Satire', 'Comedy', 'Drama']",['Serbo-Croatian']
493. Death Is My Trade,1977,2h 25m,,7.2,473,,The disturbing biography of Auschwitz commander Rudolf Höss.,https://www.imdb.com/title/tt0075708/?ref_=sr_i_493,"['Theodor Kotulla', 'Robert Merle']",['Theodor Kotulla'],"['Götz George', 'Elisabeth Schwarz', 'Kai Taschner', 'Hans Korte', 'Walter Czaschke', 'Kurt Hübner', 'Siegurd Fitzek', 'Matthias Fuchs', 'Claus-Dieter Reents', 'Peter Franke']",,,,,"November 18, 1977",['West Germany'],"['Auschwitz-Birkenau Concentration Camp, Oswiecim, Malopolskie, Poland']","['Iduna Film Produktiongesellschaft', 'Westdeutscher Rundfunk (WDR)']","Awards, 1 win & 1 nomination total","['Biography', 'Drama']",['German']
494. The Black Pearl,1977,1h 35m,PG,6.6,85,,"The young Ramon Salazar, son of a village owner, dreams of becoming a pearl fisherman. His father agrees to let him experience this job. Ramon enters a forbidden cave, den of a giant skate nicknamed the Manta Diablo. He finds an oyster containing a black pearl of unusual size. His father donates it to the Virgin rather than sell it to dishonest traffickers. Shortly after, the flotilla of the village led by Salazar perishes at sea. Ramon must face the Manta Diablo with another fisherman to bring prosperity to the village ..",https://www.imdb.com/title/tt0074212/?ref_=sr_i_494,"['Victor Miller', ""Scott O'Dell"", 'Antonio Recoder']",['Saul Swimmer'],"['Carlos Estrada', 'Perla Cristal', 'Mario Custodio', 'Emilio Rodríguez', 'Carl Anderson', 'Jorge Rigaud', 'Rafael Cabarcos', 'Aldo Sambrell', 'Ricardo Palacios', 'José Crespo']",,,,,August 1977,"['United States', 'Spain']",['Bahamas (location)'],"['Royal Productions', 'Universum Film']",,"['Adventure', 'Drama']",['English']
495. Haunted,1977,1h 22m,R,3.5,233,,"In Arizona during the Civil War, a woman is accused of witchcraft, tied to a horse, and left to die in the desert. One hundred years later, the descendants of the woman's accusers start being killed off, and the townspeople suspect that the woman has come back as an evil spirit.",https://www.imdb.com/title/tt0079273/?ref_=sr_i_495,['Alessandro De Gaetano'],['Alessandro De Gaetano'],"['Aldo Ray', 'Virginia Mayo', 'Ann Michelle', 'Jim Negele', 'Brad Rearden', 'Fred Carroll', 'June Ely', 'Carl B. Belfor', 'Grady Daugherty', 'Paul Vincenzo']",,,,,"March 4, 1977",['United States'],"['Superstition Mountains, Arizona, USA']",['Northaire Communications'],,['Horror'],['English']
496. Cheering Section,1977,1h 24m,R,4.9,69,,A high school football star tries to romance the new girl at the school who happens to be his coach's daughter.,https://www.imdb.com/title/tt0075832/?ref_=sr_i_496,"['Wayne Crawford', 'Harry Kerwin']",['Harry Kerwin'],"['Rhonda Fox', 'Tom Leindecker', 'Patricia Michelle', 'Kim Jack', ""Greg D'Jah"", 'Jeff Laine', 'Karyn Wagner', 'Scott Blynne', 'W.G. Galivan', 'Lance Kerwin']","$60,000 (estimated)",,,,"August 19, 1977",['United States'],"['Miami, Florida, USA']",['American General Pictures'],,['Comedy'],['English']
497. El transexual,1977,1h 18m,,5.0,59,,"Sympathetic look at the tragic life of cabaret singer Lorna, who was born a man but really just wants to be a woman. She meets a man who loves her but she can't tell him the truth and decides instead to get an operation so she'll be all woman.",https://www.imdb.com/title/tt0076837/?ref_=sr_i_497,"['Juan José Porto', 'Paul Naschy', 'Antonio Fos']",['José Jara'],"['Ágata Lys', 'Paul Naschy', 'José Nieto', 'Sandra Alberti', 'Eva Robin', 'Vicente Parra', 'Ernesto Martín', 'Alfonso Castizo', 'Ángela Reyno', 'Antonio Orengo']",,,,,"October 17, 1977",['Spain'],"['Madrid, Spain']",,,['Drama'],['Spanish']
498. Last Chants for a Slow Dance,1977,1h 30m,,6.0,589,,"A man who is dissatisfied with his family life leaves home for weeks at a time, drifting from town to town.",https://www.imdb.com/title/tt0076293/?ref_=sr_i_498,['Jon Jost'],['Jon Jost'],"['Tom Blair', 'Wayne Crouse', 'Jessica St. John', 'Steve Voorheis']",,,,,"August 31, 1977",['United States'],"['Missoula, Montana, USA']",,,['Drama'],['English']
499. Mattie the Goose-Boy,1977,1h 10m,TV-Y,8.2,2.4K,,"A young peasant boy stands up to tyranny, aided by his trusting friend- a goose.",https://www.imdb.com/title/tt0142632/?ref_=sr_i_499,"['Attila Dargay', 'Mihály Fazekas', 'József Nepp']",['Attila Dargay'],"['András Kern', 'Péter Geszti', 'László Csákányi', 'Gábor Agárdi', 'Antal Farkas', 'László Csurka', 'Gellért Raksányi', 'Sándor Suka', 'Hilda Gobbi', 'László Inke']",,,,,"September 22, 1978",['Hungary'],,['Pannónia Filmstúdió'],,"['Adventure', 'Animation', 'Comedy', 'Family', 'Fantasy', 'History']","['Hungarian', 'Italian', 'German']"
