Title,Year,Duration,MPA,Rating,Votes,méta_score,description,Movie Link,writers,directors,stars,budget,opening_weekend_Gross,grossWorldWWide,gross_US_Canada,release_date,countries_origin,filming_locations,production_company,awards_content,genres,Languages
117. Begin Again,2013,1h 44m,R,7.4,171K,62.0,"A chance encounter between a down-and-out music business executive, and a young singer songwriter new to Manhattan, turns into a promising collaboration between the two talents.",https://www.imdb.com/title/tt1980929/?ref_=sr_i_117,['John Carney'],['John Carney'],"['Keira Knightley', 'Mark Ruffalo', 'Adam Levine', 'Hailee Steinfeld', 'James Corden', 'Yasiin Bey', 'Karen Pittman', 'Paul Romero', 'Catherine Keener', 'Andrew Sellon']","$8,000,000 (estimated)","$134,064","$105,539,577","$16,170,632","July 11, 2014",['United States'],"['Meatpacking District, Manhattan, New York City, New York, USA']","['Exclusive Media Group', 'Sycamore Pictures', 'Apatow Productions']","Nominated for 1 Oscar, 5 wins & 18 nominations total","['Showbiz Drama', 'Comedy', 'Drama', 'Music', 'Romance']",['English']
118. Jobs,2013,2h 8m,PG-13,6.0,105K,44.0,The story of Steve Jobs' ascension from college dropout into one of the most revered creative entrepreneurs of the 20th century.,https://www.imdb.com/title/tt2357129/?ref_=sr_i_118,['Matt Whiteley'],['Joshua Michael Stern'],"['Ashton Kutcher', 'Dermot Mulroney', 'Josh Gad', 'Lukas Haas', 'Matthew Modine', 'J.K. Simmons', 'Lesley Ann Warren', 'Ron Eldard', ""Ahna O'Reilly"", 'Victor Rasuk']","$12,000,000 (estimated)","$6,713,900","$42,128,352","$16,131,410","August 16, 2013","['United States', 'Switzerland']","['Jama Masjid, Chandni Chowk, Old Delhi, Central Delhi, Delhi, India']","['Open Road Films (II)', 'Five Star Institute', 'IF Entertainment']","Awards, 2 nominations total","['Docudrama', 'Biography', 'Drama']",['English']
119. Fruitvale Station,2013,1h 25m,R,7.5,88K,85.0,"The story of Oscar Grant III, a 22-year-old Bay Area resident, who crosses paths with friends, enemies, family, and strangers on the last day of 2008.",https://www.imdb.com/title/tt2334649/?ref_=sr_i_119,['Ryan Coogler'],['Ryan Coogler'],"['Michael B. Jordan', 'Melonie Diaz', 'Octavia Spencer', 'Kevin Durand', 'Chad Michael Murray', ""Ahna O'Reilly"", 'Ariana Neal', 'Keenan Coogler', 'Trestin George', 'Joey Oglesby']","$900,000 (estimated)","$386,291","$17,385,830","$16,101,339","July 26, 2013",['United States'],"['Oakland, California, USA']","['OG Project', 'Significant Productions']","Awards, 36 wins & 58 nominations total","['True Crime', 'Biography', 'Crime', 'Drama', 'Romance']","['English', 'Spanish']"
120. About Time,2013,2h 3m,R,7.8,410K,55.0,"At the age of 21, Tim discovers he can travel in time and change what happens and has happened in his own life. His decision to make his world a better place by getting a girlfriend turns out not to be as easy as you might think.",https://www.imdb.com/title/tt2194499/?ref_=sr_i_120,['Richard Curtis'],['Richard Curtis'],"['Domhnall Gleeson', 'Rachel McAdams', 'Bill Nighy', 'Lydia Wilson', 'Lindsay Duncan', 'Richard Cordery', 'Joshua McGuire', 'Tom Hollander', 'Margot Robbie', 'Will Merrick']","$12,000,000 (estimated)","$1,076,250","$87,100,748","$15,322,921","November 8, 2013","['United States', 'United Kingdom']","['Portloe, Truro, Cornwall, England, UK (on location)']","['Translux', 'Working Title Films']","Awards, 3 wins & 9 nominations total","['Feel-Good Romance', 'Romantic Comedy', 'Time Travel', 'Comedy', 'Drama', 'Fantasy', 'Romance', 'Sci-Fi']",['English']
121. The Last Exorcism Part II,2013,1h 28m,PG-13,4.0,17K,35.0,"As Nell Sweetzer tries to build a new life after the events of the first movie, the evil force that once possessed her returns with an even more horrific plan.",https://www.imdb.com/title/tt2034139/?ref_=sr_i_121,"['Damien Chazelle', 'Ed Gass-Donnelly', 'Huck Botko']",['Ed Gass-Donnelly'],"['Ashley Bell', 'Julia Garner', 'Spencer Treat Clark', 'David Jensen', 'Tarra Riggs', 'Louis Herthum', 'Muse Watson', 'Erica Michelle Singleton', 'Sharice A. Williams', 'Boyana Balta']","$5,000,000 (estimated)","$7,728,354","$25,051,865","$15,179,302","March 1, 2013","['France', 'United States', 'United Kingdom']","['New Orleans, Louisiana, USA']","['StudioCanal', 'Strike Entertainment', 'Anton']","Awards, 1 win & 2 nominations total","['Supernatural Horror', 'Horror', 'Thriller']",['English']
122. Labor Day,2013,1h 51m,PG-13,6.9,54K,52.0,"Depressed single mom Adele and her son Henry offer a wounded, fearsome man a ride. As police search town for the escaped convict, the mother and son gradually learn his true story as their options become increasingly limited.",https://www.imdb.com/title/tt1967545/?ref_=sr_i_122,"['Jason Reitman', 'Joyce Maynard']",['Jason Reitman'],"['Kate Winslet', 'Josh Brolin', 'Gattlin Griffith', 'Clark Gregg', 'Tobey Maguire', 'Tom Lipinski', 'Maika Monroe', 'James Van Der Beek', 'J.K. Simmons', 'Brooke Smith']","$18,000,000 (estimated)","$5,175,282","$20,275,812","$13,371,528","January 31, 2014",['United States'],"['Acton, Massachusetts, USA']","['Indian Paintbrush', 'Mr. Mudd', 'Right of Way Films']","Awards, 6 nominations total","['Coming-of-Age', 'Drama', 'Romance', 'Thriller']",['English']
123. Inside Llewyn Davis,2013,1h 44m,R,7.4,167K,93.0,A week in the life of a young singer as he navigates the Greenwich Village folk scene of 1961.,https://www.imdb.com/title/tt2042568/?ref_=sr_i_123,"['Joel Coen', 'Ethan Coen']","['Ethan Coen', 'Joel Coen']","['Oscar Isaac', 'Carey Mulligan', 'John Goodman', 'Garrett Hedlund', 'Justin Timberlake', 'Ethan Phillips', 'Robin Bartlett', 'Max Casella', 'Jerry Grayson', 'Jeanine Serralles']","$11,000,000 (estimated)","$405,411","$32,962,157","$13,235,319","January 10, 2014","['United States', 'United Kingdom', 'France']","['Medford, Minnesota, USA (road scenes)']","['CBS Films', 'StudioCanal', 'Anton']","Nominated for 2 Oscars, 47 wins & 174 nominations total","['Dark Comedy', 'Period Drama', 'Showbiz Drama', 'Tragedy', 'Drama', 'Music']",['English']
124. The Last Stand,2013,1h 47m,R,6.3,148K,54.0,"The leader of a drug cartel busts out of a courthouse and speeds to the Mexican border, where the only thing in his path is a sheriff and his inexperienced staff.",https://www.imdb.com/title/tt1549920/?ref_=sr_i_124,['Andrew Knauer'],['Kim Jee-woon'],"['Arnold Schwarzenegger', 'Forest Whitaker', 'Johnny Knoxville', 'Rodrigo Santoro', 'Arron Shiver', 'Titos Menchaca', 'Richard Dillard', 'Doug Jackson', 'Mathew Greer', 'Peter Stormare']","$45,000,000 (estimated)","$6,281,433","$48,330,757","$12,050,299","January 18, 2013","['United States', 'South Korea']","['Becker Ave & N 2nd St, Belen, New Mexico, USA (shootout in Sommerton Junction, Arizona)']","['CJ Entertainment', 'Di Bonaventura Pictures']","Awards, 1 win & 2 nominations total","['Contemporary Western', 'Dark Comedy', 'Action', 'Thriller', 'Western']",['English']
125. Out of the Furnace,2013,1h 56m,R,6.7,128K,63.0,"When Rodney Baze mysteriously disappears and law enforcement doesn't follow through fast enough, his older brother Russell takes matters into his own hands to find justice.",https://www.imdb.com/title/tt1206543/?ref_=sr_i_125,"['Brad Ingelsby', 'Scott Cooper']",['Scott Cooper'],"['Christian Bale', 'Casey Affleck', 'Zoe Saldaña', 'Woody Harrelson', 'Dendrie Taylor', 'Carl Ciarfalio', 'Nancy Mosser', 'Sam Shepard', ""Bingo O'Malley"", 'Tom Bower']","$22,000,000 (estimated)","$5,220,288","$15,661,554","$11,330,849","December 6, 2013","['United Kingdom', 'United States']","['Braddock, Pennsylvania, USA']","['Appian Way', 'Energy Entertainment', 'Red Granite Pictures']","Awards, 1 win & 10 nominations total","['Crime', 'Drama', 'Thriller']",['English']
126. Dead Man Down,2013,1h 58m,R,6.4,71K,39.0,"In New York City, a crime lord's right-hand man is helped by a woman seeking retribution.",https://www.imdb.com/title/tt2101341/?ref_=sr_i_126,['J.H. Wyman'],['Niels Arden Oplev'],"['Colin Farrell', 'Noomi Rapace', 'Dominic Cooper', 'Terrence Howard', 'Isabelle Huppert', 'Luis Da Silva Jr.', 'Stu Bennett', 'Franky G', 'Declan Mulvey', 'John Cenatiempo']","$30,000,000 (estimated)","$5,345,250","$18,074,539","$10,895,295","March 8, 2013",['United States'],"['Philadelphia, Pennsylvania, USA']","['FilmDistrict', 'IM Global', 'WWE Studios']",,"['Action', 'Adventure', 'Crime', 'Drama', 'Mystery', 'Thriller']","['English', 'French', 'Albanian', 'Spanish', 'Hungarian']"
127. Belle,2013,1h 40m,PG,7.3,34K,64.0,"The biracial daughter, Dido Elizabeth Belle (Gugu Mbatha-Raw), of Royal Navy Captain Sir John Lindsay (Matthew Goode) is raised by aristocratic Great-uncle Lord William Murray, 1st Earl of Mansfield (Tom Wilkinson) in 18th century England.",https://www.imdb.com/title/tt2404181/?ref_=sr_i_127,['Misan Sagay'],['Amma Asante'],"['Gugu Mbatha-Raw', 'Matthew Goode', 'Emily Watson', 'Miranda Richardson', 'Lauren Julien-Box', 'Natasha Williams', 'Alan McKenna', 'Penelope Wilton', 'Cara Jenkins', 'Tom Wilkinson']","$10,900,000 (estimated)","$106,578","$16,607,575","$10,726,630","June 13, 2014",['United Kingdom'],"['Douglas, Isle of Man']","['DJ Films', 'Isle of Man Film', 'British Film Institute (BFI)']","Awards, 13 wins & 32 nominations total","['Costume Drama', 'Period Drama', 'Biography', 'Drama', 'Romance']","['English', 'French', 'Latin']"
128. Getaway,2013,1h 30m,PG-13,4.4,26K,22.0,"To save his kidnapped wife, Brent Magna must drive at the orders of a mysterious man.",https://www.imdb.com/title/tt2167202/?ref_=sr_i_128,"['Sean Finegan', 'Gregg Maxwell Parker']",['Courtney Solomon'],"['Ethan Hawke', 'Selena Gomez', 'Jon Voight', 'Paul Freeman', 'Rebecca Budig', 'Bruce Payne', 'Ivaylo Geraskov', 'Dimo Alexiev', 'Velislav Pavlov', 'Dejan Angelov']","$18,000,000 (estimated)","$4,503,892","$11,806,432","$10,501,938","August 30, 2013","['United States', 'Bulgaria']","['Sofia, Bulgaria']","['After Dark Films', 'Dark Castle Entertainment', 'After Dark Films']","Awards, 2 nominations total","['Action', 'Thriller']",['English']
129. Peeples,2013,1h 35m,PG-13,5.4,5.2K,52.0,Sparks fly when Wade Walker crashes the Peeples annual reunion in the Hamptons to ask for their precious daughter Grace's hand in marriage.,https://www.imdb.com/title/tt1699755/?ref_=sr_i_129,['Tina Gordon'],['Tina Gordon'],"['Craig Robinson', 'Kerry Washington', 'David Alan Grier', 'S. Epatha Merkerson', 'Tyler James Williams', 'Melvin Van Peebles', 'Diahann Carroll', 'Kali Hawk', 'Kimrie Lewis', 'Malcolm Barrett']","$15,000,000 (estimated)","$4,611,534","$9,307,166","$9,177,065","May 10, 2013",['United States'],"['Connecticut, USA']","['34th Street Films', 'Homegrown Pictures', 'Peeples Productions Inc.']","Awards, 7 nominations total","['Comedy', 'Romance']",['English']
130. Battle of the Year,2013,1h 50m,PG-13,5.0,9.8K,29.0,"Battle of the Year attracts all the best teams from around the world, but the Americans haven't won in fifteen years. Dante enlists Blake to assemble a team of the best dancers and bring the Trophy back to America where it started.",https://www.imdb.com/title/tt1532958/?ref_=sr_i_130,"['Brin Hill', 'Chris Parker', 'Benson Lee']",['Benson Lee'],"['Josh Holloway', 'Laz Alonso', 'Josh Peck', 'Caity Lotz', 'Chris Brown', ""Ivan 'Flipz' Velez"", ""Jon 'Do Knock' Cruz"", 'Anis Cheurfa', ""Jesse 'Casper' Brown"", 'David Shreibman']","$20,000,000 (estimated)","$4,603,177","$16,549,477","$8,888,355","September 20, 2013",['United States'],"['Los Angeles, California, USA']","['Contrafilm', 'Screen Gems']","Awards, 1 nomination total","['Drama', 'Music']",['English']
131. Movie 43,2013,1h 34m,R,4.4,116K,18.0,A series of interconnected short films follows a washed-up producer as he pitches insane story lines featuring some of the biggest stars in Hollywood.,https://www.imdb.com/title/tt1333125/?ref_=sr_i_131,"['Rocky Russo', 'Jeremy Sosenko', 'Ricky Blitt']","['Elizabeth Banks', 'Steven Brill', 'Steve Carr']","['Emma Stone', 'Stephen Merchant', 'Richard Gere', 'Liev Schreiber', 'Dennis Quaid', 'Greg Kinnear', 'Common', 'Charlie Saxton', 'Will Sasso', 'Odessa Rae']","$6,000,000 (estimated)","$4,805,878","$32,443,111","$8,840,453","January 25, 2013",['United States'],"['New York City, New York, USA']","['Relativity Media', 'Virgin Produced', 'GreeneStreet Films']","Awards, 4 wins & 5 nominations total","['Raunchy Comedy', 'Sketch Comedy', 'Comedy']",['English']
132. Legends of Oz: Dorothy's Return,2013,1h 28m,PG,4.9,6.4K,25.0,"Shortly after a tornado rips through her Kansas home, Dorothy returns to Oz to save her friends from a villainous jester.",https://www.imdb.com/title/tt0884726/?ref_=sr_i_132,"['Roger S. Baum', 'Randi Barnes', 'Adam Balsam']","['Will Finn', 'Daniel St. Pierre']","['Lea Michele', 'Kelsey Grammer', 'Dan Aykroyd', 'Jim Belushi', 'Tacey Adams', 'Michael Krawic', 'Martin Short', 'Bernadette Peters', 'Randi Soyland', 'Oliver Platt']","$70,000,000 (estimated)","$3,747,780","$21,755,418","$8,462,347","May 9, 2014","['United States', 'India', 'Russia', 'Netherlands']",,"['Summertime Entertainment (II)', '120dB Films', 'Carroll Brothers Production']","Awards, 1 win & 5 nominations total","['Computer Animation', 'Adventure', 'Animation', 'Family', 'Fantasy', 'Musical']",['English']
133. Mandela: Long Walk to Freedom,2013,2h 21m,PG-13,7.1,30K,60.0,A chronicle of Nelson Mandela's life journey from his childhood in a rural village through to his inauguration as the first democratically elected president of South Africa.,https://www.imdb.com/title/tt2304771/?ref_=sr_i_133,"['William Nicholson', 'Nelson Mandela']",['Justin Chadwick'],"['Idris Elba', 'Naomie Harris', 'Terry Pheto', 'Robert Hobbs', 'Tony Kgoroge', 'Riaad Moosa', 'Zolani Mkiva', 'Simo Magwaza', 'Fana Mokoena', 'Thapelo Mokoena']","$35,000,000 (estimated)","$84,283","$27,985,788","$8,323,085","December 25, 2013","['United Kingdom', 'France', 'South Africa']","[""Drakensberg Mountains, South Africa (Nelson Mandela's childhood village)""]","['Videovision Entertainment', 'Distant Horizon', 'Film Afrika Worldwide']","Nominated for 1 Oscar, 13 wins & 36 nominations total","['Biography', 'Drama', 'History']","['English', 'Afrikaans', 'Xhosa']"
134. Before Midnight,2013,1h 49m,R,7.9,179K,94.0,We meet Jesse and Celine nine years on in Greece. Almost two decades have passed since their first meeting on that train bound for Vienna.,https://www.imdb.com/title/tt2209418/?ref_=sr_i_134,"['Richard Linklater', 'Julie Delpy', 'Ethan Hawke']",['Richard Linklater'],"['Ethan Hawke', 'Julie Delpy', 'Seamus Davey-Fitzpatrick', 'Ariane Labed', 'Jennifer Prior', 'Charlotte Prior', 'Xenia Kalogeropoulou', 'Walter Lassally', 'Yiannis Papadopoulos', 'Athina Rachel Tsangari']","$3,000,000 (estimated)","$246,914","$20,705,582","$8,114,627","June 14, 2013","['United States', 'Greece']","['The Westin Resort Costa Navarino, Messinia, Greece (hotel room scene)']","['Faliro House Productions', 'Venture Forth', 'Castle Rock Entertainment']","Nominated for 1 Oscar, 20 wins & 64 nominations total","['Drama', 'Romance']","['English', 'Greek', 'French']"
135. Dhoom 3,2013,2h 52m,Not Rated,5.4,51K,61.0,"Jai and Ali return to catch the clown thief, Sahir, who has targeted various branches of the Western Bank of Chicago.",https://www.imdb.com/title/tt1833673/?ref_=sr_i_135,"['Vijay Krishna Acharya', 'Aditya Chopra']",['Vijay Krishna Acharya'],"['Aamir Khan', 'Katrina Kaif', 'Abhishek Bachchan', 'Uday Chopra', 'Jackie Shroff', 'Tabrett Bethell', 'Andrew Bicknell', 'Siddharth Nigam', 'Charles Rasmussen', 'Gavin Marshall']",,"$3,423,508","$88,031,955","$8,031,955","December 20, 2013","['India', 'United States']","['Chicago, Illinois, USA']","['Yash Raj Films', 'CounterPunch Studios', 'Curbside Films']","Awards, 21 wins & 24 nominations total","['Heist', 'Tragedy', 'Action', 'Crime', 'Drama', 'Thriller']","['Hindi', 'English']"
136. Machete Kills,2013,1h 47m,R,5.6,84K,41.0,The U.S. government recruits Machete to battle his way through Mexico in order to take down an arms dealer who looks to launch a weapon into space.,https://www.imdb.com/title/tt2002718/?ref_=sr_i_136,"['Kyle Ward', 'Robert Rodriguez', 'Marcel Rodriguez']",['Robert Rodriguez'],"['Danny Trejo', 'Alexa PenaVega', 'Mel Gibson', 'Jessica Alba', 'Demián Bichir', 'Amber Heard', 'Michelle Rodriguez', 'Sofía Vergara', 'Charlie Sheen', 'Lady Gaga']","$20,000,000 (estimated)","$3,837,183","$17,537,186","$8,008,161","October 11, 2013","['United States', 'Russia']","['Texas, USA']","['AR Films', 'Aldamisa Entertainment', '1821 Pictures']","Awards, 3 nominations total","['Dark Comedy', 'Parody', 'Action', 'Comedy', 'Crime', 'Thriller']","['English', 'Spanish']"
137. Bad Words,2013,1h 29m,R,6.6,57K,57.0,A spelling bee loser sets out to exact revenge by finding a loophole and attempting to win as an adult.,https://www.imdb.com/title/tt2170299/?ref_=sr_i_137,['Andrew Dodge'],['Jason Bateman'],"['Jason Bateman', 'Kathryn Hahn', 'Allison Janney', 'Rohan Chand', 'Philip Baker Hall', 'Ben Falcone', 'Steve Witting', 'Beth Grant', 'Gwen Parden', 'Anjul Nigam']","$10,000,000 (estimated)","$113,301","$7,804,337","$7,779,614","March 28, 2014",['United States'],"[""Sportsmen's Lodge - 12825 Ventura Blvd., Studio City, Los Angeles, California, USA (hotel)""]","['Aggregate Films', 'Darko Entertainment', 'Digital Image Associates']","Awards, 2 wins & 4 nominations total","['Comedy', 'Drama']",['English']
138. Paranoia,2013,1h 46m,PG-13,5.6,40K,32.0,"An entry-level employee at a powerful corporation finds himself occupying a corner office, but at a dangerous price: he must spy on his boss's old mentor to secure for him a multi-billion dollar advantage.",https://www.imdb.com/title/tt1413495/?ref_=sr_i_138,"['Jason Hall', 'Barry L. Levy', 'Joseph Finder']",['Robert Luketic'],"['Liam Hemsworth', 'Gary Oldman', 'Harrison Ford', 'Amber Heard', 'Lucas Till', 'Embeth Davidtz', 'Julian McMahon', 'Josh Holloway', 'Richard Dreyfuss', 'Angela Sarafyan']","$35,000,000 (estimated)","$3,528,376","$17,056,265","$7,388,654","August 16, 2013","['United States', 'India', 'France']","['Philadelphia, Pennsylvania, USA']","['Relativity Media', 'Reliance Entertainment', 'Demarest Films']","Awards, 1 nomination total","['Dark Comedy', 'Drama', 'Thriller']",['English']
139. The Green Inferno,2013,1h 40m,R,5.4,52K,38.0,"A group of student activists travels to the Amazon to save the rain forest and soon discover that they are not alone, and that no good deed goes unpunished.",https://www.imdb.com/title/tt2403021/?ref_=sr_i_139,"['Eli Roth', 'Guillermo Amoedo']",['Eli Roth'],"['Lorenza Izzo', 'Ariel Levy', 'Aaron Burns', 'Kirby Bliss Blanton', 'Daryl Sabara', 'Magda Apanowicz', 'Sky Ferreira', 'Nicolás Martínez', 'Ignacia Allamand', 'Ramón Llao']","$5,000,000 (estimated)","$3,520,626","$12,666,449","$7,192,291","September 25, 2015","['United States', 'Chile', 'United Kingdom']","['Tarapoto, Peru']","['Worldview Entertainment', 'Open Road Films (II)', 'Dragonfly Entertainment']","Awards, 1 win & 6 nominations total","['Folk Horror', 'Jungle Adventure', 'Splatter Horror', 'Survival', 'Adventure', 'Horror']","['Spanish', 'Quechua', 'English']"
140. Black Nativity,2013,1h 33m,PG,4.8,2.4K,48.0,"A street-wise teen from Baltimore who has been raised by a single mother travels to New York City to spend the Christmas holiday with his estranged relatives, where he embarks on a surprising and inspirational journey.",https://www.imdb.com/title/tt1425922/?ref_=sr_i_140,"['Langston Hughes', 'Kasi Lemmons']",['Kasi Lemmons'],"['Forest Whitaker', 'Angela Bassett', 'Jennifer Hudson', 'Mary J. Blige', 'Tyrese Gibson', 'Jacob Latimore', 'Nas', 'Vondie Curtis-Hall', 'Luke James', 'Grace Gibson']","$17,500,000 (estimated)","$3,669,530","$7,454,185","$7,018,189","November 27, 2013",['United States'],"['New York City, New York, USA']","['Bob Industries', 'Maven Pictures']","Awards, 2 wins & 5 nominations total","['Drama', 'Family', 'Music', 'Musical']",['English']
141. The Spectacular Now,2013,1h 35m,R,7.0,165K,82.0,"A hard-partying high school senior's philosophy on life changes when he meets the not-so-typical ""nice girl.""",https://www.imdb.com/title/tt1714206/?ref_=sr_i_141,"['Scott Neustadter', 'Michael H. Weber', 'Tim Tharp']",['James Ponsoldt'],"['Miles Teller', 'Shailene Woodley', 'Kyle Chandler', 'Jennifer Jason Leigh', 'Brie Larson', 'Masam Holden', 'Dayo Okeniyi', 'Nicci Roessler', 'Ava-Marie London', 'Whitney Goin']","$2,500,000 (estimated)","$197,415","$6,918,591","$6,854,611","September 13, 2013",['United States'],"['Athens, Georgia, USA']","['Andrew Lauren Productions', '21 Laps Entertainment', 'Global Produce']","Awards, 9 wins & 32 nominations total","['Coming-of-Age', 'Teen Drama', 'Teen Romance', 'Drama', 'Romance']",['English']
142. The Grandmaster,2013,2h 10m,PG-13,6.6,38K,73.0,"The story of martial-arts master Ip Man, the man who trained Bruce Lee.",https://www.imdb.com/title/tt1462900/?ref_=sr_i_142,"['Wong Kar-Wai', 'Jingzhi Zou', 'Haofeng Xu']",['Wong Kar-Wai'],"['Tony Leung Chiu-wai', 'Ziyi Zhang', 'Jin Zhang', 'Chang Chen', 'Cung Le', 'Qingxiang Wang', 'Elvis Tsui', 'Song Hye-kyo', 'Kar-Yung Lau', 'Chiu-Yee Tsang']","$38,600,000 (estimated)","$132,617","$73,933,255","$6,594,959","August 30, 2013","['Hong Kong', 'China', 'France', 'Netherlands', 'United States']","['Foshan, Guangdong, China']","['Block 2 Pictures', 'Jet Tone Production', 'Sil-Metropole Organisation']","Nominated for 2 Oscars, 68 wins & 72 nominations total","['Kung Fu', 'Martial Arts', 'Action', 'Biography', 'Drama', 'Romance', 'War']","['Mandarin', 'Cantonese', 'Japanese']"
143. All Is Lost,2013,1h 46m,PG-13,6.9,85K,87.0,"After a collision with a shipping container at sea, a resourceful sailor finds himself, despite all efforts to the contrary, staring his mortality in the face.",https://www.imdb.com/title/tt2017038/?ref_=sr_i_143,['J.C. Chandor'],['J.C. Chandor'],['Robert Redford'],"$9,000,000 (estimated)","$93,583","$13,627,519","$6,263,670","October 25, 2013","['United States', 'Canada', 'Mexico']","['San Pedro, Los Angeles, California, USA']","['Roadside Attractions', 'Before The Door Pictures', 'FilmNation Entertainment']","Nominated for 1 Oscar, 3 wins & 48 nominations total","['Sea Adventure', 'Survival', 'Action', 'Adventure', 'Drama']",['English']
144. Justin Bieber's Believe,2013,1h 32m,PG,1.6,18K,39.0,A backstage and on-stage look at Justin Bieber during his rise to super stardom.,https://www.imdb.com/title/tt3165608/?ref_=sr_i_144,['Sarah Landman Serafini'],['Jon M. Chu'],"['Justin Bieber', 'Scooter Braun', 'Ryan Good', 'Usher', 'Pattie Mallette', 'Jeremy Bieber', 'Mike Posner', 'Max Martin', 'Will.i.am', 'Rodney Jerkins']","$5,000,000 (estimated)","$2,007,567","$10,980,157","$6,206,566","December 25, 2013",['United States'],,"['Dolphin Films', 'Bieber Time Films', 'Scooter Braun Films']","Awards, 1 nomination total","['Music Documentary', 'Documentary', 'Music']",['English']
145. The Bling Ring,2013,1h 30m,R,5.6,94K,66.0,"Inspired by actual events, a group of fame-obsessed teenagers use the internet to track celebrities' whereabouts in order to rob their homes.",https://www.imdb.com/title/tt2132285/?ref_=sr_i_145,"['Sofia Coppola', 'Nancy Jo Sales']",['Sofia Coppola'],"['Katie Chang', 'Israel Broussard', 'Emma Watson', 'Claire Julien', 'Taissa Farmiga', 'Georgia Rock', 'Leslie Mann', 'Carlos Miranda', 'Gavin Rossdale', 'Stacy Edwards']","$8,000,000 (estimated)","$214,395","$20,165,000","$5,845,732","June 21, 2013","['United States', 'United Kingdom', 'France', 'Germany', 'Japan']","['Artemesia Estate - 5771 Valley Oak Drive, Los Feliz Oaks, Hollywood, Los Angeles, California, USA (various celebrity homes)']","['American Zoetrope', 'FilmNation Entertainment', 'NALA Films']","Awards, 4 wins & 7 nominations total","['Caper', 'True Crime', 'Biography', 'Crime', 'Drama']",['English']
146. Pulling Strings,2013,1h 51m,PG,6.1,2.1K,57.0,"After a night of drinking, Rachel (Laura Ramsey), a diplomat working in Mexico City finds her world turned upside down after she's saved by Alejandro (Jaime Camil), a Mariachi singer whose visa was rejected the day before - by Rachel.",https://www.imdb.com/title/tt3203890/?ref_=sr_i_146,"['Oscar Orlando Torres', 'Issa López', 'Gabriel Ripstein']",['Pitipol Ybarra'],"['Laura Ramsey', 'Jaime Camil', 'Omar Chaparro', 'Stockard Channing', 'Aurora Papile', 'Renata Ybarra', 'Mariachi Juvenil de Tecalitlán', 'Tom Arnold', 'Roberto Sosa', 'Carlos Macias']",,"$2,467,168","$13,725,819","$5,842,961","November 8, 2013",['Mexico'],,"['Byg studio', 'Traziende Films']","Awards, 1 nomination total","['Comedy', 'Romance']","['English', 'Spanish']"
147. Closed Circuit,2013,1h 36m,R,6.2,24K,50.0,A high-profile terrorism case unexpectedly binds together two ex-lovers on the defense team - testing the limits of their loyalties and placing their lives in jeopardy.,https://www.imdb.com/title/tt2218003/?ref_=sr_i_147,['Steven Knight'],['John Crowley'],"['Eric Bana', 'Rebecca Hall', 'Jim Broadbent', 'Ciarán Hinds', 'Kate Lock', 'Katherine Press', 'Patrick Warner', 'Ricky Nixon', 'Daniel Tuite', 'Zora Bishop']","$15,000,000 (estimated)","$2,464,931","$6,331,939","$5,750,401","August 28, 2013","['United Kingdom', 'United States']","['London, Greater London, England, UK (location)']","['Focus Features', 'Working Title Films']",,"['Legal Thriller', 'Crime', 'Drama', 'Mystery', 'Thriller']",['English']
