Title,Year,Duration,MPA,Rating,Votes,méta_score,description,Movie Link,writers,directors,stars,budget,opening_weekend_Gross,grossWorldWWide,gross_US_Canada,release_date,countries_origin,filming_locations,production_company,awards_content,genres,Languages
278. The Love Punch,2013,1h 34m,PG-13,5.7,16K,44.0,A divorced couple scheme to recover the retirement money that was stolen from them.,https://www.imdb.com/title/tt2234261/?ref_=sr_i_278,"['Joel Hopkins', 'Tess Morris']",['Joel Hopkins'],"['Pierce Brosnan', 'Emma Thompson', 'Timothy Spall', 'Celia Imrie', 'Louise Bourgoin', 'Laurent Lafitte', 'Marisa Berenson', 'Olivier Chantreau', 'Ellen Thomas', 'Tuppence Middleton']",,,"$8,366,493","$266,588","May 23, 2014","['France', 'United Kingdom', 'United States']","['Paris, France']","['Process Media', 'Love Punch', 'Radar Films']","Awards, 1 nomination total","['Comedy', 'Romance']","['English', 'French']"
279. Life of Crime,2013,1h 38m,R,5.8,21K,60.0,Two common criminals get more than they bargained for after kidnapping the wife of a corrupt real-estate developer who shows no interest in paying the $1 million dollar ransom for her safe return.,https://www.imdb.com/title/tt1663207/?ref_=sr_i_279,"['Daniel Schechter', 'Elmore Leonard']",['Daniel Schechter'],"['Jennifer Aniston', 'Yasiin Bey', 'Isla Fisher', 'Will Forte', 'John Hawkes', 'Mark Boone Junior', 'Tim Robbins', 'Clea Lewis', 'Charlie Tahan', 'Kevin Corrigan']","$12,000,000 (estimated)","$104,300","$1,456,675","$265,452","August 29, 2014",['United States'],"['Greenwich, Connecticut, USA']","['Abbolita Productions', 'Echo Films', 'Gotham Group']",,"['Comedy', 'Crime']",['English']
280. Blue Ruin,2013,1h 30m,R,7.1,83K,78.0,"A mysterious outsider's quiet life is turned upside down when he returns to his childhood home to carry out an act of vengeance. Proving himself an amateur assassin, he winds up in a brutal fight to protect his estranged family.",https://www.imdb.com/title/tt2359024/?ref_=sr_i_280,['Jeremy Saulnier'],['Jeremy Saulnier'],"['Macon Blair', 'Devin Ratray', 'Amy Hargreaves', 'Kevin Kolack', 'Ydaiber Orozco', 'Ronald Sarcos', 'Dani Santiago', 'Adrian Santiago', 'George Fredericks', 'Elizabeth Fredericks']","$420,000 (estimated)","$32,608","$993,313","$258,384","July 9, 2014","['United States', 'France']","['Virginia, USA']","['The Lab of Madness', 'Film Science', 'Neighborhood Watch']","Awards, 7 wins & 21 nominations total","['Crime', 'Drama', 'Thriller']",['English']
281. The Zero Theorem,2013,1h 47m,R,6.0,51K,50.0,"A hugely talented but socially isolated computer operator is tasked by Management to prove the Zero Theorem: that the universe ends as nothing, rendering life meaningless. But meaning is what he already craves.",https://www.imdb.com/title/tt2333804/?ref_=sr_i_281,"['Pat Rushin', 'Terry Gilliam']",['Terry Gilliam'],"['Christoph Waltz', 'Lucas Hedges', 'Mélanie Thierry', 'David Thewlis', 'Gwendoline Christie', 'Rupert Friend', 'Ray Cooper', 'Lily Cole', 'Sanjeev Bhaskar', 'Peter Stormare']","$8,500,000 (estimated)","$83,803","$1,486,506","$257,706","August 19, 2014","['United Kingdom', 'Romania', 'France', 'United States']","['Bucharest, Romania']","['Voltage Pictures', 'Asia & Europe Productions', 'Zanuck Independent']","Awards, 2 wins & 7 nominations total","['Cyberpunk', 'Comedy', 'Drama', 'Fantasy', 'Mystery', 'Sci-Fi']",['English']
282. The Attacks of 26/11,2013,1h 56m,Not Rated,6.9,5.7K,,"The real story of ten terrorists, who sailed to Mumbai and waged war on the populace for the next 72 hours.",https://www.imdb.com/title/tt2635622/?ref_=sr_i_282,"['Prashant Pandey', 'Rommel Rodrigues']",['Ram Gopal Varma'],"['Nana Patekar', 'Atul Kulkarni', 'Sanjeev Jaiswal', 'Rahaao', 'Sadh Orhan', 'Ferzad Jehani', 'Kamal Adib', 'Asif Basra', 'Ashish Bhatt', 'Aniruddh Harip']",,"$159,619","$2,397,025","$248,346","March 1, 2013",['India'],"['Mumbai, Maharashtra, India']","['Alumbra Entertainment', 'Eros Worldwide']",,"['Docudrama', 'Tragedy', 'True Crime', 'Action', 'Crime', 'Drama', 'History', 'Thriller']",['Hindi']
283. The Galapagos Affair: Satan Came to Eden,2013,2h,Not Rated,6.8,1.5K,69.0,About a series of unsolved disappearances on the Galapagos Island of Floreana in the 1930s.,https://www.imdb.com/title/tt2960450/?ref_=sr_i_283,"['Dayna Goldfine', 'Daniel Geller', 'Celeste Schaefer Snyder']","['Daniel Geller', 'Dayna Goldfine']","['Cate Blanchett', 'Sebastian Koch', 'Thomas Kretschmann', 'Diane Kruger', 'Connie Nielsen', 'Josh Radnor', 'Gustaf Skarsgård', 'Octavio Latorre', 'Fritz Hieber', 'Steve Divine']",,"$5,185","$247,159","$247,159","July 25, 2014","['United States', 'Ecuador', 'Germany', 'Norway']",,['Geller/Goldfine Productions'],"Awards, 3 nominations total","['Biography', 'Crime', 'Documentary', 'History', 'Mystery']","['English', 'Spanish']"
284. InAPPropriate Comedy,2013,1h 23m,,2.7,4.9K,1.0,"In this comedy film, a computer tablet full of the world's most hilariously offensive apps breaks through the borders of political correctness, stirring up cultural anarchy.",https://www.imdb.com/title/tt1754811/?ref_=sr_i_284,"['Ken Pringle', 'Ari Shaffir', 'Vince Offer']",['Vince Offer'],"['Adrien Brody', 'Lindsay Lohan', 'Michelle Rodriguez', 'Rob Schneider', 'Noelle Kenney', 'Jonathan Spencer', 'Rick Chambers', 'Andrea Lwin', ""Da'Vone McDonald"", 'Calvin Sykes']",,"$156,414","$228,004","$228,004","July 17, 2014",['United States'],"['Bronson Caves, Bronson Canyon, Griffith Park - 4730 Crystal Springs Drive, Los Angeles, California, USA']",,"Awards, 2 nominations total","['Parody', 'Sketch Comedy', 'Comedy']",['English']
285. Singh Saab the Great,2013,2h 14m,Not Rated,5.6,2.6K,,A tax collector willing to reform the society with the thought of change instead of revenge tries to control himself while attempting to teach a lesson to the man responsible behind his wife's death.,https://www.imdb.com/title/tt2437954/?ref_=sr_i_285,['Shaktimaan Talwar'],['Anil Sharma'],"['Sunny Deol', 'Urvashi Rautela', 'Prakash Raj', 'Amrita Rao', 'Anjali Abrol', 'Johny Lever', 'Sanjay Mishra', 'Yashpal Sharma', 'Manoj Pahwa', 'Vijay Suthar']","₹300,000,000 (estimated)","$138,127","$388,622","$225,668","November 22, 2013",['India'],,"['Alumbra Entertainment', 'Pen Movies', 'Shantketan Entertainments']",,"['Action', 'Drama']","['Hindi', 'Punjabi']"
286. ABCD (Any Body Can Dance),2013,2h 40m,Not Rated,6.3,7.7K,,"When a capable dancer is provoked by the evil design of his employer, naturally he will be out to prove his mettle.",https://www.imdb.com/title/tt2321163/?ref_=sr_i_286,"['Amit Aryan', ""Remo D'Souza"", 'Tushar Hiranandani']","[""Remo D'Souza""]","['Prabhu Deva', 'Ganesh Acharya', 'Kay Kay Menon', 'Lauren Gottlieb', 'Dharmesh Yelande', 'Salman', 'Noorin Sha', 'Jayant Gadekar', 'Saroj Khan', ""Remo D'Souza""]",,"$95,236","$7,610,738","$222,098","February 8, 2013",['India'],,['UTV Spotboy'],"Awards, 3 nominations total","['Drama', 'Music']",['Hindi']
287. The Suspect,2013,2h 17m,Not Rated,6.8,7K,63.0,"Betrayed and on the run, a North Korean agent tries to uncover the volatile secrets hidden inside the eyeglasses of a dead man.",https://www.imdb.com/title/tt3404158/?ref_=sr_i_287,['Sang-yoon Lim'],['Won Shin-yeon'],"['Gong Yoo', 'Park Hee-soon', 'Song Boo-gun', 'Lee Chae-yun', 'Yoo Da-in', 'Kim Eui-sung', 'Lee Hyun-Jung', 'Jo Jae-yoon', 'Choi Jong-ryul', 'Won Poong-Yeon']",,"$86,137","$28,674,130","$218,693","January 10, 2014","['South Korea', 'United States']","['Seoul, South Korea']","['Green Fish Pictures', 'Musa Productions', 'Showbox/Mediaplex']","Awards, 2 nominations total","['Action', 'Drama', 'Thriller']",['Korean']
288. Supermensch,2013,1h 25m,R,7.4,3.4K,64.0,"The life and career of the legendary Hollywood insider, Shep Gordon.",https://www.imdb.com/title/tt3074780/?ref_=sr_i_288,"['Shep Gordon', 'Sylvester Stallone', 'Michael Douglas']","['Beth Aala', 'Mike Myers']","['Shep Gordon', 'Sylvester Stallone', 'Michael Douglas', 'Alice Cooper', 'Anne Murray', 'Robert Ezrin', 'Mike Myers', 'Patricia Barson', 'Tom Arnold', 'Willie Nelson']",,"$23,017","$220,065","$213,064","June 6, 2014",['United States'],,"['A&E IndieFilms', 'Nomoneyfun Films']","Awards, 3 wins & 8 nominations total","['Biography', 'Documentary', 'Music']",['English']
289. Prince Avalanche,2013,1h 34m,R,6.3,21K,73.0,Two highway road workers spend the summer of 1988 away from their city lives. The isolated landscape becomes a place of misadventure as the men find themselves at odds with each other and the women they left behind.,https://www.imdb.com/title/tt2195548/?ref_=sr_i_289,"['David Gordon Green', 'Hafsteinn Gunnar Sigurðsson']",['David Gordon Green'],"['Paul Rudd', 'Emile Hirsch', 'Lance LeGault', 'Joyce Payne', 'Gina Grande', 'Lynn Shelton', 'Larry Kretschmar', 'Enoch Moon', 'David L. Osborne Jr.', 'Danni Wolcott']","$725,000 (estimated)","$36,694","$442,313","$205,139","September 19, 2013",['United States'],"['Bastrop, Texas, USA']","['Muskat Filmed Properties', 'Rough House Pictures', 'Dogfish Pictures']","Awards, 3 wins & 6 nominations total","['Comedy', 'Drama']","['English', 'German']"
290. Ghanchakkar,2013,2h 17m,,5.9,5.4K,,A safe cracker claims he has lost his memory when two criminals come calling for their cut of the bank heist loot.,https://www.imdb.com/title/tt2246724/?ref_=sr_i_290,"['Raj Kumar Gupta', 'Parveez Shaikh']",['Raj Kumar Gupta'],"['Emraan Hashmi', 'Vidya Balan', 'Amar Kaushik', 'Vikram Kochhar', 'Rajesh Sharma', 'Parvin Dabas', 'Raj Kumar Gupta', 'Shashank Shende', 'Namit Das', 'Vishwanath Chatterjee']",,"$143,616","$6,571,685","$203,044","July 3, 2013",['India'],['India'],['UTV Motion Pictures'],"Awards, 2 nominations total","['Comedy', 'Crime', 'Thriller']",['Hindi']
291. Crystal Fairy & the Magical Cactus,2013,1h 38m,Not Rated,5.9,9.4K,67.0,"As Jamie travels in Chile, he invites an eccentric woman to join his group's quest to score a fabled hallucinogen, a move that finds him at odds with his new companion, until they drink the magic brew on a beach at the edge of the desert.",https://www.imdb.com/title/tt2332579/?ref_=sr_i_291,['Sebastián Silva'],['Sebastián Silva'],"['Michael Cera', 'Gaby Hoffmann', 'Juan Andrés Silva', 'Agustín Silva', 'José Miguel Silva', 'Sebastián Silva', 'Manuela Baldovino', 'Gepe', 'Gracia Ariztia', 'Esteban Carreño']",,"$25,052","$223,821","$202,370","April 24, 2014",['Chile'],,"['Fabula', 'Diroriro', 'Corfo']","Awards, 2 wins & 6 nominations total","['Adventure', 'Comedy', 'Drama', 'Romance']","['English', 'Spanish']"
292. Bethlehem,2013,1h 39m,,7.1,2.3K,68.0,"Tells the story of the complex relationship between an Israeli Secret Service officer and his teenage Palestinian informant. Shuttling back and forth between conflicting points of view, the film is a raw portrayal of characters torn apart by competing loyalties and impossible moral dilemmas, giving an unparalleled glimpse into the dark and fascinating world of human intelligence.",https://www.imdb.com/title/tt2915160/?ref_=sr_i_292,"['Yuval Adler', 'Ali Wakad']",['Yuval Adler'],"['Tsahi Halevi', ""Shadi Mar'i"", 'Hitham Omari', 'Michal Shtamler', 'Tarik Kopty', 'George Iskandar', 'Yossi Eini', 'Efrat Shnap', 'Karem Shakur', 'Ibrahim Saqallah']",,"$69,700","$384,670","$201,700","September 26, 2013","['Israel', 'Germany', 'Belgium']",,"[""Centre du Cinéma et de l'Audiovisuel de la Fédération Wallonie-Bruxelles"", 'Entre Chien et Loup', 'Gringo Films']","Awards, 9 wins & 8 nominations total","['Drama', 'Thriller', 'War']","['Hebrew', 'Arabic']"
293. The Double,2013,1h 33m,R,6.4,54K,68.0,"The unenviable life of a government-agency clerk takes a horrific turn with the arrival of a new co-worker who is both his exact physical double and his opposite otherwise--he's a confident, charismatic ladies' man.",https://www.imdb.com/title/tt1825157/?ref_=sr_i_293,"['Fyodor Dostoevsky', 'Richard Ayoade', 'Avi Korine']",['Richard Ayoade'],"['Jesse Eisenberg', 'Mia Wasikowska', 'Wallace Shawn', 'Noah Taylor', 'Yasmin Paige', 'James Fox', 'Cathy Moriarty', 'Phyllis Somerville', 'Gabrielle Downey', 'Jon Korkes']",,"$14,646","$1,662,515","$200,406","April 4, 2014",['United Kingdom'],"['London, England, UK']","['Alcove Entertainment', 'Attercop Productions', 'British Film Institute (BFI)']","Awards, 1 win & 11 nominations total","['Dark Comedy', 'Comedy', 'Drama', 'Mystery', 'Sci-Fi', 'Thriller']",['English']
294. Cutie and the Boxer,2013,1h 22m,R,7.2,4.8K,83.0,"This candid New York love story explores the chaotic 40-year marriage of famed boxing painter Ushio Shinohara and his wife, Noriko. Anxious to shed her role as her overbearing husband's assistant, Noriko finds an identity of her own.",https://www.imdb.com/title/tt2355540/?ref_=sr_i_294,['Zach Heinzerling'],['Zach Heinzerling'],"['Ushio Shinohara', 'Noriko Shinohara', 'Alex Shinohara', 'Ethan Cohen', 'Benjamin Thys']",,"$21,098","$200,036","$200,036","August 1, 2013",['United States'],,"['Little Magic Films', 'Cine Mosaic', 'Ex Lion Tamer']","Nominated for 1 Oscar, 8 wins & 14 nominations total","['Biography', 'Documentary']","['English', 'Japanese']"
295. Code Black,2013,1h 18m,Not Rated,7.3,693,77.0,"A notorious trauma bay in an inner-city E.R. earns its keep as the 'hurt locker of medicine' as new, idealistic and adrenaline-seeking doctors train in an environment akin to a war zone. When the hospital moves to a swank new building, the rush fades and bureaucracy gridlocks the state-of-the-art facility, and the doctors are faced with the unexpected realities of life and death in a safety-net health-care system on the brink of overload.",https://www.imdb.com/title/tt2759372/?ref_=sr_i_295,"['Joshua Altman', 'Ryan McGarry']",['Ryan McGarry'],"['Danny Cheng', 'Andrew Eads', 'Jamie Eng', 'Luis Enriquez', 'Arash Kohanteb', 'Billy Mallon', 'Alison Martin', 'Ed Newton', 'Dave Pomeranz']",,"$6,319","$190,229","$190,229","June 20, 2014",['United States'],,,"Awards, 3 wins total","['Documentary', 'Drama']",['English']
296. We Are the Best!,2013,1h 42m,Not Rated,7.1,12K,87.0,Three girls in 1980s Stockholm decide to form a punk band -- despite not having any instruments and being told by everyone that punk is dead.,https://www.imdb.com/title/tt2364975/?ref_=sr_i_296,"['Lukas Moodysson', 'Coco Moodysson']",['Lukas Moodysson'],"['Mira Barkhammar', 'Mira Grosin', 'Liv LeMoyne', 'Johan Liljemark', 'Mattias Wiberg', 'Jonatan Salomonsson', 'Alvin Strollo', 'Anna Rydgren', 'Peter Eriksson', 'Charlie Falk']",,"$17,664","$1,604,273","$180,590","June 20, 2014","['Sweden', 'Denmark']","['Södermalm, Stockholm, Stockholms län, Sweden (Stockholm)']","['Danmarks Radio (DR)', 'Det Danske Filminstitut', 'Film i Väst']","Awards, 13 wins & 21 nominations total","['Drama', 'Music']",['Swedish']
297. Anita: Speaking Truth to Power,2013,1h 16m,Not Rated,6.8,603,68.0,"A profile of Anita Hill, the African-American lawyer who challenged Clarence Thomas' nomination to the US Supreme Court and thus exposed the problem of sexual harassment to the world.",https://www.imdb.com/title/tt2481202/?ref_=sr_i_297,['Freida Lee Mock'],['Freida Lee Mock'],"['Jill Abramson', 'Joe Biden', 'John Carr', 'Orrin Hatch', 'Anita Hill', 'Ted Kennedy', 'Patrick Leahy', 'Jane Mayer', 'Charles Ogletree', 'Alan Simpson']",,"$44,114","$176,979","$176,979","May 25, 2013",['United States'],,,"Awards, 3 wins & 3 nominations total","['Documentary', 'History']",['English']
298. A.C.O.D.,2013,1h 28m,R,5.7,14K,50.0,"A grown man caught in the crossfire of his parents' 15-year divorce discovers he was unknowingly part of a study on divorced children and is enlisted in a follow-up years later, which wreaks new havoc on his family.",https://www.imdb.com/title/tt1311060/?ref_=sr_i_298,"['Ben Karlin', 'Stuart Zicherman']",['Stuart Zicherman'],"['Adam Scott', 'Richard Jenkins', ""Catherine O'Hara"", 'Jane Lynch', 'Amy Poehler', 'Mary Elizabeth Winstead', 'Clark Duke', 'Ken Howard', 'Valerie Tian', 'Sarah Burns']",,"$19,001","$175,705","$175,705","January 23, 2013",['United States'],"['Atlanta, Georgia, USA']","['Black Bear', 'Process Media']","Awards, 1 nomination total",['Comedy'],['English']
299. Afternoon Delight,2013,1h 38m,R,5.7,12K,50.0,"Rachel tries to spice up her marriage with a trip to a strip club. She befriends McKenna, who gave her a lapdance. McKenna moves in with Rachel's family and becomes a nanny for the son.",https://www.imdb.com/title/tt2312890/?ref_=sr_i_299,['Joey Soloway'],['Joey Soloway'],"['Kathryn Hahn', 'Link Ruiz', 'Cesar Garcia', 'Jane Lynch', 'Michaela Watkins', 'Jessica St. Clair', 'Sawyer Ever', 'Josh Radnor', 'Makenna Cotton', 'Keegan-Michael Key']",,"$27,352","$175,755","$174,496","September 15, 2013",['United States'],"['Los Angeles, California, USA']","['Whitewater Films', '72 Productions', 'Rincon Entertainment']","Awards, 1 win & 3 nominations total","['Comedy', 'Drama']",['English']
300. Horns,2013,2h,R,6.4,90K,46.0,"In the aftermath of his girlfriend's mysterious death, a young man awakens to find strange horns sprouting from his forehead.",https://www.imdb.com/title/tt1528071/?ref_=sr_i_300,"['Keith Bunin', 'Joe Hill']",['Alexandre Aja'],"['Daniel Radcliffe', 'Juno Temple', 'Max Minghella', 'Joe Anderson', 'Kelli Garner', 'James Remar', 'Kathleen Quinlan', 'Heather Graham', 'David Morse', 'Michael Adamthwaite']",,"$107,544","$3,875,442","$173,948","October 3, 2014","['Canada', 'United States']","['Vancouver, British Columbia, Canada']","['Red Granite Pictures', 'Mandalay Pictures']","Awards, 4 wins & 4 nominations total","['Dark Comedy', 'Dark Fantasy', 'Comedy', 'Fantasy', 'Horror', 'Mystery', 'Thriller']",['English']
301. The Young and Prodigious T.S. Spivet,2013,1h 45m,PG,7.0,21K,53.0,"A 10-year-old scientist secretly leaves his family's ranch in Montana where he lives with his cowboy father and scientist mother, and travels across the country aboard a freight train to receive an award at the Smithsonian Institution.",https://www.imdb.com/title/tt1981107/?ref_=sr_i_301,"['Jean-Pierre Jeunet', 'Guillaume Laurant', 'Reif Larsen']",['Jean-Pierre Jeunet'],"['Helena Bonham Carter', 'Judy Davis', 'Callum Keith Rennie', 'Kyle Catlett', 'Niamh Wilson', 'Jakob Davies', 'Rick Mercer', 'Dominique Pinon', 'Julian Richings', 'Richard Jutras']","$33,000,000 (estimated)","$33,658","$9,494,789","$173,564","July 31, 2015","['France', 'Australia', 'Canada']","['Trois-Rivières, Québec, Canada']","['Epithète Films', 'Tapioca Films', 'Filmarto']","Awards, 5 wins & 6 nominations total","['Adventure', 'Comedy', 'Drama', 'Family']",['English']
"302. Cinco de Mayo, La Batalla",2013,2h 5m,R,6.2,955,,"On May 5th, 1862, a few thousand Mexican soldiers put their lives on the line against the world's largest and most powerful army in one legendary battle for freedom and for Mexico.",https://www.imdb.com/title/tt2553908/?ref_=sr_i_302,['Rafa Lara'],['Rafa Lara'],"['Christian Vazquez', 'Angélica Aragón', 'Liz Gallardo', 'Kuno Becker', 'William Miller', 'J.C. Montes-Roldan', 'Javier Oliván', 'Álvaro García', 'Mauricio Isaac', 'Ginés García Millán']","$10,000,000 (estimated)","$83,586","$2,794,852","$173,472","May 3, 2013",['Mexico'],,"['Estudios Splendor Omnia', 'Gala Films']","Awards, 3 wins & 2 nominations total","['Drama', 'History', 'War']","['Spanish', 'French', 'English']"
303. Afternoon of a Faun: Tanaquil Le Clercq,2013,1h 31m,Not Rated,7.2,300,76.0,A mesmerizing portrait of legendary ballerina Tanaquil Le Clercq - muse to both George Balanchine and Jerome Robbins - whose career was cut short by polio at the age of 27.,https://www.imdb.com/title/tt2381319/?ref_=sr_i_303,['Nancy Buirski'],['Nancy Buirski'],"['Tanaquil Le Clerq', ""Jacques d'Amboise"", 'Barbara Horgan', 'Randall Bourscheidt', 'Patricia McBride', 'George Balanchine', 'Larry Mackenzie', 'Joya Moore', 'Jerome Robbins', 'Arthur Mitchell']",,"$15,292","$172,450","$172,450","September 30, 2013",['United States'],,"['Augusta Films', 'Steeplechase Films']","Awards, 3 nominations total","['Biography', 'Documentary', 'Drama', 'Music']",['English']
304. Escape from Tomorrow,2013,1h 30m,Not Rated,5.1,10K,58.0,"In a world of fake castles and anthropomorphic rodents, an epic battle begins when an unemployed father's sanity is challenged by a chance encounter with two underage girls on holiday.",https://www.imdb.com/title/tt2187884/?ref_=sr_i_304,['Randy Moore'],['Randy Moore'],"['Roy Abramsohn', 'Elena Schuber', 'Katelynn Rodriguez', 'Jack Dalton', 'Danielle Safady', 'Annet Mahendru', 'Lee Armstrong', 'Kimberly Ables Jindra', 'Trey Loney', 'Amy Lucas']","$650,000 (estimated)","$63,297","$171,962","$171,962","July 19, 2014",['United States'],"['Disneyland Park, Disneyland Resort - 1600 S. Disneyland Drive, Anaheim, California, USA']",['Mankurt Media'],"Awards, 2 wins & 5 nominations total","['Comedy', 'Drama', 'Fantasy', 'Horror', 'Sci-Fi', 'Thriller']","['English', 'French']"
305. Copperhead,2013,2h,PG-13,5.6,1.1K,34.0,An Upstate New York family is torn apart during the American Civil War.,https://www.imdb.com/title/tt2404555/?ref_=sr_i_305,"['Harold Frederic', 'Bill Kauffman']",['Ron Maxwell'],"['François Arnaud', 'Lucy Boynton', 'Casey Thomas Brown', 'Billy Campbell', 'Mary Fay Coady', 'Josh Cruddas', 'Ryan Doucette', 'Brian Downey', 'Ryan Drost', 'Rod Ernest']","$12,000,000 (estimated)","$55,625","$171,740","$171,740","June 28, 2013",['United States'],"['New Brunswick, Canada']",['Swordspoint Productions'],"Awards, 3 nominations total",['Drama'],['English']
306. R... Rajkumar,2013,2h 26m,Not Rated,5.3,7.2K,,"An aimless ruffian starts working for a drug baron and his mission is to kill the rival, whose niece he eventually falls for.",https://www.imdb.com/title/tt2369154/?ref_=sr_i_306,"['Prabhu Deva', 'Sunil Kumar Agrawal', 'Ravi S. Sundaram']",['Prabhu Deva'],"['Shahid Kapoor', 'Sonakshi Sinha', 'Sonu Sood', 'Govardhan Asrani', 'Ashish Vidyarthi', 'Mukul Dev', 'Srihari', 'Bharat Dabholkar', 'Vijay Patkar', 'Ashok Samarth']","₹400,000,000 (estimated)","$124,669","$410,495","$166,503","December 6, 2013",['India'],,"['Eros Worldwide', 'Next Gen Films', 'Rough Copy Films']","Awards, 2 wins & 5 nominations total","['One-Person Army Action', 'Action', 'Crime', 'Romance']",['Hindi']
307. We Steal Secrets,2013,2h 10m,R,6.9,8.3K,76.0,"A documentary that details the creation of Julian Assange's controversial website, which facilitated the largest security breach in U.S. history.",https://www.imdb.com/title/tt1824254/?ref_=sr_i_307,['Alex Gibney'],['Alex Gibney'],"['Julian Assange', 'Adrian Lamo', ""John 'FuzzFace' McMahon"", 'Alex Gibney', 'Robert Manne', 'Heather Brooke', 'Michael Hayden', 'J. William Leonard', 'Daniel Domscheit-Berg', 'Smári McCarthy']",,"$27,689","$457,517","$166,243","July 11, 2013",['United States'],,"['Jigsaw Productions', 'Global Produce', 'Universal Pictures']","Nominated for 1 BAFTA Award, 3 wins & 10 nominations total",['Documentary'],['English']
308. On the Job,2013,1h 58m,Not Rated,6.9,3.4K,70.0,Inspired by a real-life scandal in which prison inmates are temporarily released from prison to work as contract killers on behalf of politicians and high ranking military officials.,https://www.imdb.com/title/tt2717558/?ref_=sr_i_308,"['Erik Matti', 'Michiko Yamamoto']",['Erik Matti'],"['Piolo Pascual', 'Gerald Anderson', 'Joel Torre', 'Joey Marquez', 'Michael De Mesa', 'Leo Martinez', 'Angel Aquino', 'Vivian Velez', 'Shaina Magdayao', 'William Martinez']",,"$56,098","$472,890","$164,620","August 28, 2013",['Philippines'],"['Manila, Philippines']","['Star Cinema', 'Reality Entertainment', 'XYZ Films']","Awards, 20 wins & 32 nominations total","['Action', 'Crime', 'Drama', 'Thriller']",['Filipino']
309. Human Capital,2013,1h 51m,Not Rated,7.2,14K,63.0,The destinies of two families are irrevocably tied together after a cyclist is hit off the road by a jeep in the night before Christmas Eve.,https://www.imdb.com/title/tt2465578/?ref_=sr_i_309,"['Stephen Amidon', 'Paolo Virzì', 'Francesco Bruni']",['Paolo Virzì'],"['Fabrizio Bentivoglio', 'Matilde Gioli', 'Valeria Bruni Tedeschi', 'Guglielmo Pinelli', 'Fabrizio Gifuni', 'Gigio Alberti', 'Valeria Golino', 'Silvia Cohen', 'Luigi Lo Cascio', 'Bebo Storti']","€6,000,000 (estimated)","$21,669","$9,113,941","$158,549","January 9, 2014","['Italy', 'France']","['Fortunago, Pavia, Lombardia, Italy (villa Bernaschi)']","['Indiana Production', 'Motorino Amaranto', 'Manny Films']","Awards, 47 wins & 30 nominations total","['Crime', 'Drama']","['Italian', 'English']"
310. Mother of George,2013,1h 47m,R,6.5,1.3K,77.0,"Adenike and Ayodele, a Nigerian couple living in Brooklyn, are having trouble conceiving a child - a problem that defies cultural expectations and leads Adenike to make a shocking decision that could either save or destroy her family.",https://www.imdb.com/title/tt2094890/?ref_=sr_i_310,['Darci Picoult'],['Andrew Dosunmu'],"['Danai Gurira', 'Isaach De Bankolé', 'Anthony Okungbowa', 'Bukky Ajayi', 'Yaya DaCosta', 'Klarissa Jackson', 'Ishmael Omolade', 'Roslyn Ruff', 'Chinaza Uche', 'Florence Egbuchulam']","$750,000 (estimated)","$22,500","$157,937","$157,937","January 18, 2013","['Nigeria', 'United States']","['Brooklyn, New York City, New York, USA']","['Maybach Film Productions', 'Parts and Labor', 'Loveless']","Awards, 7 wins & 10 nominations total",['Drama'],"['English', 'Yoruba']"
