Title,Year,Duration,MPA,Rating,Votes,méta_score,description,Movie Link,writers,directors,stars,budget,opening_weekend_Gross,grossWorldWWide,gross_US_Canada,release_date,countries_origin,filming_locations,production_company,awards_content,genres,Languages
455. Waco,1952,1h 8m,Approved,6.6,55,,"Matt Boone kills Bull Clark in self defense in a crooked poker game, and leaves Waco as he is certain he would not get a fair trial. He joins an outlaw gang led by Curly Ivers, whose lieutenant is Lou Garcia, a killer. Following a bank holdup in Pecos, Matt is captured. Two of Waco's leading citizens, Richards and Farley, pay the Pecos sheriff the reward Waco had posted for Matt and bring him back to Waco. There, they tell him they want him to be the sheriff and drive out the lawless element. Matt has trouble with Kathy Clark and her cowhands but she soon realizes that Matt is not a killer, and is a honest lawmen. The Texas Rangers capture Ivers and his gang, except for Garcia who has sworn to kill Matt before he is ever captured. Ivers warns Matt of Garcia. Matt takes off his badge, opens Ivers' cell and starts out to find Garcia. Ivers gives Matt wrong directions and then Ivers prepares to shoot Garcia when he comes looking for Matt. Garcia shoots Ivers and Matt, arriving back in town, kills Garcia. Ivers dies after wishing future happiness for Matt and Cathy.",https://www.imdb.com/title/tt0045304/?ref_=sr_i_455,['Daniel B. Ullman'],['Lewis D. Collins'],"['Bill Elliott', 'I. Stanford Jolley', 'Pamela Blake', 'Paul Fierro', 'Rand Brooks', 'Richard Avonde', 'Pierce Lyden', 'Lane Bradford', 'Terry Frost', 'Stanley Price']",,,,,"February 24, 1952",['United States'],"['Iverson Ranch - 1 Iverson Lane, Chatsworth, Los Angeles, California, USA']",['Silvermine Productions'],,['Western'],['English']
456. Latuko,1952,56m,,,,,"A young African boy in Sudan undergoes tribal rites of passage, including a challenging hunt, to become a man of his clan. As drought threatens his village, ancient customs and spiritual rituals may hold the key to survival.",https://www.imdb.com/title/tt0371787/?ref_=sr_i_456,['Charles L. Tedford'],['Edgar M. Queeny'],,,,,,"January 18, 1952",['United States'],,"['Jarville Studios', 'The American Museum of Natural History']",,['Documentary'],['English']
457. Scorching Fury,1952,1h 8m,Not Rated,5.1,22,,"Three masked bandits responsible for a wave of holdups and bank robberies stick up a stagecoach on its way to Boone City kill the drier, steal the passengers' money and a cargo of gold the stage was carrying, then cut the horses loose and dump the coach's supply of drinking water. The passengers camp out in the hills that night, not knowing that an Indian has been watching them, and he returns to his tribe to inform them of the passengers' plight. When the stage fails to show up in Boone City, the sheriff deputizes two local men and sends them out with his deputy to search for it. They; find the stage and the dead driver but no passengers. Slowly, the two new deputies begin to realize just exactly what happened, and who is behind it.and Clint embrace.",https://www.imdb.com/title/tt0228825/?ref_=sr_i_457,"['James Craig', 'Richard Devon']",['Rick Freers'],"['Richard Devon', 'William Leslie', 'Peggy Nelson', 'Sherwood Price', 'Audrey Dineen', 'Eddie McLean', 'Allen Windsor', 'Rory Mallinson', 'Twyla Paxton', 'Charles Morton']",,,,,,['United States'],,['Fraser Productions'],,['Western'],['English']
458. Plume au vent,1952,1h 25m,,4.5,16,,,https://www.imdb.com/title/tt0045036/?ref_=sr_i_458,"['Jean Nohain', 'Claude Pingault', 'René Wheeler']","['Louis Cuny', 'Ramón Torrado']","['Georges Guétary', 'Carmen Sevilla', 'José Luis Ozores', 'Jacqueline Pierreux', 'Félix Fernández', 'Nicole Francis', 'Jean Gaven', 'Rosario Royo', 'José Prada', 'Rosita Valero']",,,,,"February 6, 1953","['France', 'Spain']",,"['Celia Film', 'Cocinor', 'Célia Films']",,"['Comedy', 'Musical']",['French']
459. The Gambler and the Lady,1952,1h 12m,Approved,5.8,403,,"A social-climbing American with a business in illegal gambling falls in love with a blue blood, but gangsters and a jealous ex-girlfriend stand in the way of happiness.",https://www.imdb.com/title/tt0044649/?ref_=sr_i_459,['Sam Newfield'],"['Patrick Jenkins', 'Sam Newfield']","['Dane Clark', 'Kathleen Byron', 'Naomi Chance', 'Meredith Edwards', 'Anthony Forwood', 'Eric Pohlmann', 'Enzo Coticchia', 'Julian Somers', 'Anthony Ireland', 'Thomas Gallagher']",,,,,"December 26, 1952",['United Kingdom'],"['Bray Studios, Down Place, Oakley Green, Berkshire, England, UK (Studio)']","['Hammer Films', 'Lippert Films']",,"['Crime', 'Drama', 'Thriller']","['Italian', 'English']"
460. Double Identity,1952,30m,,,,,,https://www.imdb.com/title/tt0044561/?ref_=sr_i_460,"['Charles Hatton', 'Francis Searle']",['Francis Searle'],,,,,,,['United Kingdom'],,,,[],['English']
461. Sound Off,1952,1h 23m,,5.6,88,,An obnoxious nightclub comedian at Ciro's is drafted into the U.S. Army during the Korean War. At his arrival at his basic training he meets a WAC Lieutenant and romantically pursues her. His activities irritate the entire army.,https://www.imdb.com/title/tt0045181/?ref_=sr_i_461,"['Blake Edwards', 'Richard Quine']",['Richard Quine'],"['Mickey Rooney', 'Anne James', 'Sammy White', 'John Archer', 'Gordon Jones', 'Wally Cassell', 'Paul Bradley', 'Barry Brooks', 'Paul Bryar', 'Rosalee Calvert']",,,,,May 1952,['United States'],"['Echo Park Lake, Echo Park, Los Angeles, California, USA']",['Columbia Pictures'],,['Comedy'],['English']
462. Steel Town,1952,1h 25m,Approved,6.0,149,,"Steve Kostain (Lund), nephew of the owner, begins working at a steel mill to learn the business from the bottom up. He rooms with a steel working family, the McNamaras, and falls for the daughter, ""Red"" (Sheridan), who is already involved with another steelworker, Jim (Duff.) Although he is at first has a hard time with his co-workers, he eventually wins them over, and also wins the girl.",https://www.imdb.com/title/tt0045189/?ref_=sr_i_462,"['Gerald Drayson Adams', 'Lou Breslow', 'Leonard Freeman']",['George Sherman'],"['Ann Sheridan', 'John Lund', 'Howard Duff', 'William Harrigan', 'Eileen Crowe', 'Chick Chandler', 'James Best', 'Nancy Kulp', 'Larry Chance', 'Patricia Channing']",,,,,"May 9, 1952",['United States'],"['Kaiser Steel Mill, Fontana, California, USA']",['Universal International Pictures (UI)'],,"['Film Noir', 'Action', 'Crime', 'Drama', 'Thriller']",['English']
463. Cattle Town,1952,1h 11m,Approved,5.3,225,,"Post-civil-war Texas sells lands to wealthy Northerners but some of them are crooks bent on cheating the locals, prompting an investigation headed by the governor's envoy.",https://www.imdb.com/title/tt0044490/?ref_=sr_i_463,['Thomas W. Blackburn'],['Noel M. Smith'],"['Dennis Morgan', 'Philip Carey', 'Amanda Blake', 'Rita Moreno', 'Paul Picerni', 'Ray Teal', 'Jay Novello', ""George O'Hanlon"", 'Robert J. Wilke', 'Sheb Wooley']",,,,,"September 6, 1952",['United States'],"['Janss Conejo Ranch, Thousand Oaks, California, USA']",['Warner Bros.'],,"['Classical Western', 'Western']",['English']
464. Yavuz Sultan Selim agliyor,1952,2h 21m,,6.8,50,,"The story of Yavuz Sultan Selim, who organized a voyage to the East after he was enthroned.",https://www.imdb.com/title/tt0324617/?ref_=sr_i_464,"['Sami Ayanoglu', 'Feridun Fazil Tülbentçi']",['Sami Ayanoglu'],"['Sami Ayanoglu', 'Heyecan Basaran', 'Suavi Tedü', 'Lale Oraloglu', 'Cahit Irgat', 'Sadri Alisik', 'Nimet Alp', 'Refik Kemal Arduman', 'Sakir Arseven', 'Talat Artemel']",,,,,"October 27, 1952",['Turkey'],,['Lale Film'],,"['Drama', 'War']",['Turkish']
465. Rayya wa Sakinah,1952,1h 21m,,6.8,285,,"Dramatic rendition of a real life crime wave that terrorized the city of Alexandria, Egypt, between the years 1920 and 1922. Women are disappearing without a trace in what looked like the work of a serial killer. Being Egypt's first ever case of serial killings, the police is relentless and assigns the case to their best inspector. He traces the leads to sisters Raya and Sekina, but it becomes a race against time before they kill again.",https://www.imdb.com/title/tt0316472/?ref_=sr_i_465,"['Mustafa Abdulrahman', 'Salah Abouseif', 'El Said Bedyr']",['Salah Abouseif'],"['Anwar Wagdi', 'Negma Ibrahim', 'Farid Shawqi', 'Shukri Sarhan', 'Samira Ahmed', 'Birlanti Abdulhamid', 'Muhammad Alwan', 'Kamel Anwar', 'Malak El Gamal', 'Zouzou Hamdi El Hakim']",,,,,"February 23, 1952",['Egypt'],,,,"['Crime', 'Drama', 'History', 'Thriller']",['Arabic']
466. Striptease Girl,1952,1h 1m,,3.4,9,,"A filmed record of a typical '50s burlesque act, complete with strippers and baggy-pants comics.",https://www.imdb.com/title/tt0160921/?ref_=sr_i_466,[],"['Tempest Storm', 'Joan Bridges', 'Betty Briggs']","['Tempest Storm', 'Joan Bridges', 'Betty Briggs', 'Pat Flannery', 'Helen Rene']",,,,,,['United States'],,['Sonney Amusement Enterprises'],,['Documentary'],['English']
467. Istanbul,1952,1h 7m,,6.3,25,,A nurse in the Red Crescent (the Turkish equivalent of the Red Cross) fights to save the populace during a plague.,https://www.imdb.com/title/tt0143308/?ref_=sr_i_467,['Ali Ipar'],['Ali Ipar'],"['Virginia Bruce', 'Kenan Artun', 'Metin Birer', 'Gloria Doman', 'Edward Yeretz', 'Ali Yonceova', 'Nubar Terziyan', 'Esen Görkmen', 'Tedi Raft']",,,,,1952,['Turkey'],"['Istanbul, Turkey']",['Ipar International'],,['Drama'],"['Turkish', 'English']"
468. The City Stands Trial,1952,1h 43m,,7.3,177,,"Turn-of-the-century Naples. Salvatore Ruotolo and his wife are murdered and their bodies are found in different locations. Since the evidence points to a crime by the Neapolitan crime organization, the Camorra, fear and corruption cause serious hindrances to the investigation by police authorities. In charge is a young and courageous judge who, using evidence discovered by chance, tries to reconstruct the story of the double murder. The plot that the judge must unravel is very complicated. Many people are questioned, even those apparently above suspicion. Deciding to get to the bottom of the matter, the judge keeps all the suspects under arrest, causing a backlash of public opinion. But in the face of passive resistance which he finds everywhere, even from his own colleagues and family, he begins to feel discouraged and is about to give up the investigation when a new piece of evidence comes to light. The information causes the death of an innocent man, but it revives in the judge the conscience of his own responsibility. He carries on with the case regardless, even if it means placing under house arrest the entire city.",https://www.imdb.com/title/tt0045054/?ref_=sr_i_468,"[""Suso Cecchi D'Amico"", 'Diego Fabbri', 'Ettore Giannini']",['Luigi Zampa'],"['Amedeo Nazzari', 'Silvana Pampanini', 'Paolo Stoppa', 'Dante Maggio', 'Franco Interlenghi', 'Irene Galter', 'Gualtiero Tumiati', 'Tina Pica', 'Turi Pandolfini', 'Franca Tamantini']",,,,,1954,['Italy'],"['Naples, Campania, Italy']",['Film Costellazione Produzione'],"Awards, 3 wins total","['Crime', 'Drama', 'Mystery']",['Italian']
469. La favorita,1952,1h 18m,,5.4,83,,"While not completly stage-bound, this film of Donizetti's opera doesn't stray far from such an impression. The story of a tragic love affair involving commoners and royality in 1340 Spain finds Ferdinand (Gino Sininberghi) falling in love with a young lady (role played by Sophia Loren, billed as Sophia Lazzaro, while Palmira Vitali does the singing), who is a favorite of the King (Paolo Silveri.) Ferdinand returns from the wars as a hero and the King grants him anything he wishes and he chooses his mysterious lady. But when he learns of her true position, he forsakes her.",https://www.imdb.com/title/tt0044607/?ref_=sr_i_469,"['Cesare Barlacchi', 'Alphonse Royer', 'Gustave Vaëz']",['Cesare Barlacchi'],"['Sophia Loren', 'Franca Tamantini', 'Paolo Silveri', 'Gino Sinimberghi', 'Miriam Di Giove', 'Alfredo Colella', 'Giorgio Costantini', 'Palmira Vitali Marini', 'Piero Sardelli', ""Corpo di Ballo di Teatro dell'Opera di Roma""]",,,,,"October 6, 1953",['Italy'],,['M.A.S. Film'],,['Drama'],['Italian']
470. A Treasure on Bird Island,1952,1h 15m,,6.9,132,,"People living on an island finds a treasure, but it does not only do them good.",https://www.imdb.com/title/tt0045040/?ref_=sr_i_470,"['Frantisek Hrubín', 'E.F. Misek', 'Karel Zeman']",['Karel Zeman'],"['H. Hustolesova', 'Zdenek Kríz']",,,,,"November 16, 1955",['Czechoslovakia'],,['Ceskoslovenský Státní Film'],,['Animation'],['Czech']
471. 'B' Girl Rhapsody,1952,1h 16m,,5.1,52,,"Burlesque beauties performing their signature striptease acts, accompanied by comedians, testing the moral boundaries.",https://www.imdb.com/title/tt0193738/?ref_=sr_i_471,"['Lily Ayers', 'Crystal Starr', 'Chili Pepper']","['James R. Connell', 'Lillian Hunt']","['Lily Ayers', 'Crystal Starr', 'Chili Pepper', 'Ginger Duvall', 'Nona Carver', 'Frenchy LeVonne', 'Leon DeVoe', ""Benny 'Wop' Moore"", 'Artie Lloyd', 'George Rose']",,,,,1952,['United States'],"['New Follies Theater - 548 S. Main Street, Los Angeles, California, USA']",['Harry Farros Productions'],,['Drama'],['English']
472. Un gallo en corral ajeno,1952,1h 39m,,7.3,44,,,https://www.imdb.com/title/tt0043573/?ref_=sr_i_472,"['Paulino Masip', 'Adolfo Torrado']",['Julián Soler'],"['Jorge Negrete', 'Gloria Marín', 'Andrés Soler', 'Julio Villarreal', 'Eduardo Arozamena', 'Maruja Grifell', 'Queta Lavat', 'Miguel Bermejo', 'Trío Calaveras', 'Ricardo Adalid']",,,,,1952,['Mexico'],,['CIPPSA Industrial Productora de Películas'],,"['Comedy', 'Family', 'Musical']",['Spanish']
473. The Blazing Forest,1952,1h 30m,Approved,6.2,146,,"Kelly Hansen, the tough boss of a timber crew clearing property owned by Jessie Crain and her niece Sharon Wilks, is--unknown to anybody else--working to pay back money stolen by his brother Joe Roberts, who has a changed name, and has no love for his brother. Just as the debt is about paid off, Joe is killed in a truck accident that starts a blazing forest fire.",https://www.imdb.com/title/tt0044428/?ref_=sr_i_473,"['Lewis R. Foster', 'Winston Miller']",['Edward Ludwig'],"['John Payne', 'William Demarest', 'Agnes Moorehead', 'Richard Arlen', 'Susan Morrow', 'Roscoe Ates', 'Lynne Roberts', 'Walter Reed', 'Ewing Mitchell', 'Tom Coleman']",,,,,December 1952,['United States'],"['Truckee, California, USA']",['Pine-Thomas Productions'],,"['Action', 'Adventure', 'Mystery', 'Romance']",['English']
474. Il brigante di Tacca del Lupo,1952,1h 37m,,6.8,236,,"In 19th century southern Italy (near Melfi, Basilicata), a small force of soldiers fight in the hills against the bandits who are holding their country to ransom.",https://www.imdb.com/title/tt0044450/?ref_=sr_i_474,"['Riccardo Bacchelli', 'Federico Fellini', 'Pietro Germi']",['Pietro Germi'],"['Amedeo Nazzari', 'Cosetta Greco', 'Saro Urzì', 'Fausto Tozzi', 'Vincenzo Musolino', 'Aldo Bufi Landi', 'Amedeo Trilli', 'Renato Terra', 'Sergio Bergonzelli', 'Oscar Andriani']",,,,,"October 15, 1952",['Italy'],,"['Lux Film', 'Rovere', 'Società Italiana Cines']","Awards, 1 nomination total","['Action', 'Drama']",['Italian']
475. Vihar,1952,1h 55m,,5.7,27,,,https://www.imdb.com/title/tt0044193/?ref_=sr_i_475,['Ernö Urbán'],['Zoltán Fábri'],"['József Bihari', 'Manyi Kiss', 'Ferenc Bessenyei', 'Magda Olthy', 'Tibor Molnár', 'Endre Szemethy', 'Béla Barsi', 'Márta Fónay', 'László Misoga', 'Irma Vass']",,,,,"December 25, 1952",['Hungary'],,"['Hungarian Filmproduction', 'Mafilm', 'Magyar Filmgyártó Nemzeti Vállalat']",,"['Drama', 'History']",['Hungarian']
476. The WAC from Walla Walla,1952,1h 23m,Approved,6.1,36,,"Although three generations of Jud Canovas have distinguished themselves in service to their country, from Bull Run to World War I, the line of military Canovas seems to have ended when a daughter, Judy, is born instead of a fourth Jud. On the same night, lightning in the town square destroys the statue of Jud Canova I, and over the years, Judy's recurring mishaps delay Gramps Canova's efforts to restore it, until finally his nemesis, Col. Mayfield, convinces the town council to put a Mayfield hero on the empty pedestal. Despite the Mayfield-Canova feud, the grown-up Judy develops a crush on young Lt. Tom Mayfield, and when Tom says he needs to ask her about a hayride, she joyously assumes he wants to ask her for a date. Needing a dress for the occasion, Judy visits the town's only dress shop which is run by the sophisticated Doris Vail, who is Judy's rival for Tom's affection. When the unfashionable Judy chooses an outfit that is hanging in the shop's unfinished window display, Doris points out that it is a special outfit, only available from a woman down the street. After introducing herself to the woman, a WAC recruiting sergeant, Judy learns that the dress she admires is really a WAC uniform. Meanwhile, two men identifying themselves as Prentice and Redington of International Amalgamated arrive in town and want to hire Tom for a project. As a military officer on active duty, he rejects their offer, leaving them to report their failure to their boss, who then decides to handle the matter himself. As Judy is leaving the recruiting sergeant, Tom sees her and states how proud he is that she has joined up, and then asks if he can borrow her family's wagon to use for the hayride. Broken-hearted that she was not asked for a date, Judy decides to attend the hayride on her own, and that evening, she and Doris end up sitting on the wagon with Tom, who is oblivious to their rivalry. When Doris teases Judy about mistaking a WAC uniform for a chic dress, the embarrassed Judy explains that she was set straight by the recruiting sergeant, but enlisted after Tom expressed pride in her. In the morning, when Judy reports at the train station with the other new recruits, Doris is among them, having enlisted with the hopes of also winning Tom's approval. For the naive Judy, basic training is difficult, as Doris' incessant tricks often get her into trouble. During compass training, Doris alters the directions on Judy's instruction sheet, causing her to wander into an area where live ammunition is being used. Mistaken for one of the men, she is dragged through their maneuvers, and after shaking them off, is almost arrested for trespassing in a top secret area. Fortunately, Tom recognizes her, and tells her about the guided missile homing device they are testing. Later, when the women complete their training, both Judy and Doris ask to be assigned to Ordnance to be near Tom. Shortly after reporting for duty, they are confronted by a general who wants data about the missiles. However, when he says his name is Mayfield and describes the Canovas as ""fine people,"" Judy is certain that he is a phony. Working with the bogus general are Prentice and Redington, and the three spies escape with the homing device for the secret missile, a black box. By chasing them in an Army jeep, Judy catches up and rides off with the black box, but meanwhile, the rocket has been launched as part of a demonstration for top Army officials, and the box is its target. Judy unwittingly toggles the switch on the box, causing the rocket to circle above, but when the spies get too close to her, toggles it back, letting the low-flying rocket scatter them. The chase continues on foot after Judy's jeep gets stuck. Using the box as a blunt object, she knocks out one of the men, and even disables the second spy. As she is wrestling with the third, Doris and Tom, both of whom are impressed, arrive with help. Later, for her service in apprehending the spies, Judy is awarded a medal during a hometown ceremony in which the statues of Jud Canova I and Major Mayfield are unveiled together in the town square. After the ceremony, Judy joins a parade of her fellow WACs, as they all march away.",https://www.imdb.com/title/tt0045303/?ref_=sr_i_476,['Arthur T. Horman'],['William Witney'],"['Judy Canova', 'Stephen Dunne', 'George Cleveland', 'June Vincent', 'Irene Ryan', 'Roy Barcroft', 'Allen Jenkins', 'George Chandler', 'Elizabeth Slifer', 'Thurston Hall']",,,,,"October 10, 1952",['United States'],"['Republic Studios, Hollywood, Los Angeles, California, USA (Studio)']",['Republic Pictures (I)'],,['Comedy'],['English']
477. Bronco Buster,1952,1h 20m,Approved,6.1,112,,"A veteran rodeo rider takes on a young apprentice in order to ""teach him the ropes"", and winds up competing against him.",https://www.imdb.com/title/tt0044452/?ref_=sr_i_477,"['Horace McCoy', 'Lillie Hayward', 'Peter B. Kyne']",['Budd Boetticher'],"['John Lund', 'Scott Brady', 'Joyce Holden', 'Chill Wills', 'Don Haggerty', 'Dan Poore', 'Casey Tibbs', 'Pete Crump', 'Bill Williams', 'Jerry Ambler']",,,,,"May 1, 1952",['United States'],"['Los Angeles, California, USA']",['Universal International Pictures (UI)'],,['Western'],['English']
478. Mr. Potts Goes to Moscow,1952,1h 33m,,6.3,203,,"A British sanitary engineer accidentally takes plans for a secret weapon on vacation thinking they're plumbing designs. Russians recruit him for the plans. He falls for a Russian agent, unaware the plans are for a dangerous weapon.",https://www.imdb.com/title/tt0045244/?ref_=sr_i_478,"['Jack Davies', 'Michael Pertwee']",['Mario Zampi'],"['George Cole', 'Oscar Homolka', 'Nadia Gray', 'Frederick Valk', 'Geoffrey Sumner', 'Wilfrid Hyde-White', 'Ronald Adam', 'Edwin Styles', 'Kynaston Reeves', 'Ernest Jay']",,,,,"September 3, 1953",['United Kingdom'],"['Croydon Airport, London, England, UK (The former airport [ now largely demolished ] stands in for Moscow Airport. The control tower showing in the film still stands as a museum.)']","['Mario Zampi Productions', 'Associated British Picture Corporation (ABPC)']","Awards, 1 nomination total",['Comedy'],['English']
479. You're Only Young Twice,1952,1h 21m,,4.9,113,,"Ada Shore is mistaken for a new secretary, she brings a breath of fresh air to the traditional university.",https://www.imdb.com/title/tt0030998/?ref_=sr_i_479,"['James Bridie', 'Lindsay Galloway', 'Reginald Beckwith']",['Terry Bishop'],"['Duncan Macrae', 'Joseph Tomelty', 'Patrick Barr', 'Charles Hawtrey', 'Diane Hart', 'Robert Urquhart', 'Edward Lexy', 'Jacqueline Mackenzie', 'Reginald Beckwith', 'Russell Waters']",,,,,July 1952,['United Kingdom'],"['Southall Studios, Southall, Middlesex, England, UK (Studio)']",['Group 3 Productions'],,['Comedy'],['English']
480. Circumstantial Evidence,1952,1h 1m,,5.9,126,,Linda Harrison is about to divorce her husband for desertion so that she will be free to marry a young doctor.,https://www.imdb.com/title/tt0179723/?ref_=sr_i_480,"['Allan MacKinnon', 'Lewis Maitland']",['Daniel Birt'],"['Rona Anderson', 'Patrick Holt', 'Frederick Leister', 'Ronald Adam', 'John Arnatt', 'John Warwick', 'Ballard Berkeley', 'Leonard White', 'June Ashley', 'Lisa Lee']",,,,,"November 17, 1952",['United Kingdom'],"[""Shepperton Studios, Shepperton, Surrey, England, UK (made at 'London Film Studio Shepperton Middx.')""]",['Association of Cinema Technicians (A.C.T.)'],,"['Crime', 'Drama']",['English']
481. Wagon Team,1952,1h 1m,Approved,6.1,114,,"When bad guys steal a US Army payroll, stagecoach agent Gene goes undercover as a medicine-show entertainer to smoke them out.",https://www.imdb.com/title/tt0045305/?ref_=sr_i_481,['Gerald Geraghty'],['George Archainbaud'],"['Gene Autry', 'Champion', 'Gail Davis', 'Dickie Jones', 'Gordon Jones', 'Harry Harvey', 'Henry Rowland', 'George J. Lewis', 'John Cason', 'The Cass County Boys']",,,,,"September 30, 1952",['United States'],"['Iverson Ranch - 1 Iverson Lane, Chatsworth, Los Angeles, California, USA']",['Gene Autry Productions'],,['Western'],['English']
482. The Wind Blows Twice,1952,1h 28m,,6.7,11,,"After her marriage breaks up, a young woman moves in with her aunt and uncle and becomes a movie ticket seller. On a train she meets two men - one older and wealthy, the other young and poor - who both fall for her.",https://www.imdb.com/title/tt10841092/?ref_=sr_i_482,"['Tatsuo Nagai', 'Keinosuke Uekusa']",['Shirô Toyoda'],"['Setsuko Hara', 'Ryô Ikebe', 'Sô Yamamura', 'Yuriko Hamada', 'Haruko Sugimura', 'Tsûsai Sugawara', 'Kô Mihashi', 'Ken Mitsuda', 'Shin Tatsuoka', 'Hisao Toake']",,,,,"February 14, 1952",['Japan'],,['Toho'],,['Drama'],['Japanese']
"483. Lola, la piconera",1952,1h 29m,,6.3,27,,"During the French invasion of Spain, the population of Cadiz begins to resist and Lola is a central figure.",https://www.imdb.com/title/tt0043750/?ref_=sr_i_483,"['José María Pemán', 'Luis Lucia', 'José Luis Colina']",['Luis Lucia'],"['Juanita Reina', 'Virgilio Teixeira', 'Manuel Luna', 'Fernando Nogueras', 'Félix Dafauce', 'Fernando Fernández de Córdoba', 'Alberto Romea', 'Arturo Marín', 'José Isbert', 'Nicolás D. Perchicot']",,,,,"May 7, 1953",['Spain'],,['Compañía Industrial Film Español S.A. (CIFESA)'],,['Drama'],['Spanish']
484. Three for Bedroom C,1952,1h 14m,Approved,5.6,194,,A film star and her young daughter stow away on a cross-country train to California. The compartment they invade belongs to a celebrated biology professor; romance blossoms. The star's manager turns up; complications ensue.,https://www.imdb.com/title/tt0045235/?ref_=sr_i_484,"['Milton H. Bren', 'Goddard Lieberson']",['Milton H. Bren'],"['Gloria Swanson', 'James Warren', 'Fred Clark', 'Hans Conried', 'Steve Brodie', 'Janine Perreau', 'Ernest Anderson', 'Margaret Dumont', 'Morris Ankrum', 'Don Beddoe']",,,,,"June 26, 1952",['United States'],"['Studio City, Los Angeles, California, USA (Studio)']",['Brenco Pictures'],,['Comedy'],['English']
485. Poonam,1952,,,,,,,https://www.imdb.com/title/tt0267835/?ref_=sr_i_485,"['Azm Bazidpuri', 'Hasrat Jaipuri', 'Ramanand Sagar']",['M. Sadiq'],"['Kamini Kaushal', 'Ashok Kumar', 'Om Prakash', 'Sajjan', 'Asha Mathur', 'Baby Chun Mun', 'Balak', 'Ramesh Thakur', 'Ram Avtar', 'Ramesh Kapoor']",,,,,,['India'],,['Kay Arts'],,['Romance'],['Hindi']
