Title,Year,Duration,MPA,Rating,Votes,méta_score,description,Movie Link,writers,directors,stars,budget,opening_weekend_Gross,grossWorldWWide,gross_US_Canada,release_date,countries_origin,filming_locations,production_company,awards_content,genres,Languages
445. Billy the Kid Trapped,1942,59m,Approved,5.1,224,,Stanton breaks Billy and his two friends Fuzzy and Jeff out of jail. He wants them free so three of his men can impersonate them for the robberies and murders he has planned.,https://www.imdb.com/title/tt0033390/?ref_=sr_i_445,"[""Joseph O'Donnell""]",['Sam Newfield'],"['Buster Crabbe', 'Al St. John', ""Malcolm 'Bud' McTaggart"", 'Anne Jeffreys', 'Glenn Strange', 'Walter McGrail', 'Ted Adams', 'Jack Ingram', 'Milton Kibbee', 'Eddie Phillips']",,,,,"February 27, 1942",['United States'],"['Corriganville, Ray Corrigan Ranch, Simi Valley, California, USA']",['Sigmund Neufeld Productions'],,['Western'],['English']
446. Labbra serrate,1942,1h 20m,,4.2,10,,"A young man of high-bourgeois family loses his head for a woman with a stormy past. A family friend, a lawyer, intrudes to separate the two and after his intervention the woman is found killed.",https://www.imdb.com/title/tt0034956/?ref_=sr_i_446,"['Leo Catozzo', 'Aldo De Benedetti', 'Marcello Marchesi']",['Mario Mattoli'],"['Annette Bach', 'Andrea Checchi', 'Fosco Giachetti', 'Vera Carmi', 'Giulio Donadio', 'Carlo Campanini', 'Tino Scotti', 'Armida Bonocore', 'Nino Pavese', 'Armando Migliari']",,,,,"November 13, 1942",['Italy'],"['Cinecittà Studios, Cinecittà, Rome, Lazio, Italy (Studio)']",['Manenti Film Sp.A.'],,"['Mystery', 'Thriller']",['Italian']
447. Not a Ladies' Man,1942,1h,Approved,6.0,33,,"Bill Bruce, a young boy whose dislike of women, stems from his father's divorce from his mother, is dismayed to find that his father, Robert Brude, is falling for Bill's schoolteacher, Hester Hunter. He tells Hester that his parents still love each other and tells his father that his teacher is about to get married. Robert gets drunk and Hester drives him home. She is seen entering his house by a member of the school board who demands her dismissal. Young Bill sets out to fix the damage.",https://www.imdb.com/title/tt0035137/?ref_=sr_i_447,"['Robert Hyde', 'Rian James']",['Lew Landers'],"['Paul Kelly', 'Fay Wray', 'Douglas Croft', 'Ruth Lee', 'Lawrence Dixon', 'Marietta Canty', 'Don Beddoe', ""Eileen O'Hearn"", 'Jean Inness', 'Louise Allbritton']",,,,,"May 14, 1942",['United States'],,['Columbia Pictures'],,"['Drama', 'Romance']",['English']
448. Pacific Rendezvous,1942,1h 16m,Approved,5.8,194,,"Anxious to see some naval action in the Pacific during WWII, Lt. Bill Gordon makes the mistake of telling his new girlfriend, ditzy Elaine Carter, that he was an expert in deciphering codes. Trying to keep him in the states for herself, she convinces her uncle to add him to a unit charged with deciphering the enemy's coded messages. With the murder of his superior, Gibson attempts, with the ""help"" of Elaine, to root out the spy ring that's been intercepting valuable troop movement information.",https://www.imdb.com/title/tt0035167/?ref_=sr_i_448,"['Harry Kurnitz', 'P.J. Wolfson', 'George Oppenheimer']",['George Sidney'],"['Lee Bowman', 'Jean Rogers', 'Mona Maris', 'Carl Esmond', 'Paul Cavanagh', 'Blanche Yurka', 'Russell Hicks', 'Arthur Shields', 'William Post Jr.', 'William Tannen']","$225,000 (estimated)",,,,"May 21, 1942",['United States'],"['Metro-Goldwyn-Mayer Studios - 10202 W. Washington Blvd., Culver City, California, USA (Studio)']",['Metro-Goldwyn-Mayer (MGM)'],,"['Comedy', 'Drama', 'Mystery', 'War']",['English']
449. The Great Mr. Handel,1942,1h 29m,Not Rated,6.9,101,,"Handel's operas are less successful than before, but he hates to ask the Prince of Wales for his support. The Prince doesn't like Handel's attitude and harms his reputation. Struggling and sick Handel agrees to compose The Messiah.",https://www.imdb.com/title/tt0034813/?ref_=sr_i_449,"['Gerald Elliott', 'Victor MacLure', 'L. du Garde Peach']",['Norman Walker'],"['Wilfrid Lawson', 'Elizabeth Allan', 'Malcolm Keen', 'Michael Shepley', 'Max Kirby', 'Hay Petrie', 'Morris Harvey', 'A.E. Matthews', 'Frederick Cooper', 'Andrew Leigh']",,,,,"November 9, 1942",['United Kingdom'],"['D&P Studios, Denham, Uxbridge, Buckinghamshire, England, UK (Studio)']","['G.H.W. Productions Ltd.', 'Independent Producers']",,"['Biography', 'Drama', 'Music']",['English']
450. Kazakhstan - frontu!,1942,,,6.5,44,,,https://www.imdb.com/title/tt0259059/?ref_=sr_i_450,[],['Dziga Vertov'],,,,,,,['Soviet Union'],,,,[],['Russian']
451. Halfway to Shanghai,1942,1h 2m,Approved,6.4,83,,A murder occurs on a train bound for Shanghai during World War II.,https://www.imdb.com/title/tt0034825/?ref_=sr_i_451,['Stuart Palmer'],['John Rawlins'],"['Kent Taylor', 'Irene Hervey', 'Henry Stephenson', 'J. Edward Bromberg', 'George Zucco', 'Charles Wagenheim', 'Alexander Granach', 'Lionel Royce', 'Willie Fung', ""Oscar O'Shea""]",,,,,"September 18, 1942",['United States'],"['Universal Studios - 100 Universal City Plaza, Universal City, California, USA (Studio)']",['Universal Pictures'],,"['Adventure', 'Mystery']",['English']
452. Croisières sidérales,1942,1h 35m,,5.5,101,,It may be the first time they have used the theory of relativity in a story.,https://www.imdb.com/title/tt0033501/?ref_=sr_i_452,"['Pierre Guerlais', 'Pierre Bost']",['André Zwobada'],"['Madeleine Sologne', 'Jean Marchat', 'Julien Carette', 'Robert Arnoux', 'Simone Allain', 'Auguste Bovério', 'Violette Briet', 'Jean Dasté', 'Luce Ferrald', 'Richard Francoeur']",,,,,"April 29, 1942",['France'],"['Studios Eclair, Epinay-sur-Seine, Seine-Saint-Denis, France']",['Industrie Cinématographique'],,['Sci-Fi'],['French']
453. Junior G-Men of the Air,1942,3h 45m,Approved,6.1,110,,A group of street kids battle a terrorist gang led by a Japanese spy.,https://www.imdb.com/title/tt0034930/?ref_=sr_i_453,"['Paul Huston', 'George H. Plympton', 'Griffin Jay']","['Lewis D. Collins', 'Ray Taylor']","['Billy Halop', 'Gene Reynolds', 'Lionel Atwill', 'Frank Albertson', 'Richard Lane', 'Huntz Hall', 'Gabriel Dell', 'Bernard Punsly', 'Frankie Darro', 'David Gorcey']",,,,,"June 30, 1942",['United States'],"['Metropolitan Airport, Van Nuys, California, USA (airport scenes)']",['Universal Pictures'],,"['Action', 'Adventure', 'War']",['English']
454. Sürtük,1942,,,6.8,16,,The story of a woman who climbs the social ladder.,https://www.imdb.com/title/tt0304779/?ref_=sr_i_454,"['Refik Kemal Arduman', 'George Bernard Shaw']",['Adolf Körner'],"['Zehra Yumsel', 'Avni Dilligil', 'Halide Piskin', 'Muazzez Arçay', 'Refik Kemal Arduman', 'Avni Yasar', 'Mümtaz Ener', 'Hulusi Kentmen', 'Resit Baran', 'Sami Ayanoglu']",,,,,,['Turkey'],,['Ha-Ka Film'],,[],['Turkish']
"455. Pontcarral, colonel d'empire",1942,2h 5m,,6.5,48,,"For 15 years after Waterloo, a baron refuses to accept the defeat. He reluctantly marries one of 2 Bourbon sisters but lands up dueling with the wife's former lover. Finally he gets a chance to prove himself again in battle.",https://www.imdb.com/title/tt0198918/?ref_=sr_i_455,"['Alberic Cahuet', 'Bernard Zimmer']",['Jean Delannoy'],"['Pierre Blanchar', 'Annie Ducaux', 'Suzy Carrier', 'Charles Granval', 'Jean Marchat', 'Charlotte Lysès', 'Guillaume de Sax', 'Marcel Delaître', 'Simone Valère', 'Jacques Louvigny']",,,,,"December 11, 1942",['France'],,['Pathé Consortium Cinéma'],,['Drama'],['French']
456. Asking for Trouble,1942,1h 21m,,5.5,40,,"A London fishmonger takes up bookmaking to make ends meet, and also helps a young woman evade her unwanted upcoming marriage by pretending to be her fiance, a big game hunter from Africa.",https://www.imdb.com/title/tt0034476/?ref_=sr_i_456,"['Con West', 'Oswald Mitchell']",['Oswald Mitchell'],"['Max Miller', 'Carole Lynne', 'Mark Lester', 'Wilfrid Hyde-White', 'Billy Percy', 'Eleanor Hallam', 'Aubrey Mallalieu', 'Kenneth Kove', 'Chick Elliott', 'Esma Cannon']",,,,,September 1942,['United Kingdom'],,['British National Films'],,['Comedy'],['English']
457. Der große Schatten,1942,1h 35m,,7.3,28,,"During the rehearsals for their new play, Robert Jürgensen (Will Quadflieg) and his wife Gisela Ahrens (Heidemarie Hatheyer) recognize their former theater manager Conrad Schroeter (Heinrich George) in the prompt box as the new prompter. Jürgensen once ruthlessly seduced Schroeter's only daughter Inge, even though he already was bound to Gisela, who yet was pregnant at that time. In great desperation Inge committed suicide. In the midst of a performance with Jürgensen, Schroeter was informed about the death of his child. Horrified, he attacked Jürgensen and accused him for murder. Schroeter then was committed into a mental clinic. Now, Robert and Gisela are afraid, if Schroeter can handle the new re-encounter.",https://www.imdb.com/title/tt0034817/?ref_=sr_i_457,['Harald Bratt'],['Paul Verhoeven'],"['Heinrich George', 'Heidemarie Hatheyer', 'Will Quadflieg', 'Marina von Ditmar', 'Ernst Schröder', 'Curt Ackermann', 'Theodor Danegger', 'Karl Dannemann', 'Jac Diehl', 'Fritz Draeger']",,,,,1953,['Germany'],"['Berlin, Germany']",['Tobis Filmkunst'],"Awards, 1 win & 1 nomination total",['Drama'],['German']
458. Las cinco noches de Adán,1942,1h 57m,,6.4,9,,,https://www.imdb.com/title/tt0034596/?ref_=sr_i_458,"['Fernando Cortés', 'Gilberto Martínez Solares', 'Eduardo Ugarte']",['Gilberto Martínez Solares'],"['Mapy Cortés', 'Domingo Soler', 'Tomás Perrín', 'Fernando Cortés', 'Jorge Reyes', 'Consuelo Guerrero de Luna', 'Alfredo Varela', 'Agustín Isunza', 'Carolina Barret', 'Roberto Banquells']",,,,,"April 18, 1942",['Mexico'],['Mexico'],['Producciónes Grovas'],,"['Comedy', 'Drama', 'Musical']",['Spanish']
459. Juke Box Jenny,1942,1h 1m,Approved,5.7,31,,"Roger Wadsworth is a salesman for a company that supplies juke-boxes with classical music recordings, as Mrs. Horton, chief stockholder of the company hates swing music. Because of that, and the fact that Mrs. Horton is the mother of his fiancée, Genevieve Horton, Roger can only sit by and watch the competitors, who sell swing-and-jive music records get most of the business. Some of the other salesmen play a joke on Roger by getting Charlie Barnet and his orchestra (none playing ""Self"" in this fictional film)make a recording which they slip into Roger's packet marked as classical. They also get showgirl Jinx Corey to tell the newspapers that she and Roger are married. Malcolm Hammond goes to Genevieve to plead Roger's case, and tricks her into making a recording as 'Jukebox Jenny."" This leads to further complications.",https://www.imdb.com/title/tt0034927/?ref_=sr_i_459,"['Robert Lees', 'Frederic I. Rinaldo', 'Arthur V. Jones']",['Harold Young'],"['Ken Murray', 'Harriet Nelson', 'Iris Adrian', 'Donald Douglas', 'Marjorie Gateson', 'Charlie Barnet and His Orchestra', 'Charlie Barnet', ""The King's Men"", 'Wingy Manone and His Orchestra', 'Milt Herth and His Trio']",,,,,"March 27, 1942",['United States'],"['Universal Studios - 100 Universal City Plaza, Universal City, California, USA (Studio)']",['Universal Pictures'],,"['Comedy', 'Music', 'Romance']",['English']
460. Sunday Punch,1942,1h 16m,Approved,5.7,268,,"Ma Galestrum's boarding house for aspiring boxers is disrupted when her niece Judy moves in. Ken Burke and Olaf Jensen, housemates and rivals, both vie for Judy's affection, leading to a climactic boxing match between the two friends.",https://www.imdb.com/title/tt0035393/?ref_=sr_i_460,"['Fay Kanin', 'Michael Kanin', 'Allen Rivkin']",['David Miller'],"['William Lundigan', 'Jean Rogers', 'Dan Dailey', 'Guy Kibbee', 'J. Carrol Naish', 'Connie Gilchrist', 'Sam Levene', 'Leo Gorcey', 'Rags Ragland', 'Johnny Mitchell']","$305,000 (estimated)",,,,"May 8, 1942",['United States'],"['Metro-Goldwyn-Mayer Studios - 10202 W. Washington Blvd., Culver City, California, USA (Studio)']",['Metro-Goldwyn-Mayer (MGM)'],,"['Comedy', 'Drama', 'Romance']",['English']
461. Vengeance of the West,1942,1h 1m,Approved,6.1,28,,"The last entry in Columbia's series co-starring Bill Elliott and Tex Ritter (who departed for the corrals at Republic and Universal), and a remake of 1931's ""The Avenger"" with Buck Jones: Joaquin Murietta (Bill Elliott)is robbed of his property by Jeff Gorman (Dick Curtis) and town banker Gil Kirby (Robert Fiske) and seeks revenge by disguising himself as a masked bandit, known as The Grey Shadow,and begins to raid gold shipments intended for Gorman and Kirby. Anita Morrell (Adele Mara) arrives in town and is shocked to learn that her father has been murdered. California Ranger Tex Lake (Tex Ritter) investigates and finds clues, planted by Gorman and Kirby,implicating Murietta. Kirby, the real killer, demands $2,000 from Anita in return for the deed to her father's gold mine.Murietta comes to her, denies any involvement in the killing, and gives her the needed money. Lake is on Murietta's trail, but the two are soon united in a fight against the outlaws.",https://www.imdb.com/title/tt0035507/?ref_=sr_i_461,"['Jack Townley', 'Luci Ward']",['Lambert Hillyer'],"['Tex Ritter', 'Bill Elliott', 'Frank Mitchell', 'Adele Mara', 'Dick Curtis', 'Robert Fiske', 'Ted Mapes', 'Eva Puig', 'José Luis Tortosa', 'Guy Wilkerson']",,,,,"August 16, 1942",['United States'],"['Iverson Ranch - 1 Iverson Lane, Chatsworth, Los Angeles, California, USA']",['Columbia Pictures'],,['Western'],['English']
462. Riding the Wind,1942,1h,Approved,5.8,108,,"It's the ranchers whose cattle are dying of thirst versus Henry Dodge whose dam holds all the water. When windmills are built and they start pumping water, Dodge has them blown up. When a court order forces him to release the water, he decides to blow up the dam and flood the valley.",https://www.imdb.com/title/tt0034109/?ref_=sr_i_462,"['Morton Grant', 'Earle Snell', 'Bernard McConville']",['Edward Killy'],"['Tim Holt', 'Ray Whitley', 'Joan Barclay', ""Lee 'Lasses' White"", 'Eddie Dew', 'Ernie Adams', 'Earle Hodgins', 'Kate Harrington', 'Charles R. Phipps', 'Bud Osborne']",,,,,"February 27, 1942",['United States'],"['Burro Flats, Simi Hills, California, USA']",['RKO Radio Pictures'],,"['Drama', 'Western']",['English']
463. Adventure in Blackmail,1942,1h 19m,,6.3,29,,"Peter Conway is a playwright and his new play is having its first night. At the party afterwards, Peter is kissed by a woman he claims not to know. The woman is Pamela. At first, she persuades him but then produces some letters where he declared his undying love for her and she sues him for Breach of Promise. But Peter has a nice scheme to defeat her plan - he marries her. She then does her best to bankrupt him. But why does she want to destroy him?",https://www.imdb.com/title/tt0034548/?ref_=sr_i_463,"['Roland Pertwee', 'Emeric Pressburger']","['Harold Huth', 'Roland Pertwee']","['Clive Brook', 'Judy Campbell', 'C.V. France', 'Marguerite Allan', 'Percy Walsh', 'Dennis Arundell', 'George Merritt', 'David Horne', 'Charles Victor', 'Aubrey Mallalieu']",,,,,"August 5, 1943",['United Kingdom'],,['British Mercury'],,"['Drama', 'Romance']",['English']
464. Yokel Boy,1942,1h 9m,Approved,5.5,49,,"""Perfect Movie Fan"" Joe Ruddy is brought to Hollywood as a publicity stunt and put in charge of a production company as a gag, but everybody isn't in on the gag, and Joe imports a notorious gangster, ""Buggsy"" Malone, to play ""himself"" in a film based on his life. ""Buggsy"" has gone straight, more or less, but retains some of his old habits to the extent of assuming control of the film, and the whole studio. His sister Molly comes along and falls in love with Joe. The head of the studio, R. B. Harris, quickly becomes disenchanted with the idea of publicity stunts.",https://www.imdb.com/title/tt0035581/?ref_=sr_i_464,"['Isabel Dawn', 'Russell Rouse']",['Joseph Santley'],"['Albert Dekker', 'Joan Davis', 'Eddie Foy Jr.', 'Alan Mowbray', 'Roscoe Karns', 'Mikhail Rasumny', 'Lynne Carver', 'Marc Lawrence', 'Tom Dugan', 'James C. Morton']",,,,,"March 13, 1942",['United States'],"['Republic Studios, Hollywood, Los Angeles, California, USA']",['Republic Pictures (I)'],,"['Parody', 'Satire', 'Comedy', 'Crime', 'Romance']",['English']
465. Unpublished Story,1942,1h 32m,,6.4,271,,A journalist investigates a network of German fifth columnists operating in the midst of the Blitz.,https://www.imdb.com/title/tt0035494/?ref_=sr_i_465,"['Anthony Havelock-Allan', 'Allan MacKinnon', 'Anatole de Grunwald']",['Harold French'],"['Richard Greene', 'Valerie Hobson', 'Basil Radford', 'Roland Culver', ""Brefni O'Rorke"", 'Miles Malleson', 'George Carney', 'Muriel George', 'André Morell', 'Frederick Cooper']",,,,,"August 10, 1942",['United Kingdom'],"['D&P Studios, Denham, Uxbridge, Buckinghamshire, England, UK (studio: made at D&P Studios)']",['Two Cities Films'],,"['Drama', 'War']",['English']
466. Underground Agent,1942,1h 10m,Approved,6.3,31,,"Lee Graham (Bruce Bennett) and Johnny Davis (Frank Albertson) are U.S. government agents, aided by Ann Carter (Leslie Brooks), assigned to prevent German spies involved in a telephone-tapping scheme from infiltrating a California war-defense plant. To help them in their cause Lee invents an ingenious word-scrambler which leads to the round-up of the German spies.",https://www.imdb.com/title/tt0035488/?ref_=sr_i_466,"['J. Robert Bren', 'Gladys Atwater']",['Michael Gordon'],"['Bruce Bennett', 'Leslie Brooks', 'Frank Albertson', 'Julian Rivero', 'George McKay', 'Rhys Williams', 'Henry Victor', 'Addison Richards', 'Rosina Galli', 'Warren Ashe']",,,,,"December 3, 1942",['United States'],,['Columbia Pictures'],,"['Action', 'Drama', 'Romance', 'Thriller', 'War']",['English']
467. I Danced with Don Porfirio,1942,1h 32m,,7.0,28,,,https://www.imdb.com/title/tt0035580/?ref_=sr_i_467,"['Gilberto Martínez Solares', 'Eduardo Ugarte', 'Enrique Uthoff']",['Gilberto Martínez Solares'],"['Mapy Cortés', 'Joaquín Pardavé', 'Emilio Tuero', 'Fernando Cortés', 'Julio Villarreal', 'Consuelo Guerrero de Luna', 'Jorge Reyes', 'Consuelo Quiroz', 'Ignacio Peón', 'José Arratia']",,,,,"September 17, 1943",['Mexico'],['Mexico'],['Clasa Films Mundiales'],,"['Comedy', 'Musical']",['Spanish']
468. El comisario de Tranco Largo,1942,1h 13m,,,,,"The owner of a store must replace the town commissioner, who has died during a strike in a mill that provoked acts of violence and, finally, discovers the murderers.",https://www.imdb.com/title/tt0201633/?ref_=sr_i_468,"['Leopoldo Torres Ríos', 'Alberto Vacarezza']",['Leopoldo Torres Ríos'],"['Alí Salem de Baraja', 'Mario Baroffio', 'Isabel Figlioli', 'Ada Mendez', 'Pepito Petray', 'Carlos Fioriti', 'Claudio Martino', 'Lydia Quintana', 'Susana Campos', 'Marino Seré']",,,,,"October 21, 1942",['Argentina'],,['Ibera Film'],,['Comedy'],['Spanish']
469. Diesel,1942,1h 49m,,6.6,41,,"A German wartime biography of Rudolf Diesel, inventor of the Diesel engine. The movie links the importance of the engine to the war by starting the movie with newsreel clips of German Navy U-boats in action.",https://www.imdb.com/title/tt0034653/?ref_=sr_i_469,"['Eugen Diesel', 'Gerhard Lamprecht', 'Richard H. Riedel']",['Gerhard Lamprecht'],"['Willy Birgel', 'Hilde Weissner', 'Paul Wegener', 'Josef Sieber', 'Arthur Schröder', 'Hilde von Stolz', 'Erich Ponto', 'Werner Pledath', 'Herbert Gernot', 'Walter Janssen']",,,,,"November 13, 1942",['Germany'],,['Universum Film (UFA)'],,"['Biography', 'History']",['German']
470. Scattergood Survives a Murder,1942,1h 6m,Approved,6.4,50,,"Scattergood meets the new owner of the local newspaper, Dunker Gillson. One of Gillson's first tasks is to interview the wealthy but reclusive Quentin sisters, Lydia and Cynthia, who have stayed in their old musty house for years. The somewhat sinister Mrs. Grimes, the sisters' housekeeper, refuses to let Gillson talk to the sisters. Later, when the sisters' beloved cat takes ill, Mrs. Grimes insists on driving them to town in their horse-and-buggy outfit. An accident occurs on the way to town and the sisters are killed. At the reading of the will, everyone is surprised and shocked at the sisters' stipulations regarding their fortune.",https://www.imdb.com/title/tt0035293/?ref_=sr_i_470,"['Clarence Budington Kelland', 'Michael L. Simmons']",['Christy Cabanne'],"['Guy Kibbee', 'John Archer', 'Margaret Hayes', 'Wallace Ford', 'Spencer Charters', 'Eily Malyon', 'John Miljan', 'George Chandler', 'Dick Elliott', 'Florence Lake']",,,,,October 1942,['United States'],"['RKO Studios - 780 N. Gower Street, Hollywood, Los Angeles, California, USA (Studio)']",['Pyramid Productions'],,"['Adventure', 'Comedy', 'Crime', 'Drama', 'Mystery']",['English']
471. Ala-Arriba!,1942,1h 34m,,7.2,111,,"In a village of poor fishermen in the North of Portugal, João Moço and Julha fall in love. Unfortunately they belong to two different fisher castes and the community as well as their respective families condemn their love...",https://www.imdb.com/title/tt0034439/?ref_=sr_i_471,"['Alfredo Cortez', 'Augusto de Santa-Ritta']",['José Leitão de Barros'],"['Ilidio Rocha Silvestre', 'Elsa Bea-Flor', 'João Moço', 'Nicolau', 'Maria Olguim', 'Luís Pinto', 'Madalena Vilaça']",,,,,"September 15, 1942",['Portugal'],"['Povoa de Varzim, Portugal']","['Tobis Portuguesa', 'Comissariado do Desemprego', 'Secretariado da Propaganda Nacional (SPN)']","Awards, 1 win & 1 nomination total","['Drama', 'Romance']",['Portuguese']
472. Foreign Agent,1942,1h 4m,Approved,4.7,105,,Hollywood starlet foils an Axis plot to sabotage the L.A. infrastructure.,https://www.imdb.com/title/tt0034748/?ref_=sr_i_472,"['Martin Mooney', 'John W. Krafft']",['William Beaudine'],"['John Shelton', 'Gale Storm', 'Ivan Lebedeff', 'George Travell', 'Patsy Moran', 'Lyle Latell', 'Hans Schumm', 'William Halligan', 'Herbert Rawlinson', 'Boyd Irwin']",,,,,"October 9, 1942",['United States'],,['Monogram Pictures'],,"['Drama', 'War']","['German', 'English']"
"473. Henry Aldrich, Editor",1942,1h 12m,Approved,6.4,165,,Henry (James Lydon) gets into another jam when he becomes the editor of the Centerville Hish School newspaper. The Fire Chief suspects him when he covers fires.,https://www.imdb.com/title/tt0034842/?ref_=sr_i_473,"['Muriel Roy Bolton', 'Val Burton', 'Clifford Goldsmith']",['Hugh Bennett'],"['Jimmy Lydon', 'Charles Smith', 'John Litel', 'Olive Blakeney', 'Rita Quigley', 'Vaughan Glaser', 'Charles Halton', 'Francis Pierlot', 'Cliff Clark', 'Fern Emmett']",,,,,September 1942,['United States'],"['Paramount Studios - 5555 Melrose Avenue, Hollywood, Los Angeles, California, USA (Studio)']",['Paramount Pictures'],,"['Comedy', 'Drama', 'Family', 'Mystery']",['English']
474. Volshebnoye zerno,1942,1h 27m,,6.6,63,,"Children Andreika and Mariyka receive a magic seed as a gift, which should bring people joy and abundance. But the evil wizard Kara-Mor sends his subjects to destroy the wonderful plant.",https://www.imdb.com/title/tt0334652/?ref_=sr_i_474,['Aleksey Simukov'],"['Fyodor Filippov', 'Valentin Kadochnikov']","['Vladimir Tumalaryants', 'Nina Zavarova', 'Vladimir Gribkov', 'Ivan Pereverzev', 'Galina Kireyevskaya', 'Oleg Bant', 'Aleksei Kelberer', 'Sergey Martinson', 'Olga Toropova', 'Stepan Kayukov']",,,,,"April 10, 1942",['Soviet Union'],,"['Mosfilm', 'Tsentralnuyu Obedinyonnuyu Kinostudiyu (TsOKS)']",,"['Family', 'Fantasy']",['Russian']
475. Men of Texas,1942,1h 22m,Approved,6.5,47,,"Played by Robert Stack, Barry Conovan, a newspaperman, is sent to Texas some years after the death of Sam Houston, with the aim of getting the real skinny on the grand old man. He unearths some facts which make Houston more heroic than had been thought up North before, and then gets involved, and ultimately held hostage by Broderick Crawford's Henry Clay Jackson. Jackson is a Texan rebel, but Conovan discovers that he is no noble freedom-fighter, opting instead for robbing banks to fill his own pockets rather than for the greater glory of Texas.",https://www.imdb.com/title/tt0035058/?ref_=sr_i_475,"['Harold Shumate', 'Richard Brooks']",['Ray Enright'],"['Robert Stack', 'Broderick Crawford', 'Jackie Cooper', 'Anne Gwynne', 'Ralph Bellamy', 'Jane Darwell', 'Leo Carrillo', 'John Litel', 'William Farnum', 'Janet Beecher']",,,,,"July 3, 1942",['United States'],"['Universal Studios - 100 Universal City Plaza, Universal City, California, USA (Studio)']",['Universal Pictures'],,"['History', 'Western']",['English']
476. You're Telling Me,1942,1h,Approved,5.7,33,,"Other than the title, this film has no connection at all to the 1934 W.C. Fields film of the same title even though some sources give the plot of the Fields' film as the plot of this film. Hubert Abercrombie Gumm (Hugh Herbert), a flighty, eccentric screwball (what else)acquires a job as an executive at a radio station at the insistence of his only-slightly less eccentric aunt Fannie Handley (Esther Dale), who is married to one of the company owners, Ernest Truex. After mixing up the script pages to the various radio programs, Hubert sets out to get the name of a returning explorer on a contract for the radio station.",https://www.imdb.com/title/tt0035584/?ref_=sr_i_476,"['Frances Hyland', 'Brenda Weisberg', ""Charles O'Neil""]",['Charles Lamont'],"['Hugh Herbert', 'Anne Gwynne', 'Robert Paige', 'Edward Ashley', 'Ernest Truex', 'Esther Dale', 'Eily Malyon', 'Charles Smith', 'Helen Lynd', 'Romaine Callender']",,,,,"May 3, 1942",['United States'],"['Universal Studios - 100 Universal City Plaza, Universal City, California, USA (Studio)']",['Universal Pictures'],,"['Slapstick', 'Comedy']",['English']
