Title,Year,Duration,MPA,Rating,Votes,méta_score,description,Movie Link,writers,directors,stars,budget,opening_weekend_Gross,grossWorldWWide,gross_US_Canada,release_date,countries_origin,filming_locations,production_company,awards_content,genres,Languages
431. Meander,2020,1h 30m,,5.4,12K,63.0,A woman finds herself locked in a series of strange tunnels full of deadly traps.,https://www.imdb.com/title/tt5752192/?ref_=sr_i_431,['Mathieu Turi'],['Mathieu Turi'],"['Gaia Weiss', 'Peter Franzén', 'Romane Libert', 'Frédéric Franchitti', 'Corneliu Dragomirescu', 'Eva Niewdanski', 'Carl Laforêt', 'Henri Benard', 'Fabien Houssaye', 'Olympe Turi']",,,"$675,001",,"July 9, 2021",['France'],,"['Fulltime Studio', 'Cinéfrance Studios', 'Equitime']","Awards, 15 wins & 50 nominations total","['Drama', 'Horror', 'Mystery', 'Sci-Fi', 'Thriller']","['French', 'English']"
432. Debt Collectors,2020,1h 37m,,5.8,5.8K,,"A pair of debt collectors are thrust into an explosively dangerous situation, chasing down various lowlifes while also evading a vengeful kingpin. -Samuel Goldwyn Films-",https://www.imdb.com/title/tt10933680/?ref_=sr_i_432,"['Jesse V. Johnson', 'Stu Small']",['Jesse V. Johnson'],"['Scott Adkins', 'Louis Mandylor', 'Vladimir Kulich', 'Marina Sirtis', 'Ski Carr', 'Charity Collins', 'Mayling Ng', 'Josef Cannon', 'Jermaine Jacox', 'Vernon Wells']","$2,300,000 (estimated)",,"$26,976",,"May 20, 2020",['United States'],"['Restaurante Salvadoreno El Cafetal - 6429 Van Nuys Blvd, Van Nuys, Los Angeles, California, USA']","['Compound B', 'DC2 Productions', 'Tarzana Productions']",,"['Buddy Comedy', 'Martial Arts', 'Action', 'Comedy']",['English']
433. Rogue,2020,1h 45m,R,4.2,10K,,"O'Hara is a mercenary leading a squad of soldiers on their mission to rescue hostages in a remote part of Africa. Unfortunately, the mission goes awry and the team is stranded and forced to survive against the local rebels.",https://www.imdb.com/title/tt11576124/?ref_=sr_i_433,"['Isabel Bassett', 'M.J. Bassett', 'Mark Middlewick']",['M.J. Bassett'],"['Megan Fox', 'Philip Winchester', 'Greg Kriek', 'Brandon Auret', 'Jessica Sutton', 'Kenneth Fok', 'Isabel Bassett', 'Adam Deacon', 'Sisanda Henna', 'Tamer Burjaq']",,,"$242,884",,"August 28, 2020","['United States', 'South Africa', 'United Kingdom']","['Glen Afric Country Lodge, Broederstroom, South Africa']","['Capstone Studios', 'Grindstone Entertainment Group', 'Hassell Free Productions']","Awards, 1 win total","['Dark Comedy', 'Psychological Thriller', 'Action', 'Horror', 'Thriller']",['English']
"434. Love, Guaranteed",2020,1h 30m,TV-PG,5.6,20K,39.0,"To save her small law firm, earnest lawyer Susan takes a high-paying case from Nick, a charming new client who wants to sue a dating website that guarantees love. But as the case heats up, so do Susan and Nick's feelings for each other.",https://www.imdb.com/title/tt11100856/?ref_=sr_i_434,"['Elizabeth Hackett', 'Hilary Galanoy']",['Mark Steven Johnson'],"['Rachael Leigh Cook', 'Damon Wayans Jr.', 'Heather Graham', 'Caitlin Howden', 'Brendan Taylor', 'Sebastian Billingsley-Rodriguez', 'Sean Amsing', 'Lisa Durupt', 'Alvin Sanders', 'Jed Rees']",,,,,"September 3, 2020",['United States'],"['Vancouver, British Columbia, Canada (Exterior)']",['Off Camera Entertainment'],"Awards, 1 win & 3 nominations total","['Comedy', 'Romance']",['English']
435. Silver Skates,2020,2h 10m,TV-MA,7.1,8.2K,,"Matvey, the fastest courier on the frozen canals of 19th century St. Peteresburg is recruited by a group of pickpockets working the winter markets and falls for high-ranking official's daughter, Alisa.",https://www.imdb.com/title/tt10525672/?ref_=sr_i_435,"['Mary Mapes Dodge', 'Roman Kantor']",['Michael Lockshin'],"['Fedor Fedotov', 'Yura Borisov', 'Kirill Zaytsev', 'Severija Janusauskaite', 'Cathy Belton', 'Margarita Adaeva', 'Mikhail Shelomentsev', 'Bato Shoinjonov', 'Aleksandra Revenko', 'Timofey Tribuntsev']","RUR500,000,000 (estimated)",,"$7,099,734",,"December 10, 2020",['Russia'],"['St. Petersburg, Russia']","['Central Partnership Productions', 'KIT Film Studio', 'Kinoslovo']","Awards, 10 wins & 6 nominations total","['Period Drama', 'Adventure', 'Drama', 'Family', 'Romance']","['Russian', 'English', 'French']"
436. The Book of Vision,2020,1h 39m,,7.6,18K,,"Eva, a mysterious doctor, searches for an answer to her urgent dilemma as she unravels Dr. Anmuth's Book of Vision. Stellan gets involved in her life and is forced to confront his own nature as she faces the biggest decision of her life.",https://www.imdb.com/title/tt4016312/?ref_=sr_i_436,"['Carlo Hintermann', 'Marco Saura']",['Carlo Hintermann'],"['Charles Dance', 'Lotte Verbeek', 'Sverrir Gudnason', 'Filippo Nigro', 'Isolda Dychauk', 'Rocco Gottlieb', 'Justin Korovkin', 'Douglas Dean', 'Vera Graziadei', 'Marco Quaglia']",,,"$115,061",,"February 26, 2021","['Italy', 'United Kingdom', 'Belgium']",['Belgium'],"['Citrullo International', 'Luminous Arts Productions', 'Entre Chien et Loup']","Awards, 1 win & 8 nominations total","['Drama', 'Mystery']","['English', 'French']"
437. High Ground,2020,1h 44m,,6.5,2.8K,,"In a bid to save the last of his family, Gutjuk, a young Aboriginal man, teams up with ex-soldier Travis to track down Baywara, the most dangerous warrior in the Territory, his uncle.",https://www.imdb.com/title/tt9286908/?ref_=sr_i_437,['Chris Anastassiades'],['Stephen Johnson'],"['Guruwuk Mununggurr', 'Wakarra Gondarra', 'Mark Garrawurra', 'Neville Namarnyilk', 'Jude Lami-Lami', 'Magnolia Maymuru', 'Frances Djulibing', 'Malati Yunupingu', 'Esmerelda Marimowa', 'Callan Mulvey']",,,"$2,313,364",,"May 14, 2021",['Australia'],"['Kakadu, Northern Territory, Australia (on location)']","['Maxo', 'Bunya Productions', 'Savage Films']","Awards, 8 wins & 19 nominations total","['Action', 'Drama', 'Thriller', 'Western']","['English', 'Aboriginal']"
438. Sightless,2020,1h 29m,Unrated,5.5,11K,,"After an attack renders her blind, Ellen Ashland withdraws from the world to recover. But soon she plunges into paranoia, unable to convince anyone that her assailant has returned to terrorize her by hiding in plain sight.",https://www.imdb.com/title/tt10303430/?ref_=sr_i_438,['Cooper Karl'],['Cooper Karl'],"['Deniz Akdeniz', 'Madelaine Petsch', 'Matthew Yang King', 'Alexander Koch', 'Mikandrew', 'Lee Jones', 'December Ensminger', 'Jarrod Crawford', 'Bibhhuti Bhusan Behera', 'Courtney Compton']",,,,,"September 28, 2020",['United States'],"['North Hollywood, California, USA']","['Headlong Entertainment', 'Benattar/Thomas Productions', 'MarVista Entertainment']",,"['Psychological Thriller', 'Drama', 'Mystery', 'Thriller']","['English', 'Spanish', 'French']"
439. The Lost Husband,2020,1h 49m,PG-13,6.1,6K,49.0,"Trying to put her life back together after her husband's death, Libby and her children move to her estranged aunt's goat farm in central Texas.",https://www.imdb.com/title/tt4257940/?ref_=sr_i_439,"['Vicky Wight', 'Katherine Center']",['Vicky Wight'],"['Leslie Bibb', 'Josh Duhamel', 'Nora Dunn', 'Herizen F. Guardiola', 'Sharon Lawrence', 'Isiah Whitlock Jr.', 'Callie Haverda', 'Roxton Garcia', 'Kevin Alejandro', 'Georgia King']",,,,,"April 10, 2020",['United States'],"['Round Top, Texas, USA']","['Redbox Entertainment', 'Six Foot Pictures']","Awards, 1 nomination total","['Drama', 'Romance']",['English']
440. Gabriel's Inferno: Part One,2020,2h 4m,Not Rated,5.9,4K,,"An intriguing exploration of seduction, forbidden love, and redemption, a captivating and passionate tale of one man's escape from his own personal hell as he tries to earn the impossible: forgiveness and love.",https://www.imdb.com/title/tt11316854/?ref_=sr_i_440,"['Mary Pocrnic', 'Sylvain Reynard']",['Tosca Musk'],"['Melanie Zanetti', 'Giulio Berruti', 'James Andrew Fraser', 'Margaux Brooke', 'Agnes Albright', 'Pat Asanti', 'Linda Atkinson', 'Julia Barrett-Mitchell', 'Marcus Brandon', 'Richard Brevard']",,,,,"May 29, 2020",['United States'],"['Syracuse, New York, USA (Syracuse, NY)']",['Passionflix'],,['Romance'],['English']
441. Disturbing the Peace,2020,1h 31m,R,3.4,3.8K,34.0,"A small-town marshal who hasn't carried a gun since he left the Texas Rangers after a tragic shooting, must pick up his gun again to battle with a gang of outlaw bikers that has invaded the town to pull off a brazen and violent heist.",https://www.imdb.com/title/tt5717194/?ref_=sr_i_441,['Chuck Hustmyre'],['York Alec Shackleton'],"['Guy Pearce', 'Devon Sawa', 'Kelly Greyson', 'Michael Sirow', 'Luke Martin Collins', 'Jacob Grodnik', 'John Lewis', 'Terence J. Rotolo', 'Barbie Blank', 'Branscombe Richmond']","$5,000,000 (estimated)",,"$49,104",,"January 17, 2020",['United States'],"['Horse Cave, Kentucky, USA (main location)']","['Wonderfilm Media', 'Aloe Entertainment', 'Media Finance Capital']",,"['Contemporary Western', 'Action', 'Thriller']",['English']
442. Deliver Us from Evil,2020,1h 54m,,6.8,6.9K,,"Hit-man In-Nam kills Japanese mobster, enraging vengeful brother. Ex-lover Young-joo pleads for help but dies, her daughter missing. In-Nam must decide: flee to Panama or search for girl? Paths may cross with mobster brother.",https://www.imdb.com/title/tt12763920/?ref_=sr_i_442,"['Hwang Jung-min', 'Lee Jung-jae', 'Park Jeong-min']",['Hong Won-chan'],"['Hwang Jung-min', 'Lee Jung-jae', 'Park Jeong-min', 'Darina Boonchu', 'Hakuryû', 'Choi Hee-Seo', 'Hiroaki Hirakawa', 'Ito Keitoku', 'Ken Kurahara', 'Atsundo Maruyama']",,,"$34,217,377",,"August 5, 2020",,,"['CJ Entertainment', 'Hive Media']","Awards, 11 wins & 24 nominations total","['Action', 'Crime', 'Thriller']","['Korean', 'Thai', 'English', 'Japanese']"
443. No Escapes,2020,2h 11m,,6.5,1.8K,,A heroic story about firefighters and rescuers. What some may call an act of bravery is an ordinary day for them.,https://www.imdb.com/title/tt12200256/?ref_=sr_i_443,"['Nikolay Kulikov', 'Konstantin Mayer', 'Alexey Nuzhny']",['Alexey Nuzhny'],"['Konstantin Khabensky', 'Stasya Miloslavskaya', 'Andrey Smolyakov', 'Irina Gorbacheva', 'Viktor Dobronravov', 'Roman Kurtsyn', 'Yuriy Kuznetsov', 'Tikhon Zhiznevskiy', 'Nikolay Auzin', 'Mariya Baeva']","RUR598,512,479 (estimated)",,"$12,916,151",,"December 24, 2020",['Russia'],,"['Studio Trite', 'Vserossiyskaya Gosudarstvennaya Televizionnaya i Radioveshchatelnaya Kompaniya (VGTRK)']","Awards, 2 wins & 3 nominations total","['Action', 'Drama']",['Russian']
444. Rifkin's Festival,2020,1h 28m,PG-13,6.1,10K,44.0,"A married American couple goes to the San Sebastian Festival and gets caught up in the magic of the event, the beauty and charm of the city, and the fantasy of movies.",https://www.imdb.com/title/tt8593904/?ref_=sr_i_444,['Woody Allen'],['Woody Allen'],"['Wallace Shawn', 'Damian Chapa', 'Bobby Slayton', 'Gina Gershon', 'Louis Garrel', 'Stephanie Figueira', 'Luz Cipriota', 'Godeliv Van den Brandt', 'Manu Fullola', 'Richard Kind']",,,"$2,319,180",,"October 2, 2020","['Spain', 'United States', 'Italy']","['Donostia-San Sebastián, Guipúzcoa, País Vasco, Spain']","['Gravier Productions', 'Wildside', 'Orange']","Awards, 1 win & 1 nomination total","['Comedy', 'Romance']","['English', 'Spanish', 'Swedish']"
445. Occupation: Rainfall,2020,2h 8m,R,4.7,16K,,"Two years after aliens land on Earth, survivors from Sydney, Australia, fight in a desperate war as the number of casualties continue to grow.",https://www.imdb.com/title/tt8615822/?ref_=sr_i_445,"['Luke Sparke', 'Dale Dye', 'Felix Williamson']",['Luke Sparke'],"['Dan Ewing', 'Temuera Morrison', 'Daniel Gillies', 'Lawrence Makoare', 'Zac Garred', 'Jet Tranter', 'Mark Coles Smith', 'Trystan Go', 'Ken Jeong', 'Jason Isaacs']",,,"$343,414",,June 2021,['Australia'],"['Gold Coast, Queensland, Australia']","['Occupation Two Productions', 'Sparke Films']",,"['Action', 'Sci-Fi']",['English']
446. Your Name Engraved Herein,2020,1h 58m,Not Rated,7.3,8.7K,,"In 1987, as martial law ends in Taiwan, Jia-han and Birdy fall in love amid family pressure, homophobia and social stigma.",https://www.imdb.com/title/tt10329134/?ref_=sr_i_446,['Yu-Ning Chu'],['Kuang-Hui Liu'],"['Edward Chen', 'Jing-Hua Tseng', 'Leon Dai', 'Shih-Sian Wang', 'Fabio Grangeon', 'Barry Qu', 'Stone Yang', 'Lance Chiu', 'Mimi Shao', 'Hui-Min Lin']","NT$50,000,000 (estimated)",,,,"December 23, 2020",['Taiwan'],"['Taipei, Taiwan (City Scenes on Taiwan, during school years)']",,"Awards, 3 wins & 7 nominations total","['Drama', 'Romance']","['Mandarin', 'English', 'Min Nan']"
447. Love Sarah,2020,1h 37m,Not Rated,6.2,4.1K,52.0,"A young woman wishes to fulfill her mother's dream of opening her own bakery in Notting Hill, London. To do this, she enlists the help of an old friend and her grandma.",https://www.imdb.com/title/tt9448932/?ref_=sr_i_447,"['Jake Brunger', 'Eliza Schroeder', 'Mahalia Rimmer']",['Eliza Schroeder'],"['Celia Imrie', 'Shannon Tarbet', 'Shelley Conn', 'Candice Brown', 'Margherita Barbieri', 'Katya Bourvis', 'Rachel Maybank', 'Sophie Mergallyev', 'Sandy Nuttall', ""Amelia O'Hara""]",,,"$1,111,401",,"January 15, 2021",['United Kingdom'],"['82 Golborne Road, North Kensington, London, England, UK (Location of Love Sarah Bakery)']","['Miraj Films', 'Neopol Film', 'Rainstar Productions']",,"['Comedy', 'Drama', 'Romance']",['English']
448. Initiation,2020,1h 36m,R,5.0,4.5K,,"Whiton University unravels the night a star-athlete is murdered, kicking off a spree of social media slayings that force students to uncover the truth behind the school's hidden secrets and the horrifying meaning of an exclamation point.",https://www.imdb.com/title/tt7397098/?ref_=sr_i_448,"['John Berardo', 'Lindsay LaVanchy', 'Brian Frager']",['John Berardo'],"['Isabella Gomez', 'Lindsay LaVanchy', 'Froy Gutierrez', 'James Berardo', 'Gattlin Griffith', 'Adin Kolansky', 'Shireen Lai', 'Patrick Walker', 'Maxwell Hamilton', 'Bart Johnson']",,,"$290,310",,"May 7, 2021",['United States'],"['Los Angeles, California, USA (location)']",['Shatterproof Films'],"Awards, 1 nomination total","['Crime', 'Drama', 'Horror', 'Mystery', 'Thriller']",['English']
449. Dry Wind,2020,1h 50m,Unrated,6.4,1.4K,,"A shy, middle-aged gay factory worker in the small town of Goiás, initiates casual sexual friendship with his co-worker Ricardo. But is later consumed with jealousy after a new arrival to town competes for Ricardo's attention.",https://www.imdb.com/title/tt11719648/?ref_=sr_i_449,['Daniel Nolasco'],['Daniel Nolasco'],"['Leandro Faria Lelo', 'Allan Jacinto Santana', 'Renata Carvalho', 'Rafael Theophilo', 'Del Neto', 'Larissa Sisterolli', ""Marcelo D'Avilla"", 'Leo Moreira Sá', 'Candy Mel', 'Conrado Helt']",,,,,"February 26, 2020",['Brazil'],,"['Estúdio Giz', 'Panaceia Filmes']","Awards, 3 wins & 13 nominations total",['Drama'],['Portuguese']
450. Lazy Susan,2020,1h 30m,Not Rated,5.4,1.2K,37.0,"A slice-of-life comedy about a woman on the edge with nowhere to go but over, Lazy Susan is a story about a spectacularly unmotivated woman for whom doing nothing is exhausting.",https://www.imdb.com/title/tt8633560/?ref_=sr_i_450,"['Carrie Aizley', 'Sean Hayes', 'Darlene Hunt']",['Nick Peet'],"['Sean Hayes', 'Maria Shriver', 'Leah Huebner', 'Dominick LaRuffa Jr.', 'Mariko Takai', 'Danny Johnson', 'Erica Hernandez', 'Kiel Kennedy', 'Carrie Aizley', 'Jim Rash']",,,,,"April 3, 2020",['United States'],"['Long Island, New York, USA']","['Stargazer Films USA', 'Hazy Mills Productions', 'Dominion Pictures']",,['Comedy'],['English']
451. I'm Your Woman,2020,2h,R,6.2,10K,63.0,"In this 1970s set crime drama, a woman is forced to go on the run after her husband betrays his partners, sending her and her baby on a dangerous journey.",https://www.imdb.com/title/tt10243992/?ref_=sr_i_451,"['Julia Hart', 'Jordan Horowitz']",['Julia Hart'],"['Rachel Brosnahan', 'Marsha Stephanie Blake', 'Arinzé Kene', 'Jameson Charles', 'Justin Charles', 'Barrett Shaffer', 'Frankie Faison', 'Marceline Hugot', ""Da'mauri Parks"", 'James McMenamin']",,,,,"December 11, 2020",['United States'],"['Pittsburgh, Pennsylvania, USA']","['Big Indie Pictures', 'Original Headquarters', 'Scrap Paper Pictures']","Awards, 2 wins & 4 nominations total","['Crime', 'Drama']",['English']
452. Really Love,2020,1h 35m,,6.2,1.2K,,"Set in contemporary Washington D.C., a rising black painter strives to break into the competitive art world, while balancing a bittersweet romance he never expected.",https://www.imdb.com/title/tt8722624/?ref_=sr_i_452,"['Sanford Grimes', 'Felicia Pride', 'Angel Kristi Williams']",['Angel Kristi Williams'],"['Kofi Siriboe', 'Yootha Wong-Loi-Sing', 'Uzo Aduba', 'Tristan Mack Wilds', 'Naturi Naughton', 'Suzzanne Douglas', 'Jade Eshete', 'Blair Underwood', 'Michael Ealy', 'J. Arthur E. Brooks']",,,,,"August 25, 2021",['United States'],,['MACRO'],"Awards, 1 win & 1 nomination total","['Drama', 'Romance']",['English']
453. The Christmas Chronicles: Part Two,2020,1h 52m,PG,6.0,38K,51.0,"Kate Pierce, now a cynical teen, is unexpectedly reunited with Santa Claus when a mysterious troublemaker threatens to cancel Christmas--forever.",https://www.imdb.com/title/tt11057644/?ref_=sr_i_453,"['Matt Lieberman', 'Chris Columbus', 'David Guggenheim']",['Chris Columbus'],"['Kurt Russell', 'Goldie Hawn', 'Darby Camp', 'Julian Dennison', 'Jahzir Bruno', 'Darlene Love', 'Tyrese Gibson', 'Sunny Suljic', 'Judah Lewis', 'Kimberly Williams-Paisley']",,,,,"November 25, 2020",['United States'],"['Cancun, Mexico']","['Netflix', '1492 Pictures', 'Wonder Worldwide']","Awards, 1 nomination total","['Holiday Family', 'Adventure', 'Comedy', 'Family', 'Fantasy', 'Holiday']",['English']
454. Love Wedding Repeat,2020,1h 40m,TV-MA,5.6,23K,41.0,"While trying to make his sister's wedding day go smoothly, Jack finds himself juggling an angry ex-girlfriend, an uninvited guest with a secret, a misplaced sleep sedative, and the girl who got away in alternate versions of the same day.",https://www.imdb.com/title/tt5096470/?ref_=sr_i_454,"['Dean Craig', 'Francis Nief', 'Christelle Raynal']",['Dean Craig'],"['Sam Claflin', 'Olivia Munn', 'Freida Pinto', 'Eleanor Tomlinson', 'Joel Fry', 'Jack Farthing', 'Tim Key', 'Allan Mustafa', 'Aisling Bea', 'Paolo Mazzarelli']",,,,,"April 10, 2020","['United Kingdom', 'Italy']","['Rome, Italy']","['Notorious Pictures', 'Tempo Productions']",,"['Comedy', 'Romance']",['English']
455. Taming the Younger Sister-in-Law,2020,1h 41m,,6.8,149,,"One day, Min-sang who is not that handsome becomes a huge success because of a webtoon. Then he gets a pretty wife, Yu-ra, for himself. Accidentally, he learns of his wife's dark past through his sister-in-law's diary.",https://www.imdb.com/title/tt18689488/?ref_=sr_i_455,"['Rika', 'Shi Woo']",['Pae Kon'],"['Rika', 'Shi Woo']",,,,,"December 11, 2020",['South Korea'],,,,['Romance'],['Korean']
456. Uncle Vanya,2020,2h 10m,,7.4,793,,"The Professor retires and moves back into his estate with his young wife, turning the lives of those who have been maintaining it in his absence upside down.",https://www.imdb.com/title/tt13299678/?ref_=sr_i_456,"['Anton Chekhov', 'Conor McPherson']","['Ross MacGibbon', 'Ian Rickson']","['Roger Allam', 'Richard Armitage', 'Anna Calder-Marshall', 'Rosalind Eleazar', 'Toby Jones', 'Dearbhla Molloy', 'Peter Wight', 'Aimee Lou Wood']",,,"$258,248",,"October 27, 2020",['United Kingdom'],"['Harold Pinter Theatre, London, England, UK']","['Angelica Films', 'Sonia Friedman Productions']",,['Drama'],['English']
457. Shirley,2020,1h 47m,R,6.1,14K,76.0,A famous horror writer finds inspiration for her next book after she and her husband take in a young couple.,https://www.imdb.com/title/tt8430598/?ref_=sr_i_457,"['Sarah Gubbins', 'Susan Scarf Merrell']",['Josephine Decker'],"['Elisabeth Moss', 'Odessa Young', 'Michael Stuhlbarg', 'Logan Lerman', 'Victoria Pedretti', 'Robert Wuhl', ""Paul O'Brien"", 'Orlagh Cassidy', 'Bisserat Tseggai', 'Allen McCullough']",,,"$275,863",,"June 5, 2020",['United States'],,"['Los Angeles Media Fund (LAMF)', 'Killer Films']","Awards, 4 wins & 25 nominations total","['Biography', 'Drama', 'Mystery', 'Thriller']",['English']
458. Post Mortem,2020,1h 55m,Not Rated,5.5,3.8K,,A post mortem photographer and a little girl confront ghosts in a haunted village after the First World War.,https://www.imdb.com/title/tt9834506/?ref_=sr_i_458,"['Piros Zánkay', 'Gábor Hellebrandt', 'Péter Bergendy']",['Péter Bergendy'],"['Viktor Klem', 'Fruzsina Hais', 'Judit Schell', 'Zsolt Anger', 'Gábor Reviczky', 'Gabriella Hámori', 'Andrea Ladányi', 'Erik Gyarmati', 'Diána Magdolna Kiss', 'Mari Nagy']","$2,800,000 (estimated)",,"$508,801",,"September 20, 2022",['Hungary'],"['Skanzen, Szentendre, Hungary (village)']",['Szupermodern Stúdió'],"Awards, 27 wins & 24 nominations total","['Supernatural Horror', 'Horror', 'Mystery', 'Thriller']","['Hungarian', 'German']"
459. Rogue City,2020,1h 56m,TV-MA,6.1,10K,,"Caught in the cross hairs of police corruption and Marseille's warring gangs, a loyal cop must protect his squad by taking matters into his own hands.",https://www.imdb.com/title/tt10127684/?ref_=sr_i_459,['Olivier Marchal'],['Olivier Marchal'],"['Lannick Gautry', 'Stanislas Merhar', 'Kaaris', 'David Belle', 'Patrick Catalifo', 'Jean Reno', 'Moussa Maaskri', 'Catherine Marchal', 'Francis Renaud', 'Erika Sainte']",,,,,"October 30, 2020",['France'],,"['Gaumont', 'Umedia', 'uFund']",,"['Action', 'Crime', 'Drama', 'Thriller']",['French']
460. What Lies Below,2020,1h 27m,TV-MA,4.4,8.9K,35.0,"A 16-year-old girl returns home from camp and learns that her mother has a new boyfriend, one she intends to marry. A man whose charm, intelligence and beauty make him look like he's not human at all.",https://www.imdb.com/title/tt9264728/?ref_=sr_i_460,['Braden R. Duemmler'],['Braden R. Duemmler'],"['Ema Horvath', 'Troy Iwata', 'Danny Corbo', 'Mena Suvari', 'Trey Tucker', 'Olan Montgomery', 'Haskiri Velazquez', 'AprilAnn Dais']",,,"$21,676",,"December 4, 2020",['United States'],"[""193 Main St, Hudson Falls, New York, USA (Lu's Pharmacy)""]",['DRF Productions'],,"['Psychological Horror', 'Psychological Thriller', 'Drama', 'Horror', 'Mystery', 'Sci-Fi', 'Thriller']",['English']
"461. Love, Weddings & Other Disasters",2020,1h 36m,PG-13,4.8,3.1K,11.0,"It is a multi-story romantic comedy about the people who work on weddings to create the perfect day for a loving couple - while their own relationships are outlandish, odd, crazy and far from perfect.",https://www.imdb.com/title/tt10235718/?ref_=sr_i_461,"['Eileen Conn', 'Dennis Dugan', 'Larry Miller']",['Dennis Dugan'],"['Maggie Grace', 'Jeremy Irons', 'Diane Keaton', 'Dennis Dugan', 'Todd Stashwick', 'Kiara Pichardo', 'Diego Boneta', 'Richard Kline', 'Jesse McCartney', 'Chandra West']",,,"$907,236",,"December 4, 2020",['United States'],,"['Align', 'Construction Film', 'Convergent Media.']",,"['Comedy', 'Romance']","['English', 'Latin', 'Russian']"
462. Beyto,2020,1h 38m,TV-MA,6.6,1.7K,,"Talented swimmer, motivated apprentice-- Beyto is in the midst of life, with a bright future ahead of him. But when the only son of a Turkish migrant family falls in love with his coach Mike, an ideal world falls to pieces.",https://www.imdb.com/title/tt12683198/?ref_=sr_i_462,"['Gitta Gsell', 'Yusuf Yesilöz']",['Gitta Gsell'],"['Burak Ates', 'Dimitri Stapfer', 'Ecem Aydin', 'Beren Tuna', 'Serkan Tastemur', 'Zeki Bulgurcu', 'Müjdat Albak', 'Délia Antonio', 'Danijela Milijic Stojcetovic', 'Zeynep Sanli']",,,,,"July 1, 2021",['Switzerland'],,"['Lomotion', 'Sulaco Film']","Awards, 2 wins & 2 nominations total",['Drama'],"['Swiss German', 'Turkish']"
463. The Stronghold,2020,1h 45m,TV-MA,6.9,15K,,"A police brigade working in the dangerous northern neighborhoods of Marseille, where the level of crime is higher than anywhere else in France.",https://www.imdb.com/title/tt10404944/?ref_=sr_i_463,"['Audrey Diwan', 'Cédric Jimenez']",['Cédric Jimenez'],"['Gilles Lellouche', 'Karim Leklou', 'François Civil', 'Adèle Exarchopoulos', 'Kenza Fortas', 'Cyril Lecomte', 'Michaël Abiteboul', 'Idir Azougli', 'Vincent Darmuzey', 'Jean-Yves Berteloot']","$13,000,000 (estimated)",,"$18,066,143",,"September 17, 2021",['France'],"['Marseille, France']","['Chi-Fou-Mi Productions', 'StudioCanal', 'France 2 Cinéma']","Awards, 7 nominations total","['Dark Comedy', 'True Crime', 'Action', 'Crime', 'Drama', 'Thriller']",['French']
464. Isi & Ossi,2020,1h 53m,TV-MA,6.4,11K,,"To realize their culinary and boxing dreams, the daughter of a billionaire forms a mutually beneficial alliance with the son of a struggling single mom.",https://www.imdb.com/title/tt9806322/?ref_=sr_i_464,['Oliver Kienle'],['Oliver Kienle'],"['Livia Renner', 'Nayla Sophie Brehmer', 'Christina Hecke', 'Hans-Jochen Wagner', 'Lisa Hagmeister', 'Gabriel Grabas', 'Ernst Stötzner', 'Nova Amondson', 'Johanna Eiworth', 'David Gentner']",,,,,"February 14, 2020",['Germany'],"['Heidelberg, Baden-Württemberg, Germany']",['X-Filme Creative Pool'],"Awards, 1 nomination total","['Comedy', 'Romance']","['German', 'English']"
465. Night in Paradise,2020,2h 11m,TV-MA,6.8,9.5K,59.0,"Hiding out in Jeju Island following a brutal tragedy, a wronged mobster with a target on his back connects with a woman who has her own demons.",https://www.imdb.com/title/tt12792418/?ref_=sr_i_465,['Park Hoon-jung'],['Park Hoon-jung'],"['Um Tae-goo', 'Jeon Yeo-been', 'Cha Seung-won', 'Cho Dong-in', 'Park Ho-san', 'Hyun Bong-sik', 'Cha Soon-bae', 'Son Byung-ho', 'Lee Ki-young', 'Lee Mun-shik']",,,,,"April 9, 2021",['South Korea'],,['Goldmoon Film'],"Awards, 1 win & 9 nominations total","['Action', 'Crime', 'Drama', 'Thriller']",['Korean']
